title,url
Puff Pastry Asparagus Spears with Strawberry Garnish ,https://eatsmarter.com/recipes/puff-pastry-asparagus-spears-with-strawberry-garnish
Beef Skewers with Tropical Fruit ,https://eatsmarter.com/recipes/beef-skewers-with-tropical-fruit
Spiced Turkey in Lettuce Leaves ,https://eatsmarter.com/recipes/spiced-turkey-in-lettuce-leaves
Louisiana Po' Boy Sandwich ,https://eatsmarter.com/recipes/louisiana-po-boy-sandwich
Bowl of Baby Spinach and Bacon ,https://eatsmarter.com/recipes/bowl-of-baby-spinach-and-bacon
Southwest Chicken Salad Bowl ,https://eatsmarter.com/recipes/southwest-chicken-salad-bowl
Lamb Patties with Salad ,https://eatsmarter.com/recipes/lamb-patties-with-salad
Beet and Sour Cream Salad Bowl ,https://eatsmarter.com/recipes/beet-and-sour-cream-salad-bowl
Sliced Chicken with Nuts and Green Spears ,https://eatsmarter.com/recipes/sliced-chicken-with-nuts-and-green-spears
Sliced Chicken and Bacon with Mixed Leaves ,https://eatsmarter.com/recipes/sliced-chicken-and-bacon-with-mixed-leaves
Bowl of Lentils with Flaked Fish and Leek ,https://eatsmarter.com/recipes/bowl-of-lentils-with-flaked-fish-and-leek
Fried Egg and Greens ,https://eatsmarter.com/recipes/fried-egg-and-greens
Golden Citrus Chicken Pieces ,https://eatsmarter.com/recipes/golden-citrus-chicken-pieces
Pork Loin Chop with Fruity Coleslaw ,https://eatsmarter.com/recipes/pork-loin-chop-with-fruity-coleslaw
Soft Fruit and Apple Salad Bowl ,https://eatsmarter.com/recipes/soft-fruit-and-apple-salad-bowl
Mixed Leaf and Prawn Salad Bowl ,https://eatsmarter.com/recipes/mixed-leaf-and-prawn-salad-bowl
Grilled Stone Fruit and Green Spear Salad ,https://eatsmarter.com/recipes/grilled-stone-fruit-and-green-spear-salad
Mixed Flowers with Leaves ,https://eatsmarter.com/recipes/mixed-flowers-with-leaves
Broccoli Topped with Almonds ,https://eatsmarter.com/recipes/broccoli-topped-with-almonds
Cool Salad with White Fish ,https://eatsmarter.com/recipes/cool-salad-with-white-fish
Ham and Kumquat Salad ,https://eatsmarter.com/recipes/ham-and-kumquat-salad
Spinach and Mushroom Salad ,https://eatsmarter.com/recipes/spinach-and-mushroom-salad
Courgette Julienne with Gouda ,https://eatsmarter.com/recipes/courgette-julienne-with-gouda
Classic Apple and Walnut Salad ,https://eatsmarter.com/recipes/classic-apple-and-walnut-salad
Cheese and String Bean Salad Bowl ,https://eatsmarter.com/recipes/cheese-and-string-bean-salad-bowl
Chicken Salad ,https://eatsmarter.com/recipes/chicken-salad-0
Caprese Salad ,https://eatsmarter.com/recipes/caprese-salad
Tricolore Salad ,https://eatsmarter.com/recipes/tricolore-salad
Cheesy Chicory Bake ,https://eatsmarter.com/recipes/cheesy-chicory-bake
Vegan Grain Salad ,https://eatsmarter.com/recipes/vegan-grain-salad
Sliced Chicken with Bulgur ,https://eatsmarter.com/recipes/sliced-chicken-with-bulgur
Pork Salad Pancake Rolls ,https://eatsmarter.com/recipes/pork-salad-pancake-rolls
Pork and Rice Bowl ,https://eatsmarter.com/recipes/pork-and-rice-bowl
Prawn Kebabs with Grain Salad ,https://eatsmarter.com/recipes/prawn-kebabs-with-grain-salad
Chopped Salsa ,https://eatsmarter.com/recipes/chopped-salsa
Southern French Salad Box ,https://eatsmarter.com/recipes/southern-french-salad-box
Golden Glazed Wings ,https://eatsmarter.com/recipes/golden-glazed-wings
Steak and Green Spear Salad Bowl ,https://eatsmarter.com/recipes/steak-and-green-spear-salad-bowl
Springtime Pasta Bowl ,https://eatsmarter.com/recipes/springtime-pasta-bowl-0
Calamari with Mixed Veggies ,https://eatsmarter.com/recipes/calamari-with-mixed-veggies
Veggie Cups with Dressing ,https://eatsmarter.com/recipes/veggie-cups-with-dressing
Fresh Veg and Fruit Salad ,https://eatsmarter.com/recipes/fresh-veg-and-fruit-salad
Smoky Fish and Conchiglie Bowls ,https://eatsmarter.com/recipes/smoky-fish-and-conchiglie-bowls
Healthy Asian Chicken Bowls ,https://eatsmarter.com/recipes/healthy-asian-chicken-bowls
Orechiette with Herbs and Fennel ,https://eatsmarter.com/recipes/orechiette-with-herbs-and-fennel
Soft Peppers and Tomatoes ,https://eatsmarter.com/recipes/soft-peppers-and-tomatoes
Flaked Fish and Penne Bowl ,https://eatsmarter.com/recipes/flaked-fish-and-penne-bowl
French Bean Salad ,https://eatsmarter.com/recipes/french-bean-salad
Pomegranate and Chicken with Leaves ,https://eatsmarter.com/recipes/pomegranate-and-chicken-with-leaves
Pepper and Soft Cheese Salad Bowl ,https://eatsmarter.com/recipes/pepper-and-soft-cheese-salad-bowl
Simple Chicken Platter with Leaves ,https://eatsmarter.com/recipes/simple-chicken-platter-with-leaves
Oily Fish and Cherry Tomato Cups ,https://eatsmarter.com/recipes/oily-fish-and-cherry-tomato-cups
Chicken Skewers over Salad ,https://eatsmarter.com/recipes/chicken-skewers-over-salad
Oriental Rice Bowl ,https://eatsmarter.com/recipes/oriental-rice-bowl
Arugula and Italian Cheese Rounds ,https://eatsmarter.com/recipes/arugula-and-italian-cheese-rounds
Seafood Salad Wraps ,https://eatsmarter.com/recipes/seafood-salad-wraps
Potato Boats with Fish Filling ,https://eatsmarter.com/recipes/potato-boats-with-fish-filling
Egg Crepe Bites ,https://eatsmarter.com/recipes/egg-crepe-bites
Sliced Beef with Arugula and Citrus ,https://eatsmarter.com/recipes/sliced-beef-with-arugula-and-citrus
Shrimp and Crab Salad Bowl ,https://eatsmarter.com/recipes/shrimp-and-crab-salad-bowl
Winter Veg Ribbon Salad ,https://eatsmarter.com/recipes/winter-veg-ribbon-salad
Endive Leaves with Tropical Fruit ,https://eatsmarter.com/recipes/endive-leaves-with-tropical-fruit
Potato Tortilla Squares ,https://eatsmarter.com/recipes/potato-tortilla-squares
Shredded Veggie Bowl ,https://eatsmarter.com/recipes/shredded-veggie-bowl
Creamy Broccoli and Tomato Bowl ,https://eatsmarter.com/recipes/creamy-broccoli-and-tomato-bowl
Sweet Fruit and Onion Pie ,https://eatsmarter.com/recipes/sweet-fruit-and-onion-pie
Winter Gourd Salad ,https://eatsmarter.com/recipes/winter-gourd-salad
Gourmet Egg and Smoked Salmon Plate ,https://eatsmarter.com/recipes/gourmet-egg-and-smoked-salmon-plate
Middle Eastern Grains with Tomato ,https://eatsmarter.com/recipes/middle-eastern-grains-with-tomato
Stuffed Tomato Towers ,https://eatsmarter.com/recipes/stuffed-tomato-towers
Mexican Tortilla Wraps ,https://eatsmarter.com/recipes/mexican-tortilla-wraps-1
Grain Salad with Sliced Chicken ,https://eatsmarter.com/recipes/grain-salad-with-sliced-chicken
Tomato and Chicken Salad Cups ,https://eatsmarter.com/recipes/tomato-and-chicken-salad-cups
Filled and Baked Tomatoes ,https://eatsmarter.com/recipes/filled-and-baked-tomatoes
Romaine Salad with Croutons ,https://eatsmarter.com/recipes/romaine-salad-with-croutons
Colourful Penne Bowl ,https://eatsmarter.com/recipes/colourful-penne-bowl
Southern French-style Salad ,https://eatsmarter.com/recipes/southern-french-style-salad
Shredded Zucchini with Fish ,https://eatsmarter.com/recipes/shredded-zucchini-with-fish
Warm Beet and Carrot Salad ,https://eatsmarter.com/recipes/warm-beet-and-carrot-salad
Beet and Asparagus Salad ,https://eatsmarter.com/recipes/beet-and-asparagus-salad
Small Pumpkin with Rice Filling ,https://eatsmarter.com/recipes/small-pumpkin-with-rice-filling
Fruit and Veg with Grains ,https://eatsmarter.com/recipes/fruit-and-veg-with-grains
Festive Cabbage Salad ,https://eatsmarter.com/recipes/festive-cabbage-salad
Gourmet Mixed Tomato Salad ,https://eatsmarter.com/recipes/gourmet-mixed-tomato-salad
Sauteed Chicken Salad with Brussels Sprouts and Pine Nuts ,https://eatsmarter.com/recipes/sauteed-chicken-salad-with-brussels-sprouts-and-pine-nuts
Red Cabbage Salad with Orange Dressing ,https://eatsmarter.com/recipes/red-cabbage-salad-with-orange-dressing
Lebanese Quinoa Tabbouleh Salad ,https://eatsmarter.com/recipes/lebanese-quinoa-tabbouleh-salad
Potato Ravioli with Endives ,https://eatsmarter.com/recipes/potato-ravioli-with-endives
"Cabbage Salad with Apples, Walnuts and Beets ",https://eatsmarter.com/recipes/cabbage-salad-with-apples-walnuts-and-beets
Fried Fish with Tartar Sauce and Coleslaw ,https://eatsmarter.com/recipes/fried-fish-with-tartar-sauce-and-coleslaw
Chicken Skewers with Lentil Salad ,https://eatsmarter.com/recipes/chicken-skewers-with-lentil-salad
Vegetable Salad with Yogurt Dressing ,https://eatsmarter.com/recipes/vegetable-salad-with-yogurt-dressing
Mixed Greens Salad ,https://eatsmarter.com/recipes/mixed-greens-salad
White Cabbage Salad with Olives and Feta ,https://eatsmarter.com/recipes/white-cabbage-salad-with-olives-and-feta
Carrot Salad with Zucchini ,https://eatsmarter.com/recipes/carrot-salad-with-zucchini
Green Salad with Hardboiled Egg and Bacon ,https://eatsmarter.com/recipes/green-salad-with-hardboiled-egg-and-bacon
Roasted Chicken Salad with Yogurt Dressing ,https://eatsmarter.com/recipes/roasted-chicken-salad-with-yogurt-dressing
Green Salad with Fruit ,https://eatsmarter.com/recipes/green-salad-with-fruit
Perch on Carrot Salad with Yogurt-Dill Dressing ,https://eatsmarter.com/recipes/perch-on-carrot-salad-with-yogurt-dill-dressing
Raw Carrot Salad with Hard-boiled Eggs ,https://eatsmarter.com/recipes/raw-carrot-salad-with-hard-boiled-eggs
"Spinach, Duck and Melon Salad ",https://eatsmarter.com/recipes/spinach-duck-and-melon-salad
Trout Tartare with Cucumber Salad ,https://eatsmarter.com/recipes/trout-tartare-with-cucumber-salad
Arugula Salad with Edible Flowers ,https://eatsmarter.com/recipes/arugula-salad-with-edible-flowers
Mustard Encrusted Rack of Lamb ,https://eatsmarter.com/recipes/mustard-encrusted-rack-of-lamb
Tuna with Green Salad ,https://eatsmarter.com/recipes/tuna-with-green-salad
Green Bean and Asparagus Salad with Almonds ,https://eatsmarter.com/recipes/green-bean-and-asparagus-salad-with-almonds
Lentil and Apple Salad ,https://eatsmarter.com/recipes/lentil-and-apple-salad
Carrot and Poppy Seed Salad ,https://eatsmarter.com/recipes/carrot-and-poppy-seed-salad
Salad with Mushrooms and Chicken Breast ,https://eatsmarter.com/recipes/salad-with-mushrooms-and-chicken-breast
Early Potatoes with Radishes and Asparagus ,https://eatsmarter.com/recipes/early-potatoes-with-radishes-and-asparagus
"Salad of Spinach, Pears, Walnuts and Feta ",https://eatsmarter.com/recipes/salad-of-spinach-pears-walnuts-and-feta
Lamb Salad with Feta and Beets ,https://eatsmarter.com/recipes/lamb-salad-with-feta-and-beets
Russian-Style Coleslaw ,https://eatsmarter.com/recipes/russian-style-coleslaw
Scallop and Green Asparagus Salad with Lime and Cilantro ,https://eatsmarter.com/recipes/scallop-and-green-asparagus-salad-with-lime-and-cilantro
Salmon with Couscous Salad and Cashews ,https://eatsmarter.com/recipes/salmon-with-couscous-salad-and-cashews
Beef Wellington with Red Cabbage Salad ,https://eatsmarter.com/recipes/beef-wellington-with-red-cabbage-salad
Shrimp in Saffron and Coconut Marinade with Mango Salad ,https://eatsmarter.com/recipes/shrimp-in-saffron-and-coconut-marinade-with-mango-salad
"Salad with Blue Cheese, Walnuts and Dried Dates ",https://eatsmarter.com/recipes/salad-with-blue-cheese-walnuts-and-dried-dates
Asparagus Salad with Avocado and Salmon ,https://eatsmarter.com/recipes/asparagus-salad-with-avocado-and-salmon
"Nicoise Salad with Tuna, Olives and Eggs ",https://eatsmarter.com/recipes/nicoise-salad-with-tuna-olives-and-eggs
Grilled Pork ,https://eatsmarter.com/recipes/grilled-pork
Lima Bean and Cabbage Salad ,https://eatsmarter.com/recipes/lima-bean-and-cabbage-salad
Carrots with Honey Dressing ,https://eatsmarter.com/recipes/carrots-with-honey-dressing
Beet Salad ,https://eatsmarter.com/recipes/beet-salad-1
Spinach-Arugula Salad with Strawberries and Parmesan ,https://eatsmarter.com/recipes/spinach-arugula-salad-with-strawberries-and-parmesan
Pork with Cucumber and Ginger Salad ,https://eatsmarter.com/recipes/pork-with-cucumber-and-ginger-salad
Roast Beef with Asparagus and Avocado Salad ,https://eatsmarter.com/recipes/roast-beef-with-asparagus-and-avocado-salad
Spinach Salad with Goat Cheese and Ham ,https://eatsmarter.com/recipes/spinach-salad-with-goat-cheese-and-ham
Green Salad with Grapefruit and Oranges ,https://eatsmarter.com/recipes/green-salad-with-grapefruit-and-oranges
Meatballs with Onion and Tomato Salad ,https://eatsmarter.com/recipes/meatballs-with-onion-and-tomato-salad
Scallops with Celery Root Puree and Radish Salad ,https://eatsmarter.com/recipes/scallops-with-celery-root-puree-and-radish-salad
Smoked Duck Breasts with Lentil Salad ,https://eatsmarter.com/recipes/smoked-duck-breasts-with-lentil-salad
Carrot Cakes with Pear Puree ,https://eatsmarter.com/recipes/carrot-cakes-with-pear-puree
"Chicken, Avocado and Strawberry Salad ",https://eatsmarter.com/recipes/chicken-avocado-and-strawberry-salad
Bacon Wrapped Melon ,https://eatsmarter.com/recipes/bacon-wrapped-melon
Meatloaf with Red Cabbage Salad ,https://eatsmarter.com/recipes/meatloaf-with-red-cabbage-salad
Frisée Salad with Brie ,https://eatsmarter.com/recipes/frisee-salad-with-brie
Salade Niçoise ,https://eatsmarter.com/recipes/salade-nicoise
"Endive Salad with Sprouts, Oranges and Beets ",https://eatsmarter.com/recipes/endive-salad-with-sprouts-oranges-and-beets
Lettuce Salad ,https://eatsmarter.com/recipes/lettuce-salad
Tomato Salad with Basil ,https://eatsmarter.com/recipes/tomato-salad-with-basil
Colorful Tomato Salad ,https://eatsmarter.com/recipes/colorful-tomato-salad
Mixed Green Salad with Potatoes ,https://eatsmarter.com/recipes/mixed-green-salad-with-potatoes
Beet Salad with Parsley ,https://eatsmarter.com/recipes/beet-salad-with-parsley
Beetroot Salad with Spinach and Feta ,https://eatsmarter.com/recipes/beetroot-salad-with-spinach-and-feta
Beef Goulash with Cucumber Salad ,https://eatsmarter.com/recipes/beef-goulash-with-cucumber-salad
Ricotta Souffle with Green Asparagus ,https://eatsmarter.com/recipes/ricotta-souffle-with-green-asparagus
Asparagus Crab Salad ,https://eatsmarter.com/recipes/asparagus-crab-salad
Avocado Grape Salad with Pomegranate Seeds ,https://eatsmarter.com/recipes/avocado-grape-salad-with-pomegranate-seeds
White Asparagus and Spinach Salad ,https://eatsmarter.com/recipes/white-asparagus-and-spinach-salad
Lentil Shrimp Salad ,https://eatsmarter.com/recipes/lentil-shrimp-salad
Sausage Salad with Tomato and Cucumber ,https://eatsmarter.com/recipes/sausage-salad-with-tomato-and-cucumber
Zucchini Salad with Shaved Parmesan and Pine Nuts ,https://eatsmarter.com/recipes/zucchini-salad-with-shaved-parmesan-and-pine-nuts
Curried Chicken Salad with Mango and Avocado ,https://eatsmarter.com/recipes/curried-chicken-salad-with-mango-and-avocado
Cucumber Stir-Fry with Honey-Chile Prawns ,https://eatsmarter.com/recipes/cucumber-stir-fry-with-honey-chile-prawns
Lentils and Pear Salad with Arugula ,https://eatsmarter.com/recipes/lentils-and-pear-salad-with-arugula
Arugula-radish Salad with Feta Cheese ,https://eatsmarter.com/recipes/arugula-radish-salad-with-feta-cheese
Fruity Endive Salad with Yogurt Dressing and Pumpkin Seeds ,https://eatsmarter.com/recipes/fruity-endive-salad-with-yogurt-dressing-and-pumpkin-seeds
Bread Salad with Vegetables and Basil ,https://eatsmarter.com/recipes/bread-salad-with-vegetables-and-basil
Sliced Tomatoes with Ricotta and Green Onion ,https://eatsmarter.com/recipes/sliced-tomatoes-with-ricotta-and-green-onion
Chicken Skewers with Tomato and Zucchini Salad ,https://eatsmarter.com/recipes/chicken-skewers-with-tomato-and-zucchini-salad
Shrimp and Cucumber Salad with Pineapple and Mango ,https://eatsmarter.com/recipes/shrimp-and-cucumber-salad-with-pineapple-and-mango
"Mango Salad with Avocado, Arugula and Red Onion ",https://eatsmarter.com/recipes/mango-salad-with-avocado-arugula-and-red-onion
Fried Shrimp with Asparagus-Potato Salad and Smoked Ham ,https://eatsmarter.com/recipes/fried-shrimp-with-asparagus-potato-salad-and-smoked-ham
"Romaine Lettuce with Egg, Olives, Nuts and Chicken Strips ",https://eatsmarter.com/recipes/romaine-lettuce-with-egg-olives-nuts-and-chicken-strips
Ravioli with Onions and Spinach ,https://eatsmarter.com/recipes/ravioli-with-onions-and-spinach
Rapunzel Salad with Gorgonzola Croutons and Apple ,https://eatsmarter.com/recipes/rapunzel-salad-with-gorgonzola-croutons-and-apple
Meat Lasagna ,https://eatsmarter.com/recipes/meat-lasagna-0
Salade Niçoise ,https://eatsmarter.com/recipes/salade-nicoise-0
Spicy Lamb Fillet with White Bean Salad ,https://eatsmarter.com/recipes/spicy-lamb-fillet-with-white-bean-salad
Green Salad with Sun Dried Tomatoes and Radishes ,https://eatsmarter.com/recipes/green-salad-with-sun-dried-tomatoes-and-radishes
Caesar Salad with Bacon and Fried Egg ,https://eatsmarter.com/recipes/caesar-salad-with-bacon-and-fried-egg
Spinach Salad with Strawberries and Kiwi ,https://eatsmarter.com/recipes/spinach-salad-with-strawberries-and-kiwi
Colorful Radish Salad ,https://eatsmarter.com/recipes/colorful-radish-salad
Steak and Goat Cheese Salad ,https://eatsmarter.com/recipes/steak-and-goat-cheese-salad
Breaded Cheese Sticks with Tomato Salad ,https://eatsmarter.com/recipes/breaded-cheese-sticks-with-tomato-salad
Chicken and Chickpea Salad ,https://eatsmarter.com/recipes/chicken-and-chickpea-salad
Avocado Salad with Trout and Caviar ,https://eatsmarter.com/recipes/avocado-salad-with-trout-and-caviar
Endive and White Bean Salad with Radicchio and Olives ,https://eatsmarter.com/recipes/endive-and-white-bean-salad-with-radicchio-and-olives
Green Salad with Parsnip Chips and Crispy Bacon ,https://eatsmarter.com/recipes/green-salad-with-parsnip-chips-and-crispy-bacon
"Asparagus Salad with Celery, Prosciutto and Rose Petals ",https://eatsmarter.com/recipes/asparagus-salad-with-celery-prosciutto-and-rose-petals
Grilled Cheese Skewers with Red Onion and Tomato Salad ,https://eatsmarter.com/recipes/grilled-cheese-skewers-with-red-onion-and-tomato-salad
Steamed Salmon with Cucumber Salad and Potatoes ,https://eatsmarter.com/recipes/steamed-salmon-with-cucumber-salad-and-potatoes
Endive and Herb Salad ,https://eatsmarter.com/recipes/endive-and-herb-salad
Panzanella Salad with Tomato and Pesto ,https://eatsmarter.com/recipes/panzanella-salad-with-tomato-and-pesto
Meat Skewers with Mango Salad ,https://eatsmarter.com/recipes/meat-skewers-with-mango-salad
Steak and Stuffed Baked Potatoes with Tomato Salad ,https://eatsmarter.com/recipes/steak-and-stuffed-baked-potatoes-with-tomato-salad
Beet Salad with Yogurt Marinade ,https://eatsmarter.com/recipes/beet-salad-with-yogurt-marinade
Asian Green Bean Salad ,https://eatsmarter.com/recipes/asian-green-bean-salad
"Romaine Salad with Chicken, Pears and Roquefort Cheese ",https://eatsmarter.com/recipes/romaine-salad-with-chicken-pears-and-roquefort-cheese
Black-eyed Pea Salad with Cornbread ,https://eatsmarter.com/recipes/black-eyed-pea-salad-with-cornbread
Coleslaw ,https://eatsmarter.com/recipes/coleslaw-1
Bulgur Salad with Tomatoes ,https://eatsmarter.com/recipes/bulgur-salad-with-tomatoes
Caesar Salad with White Beans and Onions ,https://eatsmarter.com/recipes/caesar-salad-with-white-beans-and-onions
Caesar Salad with Chicken and Avocado ,https://eatsmarter.com/recipes/caesar-salad-with-chicken-and-avocado
"Salad with Cauliflower, Mushrooms and Green Asparagus ",https://eatsmarter.com/recipes/salad-with-cauliflower-mushrooms-and-green-asparagus
Couscous Salad with Tomatoes and Herbs ,https://eatsmarter.com/recipes/couscous-salad-with-tomatoes-and-herbs
Orange Spinach Salad ,https://eatsmarter.com/recipes/orange-spinach-salad
Colorful Bread Salad ,https://eatsmarter.com/recipes/colorful-bread-salad
Russian Vegetable Salad with Beetroot and Mushrooms ,https://eatsmarter.com/recipes/russian-vegetable-salad-with-beetroot-and-mushrooms
Horseradish Mousse ,https://eatsmarter.com/recipes/horseradish-mousse
Spinach Salad with Mushrooms ,https://eatsmarter.com/recipes/spinach-salad-with-mushrooms
"Green Bean Salad with Onion, Peanuts and Cheese ",https://eatsmarter.com/recipes/green-bean-salad-with-onion-peanuts-and-cheese
Sausage Salad with Peppers ,https://eatsmarter.com/recipes/sausage-salad-with-peppers
Red Cabbage Salad with Sesame ,https://eatsmarter.com/recipes/red-cabbage-salad-with-sesame
Spicy Fish Fillets with Lentils ,https://eatsmarter.com/recipes/spicy-fish-fillets-with-lentils
Vegetable Salad with Pita Bread ,https://eatsmarter.com/recipes/vegetable-salad-with-pita-bread
Mixed Salad with Shrimp and Yogurt Vinaigrette ,https://eatsmarter.com/recipes/mixed-salad-with-shrimp-and-yogurt-vinaigrette
Baguette Sandwiches with Salad Niçoise ,https://eatsmarter.com/recipes/baguette-sandwiches-with-salad-nicoise
"Salad with Tomatoes, Scallions, and Artichokes ",https://eatsmarter.com/recipes/salad-with-tomatoes-scallions-and-artichokes
Salade Niçoise ,https://eatsmarter.com/recipes/salade-nicoise-1
Lentil Ham Salad with Parsley ,https://eatsmarter.com/recipes/lentil-ham-salad-with-parsley
Pollock and Bacon with Mashed Potatoes ,https://eatsmarter.com/recipes/pollock-and-bacon-with-mashed-potatoes
Beetroot Flan ,https://eatsmarter.com/recipes/beetroot-flan
"Spinach Salad with Chicken, Mandarin Oranges and Pecans ",https://eatsmarter.com/recipes/spinach-salad-with-chicken-mandarin-oranges-and-pecans
"Avocado, Arugula and Bacon Salad ",https://eatsmarter.com/recipes/avocado-arugula-and-bacon-salad
Niçoise Salad ,https://eatsmarter.com/recipes/nicoise-salad-0
Waldorf Salad ,https://eatsmarter.com/recipes/waldorf-salad-0
Cucumber Salad with Raisins and Mint ,https://eatsmarter.com/recipes/cucumber-salad-with-raisins-and-mint
Green Salad with Dandelions and Radishes ,https://eatsmarter.com/recipes/green-salad-with-dandelions-and-radishes
Mixed Berries with Orange-Flavored Mascarpone Cream ,https://eatsmarter.com/recipes/mixed-berries-with-orange-flavored-mascarpone-cream
"Crostini with Baked Goat Cheese, Salad and Pistachio Pesto ",https://eatsmarter.com/recipes/crostini-with-baked-goat-cheese-salad-and-pistachio-pesto
Pumpkin and Lentil Salad ,https://eatsmarter.com/recipes/pumpkin-and-lentil-salad
Marinated Salmon with Fresh Spinach ,https://eatsmarter.com/recipes/marinated-salmon-with-fresh-spinach
Avocado Salad with Corn ,https://eatsmarter.com/recipes/avocado-salad-with-corn
Summer Salad with Edible Flowers ,https://eatsmarter.com/recipes/summer-salad-with-edible-flowers
Asparagus and Radicchio Salad with Strawberries and Vanilla Oil ,https://eatsmarter.com/recipes/asparagus-and-radicchio-salad-with-strawberries-and-vanilla-oil
Cauliflower and Tomato Salad with Capers ,https://eatsmarter.com/recipes/cauliflower-and-tomato-salad-with-capers
Ground Meat Patties with Bulgur Salad ,https://eatsmarter.com/recipes/ground-meat-patties-with-bulgur-salad
Radicchio and Grape Salad ,https://eatsmarter.com/recipes/radicchio-and-grape-salad
Tossed Green Salad with Bologna and Daikon ,https://eatsmarter.com/recipes/tossed-green-salad-with-bologna-and-daikon
Red Cabbage and Pear Salad with Lentils ,https://eatsmarter.com/recipes/red-cabbage-and-pear-salad-with-lentils
Beef Tenderloin with Smashed Potatoes and Mixed Herbs ,https://eatsmarter.com/recipes/beef-tenderloin-with-smashed-potatoes-and-mixed-herbs
Cucumber-Tomato Salad with Meatballs ,https://eatsmarter.com/recipes/cucumber-tomato-salad-with-meatballs
Bean Endive Soup ,https://eatsmarter.com/recipes/bean-endive-soup
Colorful Potato Salad ,https://eatsmarter.com/recipes/colorful-potato-salad
Green Leef Lettuce with Prawns and Cucumber ,https://eatsmarter.com/recipes/green-leef-lettuce-with-prawns-and-cucumber
Coleslaw with Crispy Fried Shrimp ,https://eatsmarter.com/recipes/coleslaw-with-crispy-fried-shrimp
Cod with Prosciutto and Tomatoes ,https://eatsmarter.com/recipes/cod-with-prosciutto-and-tomatoes
"Roast Beef with Potato, Tomato and a Side Salad ",https://eatsmarter.com/recipes/roast-beef-with-potato-tomato-and-a-side-salad
Colorful Tomato Salad ,https://eatsmarter.com/recipes/colorful-tomato-salad-0
Salad Niçoise ,https://eatsmarter.com/recipes/salad-nicoise-1
Pumpkin Slices with Salad ,https://eatsmarter.com/recipes/pumpkin-slices-with-salad
Country Potatoes with Vegetable Salad and Dip ,https://eatsmarter.com/recipes/country-potatoes-with-vegetable-salad-and-dip
Nice Style Salad ,https://eatsmarter.com/recipes/nice-style-salad
Beetroot and Onion Salad ,https://eatsmarter.com/recipes/beetroot-and-onion-salad
Tomato and Cheese Salad with Mango ,https://eatsmarter.com/recipes/tomato-and-cheese-salad-with-mango
Grilled Halloumi with Tomato and Fennel Salad ,https://eatsmarter.com/recipes/grilled-halloumi-with-tomato-and-fennel-salad
Fried Fish with Cucumber-yogurt Salad ,https://eatsmarter.com/recipes/fried-fish-with-cucumber-yogurt-salad
Baked Lobster with Herbs ,https://eatsmarter.com/recipes/baked-lobster-with-herbs
Chicken Salad Wrap ,https://eatsmarter.com/recipes/chicken-salad-wrap
Mixed Beans and Rice with Chicken Skewers and Mango ,https://eatsmarter.com/recipes/mixed-beans-and-rice-with-chicken-skewers-and-mango
Mache Lettuce Salad with Potato Vinaigrette and Bacon ,https://eatsmarter.com/recipes/mache-lettuce-salad-with-potato-vinaigrette-and-bacon
Fish Strudel ,https://eatsmarter.com/recipes/fish-strudel
Indian Chickpea Salad with Almonds and Pomegranate Seeds ,https://eatsmarter.com/recipes/indian-chickpea-salad-with-almonds-and-pomegranate-seeds
Bread Salad with Vegetables ,https://eatsmarter.com/recipes/bread-salad-with-vegetables
Trout Fillets with Cucumber Salsa ,https://eatsmarter.com/recipes/trout-fillets-with-cucumber-salsa
Green Salad with Nectarines and Sprouts ,https://eatsmarter.com/recipes/green-salad-with-nectarines-and-sprouts
Grape and Cheese Salad ,https://eatsmarter.com/recipes/grape-and-cheese-salad
Egg Salad with Ham and Corn ,https://eatsmarter.com/recipes/egg-salad-with-ham-and-corn
Bread Salad with Mushrooms and Bacon ,https://eatsmarter.com/recipes/bread-salad-with-mushrooms-and-bacon
Octopus and Apple Salad with Celery ,https://eatsmarter.com/recipes/octopus-and-apple-salad-with-celery
Romaine Salad with Garlic Sprouts and Croutons ,https://eatsmarter.com/recipes/romaine-salad-with-garlic-sprouts-and-croutons
