title,url
Vegetarian Rigatoni ,https://eatsmarter.com/recipes/vegetarian-rigatoni
Beet Latte ,https://eatsmarter.com/recipes/beet-latte
Beet Salad with Feta and Walnuts ,https://eatsmarter.com/recipes/beet-salad-with-feta-and-walnuts
Deviled Eggs with Cress ,https://eatsmarter.com/recipes/deviled-eggs-with-cress-0
Rye Bread with Avocado and Beet Spread ,https://eatsmarter.com/recipes/rye-bread-with-avocado-and-beet-spread
Vegetable Noodles with Peanut Sauce ,https://eatsmarter.com/recipes/vegetable-noodles-with-peanut-sauce
Colorful Potato Salad ,https://eatsmarter.com/recipes/colorful-potato-salad-0
Pumpkin Hummus ,https://eatsmarter.com/recipes/pumpkin-hummus
Breaded Feta with Red Cabbage and Salsa Verde ,https://eatsmarter.com/recipes/breaded-feta-with-red-cabbage-and-salsa-verde
Easy Vegan Pumpkin Soup ,https://eatsmarter.com/recipes/easy-vegan-pumpkin-soup
Pumpkin Pasta with Arugula ,https://eatsmarter.com/recipes/pumpkin-pasta-with-arugula
Watermelon on a Stick with Chocolate ,https://eatsmarter.com/recipes/watermelon-on-a-stick-with-chocolate
Cashew Mousse with Strawberries ,https://eatsmarter.com/recipes/cashew-mousse-with-strawberries
Spicy Waffles with Dip ,https://eatsmarter.com/recipes/spicy-waffles-with-dip
Vegan Tahini Dressing ,https://eatsmarter.com/recipes/vegan-tahini-dressing
Chocolate Overnight Oats with Persimmons ,https://eatsmarter.com/recipes/chocolate-overnight-oats-with-persimmons
Brioche with Sourdough ,https://eatsmarter.com/recipes/brioche-with-sourdough
"Sourdough Pancakes with Blood Orange, Chocolate and Pistachios ",https://eatsmarter.com/recipes/sourdough-pancakes-with-blood-orange-chocolate-and-pistachios
Lavender Water with Raspberries ,https://eatsmarter.com/recipes/lavender-water-with-raspberries
Cauliflower Rice Bowl ,https://eatsmarter.com/recipes/cauliflower-rice-bowl
Avocado Chickpea Wraps ,https://eatsmarter.com/recipes/avocado-chickpea-wraps
Caprese Wraps with Avocado ,https://eatsmarter.com/recipes/caprese-wraps-with-avocado
Light Bechamel Sauce ,https://eatsmarter.com/recipes/light-bechamel-sauce
Chocolate Banana Chickpea Smoothie ,https://eatsmarter.com/recipes/chocolate-banana-chickpea-smoothie
Zucchini Coconut Soup ,https://eatsmarter.com/recipes/zucchini-coconut-soup
Oven Vegetables with Tahini Sauce ,https://eatsmarter.com/recipes/oven-vegetables-with-tahini-sauce
Peanut Sweet Potato Soup ,https://eatsmarter.com/recipes/peanut-sweet-potato-soup
Vegetable Goulash ,https://eatsmarter.com/recipes/vegetable-goulash-0
Tortellini Au Gratin ,https://eatsmarter.com/recipes/tortellini-au-gratin
Crunchy Coconut Granola ,https://eatsmarter.com/recipes/crunchy-coconut-granola
Skyr with Strawberries and Oatmeal ,https://eatsmarter.com/recipes/skyr-with-strawberries-and-oatmeal
Coconut Shakshuka ,https://eatsmarter.com/recipes/coconut-shakshuka
Honey Overnight Oats with Berries ,https://eatsmarter.com/recipes/honey-overnight-oats-with-berries
Grain Bowl with Fried Eggs ,https://eatsmarter.com/recipes/grain-bowl-with-fried-eggs
Healthy Green Shots ,https://eatsmarter.com/recipes/healthy-green-shots
Vegetarian Pizza Rolls ,https://eatsmarter.com/recipes/vegetarian-pizza-rolls
Purple Smoothie Bowl ,https://eatsmarter.com/recipes/purple-smoothie-bowl
Baked Endive with Kiwi Dressing ,https://eatsmarter.com/recipes/baked-endive-with-kiwi-dressing
Chia Water with Kiwi ,https://eatsmarter.com/recipes/chia-water-with-kiwi
Coconut Cheesecake Smoothie ,https://eatsmarter.com/recipes/coconut-cheesecake-smoothie
Stuffed Spaghetti Squash ,https://eatsmarter.com/recipes/stuffed-spaghetti-squash
Beet Bagels ,https://eatsmarter.com/recipes/beet-bagels
Sourdough Bagels ,https://eatsmarter.com/recipes/sourdough-bagels
Easy Sourdough Pizza with Mozzarella ,https://eatsmarter.com/recipes/easy-sourdough-pizza-with-mozzarella
Chickpea Pancakes ,https://eatsmarter.com/recipes/chickpea-pancakes
Alkaline Breakfast ,https://eatsmarter.com/recipes/alkaline-breakfast
Toast with Chickpea Mash ,https://eatsmarter.com/recipes/toast-with-chickpea-mash
Skyr Overnight Oats with Strawberries ,https://eatsmarter.com/recipes/skyr-overnight-oats-with-strawberries
Cottage Cheese Pancakes ,https://eatsmarter.com/recipes/cottage-cheese-pancakes
Pink Berry Coconut Drink with Silken Tofu ,https://eatsmarter.com/recipes/pink-berry-coconut-drink-with-silken-tofu
Strawberry Banana Wraps with Peanut Butter ,https://eatsmarter.com/recipes/strawberry-banana-wraps-with-peanut-butter
Strawberry Asparagus Salad with Feta ,https://eatsmarter.com/recipes/strawberry-asparagus-salad-with-feta
Ginger Celery Shot with Apple ,https://eatsmarter.com/recipes/ginger-celery-shot-with-apple
Vegetable Fries with Homemade Ketchup ,https://eatsmarter.com/recipes/vegetable-fries-with-homemade-ketchup
Savoy Cabbage Wraps with Beets ,https://eatsmarter.com/recipes/savoy-cabbage-wraps-with-beets
Smoothie Bowl with Blueberries ,https://eatsmarter.com/recipes/smoothie-bowl-with-blueberries
Wholemeal Vegetable Pizza with Avocado ,https://eatsmarter.com/recipes/wholemeal-vegetable-pizza-with-avocado
Lentil and Kale Moussaka ,https://eatsmarter.com/recipes/lentil-and-kale-moussaka
Vegetarian Cheese Quesadillas ,https://eatsmarter.com/recipes/vegetarian-cheese-quesadillas
Chickpea Tomato Salad ,https://eatsmarter.com/recipes/chickpea-tomato-salad
Skyr with Nuts ,https://eatsmarter.com/recipes/skyr-with-nuts
Colorful Tomato Salad with Halloumi ,https://eatsmarter.com/recipes/colorful-tomato-salad-with-halloumi
"Sweet Potato Salad with Spinach, Apple and Quinoa ",https://eatsmarter.com/recipes/sweet-potato-salad-with-spinach-apple-and-quinoa
Easy Apple and Carrot Salad ,https://eatsmarter.com/recipes/easy-apple-and-carrot-salad
Spelt Bread with Sourdough ,https://eatsmarter.com/recipes/spelt-bread-with-sourdough
Sweet Potato Toast with Avocado and Pea Puree ,https://eatsmarter.com/recipes/sweet-potato-toast-with-avocado-and-pea-puree
Chickpea Stuffed Peppers ,https://eatsmarter.com/recipes/chickpea-stuffed-peppers
Wholemeal Yeast Braided Bread ,https://eatsmarter.com/recipes/wholemeal-yeast-braided-bread
Tomato and Basil Hummus ,https://eatsmarter.com/recipes/tomato-and-basil-hummus
"Spelt Oatmeal with Bananas, Chocolate and Peanuts ",https://eatsmarter.com/recipes/spelt-oatmeal-with-bananas-chocolate-and-peanuts
Keto Coconut Porridge with Blueberries ,https://eatsmarter.com/recipes/keto-coconut-porridge-with-blueberries
Vegan Berry Nice Cream with Mint ,https://eatsmarter.com/recipes/vegan-berry-nice-cream-with-mint
Keto Broccoli Crust Pizza ,https://eatsmarter.com/recipes/keto-broccoli-crust-pizza
"Tacos with Cauliflower, Bean Mole and Sour Cream ",https://eatsmarter.com/recipes/tacos-with-cauliflower-bean-mole-and-sour-cream
Buckwheat Bowl with White Asparagus Skewers ,https://eatsmarter.com/recipes/buckwheat-bowl-with-white-asparagus-skewers
Garlic and Pea Risotto ,https://eatsmarter.com/recipes/garlic-and-pea-risotto
Stuffed Sweet Potato with Eggplant and Feta ,https://eatsmarter.com/recipes/stuffed-sweet-potato-with-eggplant-and-feta
Moonmilk with Lavender ,https://eatsmarter.com/recipes/moonmilk-with-lavender
Farro Balls with Caper Sauce and Broccoli ,https://eatsmarter.com/recipes/farro-balls-with-caper-sauce-and-broccoli
Breakfast Porridge with Nectarine ,https://eatsmarter.com/recipes/breakfast-porridge-with-nectarine
Zucchini-Potato-Oatmeal for Babies ,https://eatsmarter.com/recipes/zucchini-potato-oatmeal-for-babies
Citrus Breakfast Bowl ,https://eatsmarter.com/recipes/citrus-breakfast-bowl
Labneh Dip ,https://eatsmarter.com/recipes/labneh-dip
Poor Knights with Rosemary Peach Topping ,https://eatsmarter.com/recipes/poor-knights-with-rosemary-peach-topping
Sourdough Baguette ,https://eatsmarter.com/recipes/sourdough-baguette
Spicy Savoy Cabbage Chips ,https://eatsmarter.com/recipes/spicy-savoy-cabbage-chips
Basic Whole Wheat Waffles ,https://eatsmarter.com/recipes/basic-whole-wheat-waffles
Vegan Ramen Soup ,https://eatsmarter.com/recipes/vegan-ramen-soup
Baked Banana Oatmeal ,https://eatsmarter.com/recipes/baked-banana-oatmeal
Paneer Butter Masala ,https://eatsmarter.com/recipes/paneer-butter-masala
Babka with Chocolate and Walnuts ,https://eatsmarter.com/recipes/babka-with-chocolate-and-walnuts
Tomato Mozzarella Bread ,https://eatsmarter.com/recipes/tomato-mozzarella-bread
Sheet Pan Vegetables ,https://eatsmarter.com/recipes/sheet-pan-vegetables
Overnight Chocolate Banana Oats ,https://eatsmarter.com/recipes/overnight-chocolate-banana-oats
Carrot Cake Cookies with Walnuts ,https://eatsmarter.com/recipes/carrot-cake-cookies-with-walnuts
Skillet Potatoes with Asparagus ,https://eatsmarter.com/recipes/skillet-potatoes-with-asparagus
Grilled Eggplants with Pomegranate Seeds ,https://eatsmarter.com/recipes/grilled-eggplants-with-pomegranate-seeds
Grilled Vegetable Kabobs ,https://eatsmarter.com/recipes/grilled-vegetable-kabobs
Whole Wheat Vegetable Wraps ,https://eatsmarter.com/recipes/whole-wheat-vegetable-wraps
Eggplant with Pomegranate Seeds ,https://eatsmarter.com/recipes/eggplant-with-pomegranate-seeds
Tortilla with Spicy Fried Eggs ,https://eatsmarter.com/recipes/tortilla-with-spicy-fried-eggs
Orange Tomato Smoothie with Peppers ,https://eatsmarter.com/recipes/orange-tomato-smoothie-with-peppers
Strawberry Avocado Salad ,https://eatsmarter.com/recipes/strawberry-avocado-salad
Radish Salad with Ricotta Herb Gnocchi ,https://eatsmarter.com/recipes/radish-salad-with-ricotta-herb-gnocchi
Stuffed Avocado with Strawberry Salsa ,https://eatsmarter.com/recipes/stuffed-avocado-with-strawberry-salsa
Lentil Waffles with Wild Garlic Pesto ,https://eatsmarter.com/recipes/lentil-waffles-with-wild-garlic-pesto
How to Make Homemade Mayonnaise ,https://eatsmarter.com/recipes/how-to-make-homemade-mayonnaise
Almond Banana Drink ,https://eatsmarter.com/recipes/almond-banana-drink
Tart with Blueberries ,https://eatsmarter.com/recipes/tart-with-blueberries
Apricot Granola Bars with Mixed Seeds ,https://eatsmarter.com/recipes/apricot-granola-bars-with-mixed-seeds
Honeydew Melon with Basil Granita ,https://eatsmarter.com/recipes/honeydew-melon-with-basil-granita
Paneer Spinach Curry ,https://eatsmarter.com/recipes/paneer-spinach-curry
Açaí Bowl with Fresh Berries ,https://eatsmarter.com/recipes/acai-bowl-with-fresh-berries
Berry Smoothie Bowls with Seeds ,https://eatsmarter.com/recipes/berry-smoothie-bowls-with-seeds
Muesli Bowl with Coconut and Fruit ,https://eatsmarter.com/recipes/muesli-bowl-with-coconut-and-fruit
"Fried Egg, Avocado and Halloumi Breakfast ",https://eatsmarter.com/recipes/fried-egg-avocado-and-halloumi-breakfast
Mango Cream and Pumpernickel Coconut Crunch ,https://eatsmarter.com/recipes/mango-cream-and-pumpernickel-coconut-crunch
Sweet Potato Salad with Eggplant ,https://eatsmarter.com/recipes/sweet-potato-salad-with-eggplant
Green Spinach Smoothie ,https://eatsmarter.com/recipes/green-spinach-smoothie
Schupfnudeln with Vegetables ,https://eatsmarter.com/recipes/schupfnudeln-with-vegetables
Vegetarian Labskaus ,https://eatsmarter.com/recipes/vegetarian-labskaus
Avocado Fries and Yogurt Dip ,https://eatsmarter.com/recipes/avocado-fries-and-yogurt-dip
Sheet Pan Gnocchi ,https://eatsmarter.com/recipes/sheet-pan-gnocchi
Fried Potato Salad ,https://eatsmarter.com/recipes/fried-potato-salad
Easy Corn Fritters ,https://eatsmarter.com/recipes/easy-corn-fritters-0
Sheet Pan Brussels Sprouts ,https://eatsmarter.com/recipes/sheet-pan-brussels-sprouts
Vegetarian Stuffed Baked Potatoes ,https://eatsmarter.com/recipes/vegetarian-stuffed-baked-potatoes
Berry Smoothie Bowl with Almonds ,https://eatsmarter.com/recipes/berry-smoothie-bowl-with-almonds
Cottage Cheese Scrambled Eggs with Grapefruit Avocado Salad ,https://eatsmarter.com/recipes/cottage-cheese-scrambled-eggs-with-grapefruit-avocado-salad
Fruit Salad with Lemon Balm Pesto ,https://eatsmarter.com/recipes/fruit-salad-with-lemon-balm-pesto
Stuffed Sweet Potatoes with Chickpeas ,https://eatsmarter.com/recipes/stuffed-sweet-potatoes-with-chickpeas
Vegan Jackfruit Tacos ,https://eatsmarter.com/recipes/vegan-jackfruit-tacos
"Smoothie Bowl with Egg, Avocado and Snap Peas ",https://eatsmarter.com/recipes/smoothie-bowl-with-egg-avocado-and-snap-peas
Cucumber Salad with Vinegar & Oil Dressing ,https://eatsmarter.com/recipes/cucumber-salad-with-vinegar-oil-dressing
Smarter Rice Pudding with Sour Cherries ,https://eatsmarter.com/recipes/smarter-rice-pudding-with-sour-cherries
Alcohol-free Halloween Punch ,https://eatsmarter.com/recipes/alcohol-free-halloween-punch
Greek Yogurt with Fruit and Flaxseed ,https://eatsmarter.com/recipes/greek-yogurt-with-fruit-and-flaxseed
Vegan Cashew Nice Cream ,https://eatsmarter.com/recipes/vegan-cashew-nice-cream
Pistachio Fig Energy Balls ,https://eatsmarter.com/recipes/pistachio-fig-energy-balls
Coconut Raspberry Energy Balls ,https://eatsmarter.com/recipes/coconut-raspberry-energy-balls
Roasted Spiced Turmeric Cauliflower ,https://eatsmarter.com/recipes/roasted-spiced-turmeric-cauliflower
Easy Pasta with Arugula and Tomatoes ,https://eatsmarter.com/recipes/easy-pasta-with-arugula-and-tomatoes
Pancakes with Yogurt and Kiwi ,https://eatsmarter.com/recipes/pancakes-with-yogurt-and-kiwi
Golden Granola with Spelt and Buckwheat ,https://eatsmarter.com/recipes/golden-granola-with-spelt-and-buckwheat
Berry Watermelon Skyr Smoothie ,https://eatsmarter.com/recipes/berry-watermelon-skyr-smoothie
Almond Porridge with Blueberries ,https://eatsmarter.com/recipes/almond-porridge-with-blueberries
Konjac Pasta with Berries ,https://eatsmarter.com/recipes/konjac-pasta-with-berries
Oatmeal Burger with Beets and Walnuts ,https://eatsmarter.com/recipes/oatmeal-burger-with-beets-and-walnuts
Tomato Apricot Refresher ,https://eatsmarter.com/recipes/tomato-apricot-refresher
Salad Boats with Chickpeas and Tzatziki ,https://eatsmarter.com/recipes/salad-boats-with-chickpeas-and-tzatziki
Vegan Savoy Cabbage Roulades ,https://eatsmarter.com/recipes/vegan-savoy-cabbage-roulades
Carrot Noodles with Mushrooms and Tofu ,https://eatsmarter.com/recipes/carrot-noodles-with-mushrooms-and-tofu
Sweet Potato Slices with Goat Cheese & Pomegranate ,https://eatsmarter.com/recipes/sweet-potato-slices-with-goat-cheese-pomegranate
Stuffed Celery and Cheese Schnitzel with Nut Breading ,https://eatsmarter.com/recipes/stuffed-celery-and-cheese-schnitzel-with-nut-breading
Keto Lasagna with Zucchini Noodles ,https://eatsmarter.com/recipes/keto-lasagna-with-zucchini-noodles
Keto Spice Cocoa ,https://eatsmarter.com/recipes/keto-spice-cocoa
Oat Bread ,https://eatsmarter.com/recipes/oat-bread-0
Vegetarian Asparagus Casserole with Grilled Eggplant ,https://eatsmarter.com/recipes/vegetarian-asparagus-casserole-with-grilled-eggplant
Carrot and Mashed Potatoes with Mango ,https://eatsmarter.com/recipes/carrot-and-mashed-potatoes-with-mango
Compound Butter with Herbs ,https://eatsmarter.com/recipes/compound-butter-with-herbs
Apple Cookies with Dried Apricots ,https://eatsmarter.com/recipes/apple-cookies-with-dried-apricots
Granola with Mulberries ,https://eatsmarter.com/recipes/granola-with-mulberries
Apple Carrot Blueberry Smoothie ,https://eatsmarter.com/recipes/apple-carrot-blueberry-smoothie
Basic Tofu Recipe ,https://eatsmarter.com/recipes/basic-tofu-recipe
Grilled Watermelon with Herbed Ricotta ,https://eatsmarter.com/recipes/grilled-watermelon-with-herbed-ricotta
Lamb's Lettuce Avocado Smoothie with Papaya ,https://eatsmarter.com/recipes/lambs-lettuce-avocado-smoothie-with-papaya
Rye Bread Avocado Toast with Broccolini ,https://eatsmarter.com/recipes/rye-bread-avocado-toast-with-broccolini
Buckwheat with Rye Sauce and Garlic Mushrooms ,https://eatsmarter.com/recipes/buckwheat-with-rye-sauce-and-garlic-mushrooms
Sweet Potato Toast with Cashew Spread and Egg ,https://eatsmarter.com/recipes/sweet-potato-toast-with-cashew-spread-and-egg
Chia Mint Pudding with Strawberries ,https://eatsmarter.com/recipes/chia-mint-pudding-with-strawberries
Asparagus and Broccoli Tart ,https://eatsmarter.com/recipes/asparagus-and-broccoli-tart
Strawberry Lentil Salad with Rhubarb and Edamame ,https://eatsmarter.com/recipes/strawberry-lentil-salad-with-rhubarb-and-edamame
Froyo Blueberries ,https://eatsmarter.com/recipes/froyo-blueberries
Stuffed Spelt Pancakes with Salad and Goat Cheese ,https://eatsmarter.com/recipes/stuffed-spelt-pancakes-with-salad-and-goat-cheese
Ginger Shots ,https://eatsmarter.com/recipes/ginger-shots
Pulled Jackfruit Burger ,https://eatsmarter.com/recipes/pulled-jackfruit-burger
Spelt Spinach Bowl with Peanut Dressing ,https://eatsmarter.com/recipes/spelt-spinach-bowl-with-peanut-dressing
"Beet Soup with Coconut, Pear and Cinnamon ",https://eatsmarter.com/recipes/beet-soup-with-coconut-pear-and-cinnamon
Creamy Carrot Sweet Potato Soup with Croutons ,https://eatsmarter.com/recipes/creamy-carrot-sweet-potato-soup-with-croutons
Yogurt Cream with Berries ,https://eatsmarter.com/recipes/yogurt-cream-with-berries
Cucumber-Radish Salad with Feta ,https://eatsmarter.com/recipes/cucumber-radish-salad-with-feta
Coconut Curry Lentil Soup ,https://eatsmarter.com/recipes/coconut-curry-lentil-soup
Spelt Pumpkin Bread ,https://eatsmarter.com/recipes/spelt-pumpkin-bread
Avocado Mint Ice Cream with Chocolate Chips ,https://eatsmarter.com/recipes/avocado-mint-ice-cream-with-chocolate-chips
Date Applesauce Cake with Spelt Flour ,https://eatsmarter.com/recipes/date-applesauce-cake-with-spelt-flour
Immune Booster Kale Buddha Bowl ,https://eatsmarter.com/recipes/immune-booster-kale-buddha-bowl
Poppy Seed Pinwheel Cookies ,https://eatsmarter.com/recipes/poppy-seed-pinwheel-cookies
Keto Tofu Vegetable Curry with Cauliflower Rice ,https://eatsmarter.com/recipes/keto-tofu-vegetable-curry-with-cauliflower-rice
Morning Oatmeal with Oranges and Figs ,https://eatsmarter.com/recipes/morning-oatmeal-with-oranges-and-figs
Overnight Oats with Apple and Walnuts ,https://eatsmarter.com/recipes/overnight-oats-with-apple-and-walnuts
Vegan Tomato Spread ,https://eatsmarter.com/recipes/vegan-tomato-spread
Tomato Spread with Toast ,https://eatsmarter.com/recipes/tomato-spread-with-toast
"Veggie Rotini with Tomato Sauce, Lentils and Feta ",https://eatsmarter.com/recipes/veggie-rotini-with-tomato-sauce-lentils-and-feta
Stuffed Avocado with Cottage Cheese and Rye Bread ,https://eatsmarter.com/recipes/stuffed-avocado-with-cottage-cheese-and-rye-bread
Roasted Butternut Squash Soup with Feta ,https://eatsmarter.com/recipes/roasted-butternut-squash-soup-with-feta
Deviled Eggs with Beets and Capers ,https://eatsmarter.com/recipes/deviled-eggs-with-beets-and-capers
Spinach Kiwi Smoothie Bowl ,https://eatsmarter.com/recipes/spinach-kiwi-smoothie-bowl
Grilled Asparagus with Poached Egg ,https://eatsmarter.com/recipes/grilled-asparagus-with-poached-egg
German Pancake with Pears ,https://eatsmarter.com/recipes/german-pancake-with-pears
Chocolate Cake with Caramelized Figs ,https://eatsmarter.com/recipes/chocolate-cake-with-caramelized-figs
Whole Wheat Pancakes ,https://eatsmarter.com/recipes/whole-wheat-pancakes-0
Eggs Florentine on Sweet Potato Toast ,https://eatsmarter.com/recipes/eggs-florentine-on-sweet-potato-toast
Green Power Salad ,https://eatsmarter.com/recipes/green-power-salad
"Clafoutis with Apricots, Peach and Gooseberries ",https://eatsmarter.com/recipes/clafoutis-with-apricots-peach-and-gooseberries
Keto-Cracker with Spicy Cheese Dip ,https://eatsmarter.com/recipes/keto-cracker-with-spicy-cheese-dip
Leek Tofu and Cheese Soup ,https://eatsmarter.com/recipes/leek-tofu-and-cheese-soup
Classic Beet Salad ,https://eatsmarter.com/recipes/classic-beet-salad
Zucchini Potato Soup ,https://eatsmarter.com/recipes/zucchini-potato-soup
Roasted Vegetables with Garlic Mustard Dressing ,https://eatsmarter.com/recipes/roasted-vegetables-with-garlic-mustard-dressing
Low Carb Hazelnut Macaroons ,https://eatsmarter.com/recipes/low-carb-hazelnut-macaroons
Carrot Zucchini Salad with Blueberries ,https://eatsmarter.com/recipes/carrot-zucchini-salad-with-blueberries
Beet Pasta Salad with Baked Goat Cheese ,https://eatsmarter.com/recipes/beet-pasta-salad-with-baked-goat-cheese
Coconut Cashew Ice Cream with Strawberries ,https://eatsmarter.com/recipes/coconut-cashew-ice-cream-with-strawberries
Green Herb Smoothie ,https://eatsmarter.com/recipes/green-herb-smoothie
Cauliflower Crust Pizza Roll ,https://eatsmarter.com/recipes/cauliflower-crust-pizza-roll
Zucchini Carpaccio with Basil and Ricotta ,https://eatsmarter.com/recipes/zucchini-carpaccio-with-basil-and-ricotta
Vegetarian Club Sandwiches ,https://eatsmarter.com/recipes/vegetarian-club-sandwiches
Acai Bowl with Dragon Fruit ,https://eatsmarter.com/recipes/acai-bowl-with-dragon-fruit
Vegan Chocolate Pralines with Cocoa Glaze ,https://eatsmarter.com/recipes/vegan-chocolate-pralines-with-cocoa-glaze
Crunchy Oat and Mango Breakfast Bowl ,https://eatsmarter.com/recipes/crunchy-oat-and-mango-breakfast-bowl
Blueberry Coconut Smoothie ,https://eatsmarter.com/recipes/blueberry-coconut-smoothie
"Salad with Shrimp, Egg and Strawberry Dressing ",https://eatsmarter.com/recipes/salad-with-shrimp-egg-and-strawberry-dressing
Coconut Papaya Bar ,https://eatsmarter.com/recipes/coconut-papaya-bar
Spicy Almond Cashew Mix ,https://eatsmarter.com/recipes/spicy-almond-cashew-mix
Blueberry Hummus with Dates ,https://eatsmarter.com/recipes/blueberry-hummus-with-dates
Gluten-free Millet Bowl with Roasted Plums ,https://eatsmarter.com/recipes/gluten-free-millet-bowl-with-roasted-plums
Vegan Sweet Potato Burger ,https://eatsmarter.com/recipes/vegan-sweet-potato-burger
Pizza Minis for Halloween ,https://eatsmarter.com/recipes/pizza-minis-for-halloween
Vegan Burger Buns ,https://eatsmarter.com/recipes/vegan-burger-buns
Matcha Pistachio Stars ,https://eatsmarter.com/recipes/matcha-pistachio-stars
Blackberry Tartlettes ,https://eatsmarter.com/recipes/blackberry-tartlettes
Vegan Puff Pastry with Pumpkin Mushroom Filling ,https://eatsmarter.com/recipes/vegan-puff-pastry-with-pumpkin-mushroom-filling
Smarter Red Cabbage ,https://eatsmarter.com/recipes/smarter-red-cabbage
Winter Bowl with Hemp Seed Balls ,https://eatsmarter.com/recipes/winter-bowl-with-hemp-seed-balls
Kale Avocado Chili Dip with Keto Crackers ,https://eatsmarter.com/recipes/kale-avocado-chili-dip-with-keto-crackers
Sauerkraut Buddy ,https://eatsmarter.com/recipes/sauerkraut-buddy
Vegan Blueberry Coconut Overnight Oats ,https://eatsmarter.com/recipes/vegan-blueberry-coconut-overnight-oats
Avocado Fries ,https://eatsmarter.com/recipes/avocado-fries
Sheet Pan Zucchini with Feta ,https://eatsmarter.com/recipes/sheet-pan-zucchini-with-feta
Baked Oatmeal with Berries ,https://eatsmarter.com/recipes/baked-oatmeal-with-berries
Grilled Fennel ,https://eatsmarter.com/recipes/grilled-fennel
Traditional Greek Salad ,https://eatsmarter.com/recipes/traditional-greek-salad
Baked Asparagus with Feta Cheese ,https://eatsmarter.com/recipes/baked-asparagus-with-feta-cheese
Vegan Apple Crumble ,https://eatsmarter.com/recipes/vegan-apple-crumble
Avocado Toast with Egg ,https://eatsmarter.com/recipes/avocado-toast-with-egg
Cream Cheese Bites with Arugula and Cress ,https://eatsmarter.com/recipes/cream-cheese-bites-with-arugula-and-cress
Pear Crumble with Lime Cream ,https://eatsmarter.com/recipes/pear-crumble-with-lime-cream
Tofu Curry with Green Vegetables ,https://eatsmarter.com/recipes/tofu-curry-with-green-vegetables
Ricotta Pear Casserole with Almonds ,https://eatsmarter.com/recipes/ricotta-pear-casserole-with-almonds
Rye Bread with Goat Cheese and Honey ,https://eatsmarter.com/recipes/rye-bread-with-goat-cheese-and-honey
Kale Ginger Smoothie ,https://eatsmarter.com/recipes/kale-ginger-smoothie
"Polenta Pizza with Goat Cheese, Figs and Grapes ",https://eatsmarter.com/recipes/polenta-pizza-with-goat-cheese-figs-and-grapes
Beet and Bean Mini Burgers ,https://eatsmarter.com/recipes/beet-and-bean-mini-burgers
Spicy Carrot Protein Bread ,https://eatsmarter.com/recipes/spicy-carrot-protein-bread
"Smoothie Bowl with Coconut, Mango and Passion Fruit ",https://eatsmarter.com/recipes/smoothie-bowl-with-coconut-mango-and-passion-fruit
Cream Cheese Radish Toast ,https://eatsmarter.com/recipes/cream-cheese-radish-toast
Avocado Crostini ,https://eatsmarter.com/recipes/avocado-crostini
Cheese Puffs with Dried Cherries ,https://eatsmarter.com/recipes/cheese-puffs-with-dried-cherries
Baked Quinoa with Fruit Salad ,https://eatsmarter.com/recipes/baked-quinoa-with-fruit-salad
Green Bean Gratin ,https://eatsmarter.com/recipes/green-bean-gratin
Kidney Bean and Zucchini Soup ,https://eatsmarter.com/recipes/kidney-bean-and-zucchini-soup
Polenta with Roasted Garlic ,https://eatsmarter.com/recipes/polenta-with-roasted-garlic
Pumpkin Loaf Bread ,https://eatsmarter.com/recipes/pumpkin-loaf-bread
Herb Dumplings ,https://eatsmarter.com/recipes/herb-dumplings-0
Crispy Oven French Fries ,https://eatsmarter.com/recipes/crispy-oven-french-fries
Grilled Feta ,https://eatsmarter.com/recipes/grilled-feta
Potato Pancake  with Plums ,https://eatsmarter.com/recipes/potato-pancake-with-plums
Potato Focaccia ,https://eatsmarter.com/recipes/potato-focaccia-0
Radish Green Pesto ,https://eatsmarter.com/recipes/radish-green-pesto
Halloween Chocolate Pudding ,https://eatsmarter.com/recipes/halloween-chocolate-pudding
Fennel Au Gratin with Caramelized Grapes ,https://eatsmarter.com/recipes/fennel-au-gratin-with-caramelized-grapes
Grilled Halloumi and Zucchini with Berry Salsa ,https://eatsmarter.com/recipes/grilled-halloumi-and-zucchini-with-berry-salsa
Potato Pancakes with Raspberry Sauce ,https://eatsmarter.com/recipes/potato-pancakes-with-raspberry-sauce
Buckwheat Grains with Honey Pears and Hazelnut Puree ,https://eatsmarter.com/recipes/buckwheat-grains-with-honey-pears-and-hazelnut-puree
Winter Buddha-Bowl with Barley ,https://eatsmarter.com/recipes/buddha-bowl
Red Velvet Hot Chocolate ,https://eatsmarter.com/recipes/red-velvet-hot-chocolate
