title,url
Prawn Nems with Asparagus ,https://eatsmarter.com/recipes/prawn-nems-with-asparagus
Risotto with Lemon Pesto ,https://eatsmarter.com/recipes/risotto-with-lemon-pesto
"Lemon, Herb and Pine Nut Risotto ",https://eatsmarter.com/recipes/lemon-herb-and-pine-nut-risotto
Summer Berry Rice Pudding ,https://eatsmarter.com/recipes/summer-berry-rice-pudding
Creamy Rice Pudding Layered With Berries ,https://eatsmarter.com/recipes/creamy-rice-pudding-layered-with-berries
Summer Rolls ,https://eatsmarter.com/recipes/summer-rolls
Healthy Vietnamese Wrappers ,https://eatsmarter.com/recipes/healthy-vietnamese-wrappers
Chicken Summer Rolls ,https://eatsmarter.com/recipes/chicken-summer-rolls
Egg and Chicken Fried Rice ,https://eatsmarter.com/recipes/egg-and-chicken-fried-rice
Classic Egg-fried Rice ,https://eatsmarter.com/recipes/classic-egg-fried-rice
Chinese Grain and Citrus Broth ,https://eatsmarter.com/recipes/chinese-grain-and-citrus-broth
Creamy Soy and Vegetable Bowl ,https://eatsmarter.com/recipes/creamy-soy-and-vegetable-bowl
Shellfish Rice Dish ,https://eatsmarter.com/recipes/shellfish-rice-dish
Filled Vine Tomatoes ,https://eatsmarter.com/recipes/filled-vine-tomatoes
"Chicken, Pepper, and Pea Stir-fry ",https://eatsmarter.com/recipes/chicken-pepper-and-pea-stir-fry
Peanut Sauce Chicken with Mange Tout Peas ,https://eatsmarter.com/recipes/peanut-sauce-chicken-with-mange-tout-peas
Swordfish Steaks with Black Olive Tapenade and Rice ,https://eatsmarter.com/recipes/swordfish-steaks-with-black-olive-tapenade-and-rice
Asian-style Fish Fillet with Rice Noodles ,https://eatsmarter.com/recipes/asian-style-fish-fillet-with-rice-noodles
Breaded Rice Patties ,https://eatsmarter.com/recipes/breaded-rice-patties
Cannellini Bean Rice Bowl ,https://eatsmarter.com/recipes/cannellini-bean-rice-bowl
"StickySticky Rice, Coconut and Sesame Dumplings and Chocolate Nut Truffles ",https://eatsmarter.com/recipes/stickysticky-rice-coconut-and-sesame-dumplings-and-chocolate-nut-truffles
Malaysian Rice Noodles ,https://eatsmarter.com/recipes/malaysian-rice-noodles
Bacon and Vegetable-fried Rice ,https://eatsmarter.com/recipes/bacon-and-vegetable-fried-rice
Mushroom Soup with Korean-style Ribs ,https://eatsmarter.com/recipes/mushroom-soup-with-korean-style-ribs
South-east Asian Noodle Bowl ,https://eatsmarter.com/recipes/south-east-asian-noodle-bowl-0
Slow Cooker Stuffed Tomatoes ,https://eatsmarter.com/recipes/slow-cooker-stuffed-tomatoes
Jambalaya ,https://eatsmarter.com/recipes/jambalaya
Bacon-wrapped Scallops ,https://eatsmarter.com/recipes/bacon-wrapped-scallops-0
Lemon and Thyme Risotto ,https://eatsmarter.com/recipes/lemon-and-thyme-risotto
Yellow Rice Bowls with Chicken ,https://eatsmarter.com/recipes/yellow-rice-bowls-with-chicken
Sweet Italian Rice Bake ,https://eatsmarter.com/recipes/sweet-italian-rice-bake
Rice Pudding Sponge ,https://eatsmarter.com/recipes/rice-pudding-sponge
"Rice, Tuna, Corn and Kidney Bean Salad ",https://eatsmarter.com/recipes/rice-tuna-corn-and-kidney-bean-salad
Vegan Noodle Broth ,https://eatsmarter.com/recipes/vegan-noodle-broth
"Green Bean, Corn, and Beef Skillet Fry ",https://eatsmarter.com/recipes/green-bean-corn-and-beef-skillet-fry
"Fried Vegetables, Rice and Coconut ",https://eatsmarter.com/recipes/fried-vegetables-rice-and-coconut
King Prawn and Cucumber Noodle Stir-fry ,https://eatsmarter.com/recipes/king-prawn-and-cucumber-noodle-stir-fry
Creamy Pumpkin Risotto with Parmesan ,https://eatsmarter.com/recipes/creamy-pumpkin-risotto-with-parmesan
Vegetable-fried Rice ,https://eatsmarter.com/recipes/vegetable-fried-rice
Japanese Teriyaki Pork with Fried Rice ,https://eatsmarter.com/recipes/japanese-teriyaki-pork-with-fried-rice
Creole Chicken and Rice ,https://eatsmarter.com/recipes/creole-chicken-and-rice
Ruby Risotto ,https://eatsmarter.com/recipes/ruby-risotto
Risotto Primavera ,https://eatsmarter.com/recipes/risotto-primavera
Laksa ,https://eatsmarter.com/recipes/laksa
Chinese Noodle and Peanut Bowls ,https://eatsmarter.com/recipes/chinese-noodle-and-peanut-bowls
Chicken Tikka Masala with Pilau Rice ,https://eatsmarter.com/recipes/chicken-tikka-masala-with-pilau-rice
Creamy Rice with Fruit Jam ,https://eatsmarter.com/recipes/creamy-rice-with-fruit-jam
Creamy Rice Pots ,https://eatsmarter.com/recipes/creamy-rice-pots
Seared Chicken and Bacon Risotto ,https://eatsmarter.com/recipes/seared-chicken-and-bacon-risotto
Japanese Noodle Plate ,https://eatsmarter.com/recipes/japanese-noodle-plate
Pumpkin and Thyme Creamy Risotto ,https://eatsmarter.com/recipes/pumpkin-and-thyme-creamy-risotto
Pork Chinese Rice ,https://eatsmarter.com/recipes/pork-chinese-rice
Quick Biriyani ,https://eatsmarter.com/recipes/quick-biriyani
Chinese Pork Broth ,https://eatsmarter.com/recipes/chinese-pork-broth
Onigri ,https://eatsmarter.com/recipes/onigri
Mushroom Broth with Chinese Cabbage ,https://eatsmarter.com/recipes/mushroom-broth-with-chinese-cabbage
Seafood Paella ,https://eatsmarter.com/recipes/seafood-paella
Spiced Creamy Rice ,https://eatsmarter.com/recipes/spiced-creamy-rice
Breakfast Rice Dish ,https://eatsmarter.com/recipes/breakfast-rice-dish
Mexican Sweet Potato and Rice ,https://eatsmarter.com/recipes/mexican-sweet-potato-and-rice
Rice with Fava Beans and Peas ,https://eatsmarter.com/recipes/rice-with-fava-beans-and-peas
Indian Vegetable Biriyani ,https://eatsmarter.com/recipes/indian-vegetable-biriyani
Creamy Rice Cookie Stacks ,https://eatsmarter.com/recipes/creamy-rice-cookie-stacks
Crunchy Nems with Dip ,https://eatsmarter.com/recipes/crunchy-nems-with-dip
Sushi Bites with Cress ,https://eatsmarter.com/recipes/sushi-bites-with-cress
Spanish Rice Dish with Lemon ,https://eatsmarter.com/recipes/spanish-rice-dish-with-lemon
Veggie and Mint Wraps ,https://eatsmarter.com/recipes/veggie-and-mint-wraps
Healthy Salmon and Rice Bowls ,https://eatsmarter.com/recipes/healthy-salmon-and-rice-bowls
Rice and Vegetable-stuffed Banana Leaves ,https://eatsmarter.com/recipes/rice-and-vegetable-stuffed-banana-leaves
Salmon and Rice-stuffed Peppers ,https://eatsmarter.com/recipes/salmon-and-rice-stuffed-peppers
Chinese-style Pumpkin Curry ,https://eatsmarter.com/recipes/chinese-style-pumpkin-curry
Mild Chickpea Curry ,https://eatsmarter.com/recipes/mild-chickpea-curry
Tropical Rice and Chicken Salad ,https://eatsmarter.com/recipes/tropical-rice-and-chicken-salad
Creamy Beet Rice ,https://eatsmarter.com/recipes/creamy-beet-rice
Indian Pilau Rice with Veggie Curry ,https://eatsmarter.com/recipes/indian-pilau-rice-with-veggie-curry
Indian-style Lamb and Rice Dish ,https://eatsmarter.com/recipes/indian-style-lamb-and-rice-dish
Asian Chicken and Noodle Bowl ,https://eatsmarter.com/recipes/asian-chicken-and-noodle-bowl
Vegetable Egg Fried Rice ,https://eatsmarter.com/recipes/vegetable-egg-fried-rice
Vegetable Fried Rice ,https://eatsmarter.com/recipes/vegetable-fried-rice-0
South Indian Rice Cakes ,https://eatsmarter.com/recipes/south-indian-rice-cakes
Slow Cooker Creamy Rice Pudding ,https://eatsmarter.com/recipes/slow-cooker-creamy-rice-pudding
Smoked Salmon and Lemon Risotto ,https://eatsmarter.com/recipes/smoked-salmon-and-lemon-risotto
Stuffed Aubergine Halves ,https://eatsmarter.com/recipes/stuffed-aubergine-halves-1
Fragrant Rice and Potato with Sauce ,https://eatsmarter.com/recipes/fragrant-rice-and-potato-with-sauce
Indian Spiced Cashew Rice ,https://eatsmarter.com/recipes/indian-spiced-cashew-rice
Spiced Rice with Chicken Breasts ,https://eatsmarter.com/recipes/spiced-rice-with-chicken-breasts
"Mushroom, Pork, and Mushrooms over Rice ",https://eatsmarter.com/recipes/mushroom-pork-and-mushrooms-over-rice
Pumpkin Risotto ,https://eatsmarter.com/recipes/pumpkin-risotto
"Carrot, Apricot and Raisin Spicy Indian Pilau ",https://eatsmarter.com/recipes/carrot-apricot-and-raisin-spicy-indian-pilau
Creamy Leek and Sage Risotto ,https://eatsmarter.com/recipes/creamy-leek-and-sage-risotto
Indian Rice and Smoked Fish Breakfast ,https://eatsmarter.com/recipes/indian-rice-and-smoked-fish-breakfast
Spinach and Rice Pastry Pie ,https://eatsmarter.com/recipes/spinach-and-rice-pastry-pie
Spanish Chicken and Chorizo Rice ,https://eatsmarter.com/recipes/spanish-chicken-and-chorizo-rice
Sweet Rice Dome ,https://eatsmarter.com/recipes/sweet-rice-dome
Meat in Spicy Coconut Milk ,https://eatsmarter.com/recipes/meat-in-spicy-coconut-milk
Italian Rice with Spring Veg ,https://eatsmarter.com/recipes/italian-rice-with-spring-veg
Cuban Yellow Rice ,https://eatsmarter.com/recipes/cuban-yellow-rice
Puerto Rican Fried Rice ,https://eatsmarter.com/recipes/puerto-rican-fried-rice
Caribbean Rice ,https://eatsmarter.com/recipes/caribbean-rice
Cuban Yellow Rice ,https://eatsmarter.com/recipes/cuban-yellow-rice-0
"Gluten-free, Vegan Brown Rice Pasta with ",https://eatsmarter.com/recipes/gluten-free-vegan-brown-rice-pasta-with-cream-sauce
Mixed Baby Food Dinners ,https://eatsmarter.com/recipes/mixed-baby-food-dinners
Creole-style Jambalaya ,https://eatsmarter.com/recipes/creole-style-jambalaya
Classic Mushroom Risotto ,https://eatsmarter.com/recipes/classic-mushroom-risotto
Spiced Indian Chicken with Pilau ,https://eatsmarter.com/recipes/spiced-indian-chicken-with-pilau
Citrus Rice with Shrimp ,https://eatsmarter.com/recipes/citrus-rice-with-shrimp
Sticky Rice Patties with Salsa ,https://eatsmarter.com/recipes/sticky-rice-patties-with-salsa
Chicken with Curried Fried Rice ,https://eatsmarter.com/recipes/chicken-with-curried-fried-rice
Quick Indian Biriyani ,https://eatsmarter.com/recipes/quick-indian-biriyani
Fried Risotto Balls ,https://eatsmarter.com/recipes/fried-risotto-balls
"Pork with Noodles, Apple and Broccoli ",https://eatsmarter.com/recipes/pork-with-noodles-apple-and-broccoli
Spanish Seafood Rice ,https://eatsmarter.com/recipes/spanish-seafood-rice
Sweet Nutty Risotto ,https://eatsmarter.com/recipes/sweet-nutty-risotto
Chinese Sausage and Pea Rice ,https://eatsmarter.com/recipes/chinese-sausage-and-pea-rice
Fish and Salad Wraps ,https://eatsmarter.com/recipes/fish-and-salad-wraps
Cod Fried Rice ,https://eatsmarter.com/recipes/cod-fried-rice
Cheesy Arancini ,https://eatsmarter.com/recipes/cheesy-arancini
Spanish Rice with Chicken and Bream ,https://eatsmarter.com/recipes/spanish-rice-with-chicken-and-bream
Healthy Asian Wrappers ,https://eatsmarter.com/recipes/healthy-asian-wrappers
Spanish Rice Dish ,https://eatsmarter.com/recipes/spanish-rice-dish
Oriental Duck Wraps ,https://eatsmarter.com/recipes/oriental-duck-wraps
Seafood Rice Wraps ,https://eatsmarter.com/recipes/seafood-rice-wraps
Dried Fruit and Nut Rice Dish ,https://eatsmarter.com/recipes/dried-fruit-and-nut-rice-dish
Sweet Rice Dessert with Fruit ,https://eatsmarter.com/recipes/sweet-rice-dessert-with-fruit
White Meat Bisque with Rice ,https://eatsmarter.com/recipes/white-meat-bisque-with-rice
Southwest Chicken Salad Bowl ,https://eatsmarter.com/recipes/southwest-chicken-salad-bowl
Shellfish with Basil Rice ,https://eatsmarter.com/recipes/shellfish-with-basil-rice
Mushroom and Shrimp Rice ,https://eatsmarter.com/recipes/mushroom-and-shrimp-rice
Herby Salmon Rice ,https://eatsmarter.com/recipes/herby-salmon-rice
Vietnamese-style Beef Curry ,https://eatsmarter.com/recipes/vietnamese-style-beef-curry
Baked Golden Rice ,https://eatsmarter.com/recipes/baked-golden-rice
Italian Rice with Tomato and Arugula ,https://eatsmarter.com/recipes/italian-rice-with-tomato-and-arugula
Fruity Rice with Tuna Steak ,https://eatsmarter.com/recipes/fruity-rice-with-tuna-steak
Italian Rice with Winter Veg ,https://eatsmarter.com/recipes/italian-rice-with-winter-veg
Wild Rice Cups ,https://eatsmarter.com/recipes/wild-rice-cups
Indian Appetisers ,https://eatsmarter.com/recipes/indian-appetisers
Asian Beef Wrappers ,https://eatsmarter.com/recipes/asian-beef-wrappers
Asian-inspired Citrus Chicken ,https://eatsmarter.com/recipes/asian-inspired-citrus-chicken
Cheesy Ham and Veg Gratin ,https://eatsmarter.com/recipes/cheesy-ham-and-veg-gratin
Tropical Banana Pudding ,https://eatsmarter.com/recipes/tropical-banana-pudding
Spiced Indian Curry with Garnish ,https://eatsmarter.com/recipes/spiced-indian-curry-with-garnish
Aromatic Veggie Rice ,https://eatsmarter.com/recipes/aromatic-veggie-rice
South-east Asian Prawn Rice ,https://eatsmarter.com/recipes/south-east-asian-prawn-rice
Italian Rice Dish with Game Meat ,https://eatsmarter.com/recipes/italian-rice-dish-with-game-meat
Spiced Rice Crepe Bites ,https://eatsmarter.com/recipes/spiced-rice-crepe-bites
Indian Rice Crepes ,https://eatsmarter.com/recipes/indian-rice-crepes
Mixed Mushroom Rice Dish ,https://eatsmarter.com/recipes/mixed-mushroom-rice-dish
Plantain Rice Dish ,https://eatsmarter.com/recipes/plantain-rice-dish
Jambalaya ,https://eatsmarter.com/recipes/jambalaya-0
Indian Rice Dish with Garnish ,https://eatsmarter.com/recipes/indian-rice-dish-with-garnish
Thai Steak and Noodles ,https://eatsmarter.com/recipes/thai-steak-and-noodles
Rice Pudding Cake ,https://eatsmarter.com/recipes/rice-pudding-cake
Creamy Rice Cupcakes ,https://eatsmarter.com/recipes/creamy-rice-cupcakes
Crunchy Italian Bites ,https://eatsmarter.com/recipes/crunchy-italian-bites
Thin Noodles with Sautéed Chicken Curry ,https://eatsmarter.com/recipes/thin-noodles-with-sauteed-chicken-curry
Sticky Chinese Chicken ,https://eatsmarter.com/recipes/sticky-chinese-chicken
Spicy Shrimp with Noodles ,https://eatsmarter.com/recipes/spicy-shrimp-with-noodles
Creamy Pumpkin Rice ,https://eatsmarter.com/recipes/creamy-pumpkin-rice
Golden Rice Balls ,https://eatsmarter.com/recipes/golden-rice-balls
"Corn, Pepper, and Sticky Rice Plate ",https://eatsmarter.com/recipes/corn-pepper-and-sticky-rice-plate
Greek Dolmades ,https://eatsmarter.com/recipes/greek-dolmades
Tomato Rice ,https://eatsmarter.com/recipes/tomato-rice
Asian Coconut-Chicken Soup with Mango and Crispy Noodles ,https://eatsmarter.com/recipes/asian-coconut-chicken-soup-with-mango-and-crispy-noodles
Rice with Seafood (Paella) ,https://eatsmarter.com/recipes/rice-with-seafood-paella
Spanish Style Fried Rice (Paella) ,https://eatsmarter.com/recipes/spanish-style-fried-rice-paella
Chicken Stir-Fry with Coconut Rice ,https://eatsmarter.com/recipes/chicken-stir-fry-with-coconut-rice
Stir-Fried Beef with Broccoli and Peppers ,https://eatsmarter.com/recipes/stir-fried-beef-with-broccoli-and-peppers
Spanish Paella ,https://eatsmarter.com/recipes/spanish-paella-0
Pumpkin and Rice Gratin ,https://eatsmarter.com/recipes/pumpkin-and-rice-gratin
Pork Vegetable Fried Rice ,https://eatsmarter.com/recipes/pork-vegetable-fried-rice
Savoy Cabbage and Mushroom Parcels ,https://eatsmarter.com/recipes/savoy-cabbage-and-mushroom-parcels
Rice Salad with Papaya and Mushrooms ,https://eatsmarter.com/recipes/rice-salad-with-papaya-and-mushrooms
Rice Noodles with Vegetables ,https://eatsmarter.com/recipes/rice-noodles-with-vegetables
Mushroom Risotto ,https://eatsmarter.com/recipes/mushroom-risotto-0
Red Wine Risotto with Fresh Strawberries ,https://eatsmarter.com/recipes/red-wine-risotto-with-fresh-strawberries
Creamy Risotto with Sautéed Shrimp ,https://eatsmarter.com/recipes/creamy-risotto-with-sauteed-shrimp
"Risotto with Fennel, Peas, and Shrimp ",https://eatsmarter.com/recipes/risotto-with-fennel-peas-and-shrimp
Pear and Leek Salad with Glazed Walnuts and Rice Noodles ,https://eatsmarter.com/recipes/pear-and-leek-salad-with-glazed-walnuts-and-rice-noodles
Leek and Fish Rice Paper Rolls ,https://eatsmarter.com/recipes/leek-and-fish-rice-paper-rolls
Red Risotto with Parmesan and Thyme ,https://eatsmarter.com/recipes/red-risotto-with-parmesan-and-thyme
Maki Sushi with Pumpkin and Wild Salmon ,https://eatsmarter.com/recipes/maki-sushi-with-pumpkin-and-wild-salmon
Cabbage Rolls with Tomato Rice ,https://eatsmarter.com/recipes/cabbage-rolls-with-tomato-rice
Risotto with Asparagus and Sage ,https://eatsmarter.com/recipes/risotto-with-asparagus-and-sage
"Paella with Assorted Meats, Spicy Sausage and Seafood ",https://eatsmarter.com/recipes/paella-with-assorted-meats-spicy-sausage-and-seafood
Red Mullet with Rice Noodles ,https://eatsmarter.com/recipes/red-mullet-with-rice-noodles
Chicken Drumsticks with Saffron Rice ,https://eatsmarter.com/recipes/chicken-drumsticks-with-saffron-rice
Risotto with Saffron ,https://eatsmarter.com/recipes/risotto-with-saffron
Risotto with Kohlrabi and Chervil ,https://eatsmarter.com/recipes/risotto-with-kohlrabi-and-chervil
Rice with Shrimp and Mussels (Paella) ,https://eatsmarter.com/recipes/rice-with-shrimp-and-mussels-paella
Roast Lamb with Vegetable Rice ,https://eatsmarter.com/recipes/roast-lamb-with-vegetable-rice
Wild Rice with Vegetables and Chicken Breast ,https://eatsmarter.com/recipes/wild-rice-with-vegetables-and-chicken-breast
Asian-Style Rice-Fish Casserole ,https://eatsmarter.com/recipes/asian-style-rice-fish-casserole
"Pork, Broccoli, and Rice Noodle Stir-Fry ",https://eatsmarter.com/recipes/pork-broccoli-and-rice-noodle-stir-fry
"Rice Paper Rolls with Shrimp, Vegetables and Dip ",https://eatsmarter.com/recipes/rice-paper-rolls-with-shrimp-vegetables-and-dip
Crispy Rice with Peas and Eggs ,https://eatsmarter.com/recipes/crispy-rice-with-peas-and-eggs
Salad Rolls ,https://eatsmarter.com/recipes/salad-rolls
"Vegetable Risotto with Toasted Bread, Pesto and Rosemary ",https://eatsmarter.com/recipes/vegetable-risotto-with-toasted-bread-pesto-and-rosemary
Spring Rolls with Asparagus and Shrimp ,https://eatsmarter.com/recipes/spring-rolls-with-asparagus-and-shrimp
Vietnamese Style Spring Rolls ,https://eatsmarter.com/recipes/vietnamese-style-spring-rolls
Nigiri with Omelet ,https://eatsmarter.com/recipes/nigiri-with-omelet
Chicken Seafood Paella ,https://eatsmarter.com/recipes/chicken-seafood-paella
Green Risotto with Pesto ,https://eatsmarter.com/recipes/green-risotto-with-pesto
Spring Rolls with Pork and Peanuts ,https://eatsmarter.com/recipes/spring-rolls-with-pork-and-peanuts
Spiced Basmati Rice ,https://eatsmarter.com/recipes/spiced-basmati-rice
Nasi Goreng (Indonesian Rice) with Chicken Skewers (Satay) ,https://eatsmarter.com/recipes/nasi-goreng-indonesian-rice-with-chicken-skewers-satay
Red Wine Risotto with Lamb Meatballs ,https://eatsmarter.com/recipes/red-wine-risotto-with-lamb-meatballs
Spring Rolls with Raspberry Dipping Sauce ,https://eatsmarter.com/recipes/spring-rolls-with-raspberry-dipping-sauce
Lemon-Rice Soup ,https://eatsmarter.com/recipes/lemon-rice-soup
Stuffed Peppers with Rice and Olive Salsa ,https://eatsmarter.com/recipes/stuffed-peppers-with-rice-and-olive-salsa
Vietnamese Spring Rolls ,https://eatsmarter.com/recipes/vietnamese-spring-rolls-1
Lemon Risotto with Pine Nuts ,https://eatsmarter.com/recipes/lemon-risotto-with-pine-nuts
Rosemary Risotto with Lemon and Pine Nuts ,https://eatsmarter.com/recipes/rosemary-risotto-with-lemon-and-pine-nuts
Nasi Goreng with Pork Strips ,https://eatsmarter.com/recipes/nasi-goreng-with-pork-strips
Seafood Paella ,https://eatsmarter.com/recipes/seafood-paella-2
Spicy Indian-Style Rice Gratin ,https://eatsmarter.com/recipes/spicy-indian-style-rice-gratin
"Pork Stir-fry with Peppers, Snow Peas and Rice ",https://eatsmarter.com/recipes/pork-stir-fry-with-peppers-snow-peas-and-rice
Dill and Lemon Risotto with Smoked Salmon ,https://eatsmarter.com/recipes/dill-and-lemon-risotto-with-smoked-salmon
Grilled Chicken Skewers with Rice and Vegetables ,https://eatsmarter.com/recipes/grilled-chicken-skewers-with-rice-and-vegetables
Stuffed Artichokes with Rice and Peppers ,https://eatsmarter.com/recipes/stuffed-artichokes-with-rice-and-peppers
Risotto with Ham ,https://eatsmarter.com/recipes/risotto-with-ham
Risotto with Mushrooms ,https://eatsmarter.com/recipes/risotto-with-mushrooms
Broccoli with Almonds and Rice Balls ,https://eatsmarter.com/recipes/broccoli-with-almonds-and-rice-balls
Pumpkin and Walnut Risotto ,https://eatsmarter.com/recipes/pumpkin-and-walnut-risotto
Fennel Risotto with Radicchio ,https://eatsmarter.com/recipes/fennel-risotto-with-radicchio
Cranberry Risotto ,https://eatsmarter.com/recipes/cranberry-risotto
Fava Bean Risotto ,https://eatsmarter.com/recipes/fava-bean-risotto
Lemony Risotto with Grilled King Prawns ,https://eatsmarter.com/recipes/lemony-risotto-with-grilled-king-prawns
Risotto with Jerusalem Artichoke ,https://eatsmarter.com/recipes/risotto-with-jerusalem-artichoke
Chicken Pilaf with Raisins and Noodles ,https://eatsmarter.com/recipes/chicken-pilaf-with-raisins-and-noodles
Risotto with Peppers and Goat Cheese ,https://eatsmarter.com/recipes/risotto-with-peppers-and-goat-cheese
Rice Pudding with Cherries ,https://eatsmarter.com/recipes/rice-pudding-with-cherries-0
Risotto with Green Asparagus Tips ,https://eatsmarter.com/recipes/risotto-with-green-asparagus-tips
Cherry Rice Pudding ,https://eatsmarter.com/recipes/cherry-rice-pudding
Italian Rice Balls ,https://eatsmarter.com/recipes/italian-rice-balls
Rice Pudding with Saffron and Strawberry Compote ,https://eatsmarter.com/recipes/rice-pudding-with-saffron-and-strawberry-compote
Rice Pudding with Strawberry Sauce ,https://eatsmarter.com/recipes/rice-pudding-with-strawberry-sauce-0
Rice Cake with Orange Zest ,https://eatsmarter.com/recipes/rice-cake-with-orange-zest
Meaty Rice with Herbs ,https://eatsmarter.com/recipes/meaty-rice-with-herbs
Asian Soup with Rice Noodles ,https://eatsmarter.com/recipes/asian-soup-with-rice-noodles
Nasi Goreng with Mixed Vegetables and Fried Egg ,https://eatsmarter.com/recipes/nasi-goreng-with-mixed-vegetables-and-fried-egg
Beef and Rice Noodle Salad ,https://eatsmarter.com/recipes/beef-and-rice-noodle-salad
Fried Mozzarella Rice Balls ,https://eatsmarter.com/recipes/fried-mozzarella-rice-balls
"Pilaf with Vegetables, Almonds, and Chiles ",https://eatsmarter.com/recipes/pilaf-with-vegetables-almonds-and-chiles
"Paella with Vegetables, Ham and Basil ",https://eatsmarter.com/recipes/paella-with-vegetables-ham-and-basil
Flemish Style Rice Casserole Dessert ,https://eatsmarter.com/recipes/flemish-style-rice-casserole-dessert
Rice Pudding with Raspberry Sauce ,https://eatsmarter.com/recipes/rice-pudding-with-raspberry-sauce
Rice Noodle Soup with Pancetta and Bok Choy ,https://eatsmarter.com/recipes/rice-noodle-soup-with-pancetta-and-bok-choy
Sweet Risotto with Strawberries ,https://eatsmarter.com/recipes/sweet-risotto-with-strawberries
Coconut-Lime Rice Pudding ,https://eatsmarter.com/recipes/coconut-lime-rice-pudding
Rice Pudding with Oranges ,https://eatsmarter.com/recipes/rice-pudding-with-oranges
Coconut Chicken Soup with Rice Noodles and Vegetables ,https://eatsmarter.com/recipes/coconut-chicken-soup-with-rice-noodles-and-vegetables
Swordfish and Shrimp Risotto ,https://eatsmarter.com/recipes/swordfish-and-shrimp-risotto
"Risotto Topped with Sushi, Egg and Caviar ",https://eatsmarter.com/recipes/risotto-topped-with-sushi-egg-and-caviar
Sweet and Sour Stuffed Calamari with Peppers ,https://eatsmarter.com/recipes/sweet-and-sour-stuffed-calamari-with-peppers
Rice and Vegetable Soup ,https://eatsmarter.com/recipes/rice-and-vegetable-soup-1
Rice Pudding with Honey Figs ,https://eatsmarter.com/recipes/rice-pudding-with-honey-figs
Frozen Rice Parfait with Orange Sauce ,https://eatsmarter.com/recipes/frozen-rice-parfait-with-orange-sauce
Lamb and Lentil Stew ,https://eatsmarter.com/recipes/lamb-and-lentil-stew
Spicy Tuna with Nori on Sushi Rice ,https://eatsmarter.com/recipes/spicy-tuna-with-nori-on-sushi-rice
Greek Style Sandwich with Souvlaki and Vegetable Rice ,https://eatsmarter.com/recipes/greek-style-sandwich-with-souvlaki-and-vegetable-rice
Rice Paper Rolls with Duck Meat ,https://eatsmarter.com/recipes/rice-paper-rolls-with-duck-meat
Rice Paper Rolls With Raw Vegetables ,https://eatsmarter.com/recipes/rice-paper-rolls-with-raw-vegetables
Grilled Lamb with Vegetable Rice ,https://eatsmarter.com/recipes/grilled-lamb-with-vegetable-rice
Braised Beef Shanks with Saffron Risotto ,https://eatsmarter.com/recipes/braised-beef-shanks-with-saffron-risotto
Rice with Sausages ,https://eatsmarter.com/recipes/rice-with-sausages
Seafood Paella ,https://eatsmarter.com/recipes/seafood-paella-3
Mixed Beans and Rice with Chicken Skewers and Mango ,https://eatsmarter.com/recipes/mixed-beans-and-rice-with-chicken-skewers-and-mango
Asian Rice with Vegetables ,https://eatsmarter.com/recipes/asian-rice-with-vegetables
Vegetable Rice with Chicken ,https://eatsmarter.com/recipes/vegetable-rice-with-chicken
Porcini Mushroom Risotto ,https://eatsmarter.com/recipes/porcini-mushroom-risotto
Risotto with Fennel ,https://eatsmarter.com/recipes/risotto-with-fennel
Tuna Sushi with Scallions ,https://eatsmarter.com/recipes/tuna-sushi-with-scallions
Rice and Pea Soup with Pork Meatballs ,https://eatsmarter.com/recipes/rice-and-pea-soup-with-pork-meatballs
Avocado and Rice Salad ,https://eatsmarter.com/recipes/avocado-and-rice-salad
Thai Rice Rolls with Sweet and Sour Chili Sauce Dip ,https://eatsmarter.com/recipes/thai-rice-rolls-with-sweet-and-sour-chili-sauce-dip
"Wild Rice with Spinach, Feta and Walnuts ",https://eatsmarter.com/recipes/wild-rice-with-spinach-feta-and-walnuts
Mango Rolls with Smoked Trout ,https://eatsmarter.com/recipes/mango-rolls-with-smoked-trout
Risotto with Ham and Green Beans ,https://eatsmarter.com/recipes/risotto-with-ham-and-green-beans
Chicken with Lime and Mint on Rce Noodles ,https://eatsmarter.com/recipes/chicken-with-lime-and-mint-on-rce-noodles
Risotto Milanese with Clams ,https://eatsmarter.com/recipes/risotto-milanese-with-clams
Mushroom Risotto ,https://eatsmarter.com/recipes/mushroom-risotto-1
Rice-Stuffed Chinese Cabbage over Beets ,https://eatsmarter.com/recipes/rice-stuffed-chinese-cabbage-over-beets
Risotto with Fried Wolffish and Tarragon ,https://eatsmarter.com/recipes/risotto-with-fried-wolffish-and-tarragon
Risotto Appetizers ,https://eatsmarter.com/recipes/risotto-appetizers
Ossobuco with Gremolata Sauce ,https://eatsmarter.com/recipes/ossobuco-with-gremolata-sauce
