title,url
Tex-Mex Stuffed Peppers ,https://eatsmarter.com/recipes/tex-mex-stuffed-peppers
Chicken and Rice with Mixed Vegetables ,https://eatsmarter.com/recipes/chicken-and-rice-with-mixed-vegetables
Stuffed Peppers ,https://eatsmarter.com/recipes/stuffed-peppers-7
Walnut Risotto ,https://eatsmarter.com/recipes/walnut-risotto
Fruit Rice Pudding ,https://eatsmarter.com/recipes/fruit-rice-pudding-0
Rice with Shrimp ,https://eatsmarter.com/recipes/rice-with-shrimp-0
Turkey Curry with Coconut Rice ,https://eatsmarter.com/recipes/turkey-curry-with-coconut-rice
Risotto with Truffles ,https://eatsmarter.com/recipes/risotto-with-truffles
Rice Salad ,https://eatsmarter.com/recipes/rice-salad-0
Clam Risotto ,https://eatsmarter.com/recipes/clam-risotto
Hawaiian-Style Rice with Ham and Pineapple ,https://eatsmarter.com/recipes/hawaiian-style-rice-with-ham-and-pineapple
Chicken Noodle Soup ,https://eatsmarter.com/recipes/chicken-noodle-soup-3
Mushroom and Rice Soup ,https://eatsmarter.com/recipes/mushroom-and-rice-soup
Spring Rolls (vegetarian) ,https://eatsmarter.com/recipes/spring-rolls-vegetarian
Stuffed Cabbage Rolls ,https://eatsmarter.com/recipes/stuffed-cabbage-rolls-1
Shrimp Summer Rolls ,https://eatsmarter.com/recipes/shrimp-summer-rolls
Chicken Rolls with Tomato Rice ,https://eatsmarter.com/recipes/chicken-rolls-with-tomato-rice
Rice for Sushi ,https://eatsmarter.com/recipes/rice-for-sushi
Stuffed Pumpkin ,https://eatsmarter.com/recipes/stuffed-pumpkin
Coconut Rice with Blueberries ,https://eatsmarter.com/recipes/coconut-rice-with-blueberries-0
Grilled Cabbage Rolls with Rice ,https://eatsmarter.com/recipes/grilled-cabbage-rolls-with-rice
Sushi Maki Rolls ,https://eatsmarter.com/recipes/sushi-maki-rolls
Mushroom Risotto ,https://eatsmarter.com/recipes/mushroom-risotto-6
Vegetable Paella ,https://eatsmarter.com/recipes/vegetable-paella
Rice Cream with Berries ,https://eatsmarter.com/recipes/rice-cream-with-berries
Basmati Rice with Garden Herb Sauce ,https://eatsmarter.com/recipes/basmati-rice-with-garden-herb-sauce
Seafood Paella ,https://eatsmarter.com/recipes/seafood-paella-5
Mirabelle Plums and Cherry Cake ,https://eatsmarter.com/recipes/mirabelle-plums-and-cherry-cake
Chicken Rice Soup ,https://eatsmarter.com/recipes/chicken-rice-soup
Paella ,https://eatsmarter.com/recipes/paella-8
Meatballs with Vegetable Rice ,https://eatsmarter.com/recipes/meatballs-with-vegetable-rice
Stuffed Vine Leaves ,https://eatsmarter.com/recipes/stuffed-vine-leaves-0
California Roll Sushi ,https://eatsmarter.com/recipes/california-roll-sushi
Rice Cakes ,https://eatsmarter.com/recipes/rice-cakes
Rice Noodles with Pork ,https://eatsmarter.com/recipes/rice-noodles-with-pork
Sweet and Sour Chicken ,https://eatsmarter.com/recipes/sweet-and-sour-chicken-0
Risotto with Radicchio ,https://eatsmarter.com/recipes/risotto-with-radicchio
Asparagus Risotto ,https://eatsmarter.com/recipes/asparagus-risotto-2
Risotto with Green Vegetables ,https://eatsmarter.com/recipes/risotto-with-green-vegetables
Jambalaya ,https://eatsmarter.com/recipes/jambalaya-2
Rice Pudding with Berry Compote ,https://eatsmarter.com/recipes/rice-pudding-with-berry-compote-0
Fried Rice with Fish and Shiitake ,https://eatsmarter.com/recipes/fried-rice-with-fish-and-shiitake
Pineapple-Papaya Rice with Pork Tenderloin ,https://eatsmarter.com/recipes/pineapple-papaya-rice-with-pork-tenderloin
Turkey Curry with Savoy Cabbage ,https://eatsmarter.com/recipes/turkey-curry-with-savoy-cabbage
Stuffed Onions ,https://eatsmarter.com/recipes/stuffed-onions-4
Saffron Pepper Rice with Meatballs ,https://eatsmarter.com/recipes/saffron-pepper-rice-with-meatballs
"Thai Noodles with Shrimp, Tofu and Egg ",https://eatsmarter.com/recipes/thai-noodles-with-shrimp-tofu-and-egg
Eggplants Stuffed with Rice and Lamb ,https://eatsmarter.com/recipes/eggplants-stuffed-with-rice-and-lamb
Jambalaya ,https://eatsmarter.com/recipes/jambalaya-3
Jambalaya ,https://eatsmarter.com/recipes/jambalaya-4
Creole Rice ,https://eatsmarter.com/recipes/creole-rice
Rice Pudding with Berries ,https://eatsmarter.com/recipes/rice-pudding-with-berries-0
Rice Pilaf with Apricots and Chicken ,https://eatsmarter.com/recipes/rice-pilaf-with-apricots-and-chicken
Lamb with Bulgur ,https://eatsmarter.com/recipes/lamb-with-bulgur
Shrimp Fried Rice ,https://eatsmarter.com/recipes/shrimp-fried-rice-0
Sweet Risotto with Raspberry Pesto ,https://eatsmarter.com/recipes/sweet-risotto-with-raspberry-pesto
Risotto with Beans and Mushrooms ,https://eatsmarter.com/recipes/risotto-with-beans-and-mushrooms
Spiced Rice Pudding ,https://eatsmarter.com/recipes/spiced-rice-pudding
Vegetable-Rice Bake ,https://eatsmarter.com/recipes/vegetable-rice-bake
Risotto with Saltimbocca Scallops ,https://eatsmarter.com/recipes/risotto-with-saltimbocca-scallops
Spicy Rice with Onions ,https://eatsmarter.com/recipes/spicy-rice-with-onions
Tofu with Rice and Lentils ,https://eatsmarter.com/recipes/tofu-with-rice-and-lentils
Rice with Tuna Sauce ,https://eatsmarter.com/recipes/rice-with-tuna-sauce
Bacalao with Vegetables ,https://eatsmarter.com/recipes/bacalao-with-vegetables
Omelet and Cucumber Surimi Sushi ,https://eatsmarter.com/recipes/omelet-and-cucumber-surimi-sushi
"Vegetable Fried Rice with Cabbage, Carrots and Raisins ",https://eatsmarter.com/recipes/vegetable-fried-rice-with-cabbage-carrots-and-raisins
Baked Dumplings ,https://eatsmarter.com/recipes/baked-dumplings
Mushroom and Tofu Stir-Fry with Wild Rice ,https://eatsmarter.com/recipes/mushroom-and-tofu-stir-fry-with-wild-rice
Melon and Prawn Rice Salad ,https://eatsmarter.com/recipes/melon-and-prawn-rice-salad
Beef Stir-Fry with Rice Noodles ,https://eatsmarter.com/recipes/beef-stir-fry-with-rice-noodles
Risotto with Asparagus and Peas ,https://eatsmarter.com/recipes/risotto-with-asparagus-and-peas
Paella ,https://eatsmarter.com/recipes/paella-9
Pineapple Rice Salad with Shrimp ,https://eatsmarter.com/recipes/pineapple-rice-salad-with-shrimp
Baked Rice Pudding with Grapefruit ,https://eatsmarter.com/recipes/baked-rice-pudding-with-grapefruit
Hearty Fried Rice with Bell Peppers ,https://eatsmarter.com/recipes/hearty-fried-rice-with-bell-peppers
Radicchio Risotto ,https://eatsmarter.com/recipes/radicchio-risotto
Jambalaya ,https://eatsmarter.com/recipes/jambalaya-5
Onions with Rice Stuffing ,https://eatsmarter.com/recipes/onions-with-rice-stuffing
Rice Pudding with Prosecco ,https://eatsmarter.com/recipes/rice-pudding-with-prosecco
Haddock with Bell Pepper Sauce and Rice ,https://eatsmarter.com/recipes/haddock-with-bell-pepper-sauce-and-rice
Saffron Risotto ,https://eatsmarter.com/recipes/saffron-risotto-1
Paella ,https://eatsmarter.com/recipes/paella-10
Vegetable Fried Rice ,https://eatsmarter.com/recipes/vegetable-fried-rice-1
Rice Dumplings with Compote ,https://eatsmarter.com/recipes/rice-dumplings-with-compote
Corn Bean Salad with Sausage and Rice ,https://eatsmarter.com/recipes/corn-bean-salad-with-sausage-and-rice
Curry Rice Salad with Avocado and Grapefruit ,https://eatsmarter.com/recipes/curry-rice-salad-with-avocado-and-grapefruit
Meatball Curry ,https://eatsmarter.com/recipes/meatball-curry
Risotto with Cabbage and Parmesan ,https://eatsmarter.com/recipes/risotto-with-cabbage-and-parmesan
Fruit Rice Pudding ,https://eatsmarter.com/recipes/fruit-rice-pudding-1
Turkey Skewers with Risotto with Sweet Potato ,https://eatsmarter.com/recipes/turkey-skewers-with-risotto-with-sweet-potato
Asian Rice ,https://eatsmarter.com/recipes/asian-rice
Rice with Smoked Haddock and Eggs ,https://eatsmarter.com/recipes/rice-with-smoked-haddock-and-eggs
Steamed Rice with Apples ,https://eatsmarter.com/recipes/steamed-rice-with-apples
Asparagus Risotto ,https://eatsmarter.com/recipes/asparagus-risotto-3
Mexican Bean and Corn Salad ,https://eatsmarter.com/recipes/mexican-bean-and-corn-salad
Eggplants Stuffed with Pork and Rice ,https://eatsmarter.com/recipes/eggplants-stuffed-with-pork-and-rice
Winter Squash Risotto ,https://eatsmarter.com/recipes/winter-squash-risotto
Chestnut and Pear Risotto ,https://eatsmarter.com/recipes/chestnut-and-pear-risotto
Rice and Tuna Salad with Tomatoes and Lemon Vinaigrette ,https://eatsmarter.com/recipes/rice-and-tuna-salad-with-tomatoes-and-lemon-vinaigrette
Serbian Spiced Pork and Potatoes with Rice ,https://eatsmarter.com/recipes/serbian-spiced-pork-and-potatoes-with-rice
Risotto with Scallops and Scallions ,https://eatsmarter.com/recipes/risotto-with-scallops-and-scallions
Rice Balls with Salmon Filling ,https://eatsmarter.com/recipes/rice-balls-with-salmon-filling
Shrimp Fried Rice ,https://eatsmarter.com/recipes/shrimp-fried-rice-1
Stir-Fried Hoisin Duck Breast with Noodles and Vegetables ,https://eatsmarter.com/recipes/stir-fried-hoisin-duck-breast-with-noodles-and-vegetables
Pea Risotto with Zucchini and Bacon ,https://eatsmarter.com/recipes/pea-risotto-with-zucchini-and-bacon
Lemon Mackerel Risotto ,https://eatsmarter.com/recipes/lemon-mackerel-risotto
Beet Risotto with Smoked Trout ,https://eatsmarter.com/recipes/beet-risotto-with-smoked-trout
Rice with Grilled Vegetables ,https://eatsmarter.com/recipes/rice-with-grilled-vegetables
Tilapia in Curry Sauce with Rice Noodles ,https://eatsmarter.com/recipes/tilapia-in-curry-sauce-with-rice-noodles
Cod and Rice Gratin ,https://eatsmarter.com/recipes/cod-and-rice-gratin
Saffron Rice with King Prawns ,https://eatsmarter.com/recipes/saffron-rice-with-king-prawns
Saffron Lemon Risotto ,https://eatsmarter.com/recipes/saffron-lemon-risotto
"Rice Noodles with Chicken Breast, Green Beans and Capers ",https://eatsmarter.com/recipes/rice-noodles-with-chicken-breast-green-beans-and-capers
Deep-Fried Cheesy Stuffed Rice Balls ,https://eatsmarter.com/recipes/deep-fried-cheesy-stuffed-rice-balls
Tomatoes with Rice Stuffing ,https://eatsmarter.com/recipes/tomatoes-with-rice-stuffing-0
Lucky Rolls with Tofu Omelette ,https://eatsmarter.com/recipes/lucky-rolls-with-tofu-omelette
Rice Stew with Vegetables and Chicken ,https://eatsmarter.com/recipes/rice-stew-with-vegetables-and-chicken
Rice Noodles with Stir-fried Chicken and Vegetables ,https://eatsmarter.com/recipes/rice-noodles-with-stir-fried-chicken-and-vegetables
Asian Salmon Pan ,https://eatsmarter.com/recipes/asian-salmon-pan
Lamb and Apricot Pilaf ,https://eatsmarter.com/recipes/lamb-and-apricot-pilaf
Asian Rice Salad with Pineapple and Spinach ,https://eatsmarter.com/recipes/asian-rice-salad-with-pineapple-and-spinach
"Rice with Spices, Raisins and Pine Nuts ",https://eatsmarter.com/recipes/rice-with-spices-raisins-and-pine-nuts
Stir-Fried Vegetables with Rice ,https://eatsmarter.com/recipes/stir-fried-vegetables-with-rice-1
Indian Vegetable Stew ,https://eatsmarter.com/recipes/indian-vegetable-stew
Vietnamese Duck Rice Rolls ,https://eatsmarter.com/recipes/vietnamese-duck-rice-rolls
Red Beans and Rice ,https://eatsmarter.com/recipes/red-beans-and-rice
Asian Duck Soup with Rice ,https://eatsmarter.com/recipes/asian-duck-soup-with-rice
Salsify Risotto with Salmon ,https://eatsmarter.com/recipes/salsify-risotto-with-salmon
Orzo Pasta Risotto with Tomatoes ,https://eatsmarter.com/recipes/orzo-pasta-risotto-with-tomatoes
Tomato Soup with Rice and Lemongrass ,https://eatsmarter.com/recipes/tomato-soup-with-rice-and-lemongrass
Risotto with Clams and Mussels ,https://eatsmarter.com/recipes/risotto-with-clams-and-mussels
Summer Risotto ,https://eatsmarter.com/recipes/summer-risotto
Fried Rice with Vegetables and Crabmeat ,https://eatsmarter.com/recipes/fried-rice-with-vegetables-and-crabmeat
Risotto Cheese Balls ,https://eatsmarter.com/recipes/risotto-cheese-balls
Spanish Paella ,https://eatsmarter.com/recipes/spanish-paella-1
Rice Salad with Crabmeat ,https://eatsmarter.com/recipes/rice-salad-with-crabmeat
Pea Risotto with Asparagus and Ham ,https://eatsmarter.com/recipes/pea-risotto-with-asparagus-and-ham
Risotto with Shrimp and Porcini Mushrooms ,https://eatsmarter.com/recipes/risotto-with-shrimp-and-porcini-mushrooms
Spicy Lamb Curry with Saffron Rice and Papadums ,https://eatsmarter.com/recipes/spicy-lamb-curry-with-saffron-rice-and-papadums
Chicken Soup with Rice Noodles ,https://eatsmarter.com/recipes/chicken-soup-with-rice-noodles
Grilled Peppers with Rice Stuffing ,https://eatsmarter.com/recipes/grilled-peppers-with-rice-stuffing
Rice Timbales with Duck Breast ,https://eatsmarter.com/recipes/rice-timbales-with-duck-breast
Risotto with Chanterelles ,https://eatsmarter.com/recipes/risotto-with-chanterelles
Hungarian Stuffed Peppers with Rice ,https://eatsmarter.com/recipes/hungarian-stuffed-peppers-with-rice
Mediterranean Style Rice Salad with Pistachios ,https://eatsmarter.com/recipes/mediterranean-style-rice-salad-with-pistachios
Tomatoes Stuffed with Ground Meat and Rice ,https://eatsmarter.com/recipes/tomatoes-stuffed-with-ground-meat-and-rice
Marinated Prawns with Snow Peas and Rice ,https://eatsmarter.com/recipes/marinated-prawns-with-snow-peas-and-rice
Rice Noodles with Chicken and Broccoli ,https://eatsmarter.com/recipes/rice-noodles-with-chicken-and-broccoli
Barley and Brown Rice Salad with Apples ,https://eatsmarter.com/recipes/barley-and-brown-rice-salad-with-apples
Risotto Cakes with Parsley Pesto ,https://eatsmarter.com/recipes/risotto-cakes-with-parsley-pesto
Fried Risotto Balls ,https://eatsmarter.com/recipes/fried-risotto-balls-0
Vegetable Gratin with Ham ,https://eatsmarter.com/recipes/vegetable-gratin-with-ham
Fried Rice with Cashews and Vegetables ,https://eatsmarter.com/recipes/fried-rice-with-cashews-and-vegetables
Poached Chicken with Rice Noodles and Pineapple ,https://eatsmarter.com/recipes/poached-chicken-with-rice-noodles-and-pineapple
Broth with Rice Noodles and Cilantro ,https://eatsmarter.com/recipes/broth-with-rice-noodles-and-cilantro
Risotto with Parsley and Pine Nuts ,https://eatsmarter.com/recipes/risotto-with-parsley-and-pine-nuts
Black Bean Rice with Shrimp ,https://eatsmarter.com/recipes/black-bean-rice-with-shrimp
Mixed Fruit Jelly with Lemony Rice Pudding and Pine Nuts ,https://eatsmarter.com/recipes/mixed-fruit-jelly-with-lemony-rice-pudding-and-pine-nuts
Sweet Coconut Sushi Rice with Fruit ,https://eatsmarter.com/recipes/sweet-coconut-sushi-rice-with-fruit
Asian-Style Pork on Rice Noodles ,https://eatsmarter.com/recipes/asian-style-pork-on-rice-noodles
Stuffed Tomatoes ,https://eatsmarter.com/recipes/stuffed-tomatoes-4
Tuna Sashimi with Green Tea Rice ,https://eatsmarter.com/recipes/tuna-sashimi-with-green-tea-rice
Bacon-Wrapped Chicken Thighs with Saffron Rice ,https://eatsmarter.com/recipes/bacon-wrapped-chicken-thighs-with-saffron-rice
Brown Rice Salad with Vegetables ,https://eatsmarter.com/recipes/brown-rice-salad-with-vegetables
Rice and Vegetables from the Wok ,https://eatsmarter.com/recipes/rice-and-vegetables-from-the-wok
Savory Coconut Rice Puff Pastry Rolls in Sushi Style ,https://eatsmarter.com/recipes/savory-coconut-rice-puff-pastry-rolls-in-sushi-style
Chicken Curry with Saffron Rice ,https://eatsmarter.com/recipes/chicken-curry-with-saffron-rice
Italian Rice with Peas ,https://eatsmarter.com/recipes/italian-rice-with-peas
Zucchini Blossom Risotto ,https://eatsmarter.com/recipes/zucchini-blossom-risotto
Risotto with Asparagus and Peas ,https://eatsmarter.com/recipes/risotto-with-asparagus-and-peas-0
Rice Paper Vegetable Wraps with Pineapple Chutney ,https://eatsmarter.com/recipes/rice-paper-vegetable-wraps-with-pineapple-chutney
Bell Peppers with Rice ,https://eatsmarter.com/recipes/bell-peppers-with-rice
Rice Paper Rolls with Tofu and Vegetables ,https://eatsmarter.com/recipes/rice-paper-rolls-with-tofu-and-vegetables
Vegetable Fried Rice with Seafood ,https://eatsmarter.com/recipes/vegetable-fried-rice-with-seafood
Trout Risotto ,https://eatsmarter.com/recipes/trout-risotto
Rice Paper Rolls with Thai Asparagus ,https://eatsmarter.com/recipes/rice-paper-rolls-with-thai-asparagus
Deep-fried Rice Balls with Filling the Italian Way ,https://eatsmarter.com/recipes/deep-fried-rice-balls-with-filling-the-italian-way
Meatballs with Tomato and Pea Rice ,https://eatsmarter.com/recipes/meatballs-with-tomato-and-pea-rice
"Rice and Chickpea Salad with Alfalfa Sprouts, Olives and Tomatoes ",https://eatsmarter.com/recipes/rice-and-chickpea-salad-with-alfalfa-sprouts-olives-and-tomatoes
Pumpkin Stuffed with Rice and Vegetables ,https://eatsmarter.com/recipes/pumpkin-stuffed-with-rice-and-vegetables
Shrimp and Rice Noodle Soup ,https://eatsmarter.com/recipes/shrimp-and-rice-noodle-soup
Rice Salad with Mussels ,https://eatsmarter.com/recipes/rice-salad-with-mussels
Rice and Mango Salad with Tomatoes ,https://eatsmarter.com/recipes/rice-and-mango-salad-with-tomatoes
Colorful Mixed Paella ,https://eatsmarter.com/recipes/colorful-mixed-paella
Rice Salad with Prawns and Sliced Omelet ,https://eatsmarter.com/recipes/rice-salad-with-prawns-and-sliced-omelet
Omelet Rolls Filled with Spicy Rice ,https://eatsmarter.com/recipes/omelet-rolls-filled-with-spicy-rice
Peppers Stuffed with Rice ,https://eatsmarter.com/recipes/peppers-stuffed-with-rice-1
Dolmades (Grape Leaves Stuffed with Rice) ,https://eatsmarter.com/recipes/dolmades-grape-leaves-stuffed-with-rice
Shrimp Summer Rolls with Ginger Soy Sauce ,https://eatsmarter.com/recipes/shrimp-summer-rolls-with-ginger-soy-sauce
"Rice with Crispy Bacon, Pork and Peppers ",https://eatsmarter.com/recipes/rice-with-crispy-bacon-pork-and-peppers
Caribbean Rice and Seafood ,https://eatsmarter.com/recipes/caribbean-rice-and-seafood
Tomatoes Stuffed with Rice and Sauce ,https://eatsmarter.com/recipes/tomatoes-stuffed-with-rice-and-sauce
Risotto with Apple and Gorgonzola ,https://eatsmarter.com/recipes/risotto-with-apple-and-gorgonzola
Chicken and Risotto Gratin ,https://eatsmarter.com/recipes/chicken-and-risotto-gratin
Risotto with Ratatouille ,https://eatsmarter.com/recipes/risotto-with-ratatouille
Fruity Pork with Vegetables in a Wok ,https://eatsmarter.com/recipes/fruity-pork-with-vegetables-in-a-wok
Mushroom Risotto with Diced Ham ,https://eatsmarter.com/recipes/mushroom-risotto-with-diced-ham
Mushroom Risotto with Fried Pumpkin ,https://eatsmarter.com/recipes/mushroom-risotto-with-fried-pumpkin
Saffron Rice with Apple and Vegetables ,https://eatsmarter.com/recipes/saffron-rice-with-apple-and-vegetables
"Veggie Wrap with Tomato, Rice and Beans ",https://eatsmarter.com/recipes/veggie-wrap-with-tomato-rice-and-beans
Grilled Halibut with Orzo ,https://eatsmarter.com/recipes/grilled-halibut-with-orzo
"Rice Salad with Asian Vegetables, Black Sesame and Wasabi ",https://eatsmarter.com/recipes/rice-salad-with-asian-vegetables-black-sesame-and-wasabi
Vegetable and Chicken Rice with Lime ,https://eatsmarter.com/recipes/vegetable-and-chicken-rice-with-lime
"Asian Soup with Rice Noodles, Mushrooms and Leeks ",https://eatsmarter.com/recipes/asian-soup-with-rice-noodles-mushrooms-and-leeks
Asparagus Risotto ,https://eatsmarter.com/recipes/asparagus-risotto-4
Wild Rice Salad with Radish and Ginger ,https://eatsmarter.com/recipes/wild-rice-salad-with-radish-and-ginger
Sweet Italian Risotto with Strawberries and Pistachios ,https://eatsmarter.com/recipes/sweet-italian-risotto-with-strawberries-and-pistachios
Sweet Fruit Sushi ,https://eatsmarter.com/recipes/sweet-fruit-sushi-0
Apple and Rice Pudding Gratin ,https://eatsmarter.com/recipes/apple-and-rice-pudding-gratin
Saffron Rice Pudding with Cranberry Compote ,https://eatsmarter.com/recipes/saffron-rice-pudding-with-cranberry-compote
Sweet Coconut Rice with Apricots and Raisins ,https://eatsmarter.com/recipes/sweet-coconut-rice-with-apricots-and-raisins
Sweet Rhubarb Sushi ,https://eatsmarter.com/recipes/sweet-rhubarb-sushi
Rice and Pepper Salad with Mango and Curry Chicken ,https://eatsmarter.com/recipes/rice-and-pepper-salad-with-mango-and-curry-chicken
Nasi Goreng with Pancake Rolls ,https://eatsmarter.com/recipes/nasi-goreng-with-pancake-rolls
Plantains and Rice ,https://eatsmarter.com/recipes/plantains-and-rice
Cherry Rice Strudel ,https://eatsmarter.com/recipes/cherry-rice-strudel
Baked Vegetables and Rice ,https://eatsmarter.com/recipes/baked-vegetables-and-rice
Rosemary Risotto with Button Mushrooms and Chanterelles ,https://eatsmarter.com/recipes/rosemary-risotto-with-button-mushrooms-and-chanterelles
Pork with Spicy Fruit Rice ,https://eatsmarter.com/recipes/pork-with-spicy-fruit-rice
Sweet Risotto with Fig and Raspberry ,https://eatsmarter.com/recipes/sweet-risotto-with-fig-and-raspberry
Sushi with Fruit ,https://eatsmarter.com/recipes/sushi-with-fruit
Sweet Risotto with Figs and Raspberry Sauce ,https://eatsmarter.com/recipes/sweet-risotto-with-figs-and-raspberry-sauce
Milk Rice Dumplings with Balsamic Strawberries ,https://eatsmarter.com/recipes/milk-rice-dumplings-with-balsamic-strawberries
Sweet Mango Sushi ,https://eatsmarter.com/recipes/sweet-mango-sushi
Sweet Risotto with Cherries and Figs ,https://eatsmarter.com/recipes/sweet-risotto-with-cherries-and-figs
Rice Pudding with Raisins ,https://eatsmarter.com/recipes/rice-pudding-with-raisins
Chicken in Rice Paper Rolls ,https://eatsmarter.com/recipes/chicken-in-rice-paper-rolls
Rice Pudding with Pistachios ,https://eatsmarter.com/recipes/rice-pudding-with-pistachios
Risotto with Squid ,https://eatsmarter.com/recipes/risotto-with-squid
Spicy Rice and Vegetable Salad with Raisins ,https://eatsmarter.com/recipes/spicy-rice-and-vegetable-salad-with-raisins
"Coconut Milk Soup with Shrimp, Rice Noodles and Bean Sprouts ",https://eatsmarter.com/recipes/coconut-milk-soup-with-shrimp-rice-noodles-and-bean-sprouts
Asian Rice Balls with Chinese Cabbage and Mango ,https://eatsmarter.com/recipes/asian-rice-balls-with-chinese-cabbage-and-mango
Rice Noodles with Leeks and Sweet and Sour Chile Sauce ,https://eatsmarter.com/recipes/rice-noodles-with-leeks-and-sweet-and-sour-chile-sauce
Risotto with Green and White Asparagus ,https://eatsmarter.com/recipes/risotto-with-green-and-white-asparagus
Rice Fritters with Vegetables ,https://eatsmarter.com/recipes/rice-fritters-with-vegetables
California Rolls with Caviar ,https://eatsmarter.com/recipes/california-rolls-with-caviar
Dirty Rice with Cranberries and Pecans ,https://eatsmarter.com/recipes/dirty-rice-with-cranberries-and-pecans
Risotto with Cheese and Eggplant ,https://eatsmarter.com/recipes/risotto-with-cheese-and-eggplant
Deep-Fried Rice Balls with Tomato Sauce ,https://eatsmarter.com/recipes/deep-fried-rice-balls-with-tomato-sauce
South African Style Rice Salad ,https://eatsmarter.com/recipes/south-african-style-rice-salad
Chestnut Risotto ,https://eatsmarter.com/recipes/chestnut-risotto
Cuban-Style Rice Dish ,https://eatsmarter.com/recipes/cuban-style-rice-dish
Rice Paper Rolls Filled with Vegetables and Papaya ,https://eatsmarter.com/recipes/rice-paper-rolls-filled-with-vegetables-and-papaya
Sushi with Tuna ,https://eatsmarter.com/recipes/sushi-with-tuna-0
Grilled Pork Strips with Tomato Rice Salad ,https://eatsmarter.com/recipes/grilled-pork-strips-with-tomato-rice-salad
Vegetable and Mushroom Rice ,https://eatsmarter.com/recipes/vegetable-and-mushroom-rice
Risotto with Radicchio ,https://eatsmarter.com/recipes/risotto-with-radicchio-0
"Risotto with Pumpkin, Leeks and Herbs ",https://eatsmarter.com/recipes/risotto-with-pumpkin-leeks-and-herbs
Apple Risotto with Radicchio ,https://eatsmarter.com/recipes/apple-risotto-with-radicchio
Lettuce Rolls Filled with Rice Noodles and Turkey ,https://eatsmarter.com/recipes/lettuce-rolls-filled-with-rice-noodles-and-turkey
Vegetable Rice Salad ,https://eatsmarter.com/recipes/vegetable-rice-salad
Turkey Strips on Fried Rice ,https://eatsmarter.com/recipes/turkey-strips-on-fried-rice
Bulgarian-Style Grape Leaves with Rice and Raisin Filling ,https://eatsmarter.com/recipes/bulgarian-style-grape-leaves-with-rice-and-raisin-filling
Peppers with Rice and Currant Filling ,https://eatsmarter.com/recipes/peppers-with-rice-and-currant-filling
Sushi Rice Rolls with Caviar ,https://eatsmarter.com/recipes/sushi-rice-rolls-with-caviar
Risotto with King Prawns ,https://eatsmarter.com/recipes/risotto-with-king-prawns
Tuna Risotto ,https://eatsmarter.com/recipes/tuna-risotto
Wild Rice with Beef and Vegetables ,https://eatsmarter.com/recipes/wild-rice-with-beef-and-vegetables
Lamb Rolls with Wild Garlic Filling ,https://eatsmarter.com/recipes/lamb-rolls-with-wild-garlic-filling
Vietnamese Spring Roll ,https://eatsmarter.com/recipes/vietnamese-spring-roll
Prosciutto-Stuffed Chicken with Rice and Green Beans ,https://eatsmarter.com/recipes/prosciutto-stuffed-chicken-with-rice-and-green-beans
Stuffed Chicken Breast with Vegetable Rice ,https://eatsmarter.com/recipes/stuffed-chicken-breast-with-vegetable-rice
Spanish Rice with Seafood (Paella) ,https://eatsmarter.com/recipes/spanish-rice-with-seafood-paella
Risotto with Squid ,https://eatsmarter.com/recipes/risotto-with-squid-0
Saffron Rice with Vegetables ,https://eatsmarter.com/recipes/saffron-rice-with-vegetables-0
Vanilla Orange Rice Custard Cake ,https://eatsmarter.com/recipes/vanilla-orange-rice-custard-cake
Fruit Rice Pudding with Chocolate ,https://eatsmarter.com/recipes/fruit-rice-pudding-with-chocolate
Rice Pudding with Fresh Berries ,https://eatsmarter.com/recipes/rice-pudding-with-fresh-berries
Raspberry Rice Pudding ,https://eatsmarter.com/recipes/raspberry-rice-pudding
Sweet Spring Roll with Apple ,https://eatsmarter.com/recipes/sweet-spring-roll-with-apple
Rice Pudding with Apple and Mango Sauce ,https://eatsmarter.com/recipes/rice-pudding-with-apple-and-mango-sauce
Rice Puddings with Fruit ,https://eatsmarter.com/recipes/rice-puddings-with-fruit
Rice Soup with Lemon and Parsley ,https://eatsmarter.com/recipes/rice-soup-with-lemon-and-parsley
Coconut Rice Pudding with Strawberries ,https://eatsmarter.com/recipes/coconut-rice-pudding-with-strawberries
Shrimp and Rice Noodle Salad ,https://eatsmarter.com/recipes/shrimp-and-rice-noodle-salad
Peppers Stuffed with Saffron Rice ,https://eatsmarter.com/recipes/peppers-stuffed-with-saffron-rice
