title,url
Chickpea Balls on Zucchini Noodles ,https://eatsmarter.com/recipes/chickpea-balls-on-zucchini-noodles
Red Cabbage and Apple Salad with Walnuts ,https://eatsmarter.com/recipes/red-cabbage-and-apple-salad-with-walnuts-0
Vegan Banana Peanut Ice Cream Bars ,https://eatsmarter.com/recipes/vegan-banana-peanut-ice-cream-bars
Fennel Radish Salad with Miso Buttermilk Dressing ,https://eatsmarter.com/recipes/fennel-radish-salad-with-miso-buttermilk-dressing
Sweet Potato Roll with Chard Cream Cheese Filling ,https://eatsmarter.com/recipes/sweet-potato-roll-with-chard-cream-cheese-filling
Blueberry Yogurt Ice Cream Bars ,https://eatsmarter.com/recipes/blueberry-yogurt-ice-cream-bars
Red Lentil Soup (Masoor Dal) ,https://eatsmarter.com/recipes/red-lentil-soup-masoor-dal
Vegetarian Hummus with Vegetable Crisps ,https://eatsmarter.com/recipes/vegetarian-hummus-with-vegetable-crisps
Beet Salad with Pomegranate Seeds and Grapes ,https://eatsmarter.com/recipes/beet-salad-with-pomegranate-seeds-and-grapes
Tofu with Fennel Salad ,https://eatsmarter.com/recipes/tofu-with-fennel-salad
Tomato Basil Ricotta Salad ,https://eatsmarter.com/recipes/tomato-basil-ricotta-salad
Lentil Tomato Soup ,https://eatsmarter.com/recipes/lentil-tomato-soup
Tomato Lentil Soup ,https://eatsmarter.com/recipes/tomato-lentil-soup
Eggplant Tomato Salad with Chickpeas and Feta ,https://eatsmarter.com/recipes/eggplant-tomato-salad-with-chickpeas-and-feta
Tomato Zucchini Salad with Feta ,https://eatsmarter.com/recipes/tomato-zucchini-salad-with-feta
Sweet Lemon Ice Tea ,https://eatsmarter.com/recipes/sweet-lemon-ice-tea
Sweet Potato Brownies ,https://eatsmarter.com/recipes/sweet-potato-brownies
Lentil Noodle Salad with Mozzarella and Blueberries ,https://eatsmarter.com/recipes/lentil-noodle-salad-with-mozzarella-and-blueberries
Baked Sweet Potatoes with Feta Cheese ,https://eatsmarter.com/recipes/baked-sweet-potatoes-with-feta-cheese
Vegan Lentil Pasta with Pesto and Arugula ,https://eatsmarter.com/recipes/vegan-lentil-pasta-with-pesto-and-arugula
Quinoa and Vegetables ,https://eatsmarter.com/recipes/quinoa-and-vegetables
Braised Pumpkin with Sage ,https://eatsmarter.com/recipes/braised-pumpkin-with-sage
Green Bean Salad with Roasted Sweet Potato ,https://eatsmarter.com/recipes/green-bean-salad-with-roasted-sweet-potato
Honey Skyr with Nuts  (Icelandic Yogurt) ,https://eatsmarter.com/recipes/honey-skyr-with-nuts-icelandic-yogurt
Vanilla Yogurt with Strawberries ,https://eatsmarter.com/recipes/vanilla-yogurt-with-strawberries
Cucumber Turnip Salad ,https://eatsmarter.com/recipes/cucumber-turnip-salad
Zucchini Pancakes with Paprika-Yogurt Dip ,https://eatsmarter.com/recipes/zucchini-pancakes-with-paprika-yogurt-dip
Greek Yogurt Mango Smoothie Bowl ,https://eatsmarter.com/recipes/greek-yogurt-mango-smoothie-bowl
Mushrooms à La Crème ,https://eatsmarter.com/recipes/mushrooms-a-la-creme
Spicy Corn Quesadillas with Salsa Verde ,https://eatsmarter.com/recipes/spicy-corn-quesadillas-with-salsa-verde
Buddha Bowl with Asparagus and Soba Noodles ,https://eatsmarter.com/recipes/buddha-bowl-with-asparagus-and-soba-noodles
Apple Cinnamon Quinoa ,https://eatsmarter.com/recipes/apple-cinnamon-quinoa
Greek Vegetables with Feta ,https://eatsmarter.com/recipes/greek-vegetables-with-feta
Vegetarian Chickpea Curry with Apricots ,https://eatsmarter.com/recipes/vegetarian-chickpea-curry-with-apricots
Mushroom and Vegetable Ragout with Tofu and Tomatoes ,https://eatsmarter.com/recipes/mushroom-and-vegetable-ragout-with-tofu-and-tomatoes
Vegan Pistachio Ice Cream Bars ,https://eatsmarter.com/recipes/vegan-pistachio-ice-cream-bars
FroYo Bites ,https://eatsmarter.com/recipes/froyo-bites
Noodles with Vegetable Sauce ,https://eatsmarter.com/recipes/noodles-with-vegetable-sauce
Lentil Noodle Bowl with Skyr Flax Dip ,https://eatsmarter.com/recipes/lentil-noodle-bowl-with-skyr-flax-dip
Easy Oven Fries ,https://eatsmarter.com/recipes/easy-oven-fries
Asparagus and Basil Omelette ,https://eatsmarter.com/recipes/asparagus-and-basil-omelette
Strawberry Milk with Yogurt ,https://eatsmarter.com/recipes/strawberry-milk-with-yogurt
Poppy Seed Semolina Porridge with Orange Sauce ,https://eatsmarter.com/recipes/poppy-seed-semolina-porridge-with-orange-sauce
Matcha Coconut Cookies ,https://eatsmarter.com/recipes/matcha-coconut-cookies
Beet Soup with Horseradish and Apple ,https://eatsmarter.com/recipes/beet-soup-with-horseradish-and-apple
Sweet Potato Soup with Orange Turmeric Milk ,https://eatsmarter.com/recipes/sweet-potato-soup-with-orange-turmeric-milk
Cauliflower Parsnip Soup with Almond Puree ,https://eatsmarter.com/recipes/cauliflower-parsnip-soup-with-almond-puree
How to Make Overnight Oats ,https://eatsmarter.com/recipes/how-to-make-overnight-oats
Shakshuka with Tomatoes and Zucchini ,https://eatsmarter.com/recipes/shakshuka-with-tomatoes-and-zucchini
Smart Potato Pancakes ,https://eatsmarter.com/recipes/smart-potato-pancakes
Strawberry-Pumpkin Seed Crumble ,https://eatsmarter.com/recipes/strawberry-pumpkin-seed-crumble
Spicy Cottage Cheese Toast ,https://eatsmarter.com/recipes/spicy-cottage-cheese-toast
Strawberry Oatmeal Cake Roll ,https://eatsmarter.com/recipes/strawberry-oatmeal-cake-roll
Potatoes and Cauliflower with Wild Garlic Pesto ,https://eatsmarter.com/recipes/potatoes-and-cauliflower-with-wild-garlic-pesto
Chia Pudding with Yogurt and Strawberry Puree ,https://eatsmarter.com/recipes/chia-pudding-with-yogurt-and-strawberry-puree
Persimmon Coconut Skyr ,https://eatsmarter.com/recipes/persimmon-coconut-skyr
Dark Chocolate Muffin in an Egg ,https://eatsmarter.com/recipes/dark-chocolate-muffin-in-an-egg
Roasted Cinnamon Almonds ,https://eatsmarter.com/recipes/roasted-cinnamon-almonds
Cheddar Cheese Omelette with Mushrooms ,https://eatsmarter.com/recipes/cheddar-cheese-omelette-with-mushrooms
Spaghetti with Zucchini and Lemon Sauce and Feta ,https://eatsmarter.com/recipes/spaghetti-with-zucchini-and-lemon-sauce-and-feta
Vanilla Energy Balls with Coconut Shell ,https://eatsmarter.com/recipes/vanilla-energy-balls-with-coconut-shell
Spinach and Mashed Potatoes with Chickpeas ,https://eatsmarter.com/recipes/spinach-and-mashed-potatoes-with-chickpeas
Mixed Vegetable Curry ,https://eatsmarter.com/recipes/mixed-vegetable-curry
Chocolate Chip Rolls ,https://eatsmarter.com/recipes/chocolate-chip-rolls
Papas Arrugadas with Mojo Verde ,https://eatsmarter.com/recipes/papas-arrugadas-with-mojo-verde
Grilled Cheese Sandwich with Avocado and Spinach ,https://eatsmarter.com/recipes/grilled-cheese-sandwich-with-avocado-and-spinach
Tomato Sesame Tofu with Green Beans ,https://eatsmarter.com/recipes/tomato-sesame-tofu-with-green-beans
Radish Guacamole ,https://eatsmarter.com/recipes/radish-guacamole
Beet Cream Cheese Spread ,https://eatsmarter.com/recipes/beet-cream-cheese-spread
Quesadilla with Avocado Salsa ,https://eatsmarter.com/recipes/quesadilla-with-avocado-salsa
Baked Sweet Potatoes with Asparagus ,https://eatsmarter.com/recipes/baked-sweet-potatoes-with-asparagus
Coconut Soy Yogurt with Pineapple and Sesame ,https://eatsmarter.com/recipes/coconut-soy-yogurt-with-pineapple-and-sesame
Green Pea Pasta with Arugula ,https://eatsmarter.com/recipes/green-pea-pasta-with-arugula
"Yogurt with Chocolate, Berries, and Nuts ",https://eatsmarter.com/recipes/yogurt-with-chocolate-berries-and-nuts
Vegetarian English Breakfast ,https://eatsmarter.com/recipes/vegetarian-english-breakfast
Low Carb Muffins ,https://eatsmarter.com/recipes/low-carb-muffins
Spicy Pumpkin Soup with Olive Mozzarella Skewers ,https://eatsmarter.com/recipes/spicy-pumpkin-soup-with-olive-mozzarella-skewers
Lemon Cupcakes ,https://eatsmarter.com/recipes/lemon-cupcakes-0
Chai Oatmeal with Pomegranate Seeds ,https://eatsmarter.com/recipes/chai-oatmeal-with-pomegranate-seeds
Potato Corn Omelet ,https://eatsmarter.com/recipes/potato-corn-omelet
Berry Chia Pudding with Yogurt ,https://eatsmarter.com/recipes/berry-chia-pudding-with-yogurt
Sweet Potato Casserole with Arugula ,https://eatsmarter.com/recipes/sweet-potato-casserole-with-arugula
Baked Butternut Squash ,https://eatsmarter.com/recipes/baked-butternut-squash
Apricot Toast with Goat Milk Cream Cheese ,https://eatsmarter.com/recipes/apricot-toast-with-goat-milk-cream-cheese
Baked Zucchini with Couscous and Olives ,https://eatsmarter.com/recipes/baked-zucchini-with-couscous-and-olives
Exotic Cucumber Drink ,https://eatsmarter.com/recipes/exotic-cucumber-drink
Asian Scrambled Eggs ,https://eatsmarter.com/recipes/asian-scrambled-eggs
Carrot and Apricot Soup ,https://eatsmarter.com/recipes/carrot-and-apricot-soup
Tomato Gazpacho with Celery ,https://eatsmarter.com/recipes/tomato-gazpacho-with-celery
Avocado Strawberry Toast ,https://eatsmarter.com/recipes/avocado-strawberry-toast
Buttermilk Flaxseed Breakfast Cup with Apples ,https://eatsmarter.com/recipes/buttermilk-flaxseed-breakfast-cup-with-apples
Vegetarian Protein Bowl with Oats and Fava Beans ,https://eatsmarter.com/recipes/vegetarian-protein-bowl-with-oats-and-fava-beans
Vegan Mushroom Ragout with Broccoli ,https://eatsmarter.com/recipes/vegan-mushroom-ragout-with-broccoli
Carrot Risotto with Eggplant and Pesto Sauce ,https://eatsmarter.com/recipes/carrot-risotto-with-eggplant-and-pesto-sauce
Gluten Free Cornbread ,https://eatsmarter.com/recipes/gluten-free-cornbread
Rice Oat Cereal with Strawberries and Almonds ,https://eatsmarter.com/recipes/rice-oat-cereal-with-strawberries-and-almonds
"Oven Roasted Vegetables with Pears, Chickpeas and Spinach ",https://eatsmarter.com/recipes/oven-roasted-vegetables-with-pears-chickpeas-and-spinach
Quinoa Bowl with Strawberry Dressing ,https://eatsmarter.com/recipes/quinoa-bowl-with-strawberry-dressing
Spelt Pizza with Pesto ,https://eatsmarter.com/recipes/spelt-pizza-with-pesto
Chocolate Dutch Baby ,https://eatsmarter.com/recipes/chocolate-dutch-baby
Buckwheat Cereal with Banana-chocolate Topping ,https://eatsmarter.com/recipes/buckwheat-cereal-with-banana-chocolate-topping
Chocolate Yogurt with Bananas ,https://eatsmarter.com/recipes/chocolate-yogurt-with-bananas
German Pancake with Strawberry Sauce (Kaiserschmarrn) ,https://eatsmarter.com/recipes/german-pancake-with-strawberry-sauce-kaiserschmarrn
Turkish Pastry Boats with Eggplant-Paprika Filling ,https://eatsmarter.com/recipes/turkish-pastry-boats-with-eggplant-paprika-filling
Arugula Salad with Turmeric Cauliflower ,https://eatsmarter.com/recipes/arugula-salad-with-turmeric-cauliflower
Lentil Pasta with Artichokes and Olives ,https://eatsmarter.com/recipes/lentil-pasta-with-artichokes-and-olives
Turmeric Lentil Noodles ,https://eatsmarter.com/recipes/turmeric-lentil-noodles
Roasted Cauliflower Steaks with Yogurt White Bean Dip ,https://eatsmarter.com/recipes/roasted-cauliflower-steaks-with-yogurt-white-bean-dip
"Soy Yogurt with Apple, Kiwi and Oatmeal ",https://eatsmarter.com/recipes/soy-yogurt-with-apple-kiwi-and-oatmeal
Cream of Carrot Soup ,https://eatsmarter.com/recipes/cream-of-carrot-soup
Homemade Baked Oats ,https://eatsmarter.com/recipes/homemade-baked-oats
Red Lentil Soup with Croutons ,https://eatsmarter.com/recipes/red-lentil-soup-with-croutons
Acai Bowl with Berries ,https://eatsmarter.com/recipes/acai-bowl-with-berries
Fennel Salad with Red Lentils ,https://eatsmarter.com/recipes/fennel-salad-with-red-lentils
Chia Poppy Crescent Moons ,https://eatsmarter.com/recipes/chia-poppy-crescent-moons
Green Smoothie with Mint ,https://eatsmarter.com/recipes/green-smoothie-with-mint
Barley Salad with Pomegranate ,https://eatsmarter.com/recipes/barley-salad-with-pomegranate
Low-Carb Teriyaki Tofu Bowl ,https://eatsmarter.com/recipes/low-carb-teriyaki-tofu-bowl
Carrot Salad with Matcha Dressing ,https://eatsmarter.com/recipes/carrot-salad-with-matcha-dressing
Spaghetti with Pumpkin and Yogurt-herb Sauce ,https://eatsmarter.com/recipes/spaghetti-with-pumpkin-and-yogurt-herb-sauce
Carrot Apple Muffins ,https://eatsmarter.com/recipes/carrot-apple-muffins
Pumpkin Soup with Sage and Walnuts ,https://eatsmarter.com/recipes/pumpkin-soup-with-sage-and-walnuts
Spinach Quinoa Soup ,https://eatsmarter.com/recipes/spinach-quinoa-soup
Almond Shortbread with Cranberries and Pistachios ,https://eatsmarter.com/recipes/almond-shortbread-with-cranberries-and-pistachios
Spinach Spaetzle with Cheese ,https://eatsmarter.com/recipes/spinach-spaetzle-with-cheese
Tropical Chia Yogurt ,https://eatsmarter.com/recipes/tropical-chia-yogurt
Avocado Lentil Salad with Pink Grapefruit ,https://eatsmarter.com/recipes/avocado-lentil-salad-with-pink-grapefruit
Chickpea Pasta with Brie and Pears ,https://eatsmarter.com/recipes/chickpea-pasta-with-brie-and-pears
Yeast Free Rye Rolls ,https://eatsmarter.com/recipes/yeast-free-rye-rolls
Rice Paper Dumplings with Orange Coconut Dip ,https://eatsmarter.com/recipes/rice-paper-dumplings-with-orange-coconut-dip
Stuffed Peppers with Lentils ,https://eatsmarter.com/recipes/stuffed-peppers-with-lentils
Broccoli Au Gratin with Curry Dip ,https://eatsmarter.com/recipes/broccoli-au-gratin-with-curry-dip
Zucchini Fries with Pesto Dip ,https://eatsmarter.com/recipes/zucchini-fries-with-pesto-dip
Low-carb Almond Flour Banana Pancakes ,https://eatsmarter.com/recipes/low-carb-almond-flour-banana-pancakes
Vegan Lentil Stew ,https://eatsmarter.com/recipes/vegan-lentil-stew
Savoury Waffles ,https://eatsmarter.com/recipes/savoury-waffles
Chia Almond Milk Pudding ,https://eatsmarter.com/recipes/chia-almond-milk-pudding
Asparagus and Arugula Salad ,https://eatsmarter.com/recipes/asparagus-and-arugula-salad
Strawberry Yogurt Muffins ,https://eatsmarter.com/recipes/strawberry-yogurt-muffins
Blueberry Avocado Pancakes ,https://eatsmarter.com/recipes/blueberry-avocado-pancakes
Spelt Salad with Green Asparagus and Feta ,https://eatsmarter.com/recipes/spelt-salad-with-green-asparagus-and-feta
Teriyaki Mushroom Skewers with Pineapple ,https://eatsmarter.com/recipes/teriyaki-mushroom-skewers-with-pineapple
Hearty Protein Bread ,https://eatsmarter.com/recipes/hearty-protein-bread
Spinach Waffles with Asparagus Topping ,https://eatsmarter.com/recipes/spinach-waffles-with-asparagus-topping
Grilled Eggplant Rolls with Walnut-Feta Filling ,https://eatsmarter.com/recipes/grilled-eggplant-rolls-with-walnut-feta-filling
Chia Pudding with Blueberries and Bananas ,https://eatsmarter.com/recipes/chia-pudding-with-blueberries-and-bananas
Bulgur Kale Patties ,https://eatsmarter.com/recipes/bulgur-kale-patties
Banana Pancakes with Spelt Flour ,https://eatsmarter.com/recipes/banana-pancakes-with-spelt-flour
Apple Rose Tarts ,https://eatsmarter.com/recipes/apple-rose-tarts
Cream Cheese Rye Toast with Figs ,https://eatsmarter.com/recipes/cream-cheese-rye-toast-with-figs
Matcha Chia Pudding with Chocolate Cream ,https://eatsmarter.com/recipes/matcha-chia-pudding-with-chocolate-cream
Colorful Vegetable Stir Fry ,https://eatsmarter.com/recipes/colorful-vegetable-stirfry
Baked Parsnips with Parsley ,https://eatsmarter.com/recipes/baked-parsnips-with-parsley
Whole Wheat Tart with Cauliflower and Pumpkin Seeds ,https://eatsmarter.com/recipes/whole-wheat-tart-with-cauliflower-and-pumpkin-seeds
"Pasta with Broccoli, Mushrooms and Feta ",https://eatsmarter.com/recipes/pasta-with-broccoli-mushrooms-and-feta
Penne with Tomato Sauce and Chickpeas ,https://eatsmarter.com/recipes/penne-with-tomato-sauce-and-chickpeas
"Lentil Salad with Spinach, Rhubarb and Asparagus ",https://eatsmarter.com/recipes/lentil-salad-with-spinach-rhubarb-and-asparagus
Carrot Pancakes ,https://eatsmarter.com/recipes/carrot-pancakes
Pea Pancakes ,https://eatsmarter.com/recipes/pea-pancakes
Lentil Potato Soup ,https://eatsmarter.com/recipes/lentil-potato-soup
Fast Spelt Bread ,https://eatsmarter.com/recipes/fast-spelt-bread
Yogurt Pancakes with Fruit ,https://eatsmarter.com/recipes/yogurt-pancakes-with-fruit
Quick Spelt Bread ,https://eatsmarter.com/recipes/quick-spelt-bread
Low Carb Marble Cake ,https://eatsmarter.com/recipes/low-carb-marble-cake
Potato Pancakes Salad Bowl ,https://eatsmarter.com/recipes/potato-pancakes-salad-bowl
Warm Goat Cheese and Pine Nuts ,https://eatsmarter.com/recipes/warm-goat-cheese-and-pine-nuts
Greek Pasta Salad with Feta ,https://eatsmarter.com/recipes/greek-pasta-salad-with-feta
Falafel Waffles ,https://eatsmarter.com/recipes/falafel-waffles
Oven Vegetables with Mozzarella ,https://eatsmarter.com/recipes/oven-vegetables-with-mozzarella
Steamed Vegetarian Dumplings ,https://eatsmarter.com/recipes/steamed-vegetarian-dumplings
Sauerkraut and Apple Gratin ,https://eatsmarter.com/recipes/sauerkraut-and-apple-gratin
Spicy Eggs ,https://eatsmarter.com/recipes/spicy-eggs
Poached Eggs ,https://eatsmarter.com/recipes/poached-eggs
Warm Mushroom Salad ,https://eatsmarter.com/recipes/warm-mushroom-salad
Halloween Cookies with Ghosts ,https://eatsmarter.com/recipes/halloween-cookies-with-ghosts
Pumpkin and Green Spelt Salad ,https://eatsmarter.com/recipes/pumpkin-and-green-spelt-salad
Coconut Tofu on Cabbage and Pineapple ,https://eatsmarter.com/recipes/coconut-tofu-on-cabbage-and-pineapple
Overnight Oats with Coffee and Blackberries ,https://eatsmarter.com/recipes/overnight-oats-with-coffee-and-blackberries
Meatless Bulgur Tomato Filled Lettuce Leaves ,https://eatsmarter.com/recipes/meatless-bulgur-tomato-filled-lettuce-leaves
Chocolate Peanut Banana Nice Cream ,https://eatsmarter.com/recipes/chocolate-peanut-banana-nice-cream
Cherry Yogurt Popsicles ,https://eatsmarter.com/recipes/cherry-yogurt-popsicles
Green Spelt Pancakes with Beet Cheese Topping ,https://eatsmarter.com/recipes/green-spelt-pancakes-with-beet-cheese-topping
Chocolate Pancakes with Raspberries ,https://eatsmarter.com/recipes/chocolate-pancakes-with-raspberries
Oat and Coconut Porridge with Berries ,https://eatsmarter.com/recipes/oat-and-coconut-porridge-with-berries
Cucumber Rolls on Cauliflower Salad ,https://eatsmarter.com/recipes/cucumber-rolls-on-cauliflower-salad
Vegan Spicy Beet Soup ,https://eatsmarter.com/recipes/vegan-spicy-beet-soup
Chia Pudding with Flaxseed Oil ,https://eatsmarter.com/recipes/chia-pudding-with-flaxseed-oil
Porridge with Pumpkin Compote ,https://eatsmarter.com/recipes/porridge-with-pumpkin-compote
Mushroom Ragout with Leek and Mashed Potatoes ,https://eatsmarter.com/recipes/mushroom-ragout-with-leek-and-mashed-potatoes
Zucchini with Yogurt Dip ,https://eatsmarter.com/recipes/zucchini-with-yogurt-dip
Pumpkin and Vegetable Pasta ,https://eatsmarter.com/recipes/pumpkin-and-vegetable-pasta
Pasta with Beet Pesto ,https://eatsmarter.com/recipes/pasta-with-beet-pesto
Moroccan Spinach Salad ,https://eatsmarter.com/recipes/moroccan-spinach-salad
Spinach Salad with Rhubarb and Feta ,https://eatsmarter.com/recipes/spinach-salad-with-rhubarb-and-feta
Moist Nut Cake with Chocolate Icing ,https://eatsmarter.com/recipes/moist-nut-cake-with-chocolate-icing
Raspberry Smoothie Bowl with Coconut ,https://eatsmarter.com/recipes/raspberry-smoothie-bowl-with-coconut
Vegan Easter Cookies ,https://eatsmarter.com/recipes/vegan-easter-cookies
"Sweet Potatoes with Asparagus, Eggplant and Halloumi ",https://eatsmarter.com/recipes/sweet-potatoes-with-asparagus-eggplant-and-halloumi
Oat Spelt Rolls ,https://eatsmarter.com/recipes/oat-spelt-rolls
Chia Falafel with Pistachios and Mint Yogurt ,https://eatsmarter.com/recipes/chia-falafel
Vegetable Wok with Rice ,https://eatsmarter.com/recipes/vegetable-wok-with-rice
Cauliflower Rice Pilaf ,https://eatsmarter.com/recipes/cauliflower-rice-pilaf
Cauliflower Rice (Risotto) with Pecorino Cheese ,https://eatsmarter.com/recipes/cauliflower-rice-risotto-with-pecorino-cheese
Flaxseed Breakfast Bowl ,https://eatsmarter.com/recipes/flaxseed-breakfast-bowl
Vegan Mac and Cheese with Cauliflower ,https://eatsmarter.com/recipes/vegan-mac-and-cheese-with-cauliflower
Sweet Potato Toast with Peanut Butter and Banana ,https://eatsmarter.com/recipes/sweet-potato-toast-with-peanut-butter-and-banana
Creamy Hummus ,https://eatsmarter.com/recipes/creamy-hummus-0
Asparagus Fries with Garlic Dip ,https://eatsmarter.com/recipes/asparagus-fries-with-garlic-dip
Spring Salad with Halloumi Cheese ,https://eatsmarter.com/recipes/spring-salad-with-halloumi-cheese
"Hand Pies with Tomato, Hazelnut and Rosemary Filling ",https://eatsmarter.com/recipes/hand-pies-with-tomato-hazelnut-and-rosemary-filling
Pineapple Coconut Cereal ,https://eatsmarter.com/recipes/pineapple-coconut-cereal
Cucumber Celery Smoothie ,https://eatsmarter.com/recipes/cucumber-celery-smoothie
Mexican Pasta Salad with Pepitas ,https://eatsmarter.com/recipes/mexican-pasta-salad-with-pepitas
Cantaloupe and Cottage Cheese ,https://eatsmarter.com/recipes/cantaloupe-and-cottage-cheese
Falafel with Sesame Yogurt Dip ,https://eatsmarter.com/recipes/falafel-with-sesame-yogurt-dip
Rutabaga Rösti ,https://eatsmarter.com/recipes/rutabaga-rosti-0
Strawberry Cream Cheese ,https://eatsmarter.com/recipes/strawberry-cream-cheese
Feta Cheese Tacos ,https://eatsmarter.com/recipes/feta-cheese-tacos
Polenta Fries ,https://eatsmarter.com/recipes/polenta-fries
Vegetable Tart ,https://eatsmarter.com/recipes/vegetable-tart
Stuffed Yellow Bell Peppers ,https://eatsmarter.com/recipes/stuffed-yellow-bell-peppers
Vegetable Spread ,https://eatsmarter.com/recipes/vegetable-spread-0
Noodle Bowl with Falafel ,https://eatsmarter.com/recipes/noodle-bowl-with-falafel
Cocoa Cake with Beets ,https://eatsmarter.com/recipes/cocoa-cake-with-beets
Rice Shakshuka with Olives ,https://eatsmarter.com/recipes/rice-shakshuka-with-olives
Pumpkin Fritter (Röstis) on Radicchio Salad ,https://eatsmarter.com/recipes/pumpkin-fritter-roestis-on-radicchio-salad
Celery and Pear Spread with Pine Nuts ,https://eatsmarter.com/recipes/celery-and-pear-spread-with-pine-nuts
Vegan Black Bean and Walnut Spread ,https://eatsmarter.com/recipes/vegan-black-bean-and-walnut-spread
Oatmeal Crumble with Plums ,https://eatsmarter.com/recipes/oatmeal-crumble-with-plums
Plum Cocoa Nut Spread ,https://eatsmarter.com/recipes/plum-cocoa-nut-spread
Zucchini and Feta Frittata ,https://eatsmarter.com/recipes/zucchini-and-feta-frittata
Indian Spiced Carrots on Kale ,https://eatsmarter.com/recipes/indian-spiced-carrots-on-kale
Vietnamese Spring Rolls with Vegetable Filling ,https://eatsmarter.com/recipes/vietnamese-spring-rolls-with-vegetable-filling
Avocado Grapefruit Salad with Quinoa ,https://eatsmarter.com/recipes/avocado-grapefruit-salad-with-quinoa
Tofu Stuffed Butternut Squash ,https://eatsmarter.com/recipes/tofu-stuffed-butternut-squash
Buckwheat Broccoli and Egg Bowl ,https://eatsmarter.com/recipes/buckwheat-broccoli-and-egg-bowl
Watermelon Salad with Feta and Mint ,https://eatsmarter.com/recipes/watermelon-salad-with-feta-and-mint
African Pumpkin Peanut Stew ,https://eatsmarter.com/recipes/african-pumpkin-peanut-stew
Fruity Quinoa Salad with Blueberries and Peppers ,https://eatsmarter.com/recipes/fruity-quinoa-salad-with-blueberries-and-peppers
Broccoli Gorgonzola Tart ,https://eatsmarter.com/recipes/broccoli-gorgonzola-tart
Oven Vegetables with Feta Polenta ,https://eatsmarter.com/recipes/oven-vegetables-with-feta-polenta
Carrot Spelt Spaghetti with Feta ,https://eatsmarter.com/recipes/carrot-spelt-spaghetti-with-feta
Stuffed Kohlrabi with Amaranth and Goat Cheese ,https://eatsmarter.com/recipes/stuffed-kohlrabi-with-amaranth-and-goat-cheese
Orzo Spinach Pan ,https://eatsmarter.com/recipes/orzo-spinach-pan
Strawberry Coconut Water Popsicle ,https://eatsmarter.com/recipes/strawberry-coconut-water-popsicle
Cauliflower Shakshuka ,https://eatsmarter.com/recipes/cauliflower-shakshuka
Roasted Carrots and Chickpeas ,https://eatsmarter.com/recipes/roasted-carrots-and-chickpeas
Vegan Thai Curry with Tofu and Rice ,https://eatsmarter.com/recipes/vegan-thai-curry-with-tofu-and-rice
Green and White Asparagus ,https://eatsmarter.com/recipes/green-and-white-asparagus
Zucchini-Rice Fritters ,https://eatsmarter.com/recipes/zucchini-rice-fritters
Spiced Basmati Rice and Vegetables ,https://eatsmarter.com/recipes/spiced-basmati-rice-and-vegetables
Chocolate Banana Toast ,https://eatsmarter.com/recipes/chocolate-banana-toast
Spicy Chickpea Ragout ,https://eatsmarter.com/recipes/spicy-chickpea-ragout
Peppers with Cottage Cheese ,https://eatsmarter.com/recipes/peppers-with-cottage-cheese
Chocolate Cupcakes with Cashew Raspberry Frosting ,https://eatsmarter.com/recipes/chocolate-cupcakes-with-cashew-raspberry-frosting
Lentil Pancakes with Yogurt Dip ,https://eatsmarter.com/recipes/lentil-pancakes-with-yogurt-dip
Zucchini Pancakes with Apple Herb Tartar ,https://eatsmarter.com/recipes/zucchini-pancakes-with-apple-herb-tartar
"Zoodles, Tomato & Avocado Salad ",https://eatsmarter.com/recipes/zoodles-tomato-avocado-salad
Old Fashioned Oatmeal Cookies ,https://eatsmarter.com/recipes/old-fashioned-oatmeal-cookies
Gruyere Leek Soup with Lentils ,https://eatsmarter.com/recipes/gruyere-leek-soup-with-lentils
Coconut Kale Soup ,https://eatsmarter.com/recipes/coconut-kale-soup
Fresh Rhubarb Cake with Almonds ,https://eatsmarter.com/recipes/fresh-rhubarb-cake-with-almonds
Lemon Pasta with Feta and Asparagus ,https://eatsmarter.com/recipes/lemon-pasta-with-feta-and-asparagus
Asparagus Carrot Burrata Salad ,https://eatsmarter.com/recipes/asparagus-carrot-burrata-salad
Fennel Couscous ,https://eatsmarter.com/recipes/fennel-couscous
Loaded Black Bean Nachos ,https://eatsmarter.com/recipes/loaded-black-bean-nachos
Asparagus and Tomato Salad ,https://eatsmarter.com/recipes/asparagus-and-tomato-salad
Sauteed Cabbage and Tofu ,https://eatsmarter.com/recipes/sauteed-cabbage-and-tofu
Baked Sweet Potatoes and Beets ,https://eatsmarter.com/recipes/baked-sweet-potatoes-and-beets
Spaghetti with Pumpkin and Spinach ,https://eatsmarter.com/recipes/spaghetti-with-pumpkin-and-spinach
Cauliflower Steaks with Lentils and Plum Sauce ,https://eatsmarter.com/recipes/cauliflower-steaks-with-lentils-and-plum-sauce
Beets with Millet ,https://eatsmarter.com/recipes/beets-with-millet
