title,url
Rice and Vegetable Salad with Arugula ,https://eatsmarter.com/recipes/rice-and-vegetable-salad-with-arugula
Green Asparagus Risotto with Morels ,https://eatsmarter.com/recipes/green-asparagus-risotto-with-morels
Lamb Chops with Blackberry Sauce and Saffron Rice ,https://eatsmarter.com/recipes/lamb-chops-with-blackberry-sauce-and-saffron-rice
Saffron Rice with Vegetables ,https://eatsmarter.com/recipes/saffron-rice-with-vegetables
Risotto with Mussels ,https://eatsmarter.com/recipes/risotto-with-mussels
Rondini (Round Zucchini) Stuffed with Rice and Pancetta ,https://eatsmarter.com/recipes/rondini-round-zucchini-stuffed-with-rice-and-pancetta
Rice and Pepper Salad with Mozzarella ,https://eatsmarter.com/recipes/rice-and-pepper-salad-with-mozzarella
Shrimp and Rice Salad with Grapefruit ,https://eatsmarter.com/recipes/shrimp-and-rice-salad-with-grapefruit
Serbian Style Pork and Rice ,https://eatsmarter.com/recipes/serbian-style-pork-and-rice
Indian Yellow Dal with Raisin Rice ,https://eatsmarter.com/recipes/indian-yellow-dal-with-raisin-rice
Risotto with Gorgonzola and Walnuts ,https://eatsmarter.com/recipes/risotto-with-gorgonzola-and-walnuts
Green Asparagus Rice Paper Rolls ,https://eatsmarter.com/recipes/green-asparagus-rice-paper-rolls
Mushrooms with Rice ,https://eatsmarter.com/recipes/mushrooms-with-rice
Spanish Rice Dish (paella) ,https://eatsmarter.com/recipes/spanish-rice-dish-paella
Chinese-style Rice ,https://eatsmarter.com/recipes/chinese-style-rice
Tomato Risotto ,https://eatsmarter.com/recipes/tomato-risotto-0
Duck with Curry Sauce and Vegetables ,https://eatsmarter.com/recipes/duck-with-curry-sauce-and-vegetables
Beef Ragout over Rice Noodles ,https://eatsmarter.com/recipes/beef-ragout-over-rice-noodles
Fried Rice with Eggs and Vegetables ,https://eatsmarter.com/recipes/fried-rice-with-eggs-and-vegetables
Risotto with Fennel ,https://eatsmarter.com/recipes/risotto-with-fennel-0
Mussels on Risotto ,https://eatsmarter.com/recipes/mussels-on-risotto
Sweet Coconut Rice with Vegetables and Ginger ,https://eatsmarter.com/recipes/sweet-coconut-rice-with-vegetables-and-ginger
Sweet Sushi with Kiwi and Rhubarb ,https://eatsmarter.com/recipes/sweet-sushi-with-kiwi-and-rhubarb
Rice Pudding with Apricot Compote ,https://eatsmarter.com/recipes/rice-pudding-with-apricot-compote-0
Curry Rice with Walnuts ,https://eatsmarter.com/recipes/curry-rice-with-walnuts
"Fried Rice with Fish, Snow Peas and Peppers ",https://eatsmarter.com/recipes/fried-rice-with-fish-snow-peas-and-peppers
Paella with Chicken ,https://eatsmarter.com/recipes/paella-with-chicken
Salmon Risotto with Edible Flowers ,https://eatsmarter.com/recipes/salmon-risotto-with-edible-flowers
Wild Rice Salad ,https://eatsmarter.com/recipes/wild-rice-salad
Duck Curry with Okra and Asian Noodles ,https://eatsmarter.com/recipes/duck-curry-with-okra-and-asian-noodles
Paella with Mussels ,https://eatsmarter.com/recipes/paella-with-mussels
Oriental Rice Pudding ,https://eatsmarter.com/recipes/oriental-rice-pudding
Asian Chicken Soup ,https://eatsmarter.com/recipes/asian-chicken-soup
Saffron Rice with Vegetables and Shrimp ,https://eatsmarter.com/recipes/saffron-rice-with-vegetables-and-shrimp
Layered Dessert with Rice and Fruit ,https://eatsmarter.com/recipes/layered-dessert-with-rice-and-fruit
Chicken and Vegetables with Rice ,https://eatsmarter.com/recipes/chicken-and-vegetables-with-rice
Rice with Ginger ,https://eatsmarter.com/recipes/rice-with-ginger
Mulligatawny Soup ,https://eatsmarter.com/recipes/mulligatawny-soup
Rice with Carrots and Cheese ,https://eatsmarter.com/recipes/rice-with-carrots-and-cheese
Rice Zucchini Cake ,https://eatsmarter.com/recipes/rice-zucchini-cake
Asparagus Rice Paper Rolls ,https://eatsmarter.com/recipes/asparagus-rice-paper-rolls
Vegetable Rice with Pork Loin ,https://eatsmarter.com/recipes/vegetable-rice-with-pork-loin
Stuffed Grape Leaves ,https://eatsmarter.com/recipes/stuffed-grape-leaves
Rice Pudding with Cherries ,https://eatsmarter.com/recipes/rice-pudding-with-cherries-1
Rice Porridge with Apples ,https://eatsmarter.com/recipes/rice-porridge-with-apples
Leeks with Rice and Sausage ,https://eatsmarter.com/recipes/leeks-with-rice-and-sausage
Rice Salad with Chicken ,https://eatsmarter.com/recipes/rice-salad-with-chicken
Rice Pilaf with Chicken Breast ,https://eatsmarter.com/recipes/rice-pilaf-with-chicken-breast
Risi E Bisi ,https://eatsmarter.com/recipes/risi-e-bisi
Rice Pudding with Red Fruit Jelly ,https://eatsmarter.com/recipes/rice-pudding-with-red-fruit-jelly
Rice Pudding with Apples ,https://eatsmarter.com/recipes/rice-pudding-with-apples
Rice Asparagus Bake ,https://eatsmarter.com/recipes/rice-asparagus-bake
Leek Rice Salad with Tomato and Mint ,https://eatsmarter.com/recipes/leek-rice-salad-with-tomato-and-mint
"Rice Noodles with Tofu, Shrimp and Chicken ",https://eatsmarter.com/recipes/rice-noodles-with-tofu-shrimp-and-chicken
Spring Rolls ,https://eatsmarter.com/recipes/spring-rolls
Zucchini Risotto ,https://eatsmarter.com/recipes/zucchini-risotto-0
Fried Rice with Sea Bream ,https://eatsmarter.com/recipes/fried-rice-with-sea-bream
Spinach Risotto with Lemongrass ,https://eatsmarter.com/recipes/spinach-risotto-with-lemongrass
Pumpkin Risotto ,https://eatsmarter.com/recipes/pumpkin-risotto-1
Scallops with Rice Noodles ,https://eatsmarter.com/recipes/scallops-with-rice-noodles
Asparagus Risotto ,https://eatsmarter.com/recipes/asparagus-risotto-1
Asparagus Rice Cakes ,https://eatsmarter.com/recipes/asparagus-rice-cakes
Seafood Rice with Pineapple ,https://eatsmarter.com/recipes/seafood-rice-with-pineapple
"Peppers Stuffed with Rice, Chicken and Chorizo ",https://eatsmarter.com/recipes/peppers-stuffed-with-rice-chicken-and-chorizo
Shrimp with Rice Salad ,https://eatsmarter.com/recipes/shrimp-with-rice-salad
Cold Rice Pudding with Ham and Peas ,https://eatsmarter.com/recipes/cold-rice-pudding-with-ham-and-peas
Vegetarian Spring Rolls ,https://eatsmarter.com/recipes/vegetarian-spring-rolls
Vegetable Rice ,https://eatsmarter.com/recipes/vegetable-rice
Paella with Chicken ,https://eatsmarter.com/recipes/paella-with-chicken-0
Leek Risotto with Mascarpone ,https://eatsmarter.com/recipes/leek-risotto-with-mascarpone
Spanish Paella Rice with Mussels and Shrimp ,https://eatsmarter.com/recipes/spanish-paella-rice-with-mussels-and-shrimp
Fruity Rice Salad with Pesto ,https://eatsmarter.com/recipes/fruity-rice-salad-with-pesto
Shrimp Temaki ,https://eatsmarter.com/recipes/shrimp-temaki
Stuffed Fried Rice Balls ,https://eatsmarter.com/recipes/stuffed-fried-rice-balls
Stuffed Zucchini Blossoms ,https://eatsmarter.com/recipes/stuffed-zucchini-blossoms
Rice with Chicken and Vegetables ,https://eatsmarter.com/recipes/rice-with-chicken-and-vegetables
Rice with Chicken ,https://eatsmarter.com/recipes/rice-with-chicken
Rice with Ham and Pineapple ,https://eatsmarter.com/recipes/rice-with-ham-and-pineapple
Risotto with Squash ,https://eatsmarter.com/recipes/risotto-with-squash
"Rice with Chinese Cabbage, Peppers and Leeks ",https://eatsmarter.com/recipes/rice-with-chinese-cabbage-peppers-and-leeks
Saffron Rice and Chicken ,https://eatsmarter.com/recipes/saffron-rice-and-chicken
Mango Chicken and Rice ,https://eatsmarter.com/recipes/mango-chicken-and-rice
Nasi Goreng ,https://eatsmarter.com/recipes/nasi-goreng
Stuffed Cabbage Leaves with Rice ,https://eatsmarter.com/recipes/stuffed-cabbage-leaves-with-rice
Zucchini and Tomato Risotto ,https://eatsmarter.com/recipes/zucchini-and-tomato-risotto
Rice and Beans with Pickled Meat ,https://eatsmarter.com/recipes/rice-and-beans-with-pickled-meat
Chicken Risotto with Pesto ,https://eatsmarter.com/recipes/chicken-risotto-with-pesto
Asian-Style Chicken Soup with Dried Mushrooms ,https://eatsmarter.com/recipes/asian-style-chicken-soup-with-dried-mushrooms
Spicy Rice ,https://eatsmarter.com/recipes/spicy-rice
Nasi Goreng ,https://eatsmarter.com/recipes/nasi-goreng-1
Vegetable Rice ,https://eatsmarter.com/recipes/vegetable-rice-0
Coconut Rice with Mango ,https://eatsmarter.com/recipes/coconut-rice-with-mango
Curried Vegetables and Rice ,https://eatsmarter.com/recipes/curried-vegetables-and-rice
Fried Rice with Fried Egg ,https://eatsmarter.com/recipes/fried-rice-with-fried-egg
Rice Casserole ,https://eatsmarter.com/recipes/rice-casserole
Chicken Fried Rice ,https://eatsmarter.com/recipes/chicken-fried-rice-0
Rice Paper Rolls with Shrimp ,https://eatsmarter.com/recipes/rice-paper-rolls-with-shrimp
Fruity Paella ,https://eatsmarter.com/recipes/fruity-paella
Rice Noodle Soup ,https://eatsmarter.com/recipes/rice-noodle-soup
Spring Rolls with Meat Filling ,https://eatsmarter.com/recipes/spring-rolls-with-meat-filling-0
Noodle Soup with Vegetables ,https://eatsmarter.com/recipes/noodle-soup-with-vegetables
Rice Salad ,https://eatsmarter.com/recipes/rice-salad
Risotto with Seafood ,https://eatsmarter.com/recipes/risotto-with-seafood
Risotto with Tuna ,https://eatsmarter.com/recipes/risotto-with-tuna
Saffron Rice with Broccoli ,https://eatsmarter.com/recipes/saffron-rice-with-broccoli
"Peppers Stuffed with Rice, Pinenuts and Hazelnuts ",https://eatsmarter.com/recipes/peppers-stuffed-with-rice-pinenuts-and-hazelnuts
Asparagus Risotto with Trout ,https://eatsmarter.com/recipes/asparagus-risotto-with-trout
Risi Bisi (Rice and Peas) ,https://eatsmarter.com/recipes/risi-bisi-rice-and-peas
Paella ,https://eatsmarter.com/recipes/paella-0
Paella ,https://eatsmarter.com/recipes/paella-1
Strawberry Risotto ,https://eatsmarter.com/recipes/strawberry-risotto
Orange Chicken Legs with Orzo ,https://eatsmarter.com/recipes/orange-chicken-legs-with-orzo
Spring Rolls with Ground Pork Filling ,https://eatsmarter.com/recipes/spring-rolls-with-ground-pork-filling
Vegetable Curry ,https://eatsmarter.com/recipes/vegetable-curry-2
Saffron Risotto ,https://eatsmarter.com/recipes/saffron-risotto
Paella with Chicken ,https://eatsmarter.com/recipes/paella-with-chicken-1
Asian Green Salad with Tuna ,https://eatsmarter.com/recipes/asian-green-salad-with-tuna
Pumpkin Risotto ,https://eatsmarter.com/recipes/pumpkin-risotto-2
Pollock with Rice ,https://eatsmarter.com/recipes/pollock-with-rice
Scallops with Spiced Rice ,https://eatsmarter.com/recipes/scallops-with-spiced-rice
Rice with Vegetables ,https://eatsmarter.com/recipes/rice-with-vegetables
Fruit Rice Salad with Shrimp ,https://eatsmarter.com/recipes/fruit-rice-salad-with-shrimp
Hoso Maki ,https://eatsmarter.com/recipes/hoso-maki
Sauteed Rice Noodles with Monkfish and Vegetables ,https://eatsmarter.com/recipes/sauteed-rice-noodles-with-monkfish-and-vegetables
Semolina Pudding with Fruit ,https://eatsmarter.com/recipes/semolina-pudding-with-fruit
Asian Noodle Salad with Vegetables ,https://eatsmarter.com/recipes/asian-noodle-salad-with-vegetables
Rice Noodles with Shiitake ,https://eatsmarter.com/recipes/rice-noodles-with-shiitake
Fruity Rice with Shrimp ,https://eatsmarter.com/recipes/fruity-rice-with-shrimp
Coconut Rice with Mango ,https://eatsmarter.com/recipes/coconut-rice-with-mango-0
Strawberry Risotto ,https://eatsmarter.com/recipes/strawberry-risotto-0
Quick and Easy Paella ,https://eatsmarter.com/recipes/quick-and-easy-paella
Spanish Rice with Chorizo ,https://eatsmarter.com/recipes/spanish-rice-with-chorizo
Vegetable Pan with Rice and Meatballs ,https://eatsmarter.com/recipes/vegetable-pan-with-rice-and-meatballs
Vegetable and Shrimp Rice Pilaf ,https://eatsmarter.com/recipes/vegetable-and-shrimp-rice-pilaf
Ginger Salmon on Saffron Rice ,https://eatsmarter.com/recipes/ginger-salmon-on-saffron-rice
Saffron Rice with Seafood ,https://eatsmarter.com/recipes/saffron-rice-with-seafood
Vegetable Flan with Tomato Sauce ,https://eatsmarter.com/recipes/vegetable-flan-with-tomato-sauce
"Rice, Pasta and Lentils with Tomato Sauce ",https://eatsmarter.com/recipes/rice-pasta-and-lentils-with-tomato-sauce
Forest Mushroom Risotto ,https://eatsmarter.com/recipes/forest-mushroom-risotto
Coconut Rice with Shrimp ,https://eatsmarter.com/recipes/coconut-rice-with-shrimp
Asian Noodle Salad with Chicken and Papaya ,https://eatsmarter.com/recipes/asian-noodle-salad-with-chicken-and-papaya
Paella ,https://eatsmarter.com/recipes/paella-2
Jambalaya ,https://eatsmarter.com/recipes/jambalaya-1
Rice Cake ,https://eatsmarter.com/recipes/rice-cake
Risotto with Chicken Legs ,https://eatsmarter.com/recipes/risotto-with-chicken-legs
Rice with Vegetables and Shrimp ,https://eatsmarter.com/recipes/rice-with-vegetables-and-shrimp
Stuffed Grape Leaves ,https://eatsmarter.com/recipes/stuffed-grape-leaves-1
Mushroom Risotto ,https://eatsmarter.com/recipes/mushroom-risotto-3
"Rice Pudding, Two Ways ",https://eatsmarter.com/recipes/rice-pudding-two-ways
Rice Salad with Peas and Shrimp ,https://eatsmarter.com/recipes/rice-salad-with-peas-and-shrimp
Spicy Rice with Mussels ,https://eatsmarter.com/recipes/spicy-rice-with-mussels
Pancakes with Fruity Rice Filling ,https://eatsmarter.com/recipes/pancakes-with-fruity-rice-filling
Bananas with Pepper Salsa ,https://eatsmarter.com/recipes/bananas-with-pepper-salsa
Jambalaya (Creole Rice) ,https://eatsmarter.com/recipes/jambalaya-creole-rice
Nasi Goreng ,https://eatsmarter.com/recipes/nasi-goreng-2
Rice Balls with Spicy Vegetables ,https://eatsmarter.com/recipes/rice-balls-with-spicy-vegetables
Lamb with Lemon Rice and Vegetables ,https://eatsmarter.com/recipes/lamb-with-lemon-rice-and-vegetables
Osso Buco with Saffron Risotto ,https://eatsmarter.com/recipes/osso-buco-with-saffron-risotto
Vegetable Wild Rice Salad ,https://eatsmarter.com/recipes/vegetable-wild-rice-salad
Eggplant with Rice Stuffing ,https://eatsmarter.com/recipes/eggplant-with-rice-stuffing
Tofu with Rice and Green Beans ,https://eatsmarter.com/recipes/tofu-with-rice-and-green-beans
Fried Rice with Vegetables ,https://eatsmarter.com/recipes/fried-rice-with-vegetables-0
"Corn, Beans and Tomatoes ",https://eatsmarter.com/recipes/corn-beans-and-tomatoes
Saffron Rice with Tuna ,https://eatsmarter.com/recipes/saffron-rice-with-tuna
Stir-fried Vegetable Rice with Turkey ,https://eatsmarter.com/recipes/stir-fried-vegetable-rice-with-turkey
Turkey with Rice ,https://eatsmarter.com/recipes/turkey-with-rice
Hearty Rice with Meat and Olives ,https://eatsmarter.com/recipes/hearty-rice-with-meat-and-olives
Paella with Mixed Vegetables ,https://eatsmarter.com/recipes/paella-with-mixed-vegetables
Rice with Redfish and Vegetables ,https://eatsmarter.com/recipes/rice-with-redfish-and-vegetables
Vegetable Rice with Sausage ,https://eatsmarter.com/recipes/vegetable-rice-with-sausage
Rice and Fruit Salad ,https://eatsmarter.com/recipes/rice-and-fruit-salad
Rainbow Rice Cakes ,https://eatsmarter.com/recipes/rainbow-rice-cakes
Lamb and Asparagus Risotto ,https://eatsmarter.com/recipes/lamb-and-asparagus-risotto
Asian Noodle Salad with Tuna ,https://eatsmarter.com/recipes/asian-noodle-salad-with-tuna
Stir-Fried Rice with Shrimp and Vegetables ,https://eatsmarter.com/recipes/stir-fried-rice-with-shrimp-and-vegetables
Beef and Vegetable Rice ,https://eatsmarter.com/recipes/beef-and-vegetable-rice
Parmesan Risotto with Sautéed Vegetables ,https://eatsmarter.com/recipes/parmesan-risotto-with-sauteed-vegetables
Cheesy Risotto with Sautéed Vegetables ,https://eatsmarter.com/recipes/cheesy-risotto-with-sauteed-vegetables
Grape Leaf and Rice Rolls ,https://eatsmarter.com/recipes/grape-leaf-and-rice-rolls
Artichoke Paella ,https://eatsmarter.com/recipes/artichoke-paella
Sweet Rice Casserole ,https://eatsmarter.com/recipes/sweet-rice-casserole
Pea Risotto ,https://eatsmarter.com/recipes/pea-risotto
Asian Noodle Soup with Chicken Meatballs ,https://eatsmarter.com/recipes/asian-noodle-soup-with-chicken-meatballs
Steamed Rice Balls ,https://eatsmarter.com/recipes/steamed-rice-balls
Coconut Rice with Lentils ,https://eatsmarter.com/recipes/coconut-rice-with-lentils
Cevapcici with Rice ,https://eatsmarter.com/recipes/cevapcici-with-rice
Tofu Vegetable Rice ,https://eatsmarter.com/recipes/tofu-vegetable-rice
Rice with Fish and Vegetables ,https://eatsmarter.com/recipes/rice-with-fish-and-vegetables
Risotto with Mushrooms ,https://eatsmarter.com/recipes/risotto-with-mushrooms-0
Rice Patties with Tomato Sauce ,https://eatsmarter.com/recipes/rice-patties-with-tomato-sauce
"Rice Pudding with Coconut, Vanilla and Mango ",https://eatsmarter.com/recipes/rice-pudding-with-coconut-vanilla-and-mango
Dates in Bacon ,https://eatsmarter.com/recipes/dates-in-bacon
Gluten-Free Rice Cake with Zucchini ,https://eatsmarter.com/recipes/gluten-free-rice-cake-with-zucchini
Rice and Cabbage Salad with Bacon ,https://eatsmarter.com/recipes/rice-and-cabbage-salad-with-bacon
Meatballs with Pepper Rice ,https://eatsmarter.com/recipes/meatballs-with-pepper-rice
Risotto with Smoked Salmon and Shrimp ,https://eatsmarter.com/recipes/risotto-with-smoked-salmon-and-shrimp
Rice Paper Spring Rolls ,https://eatsmarter.com/recipes/rice-paper-spring-rolls
Mushroom and Spinach Risotto ,https://eatsmarter.com/recipes/mushroom-and-spinach-risotto
Fresh Pea Soup with Steelhead Trout ,https://eatsmarter.com/recipes/fresh-pea-soup-with-steelhead-trout
Saffron Risotto with Peas and Fennel ,https://eatsmarter.com/recipes/saffron-risotto-with-peas-and-fennel
Roe and Scallion Nigiri ,https://eatsmarter.com/recipes/roe-and-scallion-nigiri
Perch Sushi Rolls ,https://eatsmarter.com/recipes/perch-sushi-rolls
Fried Cabbage with Garlic and Mint ,https://eatsmarter.com/recipes/fried-cabbage-with-garlic-and-mint
Lemon Beans with Fried Rice ,https://eatsmarter.com/recipes/lemon-beans-with-fried-rice
Rice and Pepper Salad ,https://eatsmarter.com/recipes/rice-and-pepper-salad
Tomato and Mozzarella Risotto ,https://eatsmarter.com/recipes/tomato-and-mozzarella-risotto
Lamb Curry with Spiced Rice ,https://eatsmarter.com/recipes/lamb-curry-with-spiced-rice
Papaya Stuffed with Coconut Rice ,https://eatsmarter.com/recipes/papaya-stuffed-with-coconut-rice
Stuffed Bell Peppers ,https://eatsmarter.com/recipes/stuffed-bell-peppers
Vegetable Rice ,https://eatsmarter.com/recipes/vegetable-rice-1
Chicken Rice Soup with Summer Vegetables ,https://eatsmarter.com/recipes/chicken-rice-soup-with-summer-vegetables
Chicken with Saffron Rice and Braised Celery ,https://eatsmarter.com/recipes/chicken-with-saffron-rice-and-braised-celery
Vegetable Casserole with Turkey and Rice ,https://eatsmarter.com/recipes/vegetable-casserole-with-turkey-and-rice
Melon and Cucumber Rice Salad ,https://eatsmarter.com/recipes/melon-and-cucumber-rice-salad
Rice Casserole ,https://eatsmarter.com/recipes/rice-casserole-0
Tomato Lamb Casserole ,https://eatsmarter.com/recipes/tomato-lamb-casserole
Rice Paper Rolls ,https://eatsmarter.com/recipes/rice-paper-rolls
Gouda Rice Salad ,https://eatsmarter.com/recipes/gouda-rice-salad
Saffron Arancini Stuffed with Meat and Peas ,https://eatsmarter.com/recipes/saffron-arancini-stuffed-with-meat-and-peas
Zucchini and Pea Risotto with Parmesan and Thyme ,https://eatsmarter.com/recipes/zucchini-and-pea-risotto-with-parmesan-and-thyme
Rice with Vegetables ,https://eatsmarter.com/recipes/rice-with-vegetables-0
Spiced Rce with Mussels ,https://eatsmarter.com/recipes/spiced-rce-with-mussels
Rice with Beans and Squash ,https://eatsmarter.com/recipes/rice-with-beans-and-squash
Rice and Vegetable Pan with Sausage ,https://eatsmarter.com/recipes/rice-and-vegetable-pan-with-sausage
Rice with Shrimp ,https://eatsmarter.com/recipes/rice-with-shrimp
"Spiced Rice with Nuts, Raisins and Bell Pepper ",https://eatsmarter.com/recipes/spiced-rice-with-nuts-raisins-and-bell-pepper
Dolmas ,https://eatsmarter.com/recipes/dolmas
Spicy Vegetable Rice ,https://eatsmarter.com/recipes/spicy-vegetable-rice
Rice Pudding ,https://eatsmarter.com/recipes/rice-pudding-4
Chirashi Sushi with Fish ,https://eatsmarter.com/recipes/chirashi-sushi-with-fish
Lemony Crab Risotto ,https://eatsmarter.com/recipes/lemony-crab-risotto
Herb Risotto ,https://eatsmarter.com/recipes/herb-risotto
Lentil and Rice Casserole ,https://eatsmarter.com/recipes/lentil-and-rice-casserole
Plaice in Saffron Rice Ring ,https://eatsmarter.com/recipes/plaice-in-saffron-rice-ring
Pistachio Rice with Crispy Tempura Vegetables ,https://eatsmarter.com/recipes/pistachio-rice-with-crispy-tempura-vegetables
Fish Curry with Basmati Rice and Lime ,https://eatsmarter.com/recipes/fish-curry-with-basmati-rice-and-lime
Saffron Rice with Prawns ,https://eatsmarter.com/recipes/saffron-rice-with-prawns
Nasi Goreng with Two Rices ,https://eatsmarter.com/recipes/nasi-goreng-with-two-rices
Individual Rice Puddings with Strawberry-Rhubarb Compote ,https://eatsmarter.com/recipes/individual-rice-puddings-with-strawberry-rhubarb-compote
Roast Beef with Onion Sauce and Vegetable Rice ,https://eatsmarter.com/recipes/roast-beef-with-onion-sauce-and-vegetable-rice
Rice and Tuna Salad with Stuffed Cherry Tomatoes ,https://eatsmarter.com/recipes/rice-and-tuna-salad-with-stuffed-cherry-tomatoes
Rice Pudding with Caramel Sauce and Fruit Salad ,https://eatsmarter.com/recipes/rice-pudding-with-caramel-sauce-and-fruit-salad
Lime Risotto with Pork ,https://eatsmarter.com/recipes/lime-risotto-with-pork
Lamb Chops with Scallions and Curry Rice ,https://eatsmarter.com/recipes/lamb-chops-with-scallions-and-curry-rice
Risotto with Calamari ,https://eatsmarter.com/recipes/risotto-with-calamari-0
Stuffed Eggplant and Tomatoes with Rice and Ground Meat ,https://eatsmarter.com/recipes/stuffed-eggplant-and-tomatoes-with-rice-and-ground-meat
Rice Dumplings with Coconut Vegetables ,https://eatsmarter.com/recipes/rice-dumplings-with-coconut-vegetables
Risotto Alla Milanese ,https://eatsmarter.com/recipes/risotto-alla-milanese-0
Mushroom-Cucumber Risotto ,https://eatsmarter.com/recipes/mushroom-cucumber-risotto
Paella ,https://eatsmarter.com/recipes/paella-6
Red Wine Risotto to Duck Breast ,https://eatsmarter.com/recipes/red-wine-risotto-to-duck-breast
Creole Stew with Pork ,https://eatsmarter.com/recipes/creole-stew-with-pork
Caribbean Fish Pot with Papaya and Pomegranate ,https://eatsmarter.com/recipes/caribbean-fish-pot-with-papaya-and-pomegranate
"Rice with Carrots, Pine Nuts and Raisins ",https://eatsmarter.com/recipes/rice-with-carrots-pine-nuts-and-raisins
Sushi Rice Salad ,https://eatsmarter.com/recipes/sushi-rice-salad
Herbed Rice with Raisins and Pine Nuts ,https://eatsmarter.com/recipes/herbed-rice-with-raisins-and-pine-nuts
Rice Paper Rolls with Ginger and Vegetables ,https://eatsmarter.com/recipes/rice-paper-rolls-with-ginger-and-vegetables
Salmon with Wasabi-soy Marinade and Vegetable Rice ,https://eatsmarter.com/recipes/salmon-with-wasabi-soy-marinade-and-vegetable-rice
Hearty Lamb Stew ,https://eatsmarter.com/recipes/hearty-lamb-stew
Pumpkin Risotto with Fried Sage ,https://eatsmarter.com/recipes/pumpkin-risotto-with-fried-sage
Tomatoes Stuffed with Tuna and Rice ,https://eatsmarter.com/recipes/tomatoes-stuffed-with-tuna-and-rice
Shrimp and Mango Kebabs ,https://eatsmarter.com/recipes/shrimp-and-mango-kebabs
Risotto with Asparagus and Prosciutto ,https://eatsmarter.com/recipes/risotto-with-asparagus-and-prosciutto
Stuffed Zucchini ,https://eatsmarter.com/recipes/stuffed-zucchini-6
Risotto with Vegetables and Herbs ,https://eatsmarter.com/recipes/risotto-with-vegetables-and-herbs
Risotto with Chicken and Mushrooms ,https://eatsmarter.com/recipes/risotto-with-chicken-and-mushrooms
Stuffed Rice Balls ,https://eatsmarter.com/recipes/stuffed-rice-balls
Zucchini Stuffed with Fennel and Rice ,https://eatsmarter.com/recipes/zucchini-stuffed-with-fennel-and-rice
Rice Pudding with Sour Cherries ,https://eatsmarter.com/recipes/rice-pudding-with-sour-cherries
Spicy Vegetable Stir-fry with Rice ,https://eatsmarter.com/recipes/spicy-vegetable-stir-fry-with-rice
Pork Medallions with Fried Banana and Melon ,https://eatsmarter.com/recipes/pork-medallions-with-fried-banana-and-melon
Colorful Vegetables and Rice ,https://eatsmarter.com/recipes/colorful-vegetables-and-rice
Baked Tomatoes Stuffed with Vegetable Rice ,https://eatsmarter.com/recipes/baked-tomatoes-stuffed-with-vegetable-rice
Chicken and Vegetable Rice Paper Rolls ,https://eatsmarter.com/recipes/chicken-and-vegetable-rice-paper-rolls
Risotto with Lemon ,https://eatsmarter.com/recipes/risotto-with-lemon
Reisbratlinge with Spring Onions ,https://eatsmarter.com/recipes/reisbratlinge-with-spring-onions
Pork with Rice Noodles and Vegetables ,https://eatsmarter.com/recipes/pork-with-rice-noodles-and-vegetables
Asian Noodles with Vegetables ,https://eatsmarter.com/recipes/asian-noodles-with-vegetables
Tomato Soup with Deep-Fried Rice Balls ,https://eatsmarter.com/recipes/tomato-soup-with-deep-fried-rice-balls
Rice and Spinach Salad with Cheese and Mint ,https://eatsmarter.com/recipes/rice-and-spinach-salad-with-cheese-and-mint
Fried Noodle-Wrapped King Prawns ,https://eatsmarter.com/recipes/fried-noodle-wrapped-king-prawns
Mushroom Risotto ,https://eatsmarter.com/recipes/mushroom-risotto-4
Steamed Leek Trout ,https://eatsmarter.com/recipes/steamed-leek-trout
Arugula Risotto ,https://eatsmarter.com/recipes/arugula-risotto
Rice Paper Rolls with Vegetable Filling ,https://eatsmarter.com/recipes/rice-paper-rolls-with-vegetable-filling-0
Rice with Tomatoes and Beans ,https://eatsmarter.com/recipes/rice-with-tomatoes-and-beans
Beans and Rice ,https://eatsmarter.com/recipes/beans-and-rice
Seafood Risotto ,https://eatsmarter.com/recipes/seafood-risotto-0
Cellophane Noodle Salad ,https://eatsmarter.com/recipes/cellophane-noodle-salad
Risotto with Mushrooms and Leeks ,https://eatsmarter.com/recipes/risotto-with-mushrooms-and-leeks
Green Bean and Savory Risotto with Ratatouille ,https://eatsmarter.com/recipes/green-bean-and-savory-risotto-with-ratatouille
"Risotto with Bacon, Peppers and Capers ",https://eatsmarter.com/recipes/risotto-with-bacon-peppers-and-capers
Classic Seafood Paella ,https://eatsmarter.com/recipes/classic-seafood-paella
Chicken Salad with Rice ,https://eatsmarter.com/recipes/chicken-salad-with-rice
