title,url
Roasted Butternut Squash and Pomegranate Salad ,https://eatsmarter.com/recipes/roasted-butternut-squash-and-pomegranate-salad
Roast Salmon Salad with Cucumber and Dill ,https://eatsmarter.com/recipes/roast-salmon-salad-with-cucumber-and-dill
Artichoke Salad with Quinoa and Cucumber ,https://eatsmarter.com/recipes/artichoke-salad-with-quinoa-and-cucumber
Beet and Lentil Salad ,https://eatsmarter.com/recipes/beet-and-lentil-salad
Kale Salad with Shrimp and Avocado ,https://eatsmarter.com/recipes/kale-salad-with-shrimp-and-avocado
Bulgur Herb Kale Salad with Falafel ,https://eatsmarter.com/recipes/bulgur-herb-kale-salad-with-falafel
Grilled Zucchini Salad with Parmesan ,https://eatsmarter.com/recipes/grilled-zucchini-salad-with-parmesan
"Lamb's Lettuce with Radishes, Avocado, Grapefruit and Fennel ",https://eatsmarter.com/recipes/lambs-lettuce-with-radishes-avocado-grapefruit-and-fennel
Mache Salad with Pumpkin ,https://eatsmarter.com/recipes/mache-salad-with-pumpkin
Couscous Lentil Salad ,https://eatsmarter.com/recipes/couscous-lentil-salad
Grilled Turkey Breast with Couscous Apricot Salad ,https://eatsmarter.com/recipes/grilled-turkey-breast-with-couscous-apricot-salad
Watermelon Grapefruit Salad ,https://eatsmarter.com/recipes/watermelon-grapefruit-salad
Winter Salad with Watermelon Radishes ,https://eatsmarter.com/recipes/winter-salad-with-watermelon-radishes
Arugula Lentil Salad with Papaya ,https://eatsmarter.com/recipes/arugula-lentil-salad-with-papaya
Red Cabbage Salad with Oranges and Chestnuts ,https://eatsmarter.com/recipes/red-cabbage-salad-with-oranges-and-chestnuts
Pasta Salad with Asparagus and Peas To-go ,https://eatsmarter.com/recipes/pasta-salad-with-asparagus-and-peas-to-go
Quinoa Salad with Chickpeas and Spinach ,https://eatsmarter.com/recipes/quinoa-salad-with-chickpeas-and-spinach
Bok Choy Salad with Salmon ,https://eatsmarter.com/recipes/bok-choy-salad-with-salmon
Colorful Quinoa Salad ,https://eatsmarter.com/recipes/colorful-quinoa-salad
Kohlrabi Salad with Lentils ,https://eatsmarter.com/recipes/kohlrabi-salad-with-lentils
Summer Couscous Salad with Stone Fruit and Halloumi ,https://eatsmarter.com/recipes/summer-couscous-salad-with-stone-fruit-and-halloumi
Watercress Radish Salad with Sesame Tofu ,https://eatsmarter.com/recipes/watercress-radish-salad-with-sesame-tofu
Brussels Sprouts and Papaya Salad ,https://eatsmarter.com/recipes/brussels-sprouts-and-papaya-salad
Pasta Salad with Vegetables ,https://eatsmarter.com/recipes/pasta-salad-with-vegetables
Watermelon Radish Salad ,https://eatsmarter.com/recipes/watermelon-radish-salad
Thai Crab Meat Salad ,https://eatsmarter.com/recipes/thai-crab-meat-salad
Spicy Vegetable Salad ,https://eatsmarter.com/recipes/spicy-vegetable-salad
Papaya Lime Carpaccio with Mint Pesto ,https://eatsmarter.com/recipes/papaya-lime-carpaccio-with-mint-pesto
Vegetable Carpaccio ,https://eatsmarter.com/recipes/vegetable-carpaccio
Stuffed Radicchio Cups ,https://eatsmarter.com/recipes/stuffed-radicchio-cups
Crispy Bread and Cheese Salad ,https://eatsmarter.com/recipes/crispy-bread-and-cheese-salad
Watercress-Cucumber Salad ,https://eatsmarter.com/recipes/watercress-cucumber-salad
Beet and Carrot Salad ,https://eatsmarter.com/recipes/beet-and-carrot-salad
Herb Salad with Eggs ,https://eatsmarter.com/recipes/herb-salad-with-eggs
Pollock with Tomato-Bread Salad ,https://eatsmarter.com/recipes/pollock-with-tomato-bread-salad
Rice and Beans Salad with Nectarine and Pumpkin Seeds ,https://eatsmarter.com/recipes/rice-and-beans-salad-with-nectarine-and-pumpkin-seeds
Bread and Cherry Tomato Salad ,https://eatsmarter.com/recipes/bread-and-cherry-tomato-salad
Cucumber Salad with Tomatoes and Goat Cheese ,https://eatsmarter.com/recipes/cucumber-salad-with-tomatoes-and-goat-cheese
Feta and Watermelon Salad ,https://eatsmarter.com/recipes/feta-and-watermelon-salad
"Bulgur with Sprouts, Broccoli and Cauliflower ",https://eatsmarter.com/recipes/bulgur-with-sprouts-broccoli-and-cauliflower
Colorful Mixed Tomato Salad ,https://eatsmarter.com/recipes/colorful-mixed-tomato-salad
Vegetarian Waldorf Salad ,https://eatsmarter.com/recipes/vegetarian-waldorf-salad
Bean Soup ,https://eatsmarter.com/recipes/bean-soup-1
Mozzarella Potato Salad ,https://eatsmarter.com/recipes/mozzarella-potato-salad
Cauliflower and Radish Salad with Carrots ,https://eatsmarter.com/recipes/cauliflower-and-radish-salad-with-carrots
Caprese Salad with Avocado ,https://eatsmarter.com/recipes/caprese-salad-with-avocado
Zucchini Salad with Summer Fruits ,https://eatsmarter.com/recipes/zucchini-salad-with-summer-fruits
"Couscous Salad with Zucchini, Apricots and Pine Nuts ",https://eatsmarter.com/recipes/couscous-salad-with-zucchini-apricots-and-pine-nuts
Grilled Cod with Beet Salad ,https://eatsmarter.com/recipes/grilled-cod-with-beet-salad
Tuna and White Bean Salad ,https://eatsmarter.com/recipes/tuna-and-white-bean-salad
Chicken Apple Salad ,https://eatsmarter.com/recipes/chicken-apple-salad
Potato Salad with Cucumber ,https://eatsmarter.com/recipes/potato-salad-with-cucumber
Bulgur Tabbouleh ,https://eatsmarter.com/recipes/bulgur-tabbouleh
Avocado Tomato Salad ,https://eatsmarter.com/recipes/avocado-tomato-salad
"Beet, Arugula, Apple and Feta Salad ",https://eatsmarter.com/recipes/beet-arugula-apple-and-feta-salad
Grilled Peppers with Tomato Stuffing ,https://eatsmarter.com/recipes/grilled-peppers-with-tomato-stuffing
Butternut Squash and Feta Salad ,https://eatsmarter.com/recipes/butternut-squash-and-feta-salad
Lentil Salad with Pears ,https://eatsmarter.com/recipes/lentil-salad-with-pears
Potato Gnocchi and Apples on Lamb's Lettuce ,https://eatsmarter.com/recipes/potato-gnocchi-and-apples-on-lambs-lettuce
Kohlrabi Apple Crudités with Egg ,https://eatsmarter.com/recipes/kohlrabi-apple-crudites-with-egg
Steamed Cod with Hazelnuts ,https://eatsmarter.com/recipes/steamed-cod-with-hazelnuts
Pasta Salad with Peas and Burrata ,https://eatsmarter.com/recipes/pasta-salad-with-peas-and-burrata
Quinoa Salad with Edamame and Black Rice ,https://eatsmarter.com/recipes/quinoa-salad-with-edamame-and-black-rice
Mixed Salad with Cucumbers and Poached Egg ,https://eatsmarter.com/recipes/mixed-salad-with-cucumbers-and-poached-egg
Sweet Potato Salad with Mozzarella and Dill ,https://eatsmarter.com/recipes/sweet-potato-salad-with-mozzarella-and-dill
Dandelion Strawberry Salad ,https://eatsmarter.com/recipes/dandelion-strawberry-salad
Spinach Watermelon Salad with Beef ,https://eatsmarter.com/recipes/spinach-watermelon-salad-with-beef
"Spinach Salad with Blueberries, Almonds and Feta ",https://eatsmarter.com/recipes/spinach-salad-with-blueberries-almonds-and-feta
Avocado Salad with Sesame Tuna ,https://eatsmarter.com/recipes/avocado-salad-with-sesame-tuna
Beet and Quinoa Salad with Avocado and Eggs ,https://eatsmarter.com/recipes/beet-and-quinoa-salad-with-avocado-and-eggs
Panzanella with Burrata and Strawberries ,https://eatsmarter.com/recipes/panzanella-with-burrata-and-strawberries
Thai Rice Salad with Turkey ,https://eatsmarter.com/recipes/thai-rice-salad-with-turkey
Pumpkin Salad with Cottage Cheese and Walnuts ,https://eatsmarter.com/recipes/pumpkin-salad-with-cottage-cheese-and-walnuts
Lentil Noodles with Squash and Tahini Dressing ,https://eatsmarter.com/recipes/lentil-noodles-with-squash-and-tahini-dressing
Sauerkraut Apple Salad with Walnuts ,https://eatsmarter.com/recipes/sauerkraut-apple-salad-with-walnuts
German Potato Herring Salad ,https://eatsmarter.com/recipes/german-potato-herring-salad
Italian Potato Salad ,https://eatsmarter.com/recipes/italian-potato-salad
Grilled Caesar Salad with Chicken ,https://eatsmarter.com/recipes/grilled-caesar-salad-with-chicken
Couscous Tomato Salad with Poached Egg ,https://eatsmarter.com/recipes/couscous-tomato-salad-with-poached-egg
Barley Tangerine Salad with Almonds ,https://eatsmarter.com/recipes/barley-tangerine-salad-with-almonds
Radish and Asparagus Salad ,https://eatsmarter.com/recipes/radish-and-asparagus-salad
Red Cabbage Broccoli Salad ,https://eatsmarter.com/recipes/red-cabbage-broccoli-salad
Quinoa Lentil Salad ,https://eatsmarter.com/recipes/quinoa-lentil-salad
Warm Barley Salad ,https://eatsmarter.com/recipes/warm-barley-salad
Tuna Salad with Capers ,https://eatsmarter.com/recipes/tuna-salad-with-capers
Spicy Steak Salad ,https://eatsmarter.com/recipes/spicy-steak-salad
Thai Chicken Salad ,https://eatsmarter.com/recipes/thai-chicken-salad
Shrimp Skewers and Salad ,https://eatsmarter.com/recipes/shrimp-skewers-and-salad
Smoked Trout on Romaine ,https://eatsmarter.com/recipes/smoked-trout-on-romaine
Warm Asparagus Salad ,https://eatsmarter.com/recipes/warm-asparagus-salad
Fried Salsify ,https://eatsmarter.com/recipes/fried-salsify
Stuffed Goat Cheese Puffs ,https://eatsmarter.com/recipes/stuffed-goat-cheese-puffs
Zesty Marinated Bean Salad ,https://eatsmarter.com/recipes/zesty-marinated-bean-salad
Stuffed Mushrooms with Goat Cheese ,https://eatsmarter.com/recipes/stuffed-mushrooms-with-goat-cheese
Colorful Layered Salad ,https://eatsmarter.com/recipes/colorful-layered-salad
Braised Potatoes ,https://eatsmarter.com/recipes/braised-potatoes-0
Herb Yogurt Dressing ,https://eatsmarter.com/recipes/herb-yogurt-dressing
Radicchio Salad with Peaches and Mozzarella ,https://eatsmarter.com/recipes/radicchio-salad-with-peaches-and-mozzarella
Nacho Salad ,https://eatsmarter.com/recipes/nacho-salad
Tuna Salad with Olives ,https://eatsmarter.com/recipes/tuna-salad-with-olives
Radish Parsley Salad ,https://eatsmarter.com/recipes/radish-parsley-salad
Watermelon and Prawn Salad ,https://eatsmarter.com/recipes/watermelon-and-prawn-salad
Arugula and Goat Cheese Salad ,https://eatsmarter.com/recipes/arugula-and-goat-cheese-salad
Healthy Grain and Salmon Salad ,https://eatsmarter.com/recipes/healthy-grain-and-salmon-salad
Fruit and Vegetable Salad with Feta ,https://eatsmarter.com/recipes/fruit-and-vegetable-salad-with-feta
Classic Pear and Walnut Salad ,https://eatsmarter.com/recipes/classic-pear-and-walnut-salad
"Fennel, Radicchio and Blue Cheese Salad ",https://eatsmarter.com/recipes/fennel-radicchio-and-blue-cheese-salad
Fresh Summer Salad with Figs & Goat Cheese ,https://eatsmarter.com/recipes/fresh-summer-salad-with-figs-goat-cheese
Thinly Sliced Cucumber Salad with Radish ,https://eatsmarter.com/recipes/thinly-sliced-cucumber-salad-with-radish
Mixed Leaf Salad with Egg and Asparagus ,https://eatsmarter.com/recipes/mixed-leaf-salad-with-egg-and-asparagus
Napa Cabbage and Apple Salad with Camembert ,https://eatsmarter.com/recipes/napa-cabbage-and-apple-salad-with-camembert
Quinoa and Pepper Salad ,https://eatsmarter.com/recipes/quinoa-and-pepper-salad
Moroccan-Style Bean Salad ,https://eatsmarter.com/recipes/moroccan-style-bean-salad
Avocado and Cilantro Salad with Lime ,https://eatsmarter.com/recipes/avocado-and-cilantro-salad-with-lime
"Pasta Salad with Beans, Feta and Tomatoes ",https://eatsmarter.com/recipes/pasta-salad-with-beans-feta-and-tomatoes
Baked Goat Cheese on Mixed Greens ,https://eatsmarter.com/recipes/baked-goat-cheese-on-mixed-greens
"Carrot Salad with Peanuts, Sprouts and Cilantro ",https://eatsmarter.com/recipes/carrot-salad-with-peanuts-sprouts-and-cilantro
"Salad with Bacon, Egg and Parmesan ",https://eatsmarter.com/recipes/salad-with-bacon-egg-and-parmesan
Spinach Salad with Bacon Dressing ,https://eatsmarter.com/recipes/spinach-salad-with-bacon-dressing
"Capellini, Cabbage and Zucchini Salad with Peppers ",https://eatsmarter.com/recipes/capellini-cabbage-and-zucchini-salad-with-peppers
Tuscan Bread and Vegetable Salad ,https://eatsmarter.com/recipes/tuscan-bread-and-vegetable-salad
Greek Feta Salad ,https://eatsmarter.com/recipes/greek-feta-salad
Mustard Herb Crusted Sirloin with Herb Salad ,https://eatsmarter.com/recipes/mustard-herb-crusted-sirloin-with-herb-salad
Pineapple-Endive Salad with Cashews ,https://eatsmarter.com/recipes/pineapple-endive-salad-with-cashews
Sesame-Breaded Flounder with Salad ,https://eatsmarter.com/recipes/sesame-breaded-flounder-with-salad
Broad Bean and Radish Salad ,https://eatsmarter.com/recipes/broad-bean-and-radish-salad
Chicken Salad with Mozzarella ,https://eatsmarter.com/recipes/chicken-salad-with-mozzarella
Couscous and Vegetable Salad ,https://eatsmarter.com/recipes/couscous-and-vegetable-salad
Curried Rice Salad with Peas and Fruit ,https://eatsmarter.com/recipes/curried-rice-salad-with-peas-and-fruit
Orange and Blueberry Fruit Salad ,https://eatsmarter.com/recipes/orange-and-blueberry-fruit-salad
Vegetable Lentil Patties and Bulgur Salad ,https://eatsmarter.com/recipes/vegetable-lentil-patties-and-bulgur-salad
Vegetable White Bean Soup ,https://eatsmarter.com/recipes/vegetable-white-bean-soup
Carrot Ginger Salad ,https://eatsmarter.com/recipes/carrot-ginger-salad
Mediterranean Couscous Salad ,https://eatsmarter.com/recipes/mediterranean-couscous-salad
Lentil Salad ,https://eatsmarter.com/recipes/lentil-salad
Tabbouleh with Halloumi Cheese ,https://eatsmarter.com/recipes/tabbouleh-with-halloumi-cheese
Arugula Salad with Raspberries ,https://eatsmarter.com/recipes/arugula-salad-with-raspberries
Citrus Asian Cucumber Salad ,https://eatsmarter.com/recipes/citrus-asian-cucumber-salad
Pears and Celery Salad ,https://eatsmarter.com/recipes/pears-and-celery-salad
Potato and Cucumber Salad with Cottage Cheese ,https://eatsmarter.com/recipes/potato-and-cucumber-salad-with-cottage-cheese
Quinoa Cereal with Berries and Figs ,https://eatsmarter.com/recipes/quinoa-cereal-with-berries-and-figs
Chickpea Vegetable Salad with Cilantro Dressing ,https://eatsmarter.com/recipes/chickpea-vegetable-salad-with-cilantro-dressing
Hard Boiled Egg Salad ,https://eatsmarter.com/recipes/hard-boiled-egg-salad
Asian Rice Salad ,https://eatsmarter.com/recipes/asian-rice-salad
Asian Pomegranate Salad ,https://eatsmarter.com/recipes/asian-pomegranate-salad
Spinach and Chickpea Salad ,https://eatsmarter.com/recipes/spinach-and-chickpea-salad
Grapefruit Salad with Mint ,https://eatsmarter.com/recipes/grapefruit-salad-with-mint
Brussel Sprout and Chestnut Salad ,https://eatsmarter.com/recipes/brussel-sprout-and-chestnut-salad
Bulgur Salad with Chili and Carrots ,https://eatsmarter.com/recipes/bulgur-salad-with-chili-and-carrots
Bulgur Salad with Herbs ,https://eatsmarter.com/recipes/bulgur-salad-with-herbs
Mozzarella with Avocado and Mango ,https://eatsmarter.com/recipes/mozzarella-with-avocado-and-mango
Avocado and Mozzarella Salad ,https://eatsmarter.com/recipes/avocado-and-mozzarella-salad
Couscous Salad with Pine Nuts and Tomatoes ,https://eatsmarter.com/recipes/couscous-salad-with-pine-nuts-and-tomatoes
Lentil-Plum Salad with Feta Cheese ,https://eatsmarter.com/recipes/lentil-plum-salad-with-feta-cheese
Fennel and Rhubarb Salad ,https://eatsmarter.com/recipes/fennel-and-rhubarb-salad
Mushroom and Arugula Salad ,https://eatsmarter.com/recipes/mushroom-and-arugula-salad
Mushroom Carpaccio with Crème Fraiche ,https://eatsmarter.com/recipes/mushroom-carpaccio-with-creme-fraiche
Baked Endive Gratin ,https://eatsmarter.com/recipes/baked-endive-gratin
Cold Green Bean Salad ,https://eatsmarter.com/recipes/cold-green-bean-salad
Mache Salad with Ham ,https://eatsmarter.com/recipes/mache-salad-with-ham
Strawberry Salad ,https://eatsmarter.com/recipes/strawberry-salad-2
Couscous Arugula Salad with Strawberries ,https://eatsmarter.com/recipes/couscous-arugula-salad-with-strawberries
Oven Roasted Tomato Salad with Goat Cheese and Arugula ,https://eatsmarter.com/recipes/oven-roasted-tomato-salad-with-goat-cheese-and-arugula
Potato Endive Puree ,https://eatsmarter.com/recipes/potato-endive-puree
Butternut Squash and Lentils ,https://eatsmarter.com/recipes/butternut-squash-and-lentils
Daikon and Radish Salad ,https://eatsmarter.com/recipes/daikon-and-radish-salad
Chard and Broccoli Salad with Buttermilk Dressing ,https://eatsmarter.com/recipes/chard-and-broccoli-salad-with-buttermilk-dressing
Quinoa Salad with Avocado and Carrots ,https://eatsmarter.com/recipes/quinoa-salad-with-avocado-and-carrots
Colorful Carrot Salad ,https://eatsmarter.com/recipes/colorful-carrot-salad
Zucchini Basil Corn Salad ,https://eatsmarter.com/recipes/zucchini-basil-corn-salad
Couscous Quinoa Salad with Beets ,https://eatsmarter.com/recipes/couscous-quinoa-salad-with-beets
Pearl Barley Salad with Vegetables ,https://eatsmarter.com/recipes/pearl-barley-salad-with-vegetables
Plum Salad with Buffalo Mozzarella ,https://eatsmarter.com/recipes/plum-salad-with-buffalo-mozzarella
Red Cabbage and Red Onion Salad ,https://eatsmarter.com/recipes/red-cabbage-and-red-onion-salad
Watercress Salad with Feta and Sweet Potatoes ,https://eatsmarter.com/recipes/watercress-salad-with-feta-and-sweet-potatoes
Tomato Tuna Salad with Beans and Olives ,https://eatsmarter.com/recipes/tomato-tuna-salad-with-beans-and-olives
"Tomato Salad with Peaches, Raspberries and Burrata ",https://eatsmarter.com/recipes/tomato-salad-with-peaches-raspberries-and-burrata
Pumpkin Salad with Dried Plums ,https://eatsmarter.com/recipes/pumpkin-salad-with-dried-plums
Kale Caesar Salad with Chickpeas ,https://eatsmarter.com/recipes/kale-caesar-salad-with-chickpeas
Cabbage Salad with Oyster Mushrooms ,https://eatsmarter.com/recipes/cabbage-salad-with-oyster-mushrooms
Kale Avocado Salad with Mango ,https://eatsmarter.com/recipes/kale-avocado-salad-with-mango
Asparagus Pasta Salad in a Jar ,https://eatsmarter.com/recipes/asparagus-pasta-salad-in-a-jar
Beet and White Bean Salad ,https://eatsmarter.com/recipes/beet-and-white-bean-salad
Barley Salad with Cherries ,https://eatsmarter.com/recipes/barley-salad-with-cherries
Fattoush with Spinach and Pomegranate Seeds ,https://eatsmarter.com/recipes/fattoush-with-spinach-and-pomegranate-seeds
Roasted Corn Salad ,https://eatsmarter.com/recipes/roasted-corn-salad
Broccoli and Avocado Salad with Smoked Almond Rice ,https://eatsmarter.com/recipes/broccoli-and-avocado-salad-with-smoked-almond-rice
Black Kale Salad with White Beans ,https://eatsmarter.com/recipes/black-kale-salad-with-white-beans
"Salad with Smoked Salmon, Beets and Apples ",https://eatsmarter.com/recipes/salad-with-smoked-salmon-beets-and-apples
White Bean Arugula Salad ,https://eatsmarter.com/recipes/white-bean-arugula-salad
Watercress Salad with Asparagus and Poached Salmon ,https://eatsmarter.com/recipes/watercress-salad-with-asparagus-and-poached-salmon
Buckwheat Bowl with Sesame Tofu ,https://eatsmarter.com/recipes/buckwheat-bowl-with-sesame-tofu
Quinoa Tabbouleh with Kale ,https://eatsmarter.com/recipes/quinoa-tabbouleh-with-kale
Asian Cauliflower Salad with Lentils ,https://eatsmarter.com/recipes/asian-cauliflower-salad-with-lentils
Three Green Bean Salad ,https://eatsmarter.com/recipes/three-green-bean-salad
Endive Salad with Black Currants ,https://eatsmarter.com/recipes/endive-salad-with-black-currants
Fennel Oat Salad with Halloumi ,https://eatsmarter.com/recipes/fennel-oat-salad-with-halloumi
Radicchio Cheddar Salad ,https://eatsmarter.com/recipes/radicchio-cheddar-salad
Red Cabbage Pomegranate Salad with Feta ,https://eatsmarter.com/recipes/red-cabbage-pomegranate-salad-with-feta
Lentil Endive Salad with Fresh Goat Cheese ,https://eatsmarter.com/recipes/lentil-endive-salad-with-fresh-goat-cheese
Shrimp Salad with Pineapple ,https://eatsmarter.com/recipes/shrimp-salad-with-pineapple
Buckwheat Salad ,https://eatsmarter.com/recipes/buckwheat-salad
Chinese Chicken Salad ,https://eatsmarter.com/recipes/chinese-chicken-salad
Pointed Cabbage Slaw ,https://eatsmarter.com/recipes/pointed-cabbage-slaw
Fennel Salad with Pomegranate ,https://eatsmarter.com/recipes/fennel-salad-with-pomegranate
Baked Cauliflower Salad ,https://eatsmarter.com/recipes/baked-cauliflower-salad
Grilled Fennel and Feta Salad ,https://eatsmarter.com/recipes/grilled-fennel-and-feta-salad
Asparagus Salad with Salmon ,https://eatsmarter.com/recipes/asparagus-salad-with-salmon
Green Spelt and Chicken Salad ,https://eatsmarter.com/recipes/green-spelt-and-chicken-salad
Sauerkraut Cabbage Salad ,https://eatsmarter.com/recipes/sauerkraut-cabbage-salad
Warm Parsnip Salad ,https://eatsmarter.com/recipes/warm-parsnip-salad
Lemon Freekeh Salad ,https://eatsmarter.com/recipes/lemon-freekeh-salad
Arugula Lamb Summer Salad ,https://eatsmarter.com/recipes/arugula-lamb-summer-salad
Vegan Millet Summer Salad ,https://eatsmarter.com/recipes/vegan-millet-summer-salad
Lentil Salad with Sweet Potatoes ,https://eatsmarter.com/recipes/lentil-salad-with-sweet-potatoes
Vegan Quinoa Salad ,https://eatsmarter.com/recipes/vegan-quinoa-salad
Lentil and Salmon Salad ,https://eatsmarter.com/recipes/lentil-and-salmon-salad
Fresh Tomato Salad with Herbs ,https://eatsmarter.com/recipes/fresh-tomato-salad-with-herbs
Nectarine Salad with Shrimp ,https://eatsmarter.com/recipes/nectarine-salad-with-shrimp
Colorful Rainbow Salad ,https://eatsmarter.com/recipes/colorful-rainbow-salad
Halloumi Beet and Rice Salad ,https://eatsmarter.com/recipes/halloumi-beet-and-rice-salad
Green Bean and Mushroom Salad ,https://eatsmarter.com/recipes/green-bean-and-mushroom-salad
Peach Basil Chard Salad ,https://eatsmarter.com/recipes/peach-basil-chard-salad
Pumpkin Lentil Salad with Goat Cheese ,https://eatsmarter.com/recipes/pumpkin-lentil-salad-with-goat-cheese
Couscous Pearl Salad ,https://eatsmarter.com/recipes/couscous-pearl-salad
Fig and Walnut Salad ,https://eatsmarter.com/recipes/fig-and-walnut-salad
Simple Bulgur Salad ,https://eatsmarter.com/recipes/simple-bulgur-salad
Colorful Quinoa Salad with Spring Onions ,https://eatsmarter.com/recipes/colorful-quinoa-salad-with-spring-onions
Chicken Breast with Beet Salad ,https://eatsmarter.com/recipes/chicken-breast-with-beet-salad
Radicchio Fennel Salad with Walnuts ,https://eatsmarter.com/recipes/radicchio-fennel-salad-with-walnuts
Red Cabbage Endive Salad with Radishes ,https://eatsmarter.com/recipes/red-cabbage-endive-salad-with-radishes
Red Cabbage Radicchio Salad ,https://eatsmarter.com/recipes/red-cabbage-radicchio-salad
Beet Salad with Peas ,https://eatsmarter.com/recipes/beet-salad-with-peas
Spicy Chickpea Salad ,https://eatsmarter.com/recipes/spicy-chickpea-salad
Bulgur Squash Salad ,https://eatsmarter.com/recipes/bulgur-squash-salad
Pointed Cabbage Salad with Walnuts ,https://eatsmarter.com/recipes/pointed-cabbage-salad-with-walnuts
Farro and Feta Salad ,https://eatsmarter.com/recipes/farro-and-feta-salad
Roasted Vegetable Halloumi Salad ,https://eatsmarter.com/recipes/roasted-vegetable-halloumi-salad
Rice Salad To Go ,https://eatsmarter.com/recipes/rice-salad-to-go
Cucumber Shrimp Salad with Greek Yogurt ,https://eatsmarter.com/recipes/cucumber-shrimp-salad-with-greek-yogurt
Quick Chicory Kiwi Salad ,https://eatsmarter.com/recipes/quick-chicory-kiwi-salad
Halloumi Barley Salad with Oranges ,https://eatsmarter.com/recipes/halloumi-barley-salad-with-oranges
Danish Bread Salad ,https://eatsmarter.com/recipes/danish-bread-salad
Bistro Salad ,https://eatsmarter.com/recipes/bistro-salad
Spicy Octopus and Vegetable Salad ,https://eatsmarter.com/recipes/spicy-octopus-and-vegetable-salad
Tex-Mex Caesar Salad ,https://eatsmarter.com/recipes/tex-mex-caesar-salad
Asian Spinach Salad with Chicken Fillet ,https://eatsmarter.com/recipes/asian-spinach-salad-with-chicken-fillet
Lobster Papaya Salad ,https://eatsmarter.com/recipes/lobster-papaya-salad
Asian-Style Romaine Salad ,https://eatsmarter.com/recipes/asian-style-romaine-salad
Mediterranean Salad in Parmesan Baskets ,https://eatsmarter.com/recipes/mediterranean-salad-in-parmesan-baskets
"Lamb Fillet, Purslane and Arugula Salad ",https://eatsmarter.com/recipes/lamb-fillet-purslane-and-arugula-salad
Spicy Shrimp with Grapefruit ,https://eatsmarter.com/recipes/spicy-shrimp-with-grapefruit
Orange and Grapefruit Salad ,https://eatsmarter.com/recipes/orange-and-grapefruit-salad
Fava and Green Bean Salad with Pears ,https://eatsmarter.com/recipes/fava-and-green-bean-salad-with-pears
Asian Chicken ,https://eatsmarter.com/recipes/asian-chicken
Layered Pepper Salad with Sesame ,https://eatsmarter.com/recipes/layered-pepper-salad-with-sesame
Healthy Tuna Salad ,https://eatsmarter.com/recipes/healthy-tuna-salad
"Mixed Greens, Asian Pear and Feta Cheese ",https://eatsmarter.com/recipes/mixed-greens-asian-pear-and-feta-cheese
Marinated Romanesco on Mache ,https://eatsmarter.com/recipes/marinated-romanesco-on-mache
Brasserie-Style Salad ,https://eatsmarter.com/recipes/brasserie-style-salad
Spicy Zucchini-Tomato Relish on Celery Root ,https://eatsmarter.com/recipes/spicy-zucchini-tomato-relish-on-celery-root
Potato and Bean Salad ,https://eatsmarter.com/recipes/potato-and-bean-salad
Caprese Style Salad in a Jar ,https://eatsmarter.com/recipes/caprese-style-salad-in-a-jar
Green Salad in Pepper Dressing ,https://eatsmarter.com/recipes/green-salad-in-pepper-dressing
Walnut Green Beans ,https://eatsmarter.com/recipes/walnut-green-beans
Baked Veggie Flatbread ,https://eatsmarter.com/recipes/baked-veggie-flatbread
Grilled Panzanella Salad ,https://eatsmarter.com/recipes/grilled-panzanella-salad
"Spinach Salad with Quinoa, Shrimp, and Grapefruit ",https://eatsmarter.com/recipes/spinach-salad-with-quinoa-shrimp-and-grapefruit
Baja Fish Tacos with Cabbage ,https://eatsmarter.com/recipes/baja-fish-tacos-with-cabbage
Chorizo and Green Leaf Salad ,https://eatsmarter.com/recipes/chorizo-and-green-leaf-salad
Japanese Noodles with Cucumber ,https://eatsmarter.com/recipes/japanese-noodles-with-cucumber
Figs and Ham with Mixed Greens ,https://eatsmarter.com/recipes/figs-and-ham-with-mixed-greens
Fava Bean and Arugula Salad ,https://eatsmarter.com/recipes/fava-bean-and-arugula-salad
Healthy Mixed Bean and Corn Salad ,https://eatsmarter.com/recipes/healthy-mixed-bean-and-corn-salad
Crab Cucumber Salad Wraps ,https://eatsmarter.com/recipes/crab-cucumber-salad-wraps
Beet and Radish Carpaccio ,https://eatsmarter.com/recipes/beet-and-radish-carpaccio
