title,url
White Beans with Parsnips and Apple ,https://eatsmarter.com/recipes/white-beans-with-parsnips-and-apple
White Asparagus with Chickpeas and Poached Egg ,https://eatsmarter.com/recipes/white-asparagus-with-chickpeas-and-poached-egg
Quinoa Lentil Salad ,https://eatsmarter.com/recipes/quinoa-lentil-salad
Warm Barley Salad ,https://eatsmarter.com/recipes/warm-barley-salad
Turkish Pide with Potatoes ,https://eatsmarter.com/recipes/turkish-pide-with-potatoes
Banana Bread with Blackberries ,https://eatsmarter.com/recipes/banana-bread-with-blackberries
Vegan Beet Risotto ,https://eatsmarter.com/recipes/vegan-beet-risotto
Pumpkin Crescent Cookies ,https://eatsmarter.com/recipes/pumpkin-crescent-cookies
Baked Apple Pancake ,https://eatsmarter.com/recipes/baked-apple-pancake
Nectarines with Basil Mascarpone Cream ,https://eatsmarter.com/recipes/nectarines-with-basil-mascarpone-cream
Rainbow Oatmeal Bowl ,https://eatsmarter.com/recipes/rainbow-oatmeal-bowl
Strawberry Nice Cream with Chocolate ,https://eatsmarter.com/recipes/strawberry-nice-cream-with-chocolate
Brown Rice ,https://eatsmarter.com/recipes/brown-rice
Braised Artichokes ,https://eatsmarter.com/recipes/braised-artichokes
Fried Salsify ,https://eatsmarter.com/recipes/fried-salsify
Grilled Potatoes ,https://eatsmarter.com/recipes/grilled-potatoes
Stuffed Goat Cheese Puffs ,https://eatsmarter.com/recipes/stuffed-goat-cheese-puffs
Zesty Marinated Bean Salad ,https://eatsmarter.com/recipes/zesty-marinated-bean-salad
Stuffed Mushrooms with Goat Cheese ,https://eatsmarter.com/recipes/stuffed-mushrooms-with-goat-cheese
Sesame Sushi Rice ,https://eatsmarter.com/recipes/sesame-sushi-rice
Mushroom Scrambled Eggs on Flatbread ,https://eatsmarter.com/recipes/mushroom-scrambled-eggs-on-flatbread
Green Asparagus Soup ,https://eatsmarter.com/recipes/green-asparagus-soup
Herb Yogurt Dressing ,https://eatsmarter.com/recipes/herb-yogurt-dressing
Danish Apple Pie ,https://eatsmarter.com/recipes/danish-apple-pie
Chai Latte ,https://eatsmarter.com/recipes/chai-latte
Vegan Nut Nougat Cream ,https://eatsmarter.com/recipes/vegan-nut-nougat-cream
Healthy Vegetable Stock ,https://eatsmarter.com/recipes/healthy-vegetable-stock
Blackberry Goat Cheese Pizza ,https://eatsmarter.com/recipes/blackberry-goat-cheese-pizza
Vegan Pancakes with Mango ,https://eatsmarter.com/recipes/vegan-pancakes-with-mango
Sushi Burger ,https://eatsmarter.com/recipes/sushi-burger
Chia Detox Water ,https://eatsmarter.com/recipes/chia-detox-water
Basic Cookie Dough ,https://eatsmarter.com/recipes/basic-cookie-dough
Virgin Margarita ,https://eatsmarter.com/recipes/virgin-margarita
Vegan Spicy Hot Chocolate ,https://eatsmarter.com/recipes/vegan-spicy-hot-chocolate
Greek Yogurt with Fruit ,https://eatsmarter.com/recipes/greek-yogurt-with-fruit
Smart Homemade Taco Shells ,https://eatsmarter.com/recipes/smart-homemade-taco-shells
Classic Falafel ,https://eatsmarter.com/recipes/classic-falafel
Italian Chia Pudding with Raspberries and Pistachios ,https://eatsmarter.com/recipes/italian-chia-pudding-with-raspberries-and-pistachios
Spelt Ribbon Noodles ,https://eatsmarter.com/recipes/spelt-ribbon-noodles
Red Lentil Noodles ,https://eatsmarter.com/recipes/red-lentil-noodles
Vegan Wontons ,https://eatsmarter.com/recipes/vegan-wontons
Jackfruit Fricassee with Pea Rice ,https://eatsmarter.com/recipes/jackfruit-fricassee-with-pea-rice
Radicchio Salad with Peaches and Mozzarella ,https://eatsmarter.com/recipes/radicchio-salad-with-peaches-and-mozzarella
Non-Alcoholic Cherry Punch ,https://eatsmarter.com/recipes/non-alcoholic-cherry-punch
Nacho Salad ,https://eatsmarter.com/recipes/nacho-salad
Cucumber Yogurt Dip ,https://eatsmarter.com/recipes/cucumber-yogurt-dip
Vegan Chana Masala ,https://eatsmarter.com/recipes/vegan-chana-masala
Banana Protein Pancakes ,https://eatsmarter.com/recipes/banana-protein-pancakes
3 Healthy Party Dips ,https://eatsmarter.com/recipes/3-healthy-party-dips
Radish Parsley Salad ,https://eatsmarter.com/recipes/radish-parsley-salad
Smashed Potatoes ,https://eatsmarter.com/recipes/smashed-potatoes
Vegetarian Chop Suey ,https://eatsmarter.com/recipes/vegetarian-chop-suey
Mixed Leaf Salad with Egg and Asparagus ,https://eatsmarter.com/recipes/mixed-leaf-salad-with-egg-and-asparagus
Cold Dill-Zucchini Soup ,https://eatsmarter.com/recipes/cold-dill-zucchini-soup
Quinoa and Pepper Salad ,https://eatsmarter.com/recipes/quinoa-and-pepper-salad
Spinach and Mushroom Crêpe Gratin ,https://eatsmarter.com/recipes/spinach-and-mushroom-crepe-gratin
Tomato-Mushroom Barley Soup ,https://eatsmarter.com/recipes/tomato-mushroom-barley-soup
Creamy Gazpacho Soup ,https://eatsmarter.com/recipes/creamy-gazpacho-soup
Brie Soup with Pears and Porcini Oil ,https://eatsmarter.com/recipes/brie-soup-with-pears-and-porcini-oil
Italian-Style Tomato Soup ,https://eatsmarter.com/recipes/italian-style-tomato-soup
Gluten Free Zucchini Lasagna ,https://eatsmarter.com/recipes/gluten-free-zucchini-lasagna
Pizza with Asparagus and Cherry Tomatoes ,https://eatsmarter.com/recipes/pizza-with-asparagus-and-cherry-tomatoes
Asparagus and Walnut Cream ,https://eatsmarter.com/recipes/asparagus-and-walnut-cream
Lemonade with Elderflower ,https://eatsmarter.com/recipes/lemonade-with-elderflower
Crepes with Oyster Mushrooms ,https://eatsmarter.com/recipes/crepes-with-oyster-mushrooms
Vegetable Soup with Leeks and Zucchini ,https://eatsmarter.com/recipes/vegetable-soup-with-leeks-and-zucchini
Vegetable Lentil Patties and Bulgur Salad ,https://eatsmarter.com/recipes/vegetable-lentil-patties-and-bulgur-salad
Italian Marinated Olives ,https://eatsmarter.com/recipes/italian-marinated-olives
Pasta Salad with Arugula ,https://eatsmarter.com/recipes/pasta-salad-with-arugula
Mediterranean Couscous Salad ,https://eatsmarter.com/recipes/mediterranean-couscous-salad
Arugula Salad with Raspberries ,https://eatsmarter.com/recipes/arugula-salad-with-raspberries
Vegetable Pancakes with Pear Salad ,https://eatsmarter.com/recipes/vegetable-pancakes-with-pear-salad
Asparagus Quiche with Strawberries ,https://eatsmarter.com/recipes/asparagus-quiche-with-strawberries
Thai Stir Fry Vegetables ,https://eatsmarter.com/recipes/thai-stir-fry-vegetables
Deep Fried Zucchini Balls ,https://eatsmarter.com/recipes/deep-fried-zucchini-balls
Potato Salad Sandwich ,https://eatsmarter.com/recipes/potato-salad-sandwich
Watermelon with Ricotta Cream ,https://eatsmarter.com/recipes/watermelon-with-ricotta-cream
Savoury Roulades with Swiss Chard ,https://eatsmarter.com/recipes/savoury-roulades-with-swiss-chard
Tropical Fruit with Crunchy Buckwheat ,https://eatsmarter.com/recipes/tropical-fruit-with-crunchy-buckwheat
Mushroom and Arugula Salad ,https://eatsmarter.com/recipes/mushroom-and-arugula-salad
Garlic Herb Compound Butter ,https://eatsmarter.com/recipes/garlic-herb-compound-butter
Creamy Cheese Soup with Croutons ,https://eatsmarter.com/recipes/creamy-cheese-soup-with-croutons-0
Radish and Onion Salad ,https://eatsmarter.com/recipes/radish-and-onion-salad
"Risotto with Porcini Mushrooms, Pine Nuts and Arugula ",https://eatsmarter.com/recipes/risotto-with-porcini-mushrooms-pine-nuts-and-arugula
Omelet with Onions and Olives ,https://eatsmarter.com/recipes/omelet-with-onions-and-olives
Tomato Soup with Roquefort ,https://eatsmarter.com/recipes/tomato-soup-with-roquefort
Green Bean and Tomato Salad ,https://eatsmarter.com/recipes/green-bean-and-tomato-salad
Rosemary Infused Olive Oil ,https://eatsmarter.com/recipes/rosemary-infused-olive-oil
Egg Salad Appetizers ,https://eatsmarter.com/recipes/egg-salad-appetizers
Carrot Juice Smoothie ,https://eatsmarter.com/recipes/carrot-juice-smoothie
Kale Smoothie ,https://eatsmarter.com/recipes/kale-smoothie
Grilled Sweet Potatoes with Pistachios ,https://eatsmarter.com/recipes/grilled-sweet-potatoes-with-pistachios
Goat Cheese Stuffed Tomatoes ,https://eatsmarter.com/recipes/goat-cheese-stuffed-tomatoes
Cream of Green and White Asparagus Soup ,https://eatsmarter.com/recipes/cream-of-green-and-white-asparagus-soup
Frozen Yogurt with Red Currant Compote ,https://eatsmarter.com/recipes/frozen-yogurt-with-red-currant-compote
Blackberry Yogurt Ice Cream with Pistachios ,https://eatsmarter.com/recipes/blackberry-yogurt-ice-cream-with-pistachios
Spelt Fennel Salad with Currants ,https://eatsmarter.com/recipes/spelt-fennel-salad-with-currants
Classic Guacamole ,https://eatsmarter.com/recipes/classic-guacamole
Spicy Tomato Ketchup ,https://eatsmarter.com/recipes/spicy-tomato-ketchup
Spiced Apricot Compote ,https://eatsmarter.com/recipes/spiced-apricot-compote
Sun Kissed Tomatoes ,https://eatsmarter.com/recipes/sun-kissed-tomatoes
Easy Plum Compote ,https://eatsmarter.com/recipes/easy-plum-compote
Onion Apple Jam ,https://eatsmarter.com/recipes/onion-apple-jam
Roasted Pears with Vanilla ,https://eatsmarter.com/recipes/roasted-pears-with-vanilla
Smoothie with Pomegranate and Pistachios ,https://eatsmarter.com/recipes/smoothie-with-pomegranate-and-pistachios
Beet Curry with Butternut Squash ,https://eatsmarter.com/recipes/beet-curry-with-butternut-squash
Ramen Noodle Soup with Tofu and Vegetables ,https://eatsmarter.com/recipes/ramen-noodle-soup-with-tofu-and-vegetables
Hearty Sourdough Rye Bread ,https://eatsmarter.com/recipes/hearty-sourdough-rye-bread
Rye Pumpernickel Loaf ,https://eatsmarter.com/recipes/rye-pumpernickel-loaf
Chickpea Pasta with Salmon and Asparagus ,https://eatsmarter.com/recipes/chickpea-pasta-with-salmon-and-asparagus
Oatmeal with Tempeh and Mushrooms ,https://eatsmarter.com/recipes/oatmeal-with-tempeh-and-mushrooms
Watermelon and Radish Salad ,https://eatsmarter.com/recipes/watermelon-and-radish-salad
Chard and Broccoli Salad with Buttermilk Dressing ,https://eatsmarter.com/recipes/chard-and-broccoli-salad-with-buttermilk-dressing
Zucchini Cannelloni Au Gratin ,https://eatsmarter.com/recipes/zucchini-cannelloni-au-gratin
Pea Soup with Watercress ,https://eatsmarter.com/recipes/pea-soup-with-watercress
Irish Soda Bread with Parsley ,https://eatsmarter.com/recipes/irish-soda-bread-with-parsley
Fig and Strawberry Carpaccio with Ricotta Cheese ,https://eatsmarter.com/recipes/fig-and-strawberry-carpaccio-with-ricotta-cheese
Raspberry Coconut Matcha Ice Milk Bars ,https://eatsmarter.com/recipes/raspberry-coconut-matcha-ice-milk-bars
Frozen Yogurt with Chia Seeds and Goji Berries ,https://eatsmarter.com/recipes/frozen-yogurt-with-chia-seeds-and-goji-berries
Mixed Berry Rose Popsicles ,https://eatsmarter.com/recipes/mixed-berry-rose-popsicles
Strawberry Watermelon Mint Popsicles ,https://eatsmarter.com/recipes/strawberry-watermelon-mint-popsicles
Coconut Avocado Nice Cream ,https://eatsmarter.com/recipes/coconut-avocado-nice-cream
Blackberry Thyme Ice Cream Bars ,https://eatsmarter.com/recipes/blackberry-thyme-ice-cream-bars
Quinoa Salad with Avocado and Carrots ,https://eatsmarter.com/recipes/quinoa-salad-with-avocado-and-carrots
Baked Honey Banana ,https://eatsmarter.com/recipes/baked-honey-banana
Grilled Corn on the Cob with Thyme Butter ,https://eatsmarter.com/recipes/grilled-corn-on-the-cob-with-thyme-butter
Cedar Plank Stuffed Tomatoes ,https://eatsmarter.com/recipes/cedar-plank-stuffed-tomatoes
Grilled Eggplant with Tomato Compote ,https://eatsmarter.com/recipes/grilled-eggplant-with-tomato-compote
Matcha Cooler ,https://eatsmarter.com/recipes/matcha-cooler
Peach Sangria Mocktail ,https://eatsmarter.com/recipes/peach-sangria-mocktail
Sparkling Berry Punch ,https://eatsmarter.com/recipes/sparkling-berry-punch-0
Thyme Lemonade ,https://eatsmarter.com/recipes/thyme-lemonade
Hibiscus Sage Iced Tea ,https://eatsmarter.com/recipes/hibiscus-sage-iced-tea
Oat Milk Chai Iced Tea ,https://eatsmarter.com/recipes/oat-milk-chai-iced-tea
Colorful Spelt Pumpkin Pizza ,https://eatsmarter.com/recipes/colorful-spelt-pumpkin-pizza
Colorful Carrot Salad ,https://eatsmarter.com/recipes/colorful-carrot-salad
Carrot Falafels with Tahini Yogurt Dip ,https://eatsmarter.com/recipes/carrot-falafels-with-tahini-yogurt-dip
Paprika Pomegranate Paste ,https://eatsmarter.com/recipes/paprika-pomegranate-paste
Zucchini Basil Corn Salad ,https://eatsmarter.com/recipes/zucchini-basil-corn-salad
Cheese Omelet with Spring Onions ,https://eatsmarter.com/recipes/cheese-omelet-with-spring-onions
Almond Pesto Pasta with Pears ,https://eatsmarter.com/recipes/almond-pesto-pasta-with-pears
Sweet Potatoes with Tahini Butter ,https://eatsmarter.com/recipes/sweet-potatoes-with-tahini-butter
Chinese Almond Cookies ,https://eatsmarter.com/recipes/chinese-almond-cookies
Parsnip Carrot Soup ,https://eatsmarter.com/recipes/parsnip-carrot-soup
Brussels Sprout Salad with Poached Eggs ,https://eatsmarter.com/recipes/brussels-sprout-salad-with-poached-eggs
Green Pea Soup with Yogurt ,https://eatsmarter.com/recipes/green-pea-soup-with-yogurt
Pickled Vegetable Sushi ,https://eatsmarter.com/recipes/pickled-vegetable-sushi
Raita with Pomegranate Seeds ,https://eatsmarter.com/recipes/raita-with-pomegranate-seeds
How to Make Gluten Free Pasta ,https://eatsmarter.com/recipes/how-to-make-gluten-free-pasta
Tomato Carrot Sauce ,https://eatsmarter.com/recipes/tomato-carrot-sauce
Cauliflower Chickpea Curry ,https://eatsmarter.com/recipes/cauliflower-chickpea-curry
Eggplant with Yogurt Cream ,https://eatsmarter.com/recipes/eggplant-with-yogurt-cream
Couscous Quinoa Salad with Beets ,https://eatsmarter.com/recipes/couscous-quinoa-salad-with-beets
Veggie Meatballs with Oven Vegetables ,https://eatsmarter.com/recipes/veggie-meatballs-with-oven-vegetables
"Scrambled Tofu with Avocado, Potatoes and Tomatoes ",https://eatsmarter.com/recipes/scrambled-tofu-with-avocado-potatoes-and-tomatoes
Strawberry Skyr Ice Cream Bars ,https://eatsmarter.com/recipes/strawberry-skyr-ice-cream-bars
Honey Cake with Roasted Strawberries ,https://eatsmarter.com/recipes/honey-cake-with-roasted-strawberries
Turmeric Semolina Porridge ,https://eatsmarter.com/recipes/turmeric-semolina-porridge
Strawberry Orange Soup ,https://eatsmarter.com/recipes/strawberry-orange-soup
Pearl Barley Salad with Vegetables ,https://eatsmarter.com/recipes/pearl-barley-salad-with-vegetables
Bulgur Bowl with Sundried Tomatoes and Scallions ,https://eatsmarter.com/recipes/bulgur-bowl-with-sundried-tomatoes-and-scallions
Halloumi with Grilled Zucchini ,https://eatsmarter.com/recipes/halloumi-with-grilled-zucchini
Green Smoothie Bowl with Eggs ,https://eatsmarter.com/recipes/green-smoothie-bowl-with-eggs
Buckwheat Zucchini Spaghetti with Parsley Pesto ,https://eatsmarter.com/recipes/buckwheat-zucchini-spaghetti-with-parsley-pesto
Creamy Thai Carrot Soup ,https://eatsmarter.com/recipes/creamy-thai-carrot-soup
Avocado Pudding with Oatmeal and Walnuts ,https://eatsmarter.com/recipes/avocado-pudding-with-oatmeal-and-walnuts
Cauliflower Steaks with Turmeric Dip ,https://eatsmarter.com/recipes/cauliflower-steaks-with-turmeric-dip
Quinoa Bowl with Chickpea Rounds ,https://eatsmarter.com/recipes/quinoa-bowl-with-chickpea-rounds
Watercress Salad with Feta and Sweet Potatoes ,https://eatsmarter.com/recipes/watercress-salad-with-feta-and-sweet-potatoes
White Asparagus with Herb Scrambled Eggs ,https://eatsmarter.com/recipes/white-asparagus-with-herb-scrambled-eggs
Cauliflower Lupine Pizza with Corn and Arugula ,https://eatsmarter.com/recipes/cauliflower-lupine-pizza-with-corn-and-arugula
Strawberry Rhubarb Ice Cream ,https://eatsmarter.com/recipes/strawberry-rhubarb-ice-cream
"Tomato Salad with Peaches, Raspberries and Burrata ",https://eatsmarter.com/recipes/tomato-salad-with-peaches-raspberries-and-burrata
Stuffed Eggplant with Couscous and Apricots ,https://eatsmarter.com/recipes/stuffed-eggplant-with-couscous-and-apricots
Clafoutis Tartlet with Gooseberries ,https://eatsmarter.com/recipes/clafoutis-tartlet-with-gooseberries
Broiled Watermelon with Smoked Mozzarella ,https://eatsmarter.com/recipes/broiled-watermelon-with-smoked-mozzarella
Millet Blueberry Pudding with Yogurt ,https://eatsmarter.com/recipes/millet-blueberry-pudding-with-yogurt
Chocolate Cherry Clafoutis ,https://eatsmarter.com/recipes/chocolate-cherry-clafoutis
Gnocchi with Chard and Goat Cheese Cream ,https://eatsmarter.com/recipes/gnocchi-with-chard-and-goat-cheese-cream
How to Make Raspberry Vinegar ,https://eatsmarter.com/recipes/how-to-make-raspberry-vinegar
Overnight Oats with Blood Oranges ,https://eatsmarter.com/recipes/overnight-oats-with-blood-oranges
Vegetable Harira Soup ,https://eatsmarter.com/recipes/vegetable-harira-soup
Potato and Fig Tarte Flambée ,https://eatsmarter.com/recipes/potato-and-fig-tarte-flambee
Roasted Pumpkin with Radicchio and Blue Cheese ,https://eatsmarter.com/recipes/roasted-pumpkin-with-radicchio-and-blue-cheese
Raspberry Chia Jam ,https://eatsmarter.com/recipes/raspberry-chia-jam
Kale Caesar Salad with Chickpeas ,https://eatsmarter.com/recipes/kale-caesar-salad-with-chickpeas
Spicy Apple Cinnamon Satsuma Punch ,https://eatsmarter.com/recipes/spicy-apple-cinnamon-satsuma-punch
Pumpkin Spice Latte ,https://eatsmarter.com/recipes/pumpkin-spice-latte
Citrus Turmeric Drink ,https://eatsmarter.com/recipes/citrus-turmeric-drink
Orange Chia Pudding with Pistachios ,https://eatsmarter.com/recipes/orange-chia-pudding-with-pistachios
Coconut Rice with Wasabi Strawberries ,https://eatsmarter.com/recipes/coconut-rice-with-wasabi-strawberries
Asparagus Pasta Salad in a Jar ,https://eatsmarter.com/recipes/asparagus-pasta-salad-in-a-jar
Berry Vegetable Smoothie ,https://eatsmarter.com/recipes/berry-vegetable-smoothie
Crêpes with Blueberries and Strawberries ,https://eatsmarter.com/recipes/crepes-with-blueberries-and-strawberries
Beet Dip with Goat Cheese ,https://eatsmarter.com/recipes/beet-dip-with-goat-cheese
Yellow Plum Yogurt Bowl ,https://eatsmarter.com/recipes/yellow-plum-yogurt-bowl
Lentil Beet Barley Salad ,https://eatsmarter.com/recipes/lentil-beet-barley-salad
Rose Milk Hazelnut Rice ,https://eatsmarter.com/recipes/rose-milk-hazelnut-rice
Cucumber Noodles with Spinach Peanut Sauce ,https://eatsmarter.com/recipes/cucumber-noodles-with-spinach-peanut-sauce
Vegetable Curry Tofu and Asparagus Lentil Salad ,https://eatsmarter.com/recipes/vegetable-curry-tofu-and-asparagus-lentil-salad
Asparagus Broccoli Salad with Miso Dressing ,https://eatsmarter.com/recipes/asparagus-broccoli-salad-with-miso-dressing
One Pot Barley and Lentils ,https://eatsmarter.com/recipes/one-pot-barley-and-lentils
Nettle Omelet with Basil Pesto ,https://eatsmarter.com/recipes/nettle-omelet-with-basil-pesto
Purple Potato Salad ,https://eatsmarter.com/recipes/purple-potato-salad
Wheat Vegetable Bowl with Halloumi ,https://eatsmarter.com/recipes/wheat-vegetable-bowl-with-halloumi
Watermelon Cucumber Smoothie ,https://eatsmarter.com/recipes/watermelon-cucumber-smoothie
Rice Stuffed Eggplant Marinara ,https://eatsmarter.com/recipes/rice-stuffed-eggplant-marinara
Peppers Stuffed with Rice and Beans ,https://eatsmarter.com/recipes/peppers-stuffed-with-rice-and-beans
Barley Salad with Cherries ,https://eatsmarter.com/recipes/barley-salad-with-cherries
Green Minestrone with Pesto ,https://eatsmarter.com/recipes/green-minestrone-with-pesto
Indian Chickpea Patties with Arugula ,https://eatsmarter.com/recipes/indian-chickpea-patties-with-arugula
Whole Wheat Beet Pasta ,https://eatsmarter.com/recipes/whole-wheat-beet-pasta
Ravioli with Ricotta Walnut Filling ,https://eatsmarter.com/recipes/ravioli-with-ricotta-walnut-filling
Pistachio Arugula Pesto ,https://eatsmarter.com/recipes/pistachio-arugula-pesto
Banana Avocado NiceCream ,https://eatsmarter.com/recipes/banana-avocado-nicecream
Roasted Corn Salad ,https://eatsmarter.com/recipes/roasted-corn-salad
Broccoli and Avocado Salad with Smoked Almond Rice ,https://eatsmarter.com/recipes/broccoli-and-avocado-salad-with-smoked-almond-rice
Chilled Blueberry Orange Bowl ,https://eatsmarter.com/recipes/chilled-blueberry-orange-bowl
Pumpkin Apple Ginger Soup ,https://eatsmarter.com/recipes/pumpkin-apple-ginger-soup-0
Asparagus Salad with Lentils ,https://eatsmarter.com/recipes/asparagus-salad-with-lentils
Green Superfood Smoothie Bowl ,https://eatsmarter.com/recipes/green-superfood-smoothie-bowl
Frozen Yogurt with Strawberry Compote and Basil Pesto ,https://eatsmarter.com/recipes/frozen-yogurt-with-strawberry-compote-and-basil-pesto
Goat Cheese on Wild Herbs Asparagus Salad ,https://eatsmarter.com/recipes/goat-cheese-on-wild-herbs-asparagus-salad
Sesame Broccoli with Mango Dip ,https://eatsmarter.com/recipes/sesame-broccoli-with-mango-dip
Pesto Orecchiette with Roasted Cauliflower ,https://eatsmarter.com/recipes/pesto-orecchiette-with-roasted-cauliflower
Herb Parmesan Spaetzle ,https://eatsmarter.com/recipes/herb-parmesan-spaetzle
Black Kale Salad with White Beans ,https://eatsmarter.com/recipes/black-kale-salad-with-white-beans
Vegetable and Bean Minestrone ,https://eatsmarter.com/recipes/vegetable-and-bean-minestrone
Mason Jar Mango Chocolate Granola Smoothies ,https://eatsmarter.com/recipes/mason-jar-mango-chocolate-granola-smoothies
Carrot Quiche with Colorful Vegetable Strips ,https://eatsmarter.com/recipes/carrot-quiche-with-colorful-vegetable-strips
Maple Mustard Carrots ,https://eatsmarter.com/recipes/maple-mustard-carrots
Vegetable Carpaccio with Cashew Cream ,https://eatsmarter.com/recipes/vegetable-carpaccio-with-cashew-cream
Spinach Lasagna with Ricotta Cheese ,https://eatsmarter.com/recipes/spinach-lasagna-with-ricotta-cheese
Vegan Cashew Matcha Ice Cream Bars ,https://eatsmarter.com/recipes/vegan-cashew-matcha-ice-cream-bars
Chickpea Tofu Meatballs on Bulgur Salad ,https://eatsmarter.com/recipes/chickpea-tofu-meatballs-on-bulgur-salad
Spelt Crepes with Cheese and Leek Filling ,https://eatsmarter.com/recipes/spelt-crepes-with-cheese-and-leek-filling
Pumpkin Ravioli with Pine Nuts and Arugula ,https://eatsmarter.com/recipes/pumpkin-ravioli-with-pine-nuts-and-arugula
White Bean Arugula Salad ,https://eatsmarter.com/recipes/white-bean-arugula-salad
Hazelnut Pumpkin Pie ,https://eatsmarter.com/recipes/hazelnut-pumpkin-pie
Plum and Blackberry Crumble ,https://eatsmarter.com/recipes/plum-and-blackberry-crumble
Hummus with Spinach Tortilla Chips ,https://eatsmarter.com/recipes/hummus-with-spinach-tortilla-chips
Whole Grain Crackers with Beet Cashew Spread ,https://eatsmarter.com/recipes/whole-grain-crackers-with-beet-cashew-spread
Chocolate Hummus Dip with Plums and Figs ,https://eatsmarter.com/recipes/chocolate-hummus-dip-with-plums-and-figs
Chocolate Ricotta Cream ,https://eatsmarter.com/recipes/chocolate-ricotta-cream
Sheet Pan Purple Potatoes with Spicy Red Pesto ,https://eatsmarter.com/recipes/sheet-pan-purple-potatoes-with-spicy-red-pesto
Strawberry Tortilla Pancake with Chocolate Cream ,https://eatsmarter.com/recipes/strawberry-tortilla-pancake-with-chocolate-cream
Chocolate Strawberry Clafoutis ,https://eatsmarter.com/recipes/chocolate-strawberry-clafoutis
Rainbow Vegetable Pizza ,https://eatsmarter.com/recipes/rainbow-vegetable-pizza
Caramelized Plums with Montello Mousse ,https://eatsmarter.com/recipes/caramelized-plums-with-montello-mousse
Chickpea Ragout with Paneer ,https://eatsmarter.com/recipes/chickpea-ragout-with-paneer
Chocolate Pancakes with Cinnamon ,https://eatsmarter.com/recipes/chocolate-pancakes-with-cinnamon
Lentil Salad with Citrus and Nuts ,https://eatsmarter.com/recipes/lentil-salad-with-citrus-and-nuts
Muesli Bar with Nuts ,https://eatsmarter.com/recipes/muesli-bar-with-nuts
Herb French Fries ,https://eatsmarter.com/recipes/herb-french-fries
Purple Mashed Potatoes ,https://eatsmarter.com/recipes/purple-mashed-potatoes
Coconut Cream with Chocolate ,https://eatsmarter.com/recipes/coconut-cream-with-chocolate
Pea Mint Soup ,https://eatsmarter.com/recipes/pea-mint-soup
Sun Dried Tomato Basil Rolls ,https://eatsmarter.com/recipes/sun-dried-tomato-basil-rolls
Spicy Carrot Cream Soup with Smoked Almonds ,https://eatsmarter.com/recipes/spicy-carrot-cream-soup-with-smoked-almonds
Passion Fruit Lemon Dessert ,https://eatsmarter.com/recipes/passion-fruit-lemon-dessert
Thai Sweet Potato Soup ,https://eatsmarter.com/recipes/thai-sweet-potato-soup
Broccoli Rice Bowl ,https://eatsmarter.com/recipes/broccoli-rice-bowl
Chili Sweet Potato Puree with Cauliflower ,https://eatsmarter.com/recipes/chili-sweet-potato-puree-with-cauliflower
Meatless Chili Sweet Potato Fries ,https://eatsmarter.com/recipes/meatless-chili-sweet-potato-fries
Asparagus Quiche with Parmesan ,https://eatsmarter.com/recipes/asparagus-quiche-with-parmesan
Lentil Risotto with Asparagus and Egg ,https://eatsmarter.com/recipes/lentil-risotto-with-asparagus-and-egg
White Asparagus on Spinach with Potato Wedges ,https://eatsmarter.com/recipes/white-asparagus-on-spinach-with-potato-wedges
Spaghetti with Wild Asparagus and Lemon Sauce ,https://eatsmarter.com/recipes/spaghetti-with-wild-asparagus-and-lemon-sauce
Taboulé with Halloumi ,https://eatsmarter.com/recipes/taboule-with-halloumi
Asian Cauliflower Salad with Lentils ,https://eatsmarter.com/recipes/asian-cauliflower-salad-with-lentils
Individual Chard Quiche ,https://eatsmarter.com/recipes/individual-chard-quiche
Colorful Vegetable Chips ,https://eatsmarter.com/recipes/colorful-vegetable-chips
Halloumi Salad with Watermelon and Tomatoes ,https://eatsmarter.com/recipes/halloumi-salad-with-watermelon-and-tomatoes
Apricot Dumplings and Poppy Seed Cream ,https://eatsmarter.com/recipes/apricot-dumplings-and-poppy-seed-cream
Endive Salad with Black Currants ,https://eatsmarter.com/recipes/endive-salad-with-black-currants
Grilled Romaine Lettuce with Bread ,https://eatsmarter.com/recipes/grilled-romaine-lettuce-with-bread
Halloumi Skewers with Couscous Salad ,https://eatsmarter.com/recipes/halloumi-skewers-with-couscous-salad
Grilled Vegetables with Miso Dressing ,https://eatsmarter.com/recipes/grilled-vegetables-with-miso-dressing
Grilled Stuffed Sweet Potatoes ,https://eatsmarter.com/recipes/grilled-stuffed-sweet-potatoes
Broccoli Zucchini Soup ,https://eatsmarter.com/recipes/broccoli-zucchini-soup
