title,url
Cod  Fillet with Bacon and Lentil Salad ,https://eatsmarter.com/recipes/cod-fillet-with-bacon-and-lentil-salad
Mixed Salad with Mozzarella and Ham ,https://eatsmarter.com/recipes/mixed-salad-with-mozzarella-and-ham
Cucumber and Herb Salad ,https://eatsmarter.com/recipes/cucumber-and-herb-salad
Beet and Orange Salad with Walnuts ,https://eatsmarter.com/recipes/beet-and-orange-salad-with-walnuts
Beet Green Salad ,https://eatsmarter.com/recipes/beet-green-salad
Beet and Arugula Salad ,https://eatsmarter.com/recipes/beet-and-arugula-salad
Beef Salad with Avocado ,https://eatsmarter.com/recipes/beef-salad-with-avocado
"Spinach Salad with Gorgonzola, Broad Beans and Garlic ",https://eatsmarter.com/recipes/spinach-salad-with-gorgonzola-broad-beans-and-garlic
Salad with Chicken and Sunflower Seeds ,https://eatsmarter.com/recipes/salad-with-chicken-and-sunflower-seeds
Grilled Pork with Mixed Salad ,https://eatsmarter.com/recipes/grilled-pork-with-mixed-salad
"Mixed Salad with Eggs, Cucumber and Dried Tomatoes ",https://eatsmarter.com/recipes/mixed-salad-with-eggs-cucumber-and-dried-tomatoes
"Chicken with Sun-dried Tomatoes, Spinach and Couscous Salad ",https://eatsmarter.com/recipes/chicken-with-sun-dried-tomatoes-spinach-and-couscous-salad
Salad with Beef and Avocado ,https://eatsmarter.com/recipes/salad-with-beef-and-avocado
White Asparagus Salad with Shrimp ,https://eatsmarter.com/recipes/white-asparagus-salad-with-shrimp
Japanese-style Coleslaw ,https://eatsmarter.com/recipes/japanese-style-coleslaw
Smoked Tofu Salad with Anchovy Dressing ,https://eatsmarter.com/recipes/smoked-tofu-salad-with-anchovy-dressing
Caesar Salad with Croutons ,https://eatsmarter.com/recipes/caesar-salad-with-croutons
Grilled Cod with Cucumber and Avocado Salad ,https://eatsmarter.com/recipes/grilled-cod-with-cucumber-and-avocado-salad
Beef and Tomato Salad with Green Beans ,https://eatsmarter.com/recipes/beef-and-tomato-salad-with-green-beans
Cucumber Salsa ,https://eatsmarter.com/recipes/cucumber-salsa
Beans and Carrot Salad with Mozzarella ,https://eatsmarter.com/recipes/beans-and-carrot-salad-with-mozzarella
Monkfish with Mint and Tomato Salad ,https://eatsmarter.com/recipes/monkfish-with-mint-and-tomato-salad
Poached Beef Fillets with Fresh Cucumber Salsa ,https://eatsmarter.com/recipes/poached-beef-fillets-with-fresh-cucumber-salsa
Mango Salad with Mint ,https://eatsmarter.com/recipes/mango-salad-with-mint
Colorful Zucchini Salad ,https://eatsmarter.com/recipes/colorful-zucchini-salad
Couscous Salad ,https://eatsmarter.com/recipes/couscous-salad-1
Turkish Style Breakfast ,https://eatsmarter.com/recipes/turkish-style-breakfast
Bread Salad with Tomatoes and Arugula ,https://eatsmarter.com/recipes/bread-salad-with-tomatoes-and-arugula
"Beet, Radicchio and Smoked Mackerel Salad ",https://eatsmarter.com/recipes/beet-radicchio-and-smoked-mackerel-salad
"Cucumber Salad with Carrots, Watercress and Eggs ",https://eatsmarter.com/recipes/cucumber-salad-with-carrots-watercress-and-eggs
"Spinach and Oak Leaf Salad with Smoked Salmon, Radish and Green Peppercorns ",https://eatsmarter.com/recipes/spinach-and-oak-leaf-salad-with-smoked-salmon-radish-and-green-peppercorns
Spinach Salad with Raspberries ,https://eatsmarter.com/recipes/spinach-salad-with-raspberries
"Endive Salad with Spinach, Grilled Peppers, Gorgonzola and Pears ",https://eatsmarter.com/recipes/endive-salad-with-spinach-grilled-peppers-gorgonzola-and-pears
Chicken with Sesame Seed Crust and Arugula Salad ,https://eatsmarter.com/recipes/chicken-with-sesame-seed-crust-and-arugula-salad
Colorful Salad with Shrimp Skewers ,https://eatsmarter.com/recipes/colorful-salad-with-shrimp-skewers
Crepes with Salad and Cream Cheese ,https://eatsmarter.com/recipes/crepes-with-salad-and-cream-cheese
Mushroom and Tomato Salad with Scallions and Parsley ,https://eatsmarter.com/recipes/mushroom-and-tomato-salad-with-scallions-and-parsley
Roasted Tomatoes with Garlic and Basil ,https://eatsmarter.com/recipes/roasted-tomatoes-with-garlic-and-basil
Colorful Vegetable Salad ,https://eatsmarter.com/recipes/colorful-vegetable-salad-3
Caesar Salad ,https://eatsmarter.com/recipes/caesar-salad-6
"Salmon with Asparagus, Arugula and Tomatoes ",https://eatsmarter.com/recipes/salmon-with-asparagus-arugula-and-tomatoes
Spinach Salad ,https://eatsmarter.com/recipes/spinach-salad
"Mixed Leaf Salad with Oranges, Sprouts and Gorgonzola ",https://eatsmarter.com/recipes/mixed-leaf-salad-with-oranges-sprouts-and-gorgonzola
Panzanella ,https://eatsmarter.com/recipes/panzanella-6
Waldorf Salad with Celery ,https://eatsmarter.com/recipes/waldorf-salad-with-celery
Steak Bowls with Green Beans. Tomato and Arugula ,https://eatsmarter.com/recipes/steak-bowls-with-green-beans-tomato-and-arugula
"Medallions of Beef with Bean Salad, Tomatoes and Arugula ",https://eatsmarter.com/recipes/medallions-of-beef-with-bean-salad-tomatoes-and-arugula
"Spicy Zucchini Salad with Pine Nuts, Parmesan and Basil ",https://eatsmarter.com/recipes/spicy-zucchini-salad-with-pine-nuts-parmesan-and-basil
Salmon Carpaccio with Asparagus Salad and Arugula ,https://eatsmarter.com/recipes/salmon-carpaccio-with-asparagus-salad-and-arugula
Chicken and Chickpea Salad with Spinach ,https://eatsmarter.com/recipes/chicken-and-chickpea-salad-with-spinach
Garbanzo Bean Salad ,https://eatsmarter.com/recipes/garbanzo-bean-salad-0
Potato Salad with Green Beans ,https://eatsmarter.com/recipes/potato-salad-with-green-beans
Grilled Green Asparagus Salad ,https://eatsmarter.com/recipes/grilled-green-asparagus-salad
"Chicken Salad with Avocado, Green Asparagus and Walnuts ",https://eatsmarter.com/recipes/chicken-salad-with-avocado-green-asparagus-and-walnuts
Pork Chop with Avocado Salad ,https://eatsmarter.com/recipes/pork-chop-with-avocado-salad
Austrian-Style Pork with Radish Salad ,https://eatsmarter.com/recipes/austrian-style-pork-with-radish-salad
Lentil-Pumpkin Salad with Tomatoes and Spinach ,https://eatsmarter.com/recipes/lentil-pumpkin-salad-with-tomatoes-and-spinach
Thai-Style Cucumber Salad with Peanuts ,https://eatsmarter.com/recipes/thai-style-cucumber-salad-with-peanuts
Grilled Asparagus with Citrus Dressing ,https://eatsmarter.com/recipes/grilled-asparagus-with-citrus-dressing
Tuscan Bread Salad ,https://eatsmarter.com/recipes/tuscan-bread-salad-2
Arugula Salad with Avocado and Grapefruit ,https://eatsmarter.com/recipes/arugula-salad-with-avocado-and-grapefruit
Asparagus and Mango Salad ,https://eatsmarter.com/recipes/asparagus-and-mango-salad
Green Pesto Pasta Salad ,https://eatsmarter.com/recipes/green-pesto-pasta-salad
Mixed Bean Salad with Bacon ,https://eatsmarter.com/recipes/mixed-bean-salad-with-bacon
Vegetable and Feta Salad with Pumpkin Seed Pesto ,https://eatsmarter.com/recipes/vegetable-and-feta-salad-with-pumpkin-seed-pesto
"Green Salad with Cheese, Mushrooms and Ham ",https://eatsmarter.com/recipes/green-salad-with-cheese-mushrooms-and-ham
Celery Root Chips with Carrots ,https://eatsmarter.com/recipes/celery-root-chips-with-carrots
Bulgarian Style Vegetable Salad with Feta ,https://eatsmarter.com/recipes/bulgarian-style-vegetable-salad-with-feta
Red Cabbage with Mushrooms ,https://eatsmarter.com/recipes/red-cabbage-with-mushrooms
Colorful Avocado and Endive Salad with Sunflower Seeds ,https://eatsmarter.com/recipes/colorful-avocado-and-endive-salad-with-sunflower-seeds
Couscous Salad with Chicken and Arugula ,https://eatsmarter.com/recipes/couscous-salad-with-chicken-and-arugula
Monkfish Skewers with Mango Salad ,https://eatsmarter.com/recipes/monkfish-skewers-with-mango-salad
Green Salad with Tomatoes and Carrots ,https://eatsmarter.com/recipes/green-salad-with-tomatoes-and-carrots
Carrot Salad with Daisies ,https://eatsmarter.com/recipes/carrot-salad-with-daisies
Celery Salad with Apple and Red Onions ,https://eatsmarter.com/recipes/celery-salad-with-apple-and-red-onions
Salad with Parmesan and Croutons ,https://eatsmarter.com/recipes/salad-with-parmesan-and-croutons
Salade Niçoise ,https://eatsmarter.com/recipes/salade-nicoise-9
Strawberry and Asparagus Salad ,https://eatsmarter.com/recipes/strawberry-and-asparagus-salad
Mixed Salad with Shrimp ,https://eatsmarter.com/recipes/mixed-salad-with-shrimp-1
Endive and Ham Gratin ,https://eatsmarter.com/recipes/endive-and-ham-gratin
Avocado and Asparagus Salad with Lentil Vinaigrette ,https://eatsmarter.com/recipes/avocado-and-asparagus-salad-with-lentil-vinaigrette
Tortillas with Avocado and Tomato Salsa ,https://eatsmarter.com/recipes/tortillas-with-avocado-and-tomato-salsa
Radish Salad with Toasted Bread ,https://eatsmarter.com/recipes/radish-salad-with-toasted-bread
Pumpkin Seed Crusted Fish Sticks with Salad ,https://eatsmarter.com/recipes/pumpkin-seed-crusted-fish-sticks-with-salad
"Colorful Salad with Zucchini, Asparagus, Corn and Avocado ",https://eatsmarter.com/recipes/colorful-salad-with-zucchini-asparagus-corn-and-avocado
Glazed Tomato Salad with Sesame and Cinnamon ,https://eatsmarter.com/recipes/glazed-tomato-salad-with-sesame-and-cinnamon
"Cucumber, Kiwi and Avocado Salad ",https://eatsmarter.com/recipes/cucumber-kiwi-and-avocado-salad
"Chicken, Mango and Avocado Salad with Walnut Dressing ",https://eatsmarter.com/recipes/chicken-mango-and-avocado-salad-with-walnut-dressing
Tandoori-Style Chicken and Tomato Salad ,https://eatsmarter.com/recipes/tandoori-style-chicken-and-tomato-salad
Lentil Salad and Bruschetta ,https://eatsmarter.com/recipes/lentil-salad-and-bruschetta
Spinach Salad with Cilantro Vinaigrette ,https://eatsmarter.com/recipes/spinach-salad-with-cilantro-vinaigrette
Kohlrabi Salad with Apples and Goat Cheese ,https://eatsmarter.com/recipes/kohlrabi-salad-with-apples-and-goat-cheese
Green Lentil and Arugula Salad ,https://eatsmarter.com/recipes/green-lentil-and-arugula-salad
Bacon Dumplings with Coleslaw ,https://eatsmarter.com/recipes/bacon-dumplings-with-coleslaw
"White Bean, Potato and Tomato Salad ",https://eatsmarter.com/recipes/white-bean-potato-and-tomato-salad
Greek-style Beet Salad ,https://eatsmarter.com/recipes/greek-style-beet-salad
Sautéed Pollock in a Bread Case with Bean and Tomato Salad ,https://eatsmarter.com/recipes/sauteed-pollock-in-a-bread-case-with-bean-and-tomato-salad
Green Bean and Apple Salad ,https://eatsmarter.com/recipes/green-bean-and-apple-salad
Broad Beans Salad with Lemon and Flatbread ,https://eatsmarter.com/recipes/broad-beans-salad-with-lemon-and-flatbread
Strawberry-Arugula Salad with Pork ,https://eatsmarter.com/recipes/strawberry-arugula-salad-with-pork
Frozen Cucumber and Yogurt Salad ,https://eatsmarter.com/recipes/frozen-cucumber-and-yogurt-salad
Pasta and Avocado Salad with Walnuts ,https://eatsmarter.com/recipes/pasta-and-avocado-salad-with-walnuts
Summer Strawberry and Shrimp Salad ,https://eatsmarter.com/recipes/summer-strawberry-and-shrimp-salad
Brussels Sprouts Salad with Leeks and Pancetta ,https://eatsmarter.com/recipes/brussels-sprouts-salad-with-leeks-and-pancetta
Roast Pork with Cabbage Salad and Potatoes ,https://eatsmarter.com/recipes/roast-pork-with-cabbage-salad-and-potatoes
Arabic Style Fried Potato and Bulgur Balls ,https://eatsmarter.com/recipes/arabic-style-fried-potato-and-bulgur-balls
Salmon Rolls with Green Salad ,https://eatsmarter.com/recipes/salmon-rolls-with-green-salad
Swiss Chard and Green Bean Salad with Pecorino ,https://eatsmarter.com/recipes/swiss-chard-and-green-bean-salad-with-pecorino
Eggplant Salad with Tomatoes and Garlic ,https://eatsmarter.com/recipes/eggplant-salad-with-tomatoes-and-garlic
Asparagus Salad with Marinated Tofu ,https://eatsmarter.com/recipes/asparagus-salad-with-marinated-tofu
Valentine's Day Avocado Salad ,https://eatsmarter.com/recipes/valentines-day-avocado-salad
Greek Salad with Meatballs ,https://eatsmarter.com/recipes/greek-salad-with-meatballs
Green Salad with Roast Beef and Parmesan Chips ,https://eatsmarter.com/recipes/green-salad-with-roast-beef-and-parmesan-chips
Salad Greens with Flowers ,https://eatsmarter.com/recipes/salad-greens-with-flowers
Layered Asparagus Gelatin Salad ,https://eatsmarter.com/recipes/layered-asparagus-gelatin-salad
Asparagus Salad with Strawberries and Cress ,https://eatsmarter.com/recipes/asparagus-salad-with-strawberries-and-cress
Beef Skewers and Couscous Salad with Lentils ,https://eatsmarter.com/recipes/beef-skewers-and-couscous-salad-with-lentils
Salmon Tartare with Sprouts and Baby Spinach ,https://eatsmarter.com/recipes/salmon-tartare-with-sprouts-and-baby-spinach
Endive and Potato Gratin with Ham ,https://eatsmarter.com/recipes/endive-and-potato-gratin-with-ham
Mini Quiches with Endives and Sun-dried Tomatoes ,https://eatsmarter.com/recipes/mini-quiches-with-endives-and-sun-dried-tomatoes
Braised Romaine Lettuce with Tomatoes and Parmesan ,https://eatsmarter.com/recipes/braised-romaine-lettuce-with-tomatoes-and-parmesan
Mixed Salad with Pomegranate Dressing ,https://eatsmarter.com/recipes/mixed-salad-with-pomegranate-dressing
"Watercress Salad with Broad Beans, Tomatoes and Parmesan ",https://eatsmarter.com/recipes/watercress-salad-with-broad-beans-tomatoes-and-parmesan
Salmon with Avocado and Corn Salsa ,https://eatsmarter.com/recipes/salmon-with-avocado-and-corn-salsa
Broad Beans Salad with Eggs ,https://eatsmarter.com/recipes/broad-beans-salad-with-eggs
"Green Tagliatelle with Beans, Pesto and Parmesan ",https://eatsmarter.com/recipes/green-tagliatelle-with-beans-pesto-and-parmesan
Chicken Caesar Salad ,https://eatsmarter.com/recipes/chicken-caesar-salad-1
Grilled Ribs with Cornbread and Coleslaw ,https://eatsmarter.com/recipes/grilled-ribs-with-cornbread-and-coleslaw
Spinach Salad with Pea Pods and Carrots ,https://eatsmarter.com/recipes/spinach-salad-with-pea-pods-and-carrots
Chickpea and Peanut Salad ,https://eatsmarter.com/recipes/chickpea-and-peanut-salad
Cabbage and Bacon Salad ,https://eatsmarter.com/recipes/cabbage-and-bacon-salad-0
Carrot and Peach Salad with Pine Nuts ,https://eatsmarter.com/recipes/carrot-and-peach-salad-with-pine-nuts
Beans with Rosemary and Tomatoes ,https://eatsmarter.com/recipes/beans-with-rosemary-and-tomatoes
Christmas Mango-Pineapple Dessert Salad ,https://eatsmarter.com/recipes/christmas-mango-pineapple-dessert-salad
Bean Salad with Tomatoes and Olives ,https://eatsmarter.com/recipes/bean-salad-with-tomatoes-and-olives
Cheese Flan with Tomato and Arugula Salad ,https://eatsmarter.com/recipes/cheese-flan-with-tomato-and-arugula-salad
"Asparagus, Arugula and Strawberry Salad with Duck Breast ",https://eatsmarter.com/recipes/asparagus-arugula-and-strawberry-salad-with-duck-breast
Chicken and Pork Satay ,https://eatsmarter.com/recipes/chicken-and-pork-satay
Bean and Zucchini Salad with Onions and Spinach ,https://eatsmarter.com/recipes/bean-and-zucchini-salad-with-onions-and-spinach
Emmentaler Salad with Tomato and Mustard Sauce ,https://eatsmarter.com/recipes/emmentaler-salad-with-tomato-and-mustard-sauce
Spinach Salad with Tomatoes and Gorgonzola ,https://eatsmarter.com/recipes/spinach-salad-with-tomatoes-and-gorgonzola
Fruit Salad with Star Anise ,https://eatsmarter.com/recipes/fruit-salad-with-star-anise-0
Sorrel Salad with Broad Beans and Bacon ,https://eatsmarter.com/recipes/sorrel-salad-with-broad-beans-and-bacon
Pear and Ham Salad ,https://eatsmarter.com/recipes/pear-and-ham-salad
Waldorf Salad with Mango Chutney ,https://eatsmarter.com/recipes/waldorf-salad-with-mango-chutney
Beef Steaks with Bean Salad ,https://eatsmarter.com/recipes/beef-steaks-with-bean-salad
Pita Pockets with Fava Bean Salad ,https://eatsmarter.com/recipes/pita-pockets-with-fava-bean-salad
Wiener Schnitzel with Parsley Potatoes and Cucumber Salad ,https://eatsmarter.com/recipes/wiener-schnitzel-with-parsley-potatoes-and-cucumber-salad
Lamb and Arugula Salad ,https://eatsmarter.com/recipes/lamb-and-arugula-salad
Mediterranean Style Bean Salad with Feta Cheese ,https://eatsmarter.com/recipes/mediterranean-style-bean-salad-with-feta-cheese
Fish Cakes with Avocado Salad ,https://eatsmarter.com/recipes/fish-cakes-with-avocado-salad
Mixed Leaf Salad with Walnuts and Chicken ,https://eatsmarter.com/recipes/mixed-leaf-salad-with-walnuts-and-chicken
Strawberry and Bean Salad with Honey ,https://eatsmarter.com/recipes/strawberry-and-bean-salad-with-honey
Turkey Roll Salad ,https://eatsmarter.com/recipes/turkey-roll-salad-0
Asparagus Tomato Carpaccio with Sesame Vinaigrette ,https://eatsmarter.com/recipes/asparagus-tomato-carpaccio-with-sesame-vinaigrette
Ham and Asparagus on Lettuce ,https://eatsmarter.com/recipes/ham-and-asparagus-on-lettuce
Carrot-yogurt Salad ,https://eatsmarter.com/recipes/carrot-yogurt-salad
Salade Niçoise with Tuna ,https://eatsmarter.com/recipes/salade-nicoise-with-tuna-0
Green Salad with Salmon and Avocado ,https://eatsmarter.com/recipes/green-salad-with-salmon-and-avocado
"Beef Roulades with Bell Peppers, Scallions and Bean Salad ",https://eatsmarter.com/recipes/beef-roulades-with-bell-peppers-scallions-and-bean-salad
Pasta-Vegetable Salad with Pomegranate Seeds ,https://eatsmarter.com/recipes/pasta-vegetable-salad-with-pomegranate-seeds
Spinach Salad with Orzo Pasta ,https://eatsmarter.com/recipes/spinach-salad-with-orzo-pasta
Crunchy Salad with Peppers and Jicama ,https://eatsmarter.com/recipes/crunchy-salad-with-peppers-and-jicama
Beet and Orange Salad ,https://eatsmarter.com/recipes/beet-and-orange-salad-0
Chickpeas Salad with Beans ,https://eatsmarter.com/recipes/chickpeas-salad-with-beans
Grilled Fish with Chickpea Salad ,https://eatsmarter.com/recipes/grilled-fish-with-chickpea-salad
Tofu and Beet Salad ,https://eatsmarter.com/recipes/tofu-and-beet-salad
Vegetable Salad with Fried Tofu and Parmesan ,https://eatsmarter.com/recipes/vegetable-salad-with-fried-tofu-and-parmesan
"Dandelion Salad with Eggs, Avocados and Smoked Fish ",https://eatsmarter.com/recipes/dandelion-salad-with-eggs-avocados-and-smoked-fish
Mediterranean Beets ,https://eatsmarter.com/recipes/mediterranean-beets
Beetroot Salad with Feta Cheese ,https://eatsmarter.com/recipes/beetroot-salad-with-feta-cheese
"Bream with Peas, Red Lentils and Yogurt Dip ",https://eatsmarter.com/recipes/bream-with-peas-red-lentils-and-yogurt-dip
Carrots with Almonds and Mint ,https://eatsmarter.com/recipes/carrots-with-almonds-and-mint
Beet Salad with Horseradish Mousse ,https://eatsmarter.com/recipes/beet-salad-with-horseradish-mousse
"Watercress Salad with Cucumber, Strawberries and Honey Mustard Vinaigrette ",https://eatsmarter.com/recipes/watercress-salad-with-cucumber-strawberries-and-honey-mustard-vinaigrette
Zucchini and Carrot Salad with Apples and Sunflower Seeds ,https://eatsmarter.com/recipes/zucchini-and-carrot-salad-with-apples-and-sunflower-seeds
Lebanese Style Bulgur Salad ,https://eatsmarter.com/recipes/lebanese-style-bulgur-salad
Caesar Salad with Parmesan Crisps ,https://eatsmarter.com/recipes/caesar-salad-with-parmesan-crisps
"Nicoise Salad with Tuna, Anchovies and Green Beans ",https://eatsmarter.com/recipes/nicoise-salad-with-tuna-anchovies-and-green-beans
Mixed Salad with Shrimp and Bacon ,https://eatsmarter.com/recipes/mixed-salad-with-shrimp-and-bacon
Tuna Sashimi with Mango Salad ,https://eatsmarter.com/recipes/tuna-sashimi-with-mango-salad
Cabbage Salad with Coriander Chicken Breasts ,https://eatsmarter.com/recipes/cabbage-salad-with-coriander-chicken-breasts
Salmon Fillets with Mustard Crust and Tomato Salad ,https://eatsmarter.com/recipes/salmon-fillets-with-mustard-crust-and-tomato-salad
White Bean Salad with Olives and Onions ,https://eatsmarter.com/recipes/white-bean-salad-with-olives-and-onions
"Salad with Herbs, Oyster Mushrooms and Pumpkin Seeds ",https://eatsmarter.com/recipes/salad-with-herbs-oyster-mushrooms-and-pumpkin-seeds
Spinach Salad with Red and Yellow Beets ,https://eatsmarter.com/recipes/spinach-salad-with-red-and-yellow-beets
"Romaine Lettuce with Chicken, Pear and Blue Cheese ",https://eatsmarter.com/recipes/romaine-lettuce-with-chicken-pear-and-blue-cheese
Spring Salad with Egg and Asparagus ,https://eatsmarter.com/recipes/spring-salad-with-egg-and-asparagus
"Layered Tomato, Avocado and Crabmeat Salads ",https://eatsmarter.com/recipes/layered-tomato-avocado-and-crabmeat-salads
Lettuce Rolls Filled with Rice Noodles and Turkey ,https://eatsmarter.com/recipes/lettuce-rolls-filled-with-rice-noodles-and-turkey
Potato and Cabbage Salad with Apples and Smoked Pork ,https://eatsmarter.com/recipes/potato-and-cabbage-salad-with-apples-and-smoked-pork
Salad with Roasted Vegetables ,https://eatsmarter.com/recipes/salad-with-roasted-vegetables
Hearty Grapefruit and Arugula Salad with Walnuts ,https://eatsmarter.com/recipes/hearty-grapefruit-and-arugula-salad-with-walnuts
Beet and Rhubarb Salad with Prosciutto ,https://eatsmarter.com/recipes/beet-and-rhubarb-salad-with-prosciutto
Endive and Chicken Salad with Prawns and Tomatoes ,https://eatsmarter.com/recipes/endive-and-chicken-salad-with-prawns-and-tomatoes
Green Bean Salad with Sesame and Cilantro ,https://eatsmarter.com/recipes/green-bean-salad-with-sesame-and-cilantro
Salad with Asparagus and Goat Cheese ,https://eatsmarter.com/recipes/salad-with-asparagus-and-goat-cheese
Autumnal Cheese and Grape Salad with Pear ,https://eatsmarter.com/recipes/autumnal-cheese-and-grape-salad-with-pear
Caesar Salad ,https://eatsmarter.com/recipes/caesar-salad-7
Mixed Salad with Berries and Chicken Breast ,https://eatsmarter.com/recipes/mixed-salad-with-berries-and-chicken-breast
Chicken Salad with Bean Sprouts and Strawberries ,https://eatsmarter.com/recipes/chicken-salad-with-bean-sprouts-and-strawberries
Wild Herb Salad with Eggs and Shrimp ,https://eatsmarter.com/recipes/wild-herb-salad-with-eggs-and-shrimp
Chicken and Grape Salad ,https://eatsmarter.com/recipes/chicken-and-grape-salad
Lettuce Wraps with Glass Noodles and Shrimp ,https://eatsmarter.com/recipes/lettuce-wraps-with-glass-noodles-and-shrimp
Rack of Lamb with Bean Salad ,https://eatsmarter.com/recipes/rack-of-lamb-with-bean-salad
Fruity Green Salad ,https://eatsmarter.com/recipes/fruity-green-salad-0
Cucumber Salad with Anchovies ,https://eatsmarter.com/recipes/cucumber-salad-with-anchovies
Asparagus Salad with Strawberries and Ham ,https://eatsmarter.com/recipes/asparagus-salad-with-strawberries-and-ham
Summery Vegetable Salad ,https://eatsmarter.com/recipes/summery-vegetable-salad
Tuna Salad with White Beans ,https://eatsmarter.com/recipes/tuna-salad-with-white-beans
Couscous Salad with Pumpkin and Lamb ,https://eatsmarter.com/recipes/couscous-salad-with-pumpkin-and-lamb
Spinach and Chickpea Salad with Ham-Wrapped Scallops ,https://eatsmarter.com/recipes/spinach-and-chickpea-salad-with-ham-wrapped-scallops
Easter Salad with Savory Crackers ,https://eatsmarter.com/recipes/easter-salad-with-savory-crackers
Fried Cod Fillets with Warm Cabbage and Mint Salad ,https://eatsmarter.com/recipes/fried-cod-fillets-with-warm-cabbage-and-mint-salad
Kohlrabi Cheese Schnitzels with Sesame Coating ,https://eatsmarter.com/recipes/kohlrabi-cheese-schnitzels-with-sesame-coating
Strawberry and Mango Salad with Dried Ham ,https://eatsmarter.com/recipes/strawberry-and-mango-salad-with-dried-ham
Apple and Goat Cheese Salad with Breadsticks and Olive Tapenade ,https://eatsmarter.com/recipes/apple-and-goat-cheese-salad-with-breadsticks-and-olive-tapenade
Rosemary Lamb with Chickpea Salad ,https://eatsmarter.com/recipes/rosemary-lamb-with-chickpea-salad
"Spinach Salad with Avocado, Corn and Peppers ",https://eatsmarter.com/recipes/spinach-salad-with-avocado-corn-and-peppers
"Salad with Duck Breasts, Grapefruit and Lychee ",https://eatsmarter.com/recipes/salad-with-duck-breasts-grapefruit-and-lychee
Lettuce Rolls Stuffed with Tofu ,https://eatsmarter.com/recipes/lettuce-rolls-stuffed-with-tofu
"White Fish Fillets with Arugula, Carrot and Fried Garlic ",https://eatsmarter.com/recipes/white-fish-fillets-with-arugula-carrot-and-fried-garlic
Fried Trout with Beet Salad ,https://eatsmarter.com/recipes/fried-trout-with-beet-salad
Asparagus and Ham Salad with Eggs and Mustard Vinaigrette ,https://eatsmarter.com/recipes/asparagus-and-ham-salad-with-eggs-and-mustard-vinaigrette
Potato Waffles with Creamy Cabbage Slaw ,https://eatsmarter.com/recipes/potato-waffles-with-creamy-cabbage-slaw
Fruit Salad ,https://eatsmarter.com/recipes/fruit-salad-20
Foie Gras with Brussels Sprouts ,https://eatsmarter.com/recipes/foie-gras-with-brussels-sprouts
Spicy Cucumber Sauce ,https://eatsmarter.com/recipes/spicy-cucumber-sauce-0
Tomato Salad ,https://eatsmarter.com/recipes/tomato-salad-5
Niçoise Salad ,https://eatsmarter.com/recipes/nicoise-salad-6
Panzanella ,https://eatsmarter.com/recipes/panzanella-7
Brussels Sprouts Salad with Hot Dogs ,https://eatsmarter.com/recipes/brussels-sprouts-salad-with-hot-dogs
Raw Vegetable Salad with Peanuts ,https://eatsmarter.com/recipes/raw-vegetable-salad-with-peanuts
Asparagus Tomato Salad ,https://eatsmarter.com/recipes/asparagus-tomato-salad
Mixed Green Salad with Apple and Ham ,https://eatsmarter.com/recipes/mixed-green-salad-with-apple-and-ham
Artichoke-Spinach Salad ,https://eatsmarter.com/recipes/artichoke-spinach-salad
Greek Salad ,https://eatsmarter.com/recipes/greek-salad-17
Mixed Green Salad with Tofu and Tomatoes ,https://eatsmarter.com/recipes/mixed-green-salad-with-tofu-and-tomatoes
Salade Niçoise ,https://eatsmarter.com/recipes/salade-nicoise-10
Bread Salad ,https://eatsmarter.com/recipes/bread-salad-3
Cabbage Salad with Sprouts and Raisins ,https://eatsmarter.com/recipes/cabbage-salad-with-sprouts-and-raisins
Green Bean and Pea Salad ,https://eatsmarter.com/recipes/green-bean-and-pea-salad
Turkey and Citrus Salad ,https://eatsmarter.com/recipes/turkey-and-citrus-salad
Colorful Summer Salad ,https://eatsmarter.com/recipes/colorful-summer-salad
Mixed Salad with Goat Cheese ,https://eatsmarter.com/recipes/mixed-salad-with-goat-cheese
Grilled Lamb with Spinach Salad ,https://eatsmarter.com/recipes/grilled-lamb-with-spinach-salad
