title,url
Celery Pear Risotto ,https://eatsmarter.com/recipes/celery-pear-risotto
Rice with Roasted Butternut Squash ,https://eatsmarter.com/recipes/rice-with-roasted-butternut-squash
Rice and Chard Casserole ,https://eatsmarter.com/recipes/rice-and-chard-casserole
Saffron Risotto with Scallops ,https://eatsmarter.com/recipes/saffron-risotto-with-scallops
Vegan Beet Risotto ,https://eatsmarter.com/recipes/vegan-beet-risotto
Brown Rice ,https://eatsmarter.com/recipes/brown-rice
Salmon Sushi ,https://eatsmarter.com/recipes/salmon-sushi
Sesame Sushi Rice ,https://eatsmarter.com/recipes/sesame-sushi-rice
Healthy Vegetarian Quinoa Bowl ,https://eatsmarter.com/recipes/healthy-vegetarian-quinoa-bowl
Carrot and Wild Rice Salad ,https://eatsmarter.com/recipes/carrot-and-wild-rice-salad
Thai Chicken Stew ,https://eatsmarter.com/recipes/thai-chicken-stew
Mushroom Risotto ,https://eatsmarter.com/recipes/mushroom-risotto
Fish and Rice Soup ,https://eatsmarter.com/recipes/fish-and-rice-soup
Rice Noodles with Chile Peppers ,https://eatsmarter.com/recipes/rice-noodles-with-chile-peppers
Kedgeree ,https://eatsmarter.com/recipes/kedgeree
Zucchini Stuffed with Rice ,https://eatsmarter.com/recipes/zucchini-stuffed-with-rice
Rice Salad with Dried Apricots ,https://eatsmarter.com/recipes/rice-salad-with-dried-apricots
Baked Pumpkin with Vegetable Wild Rice Stuffing ,https://eatsmarter.com/recipes/baked-pumpkin-with-vegetable-wild-rice-stuffing
Pumpkin Risotto with Ricotta ,https://eatsmarter.com/recipes/pumpkin-risotto-with-ricotta
Risotto with Mushrooms and Bacon ,https://eatsmarter.com/recipes/risotto-with-mushrooms-and-bacon
Stuffed Grape Leaves with Dipping Sauce ,https://eatsmarter.com/recipes/stuffed-grape-leaves-with-dipping-sauce
Thai Stir Fry Vegetables ,https://eatsmarter.com/recipes/thai-stir-fry-vegetables
Asian Rice Salad ,https://eatsmarter.com/recipes/asian-rice-salad
"Mango Salad with Rice, Peas and Tofu ",https://eatsmarter.com/recipes/mango-salad-with-rice-peas-and-tofu
Risotto with Salmon and Asparagus ,https://eatsmarter.com/recipes/risotto-with-salmon-and-asparagus
Risotto in a Pumpkin ,https://eatsmarter.com/recipes/risotto-in-a-pumpkin
"Risotto with Porcini Mushrooms, Pine Nuts and Arugula ",https://eatsmarter.com/recipes/risotto-with-porcini-mushrooms-pine-nuts-and-arugula
"Creole Chicken Stew with Corn, Beans and Bananas ",https://eatsmarter.com/recipes/creole-chicken-stew-with-corn-beans-and-bananas
Vegetable Rice Salad with Seaweed ,https://eatsmarter.com/recipes/vegetable-rice-salad-with-seaweed
Tandoori Chicken with Rice ,https://eatsmarter.com/recipes/tandoori-chicken-with-rice
Spanish Rice with Chicken (paella) ,https://eatsmarter.com/recipes/spanish-rice-with-chicken-paella
Sliced Turkey Bowl with Apples and Rice Noodles ,https://eatsmarter.com/recipes/sliced-turkey-bowl-with-apples-and-rice-noodles
Broccolini Risotto with Parmesan Cheese ,https://eatsmarter.com/recipes/broccolini-risotto-with-parmesan-cheese
Coconut Milk Rice Balls with Berry Sauce ,https://eatsmarter.com/recipes/coconut-milk-rice-balls-with-berry-sauce
Turkey with Coconut Glaze ,https://eatsmarter.com/recipes/turkey-with-coconut-glaze
Rose Milk Hazelnut Rice ,https://eatsmarter.com/recipes/rose-milk-hazelnut-rice
Rice Stuffed Eggplant Marinara ,https://eatsmarter.com/recipes/rice-stuffed-eggplant-marinara
Peppers Stuffed with Rice and Beans ,https://eatsmarter.com/recipes/peppers-stuffed-with-rice-and-beans
Shrimp Skewers with Black Rice ,https://eatsmarter.com/recipes/shrimp-skewers-with-black-rice
Chard Leaves Stuffed with Chicken and Rice ,https://eatsmarter.com/recipes/chard-leaves-stuffed-with-chicken-and-rice
Rice and Crispy Salmon with Turmeric Dressing ,https://eatsmarter.com/recipes/rice-and-crispy-salmon-with-turmeric-dressing
Persian Chicken Skewers ,https://eatsmarter.com/recipes/persian-chicken-skewers
Chickpea Ragout with Paneer ,https://eatsmarter.com/recipes/chickpea-ragout-with-paneer
Sushi Bowl with Tuna and Radish ,https://eatsmarter.com/recipes/sushi-bowl-with-tuna-and-radish
Roasted Eggplant with Fava Beans ,https://eatsmarter.com/recipes/roasted-eggplant-with-fava-beans
Kimchi Fried Rice ,https://eatsmarter.com/recipes/kimchi-fried-rice
"Risotto with Pumpkin, Beet and Goat Cheese ",https://eatsmarter.com/recipes/risotto-with-pumpkin-beet-and-goat-cheese
Risotto Without Parmesan ,https://eatsmarter.com/recipes/risotto-without-parmesan
Almond Milk Rice Pudding ,https://eatsmarter.com/recipes/almond-milk-rice-pudding
Vegetable Biryani ,https://eatsmarter.com/recipes/vegetable-biryani
Vegan Fried Rice ,https://eatsmarter.com/recipes/vegan-fried-rice
Halloumi Beet and Rice Salad ,https://eatsmarter.com/recipes/halloumi-beet-and-rice-salad
Poached Salmon with Rice and Papaya ,https://eatsmarter.com/recipes/poached-salmon-with-rice-and-papaya
Red Rice Salad with Shrimp ,https://eatsmarter.com/recipes/red-rice-salad-with-shrimp
Wild Rice Salad with Asparagus ,https://eatsmarter.com/recipes/wild-rice-salad-with-asparagus
Indian Lentils and Rice with Fried Onions ,https://eatsmarter.com/recipes/indian-lentils-and-rice-with-fried-onions
Green Peppers Stuffed with Pineapple Rice ,https://eatsmarter.com/recipes/green-peppers-stuffed-with-pineapple-rice
Basmati Rice with Crab Meat ,https://eatsmarter.com/recipes/basmati-rice-with-crab-meat
Pineapple and Banana Paella ,https://eatsmarter.com/recipes/pineapple-and-banana-paella
New Orleans Seafood Stew ,https://eatsmarter.com/recipes/new-orleans-seafood-stew
Spanish Paella ,https://eatsmarter.com/recipes/spanish-paella
Risotto Filled Pumpkins ,https://eatsmarter.com/recipes/risotto-filled-pumpkins
Creamy Rice with Figs ,https://eatsmarter.com/recipes/creamy-rice-with-figs
Sauteed Vegetable and Tofu Bowl ,https://eatsmarter.com/recipes/sauteed-vegetable-and-tofu-bowl
Rich Woodland Mushroom Rice ,https://eatsmarter.com/recipes/rich-woodland-mushroom-rice
Vietnamese Spring Rolls ,https://eatsmarter.com/recipes/vietnamese-spring-rolls
Radicchio Risotto ,https://eatsmarter.com/recipes/radicchio-risotto-2
Halibut Fillets with Gourmet Risotto ,https://eatsmarter.com/recipes/halibut-fillets-with-gourmet-risotto
Asian Rice Bowl with Pork ,https://eatsmarter.com/recipes/asian-rice-bowl-with-pork
Tex-Mex Style Rice and Bean Salad ,https://eatsmarter.com/recipes/tex-mex-style-rice-and-bean-salad
Creamy Rice with Blue Cheese ,https://eatsmarter.com/recipes/creamy-rice-with-blue-cheese
Roasted Tomato and Saffron Risotto ,https://eatsmarter.com/recipes/roasted-tomato-and-saffron-risotto
Creamy Pumpkin Sage Risotto ,https://eatsmarter.com/recipes/creamy-pumpkin-sage-risotto
Wild Rice with Peaches and Mint ,https://eatsmarter.com/recipes/wild-rice-with-peaches-and-mint
Spicy Beef with Thai Basil on Rice ,https://eatsmarter.com/recipes/spicy-beef-with-thai-basil-on-rice
Risotto with Mussels ,https://eatsmarter.com/recipes/risotto-with-mussels-1
Healthy Vegetable Rice Paper Wraps ,https://eatsmarter.com/recipes/healthy-vegetable-rice-paper-wraps
Tuna Sushi Handroll ,https://eatsmarter.com/recipes/tuna-sushi-handroll
Asian Rice Pilaf with Lamb ,https://eatsmarter.com/recipes/asian-rice-pilaf-with-lamb
Rice Salad with Chicken and Avocado ,https://eatsmarter.com/recipes/rice-salad-with-chicken-and-avocado
Pumpkin Risotto with Parmesan ,https://eatsmarter.com/recipes/pumpkin-risotto-with-parmesan
Nigiri Sushi with Omelet (Tamagosushi) ,https://eatsmarter.com/recipes/nigiri-sushi-with-omelet-tamagosushi
Indonesian Rice (Nasi Goreng) ,https://eatsmarter.com/recipes/indonesian-rice-nasi-goreng
Pumpkin Wild Rice ,https://eatsmarter.com/recipes/pumpkin-wild-rice
Risotto with Porcini Mushrooms ,https://eatsmarter.com/recipes/risotto-with-porcini-mushrooms
Nigiri with Mackerel ,https://eatsmarter.com/recipes/nigiri-with-mackerel
Coconut Chicken Curry with Rice ,https://eatsmarter.com/recipes/coconut-chicken-curry-with-rice
Risotto with Mushrooms and Arugula ,https://eatsmarter.com/recipes/risotto-with-mushrooms-and-arugula
Pumpin and Corn Risotto ,https://eatsmarter.com/recipes/pumpin-and-corn-risotto
Rice with Vegetables and Smoked Salmon ,https://eatsmarter.com/recipes/rice-with-vegetables-and-smoked-salmon
Coconut Rice Pudding with Berry Sauce ,https://eatsmarter.com/recipes/coconut-rice-pudding-with-berry-sauce
Chicken with Saffron Rice ,https://eatsmarter.com/recipes/chicken-with-saffron-rice
Rice with Chicken and Coconut Pepper Sauce ,https://eatsmarter.com/recipes/rice-with-chicken-and-coconut-pepper-sauce
Chicken and Rice Stew with Zucchini ,https://eatsmarter.com/recipes/chicken-and-rice-stew-with-zucchini
Wild Rice and Eggplant Balls ,https://eatsmarter.com/recipes/wild-rice-and-eggplant-balls
Lentils and Rice Indian-Style ,https://eatsmarter.com/recipes/lentils-and-rice-indian-style
Roasted Vegetables with Chicken and Rice Noodles ,https://eatsmarter.com/recipes/roasted-vegetables-with-chicken-and-rice-noodles
Nasi Goreng - Asian Fried Rice with Pork and Fried Egg ,https://eatsmarter.com/recipes/nasi-goreng-asian-fried-rice-with-pork-and-fried-egg
Rice Pudding with Tropical Fruit ,https://eatsmarter.com/recipes/rice-pudding-with-tropical-fruit
Cod Stew with Rice ,https://eatsmarter.com/recipes/cod-stew-with-rice
Rice and Vegetable Sauté with Ground Meat ,https://eatsmarter.com/recipes/rice-and-vegetable-saute-with-ground-meat
Zucchini Risotto ,https://eatsmarter.com/recipes/zucchini-risotto
Rice Stew with Turkey and Vegetables ,https://eatsmarter.com/recipes/rice-stew-with-turkey-and-vegetables
Nasi Goreng Indonesian Style ,https://eatsmarter.com/recipes/nasi-goreng-indonesian-style
Peppers Stuffed with Rice ,https://eatsmarter.com/recipes/peppers-stuffed-with-rice-0
Risotto with Chard ,https://eatsmarter.com/recipes/risotto-with-chard
How to Make Maki Sushi ,https://eatsmarter.com/recipes/how-to-make-maki-sushi
Stuffed Zucchini ,https://eatsmarter.com/recipes/stuffed-zucchini-3
Coconut Rice with Melon ,https://eatsmarter.com/recipes/coconut-rice-with-melon
"Rice with Fish, Spinach and Egg ",https://eatsmarter.com/recipes/rice-with-fish-spinach-and-egg
Authentic Spanish Seafood Paella ,https://eatsmarter.com/recipes/authentic-spanish-seafood-paella
Rice Noodles with Shrimp ,https://eatsmarter.com/recipes/rice-noodles-with-shrimp
Chicken Satay ,https://eatsmarter.com/recipes/chicken-satay-3
Risotto with Vegetables ,https://eatsmarter.com/recipes/risotto-with-vegetables
Oakleaf Salad with Peppers and Corn ,https://eatsmarter.com/recipes/oakleaf-salad-with-peppers-and-corn
Creamy Vegetable Soup with Meatballs ,https://eatsmarter.com/recipes/creamy-vegetable-soup-with-meatballs
Fried Persimmon Slices on Thai Rice ,https://eatsmarter.com/recipes/fried-persimmon-slices-on-thai-rice
Curry Rice with Oyster Mushrooms and Melted Camembert ,https://eatsmarter.com/recipes/curry-rice-with-oyster-mushrooms-and-melted-camembert
Pear Rice Pudding with Almonds ,https://eatsmarter.com/recipes/pear-rice-pudding-with-almonds
Paella with Chorizo ,https://eatsmarter.com/recipes/paella-with-chorizo
Almond Rice Pudding ,https://eatsmarter.com/recipes/almond-rice-pudding
Easy Paella ,https://eatsmarter.com/recipes/easy-paella
Lemony Risotto with Porcini and Button Mushrooms ,https://eatsmarter.com/recipes/lemony-risotto-with-porcini-and-button-mushrooms
Risotto in Glass ,https://eatsmarter.com/recipes/risotto-in-glass
Easy Seafood Paella ,https://eatsmarter.com/recipes/easy-seafood-paella
Rice Stuffed Grape Leaves with Raisins and Cinnamon ,https://eatsmarter.com/recipes/rice-stuffed-grape-leaves-with-raisins-and-cinnamon
"Rice Pudding with Coconut Milk, Lime and Mango ",https://eatsmarter.com/recipes/rice-pudding-with-coconut-milk-lime-and-mango
Fried Rice with Egg ,https://eatsmarter.com/recipes/fried-rice-with-egg
Spicy Tuna Maki ,https://eatsmarter.com/recipes/spicy-tuna-maki
Rice Balls Stuffed with Mozzarella (Arancini) ,https://eatsmarter.com/recipes/rice-balls-stuffed-with-mozzarella-arancini
Stuffed Zucchini Flowers ,https://eatsmarter.com/recipes/stuffed-zucchini-flowers-0
Salmon with Vegetable Pilaf ,https://eatsmarter.com/recipes/salmon-with-vegetable-pilaf
"Risotto with Pumpkin, Mushrooms and Scallops ",https://eatsmarter.com/recipes/risotto-with-pumpkin-mushrooms-and-scallops
Vietnamese Summer Rolls with Sesame Dip ,https://eatsmarter.com/recipes/vietnamese-summer-rolls-with-sesame-dip
Seafood Paella ,https://eatsmarter.com/recipes/seafood-paella-7
Rice and Pea Salad with Mangoes and Ham ,https://eatsmarter.com/recipes/rice-and-pea-salad-with-mangoes-and-ham
Vegetable and Rice Salad with Salmon ,https://eatsmarter.com/recipes/vegetable-and-rice-salad-with-salmon
Rice Salad with Corn ,https://eatsmarter.com/recipes/rice-salad-with-corn
Cockles with Saffron Rice ,https://eatsmarter.com/recipes/cockles-with-saffron-rice
Risotto with Parmesan and Black Truffles ,https://eatsmarter.com/recipes/risotto-with-parmesan-and-black-truffles
Stir-Fried Shrimp with Rice and Vegetables ,https://eatsmarter.com/recipes/stir-fried-shrimp-with-rice-and-vegetables
Cilantro Fried Rice ,https://eatsmarter.com/recipes/cilantro-fried-rice
Rice Pudding and Plum Cake with Almonds ,https://eatsmarter.com/recipes/rice-pudding-and-plum-cake-with-almonds
Risotto with Celery ,https://eatsmarter.com/recipes/risotto-with-celery
Rice Pudding with Rose Water and Cinnamon ,https://eatsmarter.com/recipes/rice-pudding-with-rose-water-and-cinnamon
Rice Noodles with Vegetables and Tofu ,https://eatsmarter.com/recipes/rice-noodles-with-vegetables-and-tofu
Mixed Berries Rice Pudding ,https://eatsmarter.com/recipes/mixed-berries-rice-pudding
Thai Style Vegetable Rice ,https://eatsmarter.com/recipes/thai-style-vegetable-rice
Soup with Rice and Meatballs ,https://eatsmarter.com/recipes/soup-with-rice-and-meatballs
Spring Rolls with Vegetables and Seafood ,https://eatsmarter.com/recipes/spring-rolls-with-vegetables-and-seafood
Chicken Biryani ,https://eatsmarter.com/recipes/chicken-biryani
Curried Rice Noodles with Sprouts and Scallions ,https://eatsmarter.com/recipes/curried-rice-noodles-with-sprouts-and-scallions
Shrimp Fried Rice ,https://eatsmarter.com/recipes/shrimp-fried-rice-2
Chestnut Wild Rice Risotto with Sage and Bacon ,https://eatsmarter.com/recipes/chestnut-wild-rice-risotto-with-sage-and-bacon
Strawberry Risotto ,https://eatsmarter.com/recipes/strawberry-risotto-1
Shrimp and Rice Stuffed Savoy Cabbage ,https://eatsmarter.com/recipes/shrimp-and-rice-stuffed-savoy-cabbage
Shrimp with Cognac and Tomato Sauce Over Rice ,https://eatsmarter.com/recipes/shrimp-with-cognac-and-tomato-sauce-over-rice
Rice Paper Rolls with Wild Garlic Sprouts ,https://eatsmarter.com/recipes/rice-paper-rolls-with-wild-garlic-sprouts
Mixed Vegetable Paella ,https://eatsmarter.com/recipes/mixed-vegetable-paella
Risi E Bisi (Rice and Peas) ,https://eatsmarter.com/recipes/risi-e-bisi-rice-and-peas
Orzo with Tomatoes and Feta Cheese ,https://eatsmarter.com/recipes/orzo-with-tomatoes-and-feta-cheese
Egyptian Stuffed Eggplants ,https://eatsmarter.com/recipes/egyptian-stuffed-eggplants
Cherry Rice Cake ,https://eatsmarter.com/recipes/cherry-rice-cake
Chicken with Vegetable Rice ,https://eatsmarter.com/recipes/chicken-with-vegetable-rice
Lamb Stew with Rice ,https://eatsmarter.com/recipes/lamb-stew-with-rice
Rice with Cabbage and Chickpeas ,https://eatsmarter.com/recipes/rice-with-cabbage-and-chickpeas
Spinach Risotto ,https://eatsmarter.com/recipes/spinach-risotto-0
Rice Noodle Salad with Vegetables ,https://eatsmarter.com/recipes/rice-noodle-salad-with-vegetables
Lamb Stew with Rice ,https://eatsmarter.com/recipes/lamb-stew-with-rice-0
Curried Meat with Apricots and Cashew Rice ,https://eatsmarter.com/recipes/curried-meat-with-apricots-and-cashew-rice
Asparagus Risotto ,https://eatsmarter.com/recipes/asparagus-risotto-6
Noodles with Chicken and Shrimp ,https://eatsmarter.com/recipes/noodles-with-chicken-and-shrimp
Baked Pumpkin Stuffed with Rice and Cranberries ,https://eatsmarter.com/recipes/baked-pumpkin-stuffed-with-rice-and-cranberries
Brown Rice Pilaf ,https://eatsmarter.com/recipes/brown-rice-pilaf
Tomato Rice and Meatloaf Sticks (cevapcici) ,https://eatsmarter.com/recipes/tomato-rice-and-meatloaf-sticks-cevapcici
Kedgeree ,https://eatsmarter.com/recipes/kedgeree-1
Nasi Goreng (Indonesian Fried Rice) ,https://eatsmarter.com/recipes/nasi-goreng-indonesian-fried-rice
Paella ,https://eatsmarter.com/recipes/paella-17
"Paella with Mango, Papaya and Pineapple ",https://eatsmarter.com/recipes/paella-with-mango-papaya-and-pineapple
Tomatoes Stuffed with Rice ,https://eatsmarter.com/recipes/tomatoes-stuffed-with-rice
Vegetable Risotto ,https://eatsmarter.com/recipes/vegetable-risotto-2
Jambalaya ,https://eatsmarter.com/recipes/jambalaya-6
Tomato Soup with Rice ,https://eatsmarter.com/recipes/tomato-soup-with-rice
Rice and Vegetable Salad with Chicken ,https://eatsmarter.com/recipes/rice-and-vegetable-salad-with-chicken
Rice Mushroom Au Gratin ,https://eatsmarter.com/recipes/rice-mushroom-au-gratin
Cherry Rice Pudding ,https://eatsmarter.com/recipes/cherry-rice-pudding-0
Paprika Rice with Sausage ,https://eatsmarter.com/recipes/paprika-rice-with-sausage
Tofu and Vegetable Rolls with Rice Noodles ,https://eatsmarter.com/recipes/tofu-and-vegetable-rolls-with-rice-noodles
Pressure Cooker Risotto with Smoked Salmon ,https://eatsmarter.com/recipes/pressure-cooker-risotto-with-smoked-salmon
Pressure Cooker Paella ,https://eatsmarter.com/recipes/pressure-cooker-paella
Wild Rice and Mushrooms ,https://eatsmarter.com/recipes/wild-rice-and-mushrooms
Vegetable Spring Rolls with Rice Paper ,https://eatsmarter.com/recipes/vegetable-spring-rolls-with-rice-paper
Zucchini Stuffed with Ground Beef ,https://eatsmarter.com/recipes/zucchini-stuffed-with-ground-beef-0
Risotto with Sea Bass ,https://eatsmarter.com/recipes/risotto-with-sea-bass
Chicken and Rice Soup ,https://eatsmarter.com/recipes/chicken-and-rice-soup
"Swiss Chard, Ground Beef and Rice Casserole ",https://eatsmarter.com/recipes/swiss-chard-ground-beef-and-rice-casserole
Lemon Rice Soup ,https://eatsmarter.com/recipes/lemon-rice-soup-0
Risotto with Bacon and Cauliflower ,https://eatsmarter.com/recipes/risotto-with-bacon-and-cauliflower
Curried Chicken with Turmeric Rice ,https://eatsmarter.com/recipes/curried-chicken-with-turmeric-rice
Pea Risotto with Beans and Avocado ,https://eatsmarter.com/recipes/pea-risotto-with-beans-and-avocado
Oven Baked Risotto with Chicken ,https://eatsmarter.com/recipes/oven-baked-risotto-with-chicken
"Green Bean, Pea and Olive Paella ",https://eatsmarter.com/recipes/green-bean-pea-and-olive-paella
Paella with Vegetables ,https://eatsmarter.com/recipes/paella-with-vegetables
Vegetarian Chickpea Curry with Apricots ,https://eatsmarter.com/recipes/vegetarian-chickpea-curry-with-apricots
Mixed Vegetable Curry ,https://eatsmarter.com/recipes/mixed-vegetable-curry
Colorful Rice with Bell Peppers and Green Beans ,https://eatsmarter.com/recipes/colorful-rice-with-bell-peppers-and-green-beans
Stuffed Peppers with Lentils ,https://eatsmarter.com/recipes/stuffed-peppers-with-lentils
Salmon Avocado Poké Bowl ,https://eatsmarter.com/recipes/salmon-avocado-poke-bowl
Asian Sesame Poké Bowl ,https://eatsmarter.com/recipes/asian-sesame-poke-bowl
Vegetable Wok with Rice ,https://eatsmarter.com/recipes/vegetable-wok-with-rice
Spicy Wok-Fried Rice with Broccoli ,https://eatsmarter.com/recipes/spicy-wok-fried-rice-with-broccoli
Peas and Rice with Prosciutto ,https://eatsmarter.com/recipes/peas-and-rice-with-prosciutto
Rice Shakshuka with Olives ,https://eatsmarter.com/recipes/rice-shakshuka-with-olives
Asparagus and Wild Garlic Risotto ,https://eatsmarter.com/recipes/asparagus-and-wild-garlic-risotto
One Pot Mexican Rice Casserole ,https://eatsmarter.com/recipes/one-pot-mexican-rice-casserole
Spiced Basmati Rice and Vegetables ,https://eatsmarter.com/recipes/spiced-basmati-rice-and-vegetables
Rice and Beans ,https://eatsmarter.com/recipes/rice-and-beans
Paella ,https://eatsmarter.com/recipes/paella-11
Vegetarian Asparagus Risotto ,https://eatsmarter.com/recipes/vegetarian-asparagus-risotto
"Goat Cheese, Vegetable and Lime Rice ",https://eatsmarter.com/recipes/goat-cheese-vegetable-and-lime-rice
Bok Choy and Beef Rice Bowl ,https://eatsmarter.com/recipes/bok-choy-and-beef-rice-bowl
Risotto with Tomatoes and Parmesan ,https://eatsmarter.com/recipes/risotto-with-tomatoes-and-parmesan
Tomato Risotto ,https://eatsmarter.com/recipes/tomato-risotto-1
Citrus Rice Salad with Smoked Ham and Radish ,https://eatsmarter.com/recipes/citrus-rice-salad-with-smoked-ham-and-radish
Rice and Green Bean Salad ,https://eatsmarter.com/recipes/rice-and-green-bean-salad
Wild Rice and Pepper Salad ,https://eatsmarter.com/recipes/wild-rice-and-pepper-salad
Pea and Asparagus Risotto ,https://eatsmarter.com/recipes/pea-and-asparagus-risotto
Baked Vegetable Rice ,https://eatsmarter.com/recipes/baked-vegetable-rice
"Chicken and Rice Casserole with Tomatoes, Almonds and Raisins ",https://eatsmarter.com/recipes/chicken-and-rice-casserole-with-tomatoes-almonds-and-raisins
Fried Rice ,https://eatsmarter.com/recipes/fried-rice
Sushi Cake ,https://eatsmarter.com/recipes/sushi-cake
Spicy Thai Steak Salad ,https://eatsmarter.com/recipes/spicy-thai-steak-salad
Sweet Potato Risotto ,https://eatsmarter.com/recipes/sweet-potato-risotto
Fried Rice with Chinese Cabbage and Carrots ,https://eatsmarter.com/recipes/fried-rice-with-chinese-cabbage-and-carrots
Tofu Vegetable Fried Rice with Peanut Sauce ,https://eatsmarter.com/recipes/tofu-vegetable-fried-rice-with-peanut-sauce
Rice-Lentil Pilaf ,https://eatsmarter.com/recipes/rice-lentil-pilaf
Creamy Yogurt Rice Pudding ,https://eatsmarter.com/recipes/creamy-yogurt-rice-pudding
Easy Maki Rolls ,https://eatsmarter.com/recipes/easy-maki-rolls
Warm Rice Cakes ,https://eatsmarter.com/recipes/warm-rice-cakes
Carrot Basil Risotto with Smoked Salmon ,https://eatsmarter.com/recipes/carrot-basil-risotto-with-smoked-salmon
Rice and Spinach Dumplings with Sage ,https://eatsmarter.com/recipes/rice-and-spinach-dumplings-with-sage
Risotto with Mushrooms and Garlic ,https://eatsmarter.com/recipes/risotto-with-mushrooms-and-garlic
Risotto with Wild Garlic ,https://eatsmarter.com/recipes/risotto-with-wild-garlic
Risotto with Snow Peas and Pine Nuts ,https://eatsmarter.com/recipes/risotto-with-snow-peas-and-pine-nuts
"Pork with Rice, Mixed Vegetables and Pineapple ",https://eatsmarter.com/recipes/pork-with-rice-mixed-vegetables-and-pineapple
Serbian-Style Vegetable Rice with Lamb (Djuvec) ,https://eatsmarter.com/recipes/serbian-style-vegetable-rice-with-lamb-djuvec
Fried Rice with Vegetables ,https://eatsmarter.com/recipes/fried-rice-with-vegetables
Salmon with Shrimp and Asparagus Cooked in a Wok ,https://eatsmarter.com/recipes/salmon-with-shrimp-and-asparagus-cooked-in-a-wok
Risotto with Asparagus and Scallops ,https://eatsmarter.com/recipes/risotto-with-asparagus-and-scallops
Salmon Risotto with Saffron ,https://eatsmarter.com/recipes/salmon-risotto-with-saffron
Savory Rice Cake with Sesame ,https://eatsmarter.com/recipes/savory-rice-cake-with-sesame
Risotto with Wild Mushrooms ,https://eatsmarter.com/recipes/risotto-with-wild-mushrooms-0
Vegetable-Tofu Fried Rice ,https://eatsmarter.com/recipes/vegetable-tofu-fried-rice
Turkey Vegetable Rice ,https://eatsmarter.com/recipes/turkey-vegetable-rice
Brown Rice Cereal with Mango ,https://eatsmarter.com/recipes/brown-rice-cereal-with-mango
Coconut Brown Rice Omelet with Blueberries ,https://eatsmarter.com/recipes/coconut-brown-rice-omelet-with-blueberries
Rice and Vegetable Salad ,https://eatsmarter.com/recipes/rice-and-vegetable-salad
Korma Vegetable Dumplings ,https://eatsmarter.com/recipes/korma-vegetable-dumplings
Vegetable Rice with Curry ,https://eatsmarter.com/recipes/vegetable-rice-with-curry
Fig Rice Pudding ,https://eatsmarter.com/recipes/fig-rice-pudding
Chicken and Rice Casserole ,https://eatsmarter.com/recipes/chicken-and-rice-casserole
Creamy Pepper Soup with Rice and Avocado ,https://eatsmarter.com/recipes/creamy-pepper-soup-with-rice-and-avocado
Mushroom Risotto with Butternut Squash ,https://eatsmarter.com/recipes/mushroom-risotto-with-butternut-squash
Spicy Vegetable Lamb Stew ,https://eatsmarter.com/recipes/spicy-vegetable-lamb-stew
Carrot Fried Rice ,https://eatsmarter.com/recipes/carrot-fried-rice
Tomato Rice with Ground Meat ,https://eatsmarter.com/recipes/tomato-rice-with-ground-meat
Thai Rice Noodle Stir-Fry ,https://eatsmarter.com/recipes/thai-rice-noodle-stir-fry
Asian Rice Paper Wraps ,https://eatsmarter.com/recipes/asian-rice-paper-wraps
Vegetable and Brown Rice Casserole ,https://eatsmarter.com/recipes/vegetable-and-brown-rice-casserole
Pumpkin and Mushroom Rice ,https://eatsmarter.com/recipes/pumpkin-and-mushroom-rice
Indian Saffron Rice with Vegetables and Cashew Nuts ,https://eatsmarter.com/recipes/indian-saffron-rice-with-vegetables-and-cashew-nuts
Curry Rice with Golden Raisins and Cashews ,https://eatsmarter.com/recipes/curry-rice-with-golden-raisins-and-cashews
Coconut Rice with Blueberries ,https://eatsmarter.com/recipes/coconut-rice-with-blueberries
Green Wok-Fried Rice ,https://eatsmarter.com/recipes/green-wok-fried-rice
Risotto with Pumpkin and Shrimp ,https://eatsmarter.com/recipes/risotto-with-pumpkin-and-shrimp
Colorful Rice Salad with Ham ,https://eatsmarter.com/recipes/colorful-rice-salad-with-ham
Shrimp and Basil Risotto ,https://eatsmarter.com/recipes/shrimp-and-basil-risotto
"Brown Rice, Wheat Berry and Vegetable Casserole ",https://eatsmarter.com/recipes/brown-rice-wheat-berry-and-vegetable-casserole
Mushroom Risotto with Pumpkin ,https://eatsmarter.com/recipes/mushroom-risotto-with-pumpkin
"Chicken Soup with Rice Noodles, Kale and Carrots ",https://eatsmarter.com/recipes/chicken-soup-with-rice-noodles-kale-and-carrots
Spicy Chicken with Risotto ,https://eatsmarter.com/recipes/spicy-chicken-with-risotto
