title,url
Light Chicken Salad ,https://eatsmarter.com/recipes/light-chicken-salad
Austrian Salad ,https://eatsmarter.com/recipes/austrian-salad
Coleslaw ,https://eatsmarter.com/recipes/coleslaw
Dandelion Salad ,https://eatsmarter.com/recipes/dandelion-salad
Waldorf Salad ,https://eatsmarter.com/recipes/waldorf-salad
Colorful Mango Cabbage Salad ,https://eatsmarter.com/recipes/colorful-mango-cabbage-salad
Warm Chicken Pasta Salad ,https://eatsmarter.com/recipes/warm-chicken-pasta-salad
Fennel Salad ,https://eatsmarter.com/recipes/fennel-salad
Shrimp Seafood Salad ,https://eatsmarter.com/recipes/shrimp-seafood-salad
Potato Salad with Sausages ,https://eatsmarter.com/recipes/potato-salad-with-sausages
Japanese-Style Spinach Salad with Sesame ,https://eatsmarter.com/recipes/japanese-style-spinach-salad-with-sesame
Roasted Pork Loin with Herbed Couscous ,https://eatsmarter.com/recipes/roasted-pork-loin-with-herbed-couscous
Bulgur Salad with Tomatoes ,https://eatsmarter.com/recipes/bulgur-salad-with-tomatoes-0
Smoked Salmon with Arugula and Strawberries ,https://eatsmarter.com/recipes/smoked-salmon-with-arugula-and-strawberries
"Summer Salad with Strawberries, Smoked Cheese and Nuts ",https://eatsmarter.com/recipes/summer-salad-with-strawberries-smoked-cheese-and-nuts
Herb-Crusted Roast Pork Tenderloin with Radicchio and Radish Salad ,https://eatsmarter.com/recipes/herb-crusted-roast-pork-tenderloin-with-radicchio-and-radish-salad
Tomato and Celery Salad with Nuts and Raisins ,https://eatsmarter.com/recipes/tomato-and-celery-salad-with-nuts-and-raisins
Chickpea Salad with Chicken Breast ,https://eatsmarter.com/recipes/chickpea-salad-with-chicken-breast
Avocado Salad with Shrimp and Mozzarella ,https://eatsmarter.com/recipes/avocado-salad-with-shrimp-and-mozzarella
Zucchini-Cheese Salad with Tomatoes ,https://eatsmarter.com/recipes/zucchini-cheese-salad-with-tomatoes
Cheese and Avocado Salad ,https://eatsmarter.com/recipes/cheese-and-avocado-salad
Glass Noodle Salad with Crayfish Tails ,https://eatsmarter.com/recipes/glass-noodle-salad-with-crayfish-tails
Brussel Sprout Salad with Carrots and Almonds ,https://eatsmarter.com/recipes/brussel-sprout-salad-with-carrots-and-almonds
Fruity Coleslaw with Blueberries ,https://eatsmarter.com/recipes/fruity-coleslaw-with-blueberries
Mixed Berry Salad with Goat Cheese ,https://eatsmarter.com/recipes/mixed-berry-salad-with-goat-cheese
Fennel Salad with Oranges and Olives ,https://eatsmarter.com/recipes/fennel-salad-with-oranges-and-olives
"Tuna, Artichoke and Vegetable Salad on Baguette ",https://eatsmarter.com/recipes/tuna-artichoke-and-vegetable-salad-on-baguette
"Romaine Lettuce with Red Lentils, Scallions, Apples and Walnuts ",https://eatsmarter.com/recipes/romaine-lettuce-with-red-lentils-scallions-apples-and-walnuts
"Spinach Salad with Mushrooms, Egg and Walnuts ",https://eatsmarter.com/recipes/spinach-salad-with-mushrooms-egg-and-walnuts
Bulgur Salad with Mozzarella and Pesto ,https://eatsmarter.com/recipes/bulgur-salad-with-mozzarella-and-pesto
Savoy Cabbage Coleslaw ,https://eatsmarter.com/recipes/savoy-cabbage-coleslaw
Curry Rice with Duck and Pineapple ,https://eatsmarter.com/recipes/curry-rice-with-duck-and-pineapple
Pumpkin Salad with Lentils and Mango ,https://eatsmarter.com/recipes/pumpkin-salad-with-lentils-and-mango
Cauliflower Salad with Chickpeas ,https://eatsmarter.com/recipes/cauliflower-salad-with-chickpeas-0
Colorful Chicken Salad ,https://eatsmarter.com/recipes/colorful-chicken-salad
Spicy Chinese Cabbage Wraps ,https://eatsmarter.com/recipes/spicy-chinese-cabbage-wraps
Bulgur and Pepper Salad ,https://eatsmarter.com/recipes/bulgur-and-pepper-salad
Apple and Fennel Salad ,https://eatsmarter.com/recipes/apple-and-fennel-salad
Green Potato Salad ,https://eatsmarter.com/recipes/green-potato-salad
Pan Fried Ravioli ,https://eatsmarter.com/recipes/pan-fried-ravioli
Indian Carrot Salad ,https://eatsmarter.com/recipes/indian-carrot-salad
Strawberry and Melon Dessert Salad ,https://eatsmarter.com/recipes/strawberry-and-melon-dessert-salad
Stuffed Mini Cucumbers ,https://eatsmarter.com/recipes/stuffed-mini-cucumbers
Tomato and Mango Salad ,https://eatsmarter.com/recipes/tomato-and-mango-salad
Marinated Trout ,https://eatsmarter.com/recipes/marinated-trout
Romaine with Buttermilk Roquefort Dressing ,https://eatsmarter.com/recipes/romaine-with-buttermilk-roquefort-dressing
Colorful Vegetable Platter with Herb Hollandaise ,https://eatsmarter.com/recipes/colorful-vegetable-platter-with-herb-hollandaise
Turnip Salad with Sprouts ,https://eatsmarter.com/recipes/turnip-salad-with-sprouts
Fennel Salad with Grapefruit ,https://eatsmarter.com/recipes/fennel-salad-with-grapefruit
Asparagus and Rhubarb Salad ,https://eatsmarter.com/recipes/asparagus-and-rhubarb-salad-0
Chicken and Mango Pasta Salad ,https://eatsmarter.com/recipes/chicken-and-mango-pasta-salad
Lentil-Mozzarella Salad ,https://eatsmarter.com/recipes/lentil-mozzarella-salad
Oak Leaf Lettuce and Cress Salad ,https://eatsmarter.com/recipes/oak-leaf-lettuce-and-cress-salad
Rice and Vegetable Salad ,https://eatsmarter.com/recipes/rice-and-vegetable-salad
"Spinach Salad with Carrots, Pumpkin and Feta ",https://eatsmarter.com/recipes/spinach-salad-with-carrots-pumpkin-and-feta
Duck Breast and Glass Noodle Salad ,https://eatsmarter.com/recipes/duck-breast-and-glass-noodle-salad
Spicy Dumplings ,https://eatsmarter.com/recipes/spicy-dumplings
Lebanese Beet Salad ,https://eatsmarter.com/recipes/lebanese-beet-salad
Blood Orange Salad with Vanilla-Mint Vinaigrette ,https://eatsmarter.com/recipes/blood-orange-salad-with-vanilla-mint-vinaigrette
Colorful Coleslaw ,https://eatsmarter.com/recipes/colorful-coleslaw
Carrot and Pineapple Salad ,https://eatsmarter.com/recipes/carrot-and-pineapple-salad
Citrus Salad ,https://eatsmarter.com/recipes/citrus-salad-0
Radish-Sprouts Salad ,https://eatsmarter.com/recipes/radish-sprouts-salad
Roasted Fennel Salad ,https://eatsmarter.com/recipes/roasted-fennel-salad
Warm Shrimp and Pasta Salad ,https://eatsmarter.com/recipes/warm-shrimp-and-pasta-salad
Arugula Salad with Olive Crostini ,https://eatsmarter.com/recipes/arugula-salad-with-olive-crostini
Stuffed Lettuce Leaves ,https://eatsmarter.com/recipes/stuffed-lettuce-leaves
Roasted Beets with Apple-Caramel Sauce ,https://eatsmarter.com/recipes/roasted-beets-with-apple-caramel-sauce
Mache Salad with Rhubarb ,https://eatsmarter.com/recipes/mache-salad-with-rhubarb
"Green Bean, Mushroom and Tomato Green Salad ",https://eatsmarter.com/recipes/green-bean-mushroom-and-tomato-green-salad
Orange and Asparagus Salad ,https://eatsmarter.com/recipes/orange-and-asparagus-salad
Millet Patties with Tomato Salad ,https://eatsmarter.com/recipes/millet-patties-with-tomato-salad
Asparagus Salad with Rhubarb Vinaigrette ,https://eatsmarter.com/recipes/asparagus-salad-with-rhubarb-vinaigrette
Strawberry Pasta Salad with Asparagus ,https://eatsmarter.com/recipes/strawberry-pasta-salad-with-asparagus
Fruit Salad with Mint ,https://eatsmarter.com/recipes/fruit-salad-with-mint
Fried Chicken Strips on Quinoa ,https://eatsmarter.com/recipes/fried-chicken-strips-on-quinoa
Zoodle Salad with Avocado ,https://eatsmarter.com/recipes/zoodle-salad-with-avocado
Asian Red Cabbage Salad with Duck Breast ,https://eatsmarter.com/recipes/asian-red-cabbage-salad-with-duck-breast
Pasta and Beef Salad ,https://eatsmarter.com/recipes/pasta-and-beef-salad
Endive Apple Salad with Gorgonzola ,https://eatsmarter.com/recipes/endive-apple-salad-with-gorgonzola
White Fish in a Sesame Crust ,https://eatsmarter.com/recipes/white-fish-in-a-sesame-crust
Lamb's Lettuce Salad with Emmentaler Cheese ,https://eatsmarter.com/recipes/lambs-lettuce-salad-with-emmentaler-cheese
Vegetarian Stuffed Tomatoes ,https://eatsmarter.com/recipes/vegetarian-stuffed-tomatoes
Green Salad with Rhubarb ,https://eatsmarter.com/recipes/green-salad-with-rhubarb
Colorful Salad Bowl ,https://eatsmarter.com/recipes/colorful-salad-bowl
Sausage Salad with Herbs ,https://eatsmarter.com/recipes/sausage-salad-with-herbs
Mache Salad ,https://eatsmarter.com/recipes/mache-salad
Asian Avocado Salad ,https://eatsmarter.com/recipes/asian-avocado-salad
Mozzarella and Carrot Salad ,https://eatsmarter.com/recipes/mozzarella-and-carrot-salad
Summer Salad with Cucumber and Melon ,https://eatsmarter.com/recipes/summer-salad-with-cucumber-and-melon
Leafy Green Salad with Raspberries ,https://eatsmarter.com/recipes/leafy-green-salad-with-raspberries
Spicy Couscous Salad ,https://eatsmarter.com/recipes/spicy-couscous-salad
Dried-Fruit Salad ,https://eatsmarter.com/recipes/dried-fruit-salad
Ham and Cheese Salad ,https://eatsmarter.com/recipes/ham-and-cheese-salad
Millet and Vegetable Stew ,https://eatsmarter.com/recipes/millet-and-vegetable-stew
Egg and Asparagus Salad ,https://eatsmarter.com/recipes/egg-and-asparagus-salad
"Beet, Lentil and Feta Salad ",https://eatsmarter.com/recipes/beet-lentil-and-feta-salad
Greek Tuna Salad ,https://eatsmarter.com/recipes/greek-tuna-salad
Green Salad with Chicken Strips ,https://eatsmarter.com/recipes/green-salad-with-chicken-strips
Egg-Broccoli Salad ,https://eatsmarter.com/recipes/egg-broccoli-salad
Apple-Onion Couscous ,https://eatsmarter.com/recipes/apple-onion-couscous
Chicken Salad with Avocado ,https://eatsmarter.com/recipes/chicken-salad-with-avocado
Smarter Chef's Salad ,https://eatsmarter.com/recipes/smarter-chefs-salad
Open-Faced Cucumber and Ham Sandwiches ,https://eatsmarter.com/recipes/open-faced-cucumber-and-ham-sandwiches
Turkey Rolls with Asparagus Salad ,https://eatsmarter.com/recipes/turkey-rolls-with-asparagus-salad
Beet Salad ,https://eatsmarter.com/recipes/beet-salad
Orange Couscous ,https://eatsmarter.com/recipes/orange-couscous
Fresh Cheese Balls ,https://eatsmarter.com/recipes/fresh-cheese-balls
Colorful Pesto Pasta Salad ,https://eatsmarter.com/recipes/colorful-pesto-pasta-salad
Chickpeas and Spinach Salad with Tomatoes ,https://eatsmarter.com/recipes/chickpeas-and-spinach-salad-with-tomatoes
Lettuce Wraps with Avocado and Tuna ,https://eatsmarter.com/recipes/lettuce-wraps-with-avocado-and-tuna
Mexican Chicken Avocado Salad ,https://eatsmarter.com/recipes/mexican-chicken-avocado-salad
Autumn Salad with Lamb Fillet ,https://eatsmarter.com/recipes/autumn-salad-with-lamb-fillet
Raw Kohlrabi ,https://eatsmarter.com/recipes/raw-kohlrabi
Chanterelle-Frisee Salad ,https://eatsmarter.com/recipes/chanterelle-frisee-salad
Papaya Salad with Cucumber ,https://eatsmarter.com/recipes/papaya-salad-with-cucumber
Bulgur-Fennel Salad with Mint ,https://eatsmarter.com/recipes/bulgur-fennel-salad-with-mint
Mushroom Gratin on Sprout Salad ,https://eatsmarter.com/recipes/mushroom-gratin-on-sprout-salad
Marinated Beef with Salad ,https://eatsmarter.com/recipes/marinated-beef-with-salad
Panzanella Salad ,https://eatsmarter.com/recipes/panzanella-salad-0
Quinoa Chicken and Vegetable Salad ,https://eatsmarter.com/recipes/quinoa-chicken-and-vegetable-salad
Avocado Salad with Tomatoes ,https://eatsmarter.com/recipes/avocado-salad-with-tomatoes
Carrots and Avocado Salad with Cherry Tomatoes ,https://eatsmarter.com/recipes/carrots-and-avocado-salad-with-cherry-tomatoes
Tomatoes Stuffed with Lentil Salad ,https://eatsmarter.com/recipes/tomatoes-stuffed-with-lentil-salad
Sharp Cabbage Salad with Ground Beef ,https://eatsmarter.com/recipes/sharp-cabbage-salad-with-ground-beef
Kale Salad with Carrots ,https://eatsmarter.com/recipes/kale-salad-with-carrots
Arugula and Tomato Salad ,https://eatsmarter.com/recipes/arugula-and-tomato-salad
Lentil Salad with Smoked Salmon ,https://eatsmarter.com/recipes/lentil-salad-with-smoked-salmon
Green Bean and Tuna Salad ,https://eatsmarter.com/recipes/green-bean-and-tuna-salad
Salmon ,https://eatsmarter.com/recipes/salmon
Cobb Salad ,https://eatsmarter.com/recipes/cobb-salad
Baked Lobster ,https://eatsmarter.com/recipes/baked-lobster
Stuffed Endive ,https://eatsmarter.com/recipes/stuffed-endive
Goat Cheese Salad ,https://eatsmarter.com/recipes/goat-cheese-salad-0
Marinated Peppers ,https://eatsmarter.com/recipes/marinated-peppers-0
Marinated Romanesco ,https://eatsmarter.com/recipes/marinated-romanesco
Chicken and Potato Salad ,https://eatsmarter.com/recipes/chicken-and-potato-salad
Romaine Lettuce with Pear ,https://eatsmarter.com/recipes/romaine-lettuce-with-pear
Greek Squid Salad ,https://eatsmarter.com/recipes/greek-squid-salad
Japanese Noodle Salad ,https://eatsmarter.com/recipes/japanese-noodle-salad
Lentil Salad with Smoked Mackerel ,https://eatsmarter.com/recipes/lentil-salad-with-smoked-mackerel
Colorful Pasta Salad ,https://eatsmarter.com/recipes/colorful-pasta-salad-1
Roasted Asparagus with Arugula ,https://eatsmarter.com/recipes/roasted-asparagus-with-arugula
Zucchini and Carrot Salad with Almond Dressing ,https://eatsmarter.com/recipes/zucchini-and-carrot-salad-with-almond-dressing
Puff Pastry with Salmon and Sole ,https://eatsmarter.com/recipes/puff-pastry-with-salmon-and-sole
Mixed Salad with Cherry Tomatoes and Carrot ,https://eatsmarter.com/recipes/mixed-salad-with-cherry-tomatoes-and-carrot
Red Cabbage Salad with Walnuts ,https://eatsmarter.com/recipes/red-cabbage-salad-with-walnuts
"Salad with Feta, Olives and Peppers ",https://eatsmarter.com/recipes/salad-with-feta-olives-and-peppers
Carrot Salad with Bean Sprouts and Sesame ,https://eatsmarter.com/recipes/carrot-salad-with-bean-sprouts-and-sesame
Ground Lamb Lettuce Wraps ,https://eatsmarter.com/recipes/ground-lamb-lettuce-wraps
Zucchini and Carrot Salad with Onions ,https://eatsmarter.com/recipes/zucchini-and-carrot-salad-with-onions
Spinach and Mushroom Salad ,https://eatsmarter.com/recipes/spinach-and-mushroom-salad-0
Shrimp Salad with Avocado ,https://eatsmarter.com/recipes/shrimp-salad-with-avocado
Mixed Salad with Apples and Dates ,https://eatsmarter.com/recipes/mixed-salad-with-apples-and-dates
Caesar Salad with Tofu ,https://eatsmarter.com/recipes/caesar-salad-with-tofu
Wheat Berry Crepes with Tomato and Avocado Salad ,https://eatsmarter.com/recipes/wheat-berry-crepes-with-tomato-and-avocado-salad
Carrot Salad ,https://eatsmarter.com/recipes/carrot-salad-1
Mediterranean Pasta Salad ,https://eatsmarter.com/recipes/mediterranean-pasta-salad-2
Cucumber Grapefruit Salad ,https://eatsmarter.com/recipes/cucumber-grapefruit-salad
Bell Pepper and Feta Cheese Salad ,https://eatsmarter.com/recipes/bell-pepper-and-feta-cheese-salad
Romaine Salad with Bacon-Wrapped Potatoes and Prunes ,https://eatsmarter.com/recipes/romaine-salad-with-bacon-wrapped-potatoes-and-prunes
Colorful Tomato Salad ,https://eatsmarter.com/recipes/colorful-tomato-salad-3
Salad with Turkey Ham ,https://eatsmarter.com/recipes/salad-with-turkey-ham
Pasta Salad ,https://eatsmarter.com/recipes/pasta-salad-2
"Radish, Apple and Cress Salad Wth Yogurt Dressing ",https://eatsmarter.com/recipes/radish-apple-and-cress-salad-wth-yogurt-dressing
Camembert and Apple Salad ,https://eatsmarter.com/recipes/camembert-and-apple-salad
Cucumber-radish Salad with Turkey Rolls ,https://eatsmarter.com/recipes/cucumber-radish-salad-with-turkey-rolls
Braised Cabbage with Potato Noodles ,https://eatsmarter.com/recipes/braised-cabbage-with-potato-noodles
Asparagus Salad with Pinenuts ,https://eatsmarter.com/recipes/asparagus-salad-with-pinenuts
Asian Chicken Salad ,https://eatsmarter.com/recipes/asian-chicken-salad-0
Spinach Salad with Berries and Cheese ,https://eatsmarter.com/recipes/spinach-salad-with-berries-and-cheese
Zucchini Strawberry Carpaccio with Pine Nuts ,https://eatsmarter.com/recipes/zucchini-strawberry-carpaccio-with-pine-nuts
Grilled Chicken Skewers with Carrot Salad and Dip ,https://eatsmarter.com/recipes/grilled-chicken-skewers-with-carrot-salad-and-dip
Warm Cabbage Salad with Almonds and Chorizo ,https://eatsmarter.com/recipes/warm-cabbage-salad-with-almonds-and-chorizo
Tomato and Cilantro Salsa ,https://eatsmarter.com/recipes/tomato-and-cilantro-salsa
Caramelized Radicchio with Oranges ,https://eatsmarter.com/recipes/caramelized-radicchio-with-oranges
Ligurian Potato Salad with White Beans ,https://eatsmarter.com/recipes/ligurian-potato-salad-with-white-beans
Bulgur Salad with Parsley ,https://eatsmarter.com/recipes/bulgur-salad-with-parsley
"Bean Salad with Tomatoes, Feta and Basil ",https://eatsmarter.com/recipes/bean-salad-with-tomatoes-feta-and-basil
Italian Bread Salad ,https://eatsmarter.com/recipes/italian-bread-salad-2
"Chopped Salad with and Mandarin Oranges, Avocado, Walnuts and Hard-Boiled Eggs ",https://eatsmarter.com/recipes/chopped-salad-with-and-mandarin-oranges-avocado-walnuts-and-hard-boiled-eggs
Cucumber Yogurt Salad ,https://eatsmarter.com/recipes/cucumber-yogurt-salad
Green Salad with Watermelon ,https://eatsmarter.com/recipes/green-salad-with-watermelon
Tomato and Avocado Salad with Corn Tortilla Chips ,https://eatsmarter.com/recipes/tomato-and-avocado-salad-with-corn-tortilla-chips
Cabbage Salad with Meatloaf ,https://eatsmarter.com/recipes/cabbage-salad-with-meatloaf
Roasted Asparagus and Tomato Salad with Hazelnut Dressing ,https://eatsmarter.com/recipes/roasted-asparagus-and-tomato-salad-with-hazelnut-dressing
Catfish Fillet over Lentil Ragout ,https://eatsmarter.com/recipes/catfish-fillet-over-lentil-ragout
Vegetable Salad ,https://eatsmarter.com/recipes/vegetable-salad-9
Egg Salad ,https://eatsmarter.com/recipes/egg-salad-4
Cauliflower Salad ,https://eatsmarter.com/recipes/cauliflower-salad-0
Corn Salad ,https://eatsmarter.com/recipes/corn-salad-0
Beet Salad ,https://eatsmarter.com/recipes/beet-salad-7
Arugula Salad with Bresaola ,https://eatsmarter.com/recipes/arugula-salad-with-bresaola
Greek Salad ,https://eatsmarter.com/recipes/greek-salad-20
Green Salad with Cauliflower and Chicken ,https://eatsmarter.com/recipes/green-salad-with-cauliflower-and-chicken
Chickpea Salad ,https://eatsmarter.com/recipes/chickpea-salad
Spinach Salad with Goat's Cheese ,https://eatsmarter.com/recipes/spinach-salad-with-goats-cheese
Schnitzel with Potato Cucumber Salad ,https://eatsmarter.com/recipes/schnitzel-with-potato-cucumber-salad
Asparagus Salad with Eggs and Radishes ,https://eatsmarter.com/recipes/asparagus-salad-with-eggs-and-radishes
Beet and Apple Salad with Horseradish Vinaigrette ,https://eatsmarter.com/recipes/beet-and-apple-salad-with-horseradish-vinaigrette
Green Vegetable Salad with Cheesy Toast ,https://eatsmarter.com/recipes/green-vegetable-salad-with-cheesy-toast
"Spinach, Pumpkin, Apple and Plum Salad ",https://eatsmarter.com/recipes/spinach-pumpkin-apple-and-plum-salad
Warm Mushroom Salad ,https://eatsmarter.com/recipes/warm-mushroom-salad-0
"Couscous, Grape and Feta Salad ",https://eatsmarter.com/recipes/couscous-grape-and-feta-salad
Grilled Chicken Skewers with Lentils ,https://eatsmarter.com/recipes/grilled-chicken-skewers-with-lentils
Asparagus and Rhubarb Salad ,https://eatsmarter.com/recipes/asparagus-and-rhubarb-salad
Vegetable Salad with Legumes ,https://eatsmarter.com/recipes/vegetable-salad-with-legumes
Asparagus Chicken Salad ,https://eatsmarter.com/recipes/asparagus-chicken-salad
Mixed Salad with Chicken ,https://eatsmarter.com/recipes/mixed-salad-with-chicken-2
Spinach Salad with Italian Bacon ,https://eatsmarter.com/recipes/spinach-salad-with-italian-bacon
"Pasta Salad with Beans, Chilie Pepper and Avocado ",https://eatsmarter.com/recipes/pasta-salad-with-beans-chilie-pepper-and-avocado
Crispy Breadcrumb-Coated Lettuce Wedges with Remoulade Sauce ,https://eatsmarter.com/recipes/crispy-breadcrumb-coated-lettuce-wedges-with-remoulade-sauce
Couscous-Quinoa Salad with Fruit and Mint ,https://eatsmarter.com/recipes/couscous-quinoa-salad-with-fruit-and-mint
Broad Bean Salad with Tomato and Chives ,https://eatsmarter.com/recipes/broad-bean-salad-with-tomato-and-chives
"Salad with Endives, Chives and Serrano Ham ",https://eatsmarter.com/recipes/salad-with-endives-chives-and-serrano-ham
Carrot Salad with Onions ,https://eatsmarter.com/recipes/carrot-salad-with-onions
Quinoa Salad Bowl with Mizuna ,https://eatsmarter.com/recipes/quinoa-salad-bowl-with-mizuna
Smoked Salmon and Cucumber Salad ,https://eatsmarter.com/recipes/smoked-salmon-and-cucumber-salad
Carrot-Chive Slaw ,https://eatsmarter.com/recipes/carrot-chive-slaw
Turkey Cutlets ,https://eatsmarter.com/recipes/turkey-cutlets
Colorful Vegetables and Muesli ,https://eatsmarter.com/recipes/colorful-vegetables-and-muesli
Bulgur Melon Salad ,https://eatsmarter.com/recipes/bulgur-melon-salad
Herbed Potato Salad ,https://eatsmarter.com/recipes/herbed-potato-salad
Marinated Tofu ,https://eatsmarter.com/recipes/marinated-tofu
Potato and Avocado Salad ,https://eatsmarter.com/recipes/potato-and-avocado-salad
Vegetable Sticks ,https://eatsmarter.com/recipes/vegetable-sticks
Frisee Lettuce and Melon Salad ,https://eatsmarter.com/recipes/frisee-lettuce-and-melon-salad
Papaya and Mozzarella Carpaccio ,https://eatsmarter.com/recipes/papaya-and-mozzarella-carpaccio
Smarter Shrimp Salad ,https://eatsmarter.com/recipes/smarter-shrimp-salad
Thai Shrimp Balls ,https://eatsmarter.com/recipes/thai-shrimp-balls
Summer Couscous Salad with Mint ,https://eatsmarter.com/recipes/summer-couscous-salad-with-mint
Couscous Salad with Feta Cheese ,https://eatsmarter.com/recipes/couscous-salad-with-feta-cheese-0
Braised Romaine Lettuce ,https://eatsmarter.com/recipes/braised-romaine-lettuce
Melon-Mozzarella Salad ,https://eatsmarter.com/recipes/melon-mozzarella-salad
Arugula Salad with Prosciutto ,https://eatsmarter.com/recipes/arugula-salad-with-prosciutto
Zucchini Salad with Fried Cheese ,https://eatsmarter.com/recipes/zucchini-salad-with-fried-cheese
Avocado and Tomato Salad ,https://eatsmarter.com/recipes/avocado-and-tomato-salad
Tomato Eggs with Potato Salad ,https://eatsmarter.com/recipes/tomato-eggs-with-potato-salad
Green Bean and Mozzarella Salad ,https://eatsmarter.com/recipes/green-bean-and-mozzarella-salad
Smoked Tofu Salad ,https://eatsmarter.com/recipes/smoked-tofu-salad
Potato and Lentil Salad with Pumpkin and Cauliflower ,https://eatsmarter.com/recipes/potato-and-lentil-salad-with-pumpkin-and-cauliflower
Coleslaw ,https://eatsmarter.com/recipes/coleslaw-6
Cucumber and Sausage Sandwiches ,https://eatsmarter.com/recipes/cucumber-and-sausage-sandwiches
"Strawberry Salad with Cucumber, Hazelnuts and Feta ",https://eatsmarter.com/recipes/strawberry-salad-with-cucumber-hazelnuts-and-feta
Chickpea Salad with Peppers ,https://eatsmarter.com/recipes/chickpea-salad-with-peppers
Potato Ravioli with Endive Filling ,https://eatsmarter.com/recipes/potato-ravioli-with-endive-filling
Savoy Cabbage and Smoked Pork Gratin ,https://eatsmarter.com/recipes/savoy-cabbage-and-smoked-pork-gratin
Lamb's Lettuce Salad with Camembert and Walnuts ,https://eatsmarter.com/recipes/lambs-lettuce-salad-with-camembert-and-walnuts
Marinated Zucchini ,https://eatsmarter.com/recipes/marinated-zucchini-2
Green Salad with Smoked Trout ,https://eatsmarter.com/recipes/green-salad-with-smoked-trout
Avocado Rice Salad ,https://eatsmarter.com/recipes/avocado-rice-salad
Exotic Fruit Plate ,https://eatsmarter.com/recipes/exotic-fruit-plate
Potato and Salmon Gratin ,https://eatsmarter.com/recipes/potato-and-salmon-gratin
Pizza with Chicken Caesar Salad ,https://eatsmarter.com/recipes/pizza-with-chicken-caesar-salad
Apple and Celery Salad ,https://eatsmarter.com/recipes/apple-and-celery-salad
Sauerkraut and Carrot Salad ,https://eatsmarter.com/recipes/sauerkraut-and-carrot-salad
Beet Salad with Yogurt ,https://eatsmarter.com/recipes/beet-salad-with-yogurt
Sauerkraut and Bean Salad ,https://eatsmarter.com/recipes/sauerkraut-and-bean-salad
Lamb's Lettuce Salad ,https://eatsmarter.com/recipes/lambs-lettuce-salad-0
Indonesian Salad ,https://eatsmarter.com/recipes/indonesian-salad
Mixed Fine Lettuces with Cider Vinaigrette ,https://eatsmarter.com/recipes/mixed-fine-lettuces-with-cider-vinaigrette
Cabbage Salad with Fruit and Walnuts ,https://eatsmarter.com/recipes/cabbage-salad-with-fruit-and-walnuts
Middle Eastern Carrot and Lentil Salad ,https://eatsmarter.com/recipes/middle-eastern-carrot-and-lentil-salad
Spicy Chicken with Bulgur ,https://eatsmarter.com/recipes/spicy-chicken-with-bulgur
Spicy Bean Salad with Bell Peppers ,https://eatsmarter.com/recipes/spicy-bean-salad-with-bell-peppers
Carrot Salad with Orange Dressing ,https://eatsmarter.com/recipes/carrot-salad-with-orange-dressing
"Arugula Salad with Asparagus, Pine Nuts, and Chorizo ",https://eatsmarter.com/recipes/arugula-salad-with-asparagus-pine-nuts-and-chorizo
Cabbage Salad with Pesto ,https://eatsmarter.com/recipes/cabbage-salad-with-pesto
Toasted Parmesan Polenta Crackers with Salad ,https://eatsmarter.com/recipes/toasted-parmesan-polenta-crackers-with-salad
Avocado and Melon Salad ,https://eatsmarter.com/recipes/avocado-and-melon-salad
Broccoli and Asparagus Salad ,https://eatsmarter.com/recipes/broccoli-and-asparagus-salad
Colorful Cucumber Salad ,https://eatsmarter.com/recipes/colorful-cucumber-salad
Celery Salad with Pears and Blue Cheese ,https://eatsmarter.com/recipes/celery-salad-with-pears-and-blue-cheese
Lamb's Lettuce Salad with Radish Sprouts ,https://eatsmarter.com/recipes/lambs-lettuce-salad-with-radish-sprouts
Endive Salad with Orange and Bell Peppers ,https://eatsmarter.com/recipes/endive-salad-with-orange-and-bell-peppers
Herb Rice Salad with Shrimp ,https://eatsmarter.com/recipes/herb-rice-salad-with-shrimp
Onion-grapefruit Salad ,https://eatsmarter.com/recipes/onion-grapefruit-salad
Tuna Tartare with Oranges and Lamb's Lettuce ,https://eatsmarter.com/recipes/tuna-tartare-with-oranges-and-lambs-lettuce
Asian Vegetable Salad ,https://eatsmarter.com/recipes/asian-vegetable-salad-0
Brandy Cherry-cheese Salad ,https://eatsmarter.com/recipes/brandy-cherry-cheese-salad
Potato Salad with Salmon Vinaigrette ,https://eatsmarter.com/recipes/potato-salad-with-salmon-vinaigrette
Colorful Squid Salad ,https://eatsmarter.com/recipes/colorful-squid-salad
