title,url,description,types
Fruity Pork with Vegetables in a Wok,https://eatsmarter.com/recipes/fruity-pork-with-vegetables-in-a-wok,"Rinse, trim and blanch the broccoli for 5 minutes in boiling salted water. Remove,rinse in cold water and drain well. Rinse the apples, quarter, remove the core and cut into narrow columns. Immediately sprinkle with 2 tablespoons of lemon juice. Peel the carrots, and cut into thin, long strips.","['Pork', 'Dough', 'Meat', 'Vegetable', 'Fruit', 'Stone Fruit', 'Rice', 'Cooking on vacation', 'Vintage', 'Asian']"
Mushroom Risotto with Diced Ham,https://eatsmarter.com/recipes/mushroom-risotto-with-diced-ham,Cut ham into cubes.,"['Risotto', 'mushroom', 'Rice', 'Diabetic', '250-400 Calorie']"
Mushroom Risotto with Fried Pumpkin,https://eatsmarter.com/recipes/mushroom-risotto-with-fried-pumpkin,Rinse and trim the leeks and also cut into thin slices.,"['Risotto', 'Rice']"
Saffron Rice with Apple and Vegetables,https://eatsmarter.com/recipes/saffron-rice-with-apple-and-vegetables,"Wash the apples and cut into quarters. Remove the core and cut into wedges. Peel the onions and cut into quarters. Wash the Brussels sprouts, blanch for 5 to 7 minutes in boiling salted water, remove, and drain.","['Pome Fruit', 'Rice', 'Spices', 'Fruit']"
"Veggie Wrap with Tomato, Rice and Beans",https://eatsmarter.com/recipes/veggie-wrap-with-tomato-rice-and-beans,"Meanwhile rinse the beans in a colander and drain. Rinse the tomatoes, quarter, remove seeds and cut into small cubes.","['fruit-vegetable', 'Lunch', 'Rice', 'Tortilla', 'wrap', 'Cooking on vacation', 'American', 'Latin America', 'Mexican', 'Central America']"
Grilled Halibut with Orzo,https://eatsmarter.com/recipes/grilled-halibut-with-orzo,"Cover fish and keep refrigerated for 30 minutes. Meanwhile, drain olives and cut into quarters. Rinse mint, shake dry and pluck off leaves. Cook orzo pasta in boiling salted water until al dente.","['saltwater\xa0Fish', 'Dough', 'Fish', 'Rice', 'grilling']"
"Rice Salad with Asian Vegetables, Black Sesame and Wasabi",https://eatsmarter.com/recipes/rice-salad-with-asian-vegetables-black-sesame-and-wasabi,"Rinse and dry scallions and cut into narrow rings. Peel and grate carrots. Cut nori into strips. Roast sesame seeds in a hot dry skillet, remove and set aside. Cut ginger into wide strips. Rinse and dry zucchini, quarter lengthwise and cut into thin slices. Cut chicken into bite-sized pieces. Heat oil in a pan and sauté chicken, vegetables and ginger for a short time. Remove from heat and stir in rice. Mix rice wine vinegar, soy sauce, lime juice and oil. Season with salt and pepper.  Add sesame seeds. Toss salad with vinaigrette. Serve with wasabi.","['Rice Salad', 'Rice', 'Asian']"
Vegetable and Chicken Rice with Lime,https://eatsmarter.com/recipes/vegetable-and-chicken-rice-with-lime,"Cover and simmer for about 15 minutes. 5 minutes before the end of cooking stir in peas. Season with salt, pepper and cayenne pepper. Combine with rice, mix well. Drizzle with lime juice. Season with more salt if necessary. Serve immediately.","['Chicken', 'Poultry', 'Tropical Fruit', 'Rice']"
"Asian Soup with Rice Noodles, Mushrooms and Leeks",https://eatsmarter.com/recipes/asian-soup-with-rice-noodles-mushrooms-and-leeks,"Heat oil in a large saucepan and sauté garlic and ginger for about 1-2 minutes. Add broth, oyster sauce, vegetable strips, mushrooms and lemongrass and simmer for 5-10 minutes on medium heat. Add drained rice noodles and briefly heat. Season with salt and pepper. Serve.","['Onion', 'Dough', 'Asian', 'Pasta', 'Rice', 'soup', 'Mushroom Soup', 'Chicken Noodle Soup']"
Asparagus Risotto,https://eatsmarter.com/recipes/asparagus-risotto-4,"Peel lower third of asparagus, cut off woody ends and blanch asparagus in boiling salted water for 5 minutes. Put aside about 800 ml of asparagus, put asparagus in cold, cut off tops and cut remaining rods in narrow slices.","['Risotto', 'Vegetable', 'Sprout', 'Rice', 'Asparagus risotto']"
Wild Rice Salad with Radish and Ginger,https://eatsmarter.com/recipes/wild-rice-salad-with-radish-and-ginger,"Bring the rice, 400 ml (approximately 14 ounces) of water, and cumin to a boil. Season with salt, and simmer over low heat for 45 minutes. Remove from the heat and cool. Rinse and dry the arugula, then chop into bite-sized pieces. Mix the onion-ginger marinade with the oil, season to taste with salt and pepper, then mix into the salad. Serve the salad on plates.","['Rice Salad', 'Vegetable', 'Root Vegetable', 'Spices', 'Rice', 'Spring', 'Spring Dish', 'Spring Vegetable']"
Sweet Italian Risotto with Strawberries and Pistachios,https://eatsmarter.com/recipes/sweet-italian-risotto-with-strawberries-and-pistachios,"Rinse, dry and halve strawberries.","['Rice', 'Dessert', 'Strawberry Dessert', 'dessert']"
Sweet Fruit Sushi,https://eatsmarter.com/recipes/sweet-fruit-sushi-0,Knead marzipan with food coloring on a surface dusted with powdered sugar. Put between two layers of plastic wrap and roll 1 to 1.5 mm (approximately 1/50 inch) thick. Remove plastic wrap and cut marzipan into 1 cm (approximately 1/3 inch) wide strips.,"['Fruit', 'Sushi', 'sweet sushi', 'Rice', 'Dessert', 'Fruit Dessert']"
Apple and Rice Pudding Gratin,https://eatsmarter.com/recipes/apple-and-rice-pudding-gratin,"Bring milk with a pinch of salt and butter to a boil, stirring occasionally. Add rice and cook covered on the lowest heat for about 30-40 minutes, stirring. Cool.","['Pome Fruit', 'Baking', 'Diabetic', 'Casserole', 'Rice Casserole', 'baked dish', 'Fruit', 'Rice', 'Dessert', 'dessert']"
Saffron Rice Pudding with Cranberry Compote,https://eatsmarter.com/recipes/saffron-rice-pudding-with-cranberry-compote,"Remove lid and allow rice pudding to cool. Remove vanilla pod and lemon peel. Preheat the oven to 180°C (approximately 350°F) convection. Rinse untreated lemon with hot water, wipe dry and remove peel (into zest). Squeeze out juice. Finely chop half of zest from peel. Separate eggs. Mix egg whites with salt and 2 tablespoons of lemon juice until stiff.","['Rice', 'Casserole', 'Rice Casserole', 'baked dish', 'Spices', 'dessert']"
Sweet Coconut Rice with Apricots and Raisins,https://eatsmarter.com/recipes/sweet-coconut-rice-with-apricots-and-raisins,"Cook for about 15-25 minutes, stirring occasionally. Add water if necessary. Season coconut rice to taste. Garnish with mint and serve.","['Stone Fruit', 'Spices', 'Rice', 'dessert']"
Sweet Rhubarb Sushi,https://eatsmarter.com/recipes/sweet-rhubarb-sushi,"Rinse a lemon, pat dry, halve and remove the peel from 1 half.  Split the vanilla bean lengthwise, scrape out the seeds and place both in a saucepan with the milk, cinnamon stick and lemon peel. and bring to a boil. Add the rice and simmer over very low heat until tender, about 25 minutes. Cover and cool to room temperature. Remove vanilla bean and cinnamon stick.","['Fruit', 'Sushi', 'sweet sushi', 'Party', 'Rice', 'Dessert', 'Rhubarb Dessert']"
Rice and Pepper Salad with Mango and Curry Chicken,https://eatsmarter.com/recipes/rice-and-pepper-salad-with-mango-and-curry-chicken,"Bring the broth to a boil in a pot, add the chicken breasts and cook until done, about 20 minutes. Remove, pat dry and cut into large cubes. Mix the yogurt with curry, turmeric and oil and season with salt, pepper and a dash of lemon juice. Add the diced chicken to the yogurt, mix in and marinate.","['Chicken', 'Poultry', 'Cooking', 'Spices', 'Rice', 'Rice Salad', 'Tropical Fruit', 'Curry']"
Nasi Goreng with Pancake Rolls,https://eatsmarter.com/recipes/nasi-goreng-with-pancake-rolls,"Bring rice with 600ml (approximately 2.5 cups) of water and a pinch of salt to a boil and cook for 20-25 minutes. Meanwhile, rinse celery, trim and cut into thin slices. Peel carrot and also cut into slices. Rinse peppers, cut in half, remove seeds and cut into small cubes. Rinse cilantro, shake dry, pluck off leaves and chop finely. Peel onion and garlic and chop finely. In a frying pan heat butter and fry vegetables for 3-4 minutes. Add rice and fry for another 3 minutes. The cilantro mix, season with salt and pepper and fill in noodle bowls. Serve with 3 Pancake rolls per bowl.","['Pancake', 'skillet rice dish', 'Asian', 'Spices', 'Rice']"
Plantains and Rice,https://eatsmarter.com/recipes/plantains-and-rice,"Peel plantain and cut into slices. Heat remaining oil and fry the slices until crispy, turning several times. Place plantains on the finished rice before serving.","['Rice', 'Fruit', 'Cooking on vacation', 'American', 'Latin America', 'Caribbean', 'Cuban', 'South America', 'Brazilian']"
Cherry Rice Strudel,https://eatsmarter.com/recipes/cherry-rice-strudel,"Mix the milk with the salt, spices, and sugar. Cook the washed rice according to the directions on the package. Remove from heat and let cool until lukewarm. Fold in the cherries, eggs, lemon zest, and pistachios. Roll out the puff pastry on a floured surface to a rectangle, about 40 x 20 cm (approximately 16 x 8 inches). Spread the rice filling evenly over the rough. Roll the dough and brush with egg yolk and place seam side down on a parchment-lined baking pan. Bake in a preheated oven at 220°C (approximately 425°F) for about 45 minutes, until golden brown.","['Stone Fruit', 'Fruit', 'Dessert', 'Rice']"
Baked Vegetables and Rice,https://eatsmarter.com/recipes/baked-vegetables-and-rice,"Rinse and trim the eggplant and cut into thin slices. Rinse the bell peppers, trim, cut in half, remove seeds and ribs and dice.","['Rice', 'Baking', 'Light Cooking', 'skillet rice dish', 'European', 'Spanish', 'Vegetable']"
Rosemary Risotto with Button Mushrooms and Chanterelles,https://eatsmarter.com/recipes/rosemary-risotto-with-button-mushrooms-and-chanterelles,"Clean the mushrooms, if necessary and cut or tear into smaller pieces. Sauté in remaining butter, season salt and pepper and stir in lemon juice.","['Risotto', 'Herb', 'mushroom', 'Rice']"
Pork with Spicy Fruit Rice,https://eatsmarter.com/recipes/pork-with-spicy-fruit-rice,"Rinse the meat, pat dry, and season with salt and pepper. Sear it in a hot pan with oil. Transfer to preheated oven for about 25 minutes until pink.",['Rice']
Sweet Risotto with Fig and Raspberry,https://eatsmarter.com/recipes/sweet-risotto-with-fig-and-raspberry,"Rinse the raspberries and finely puree half of them with the powdered sugar. Mix the whole raspberries into the puree, reserving a few for garnish. In serving glasses, alternate layers of risotto and raspberry.","['Fruit', 'Rice', 'Cooking on vacation', 'American', 'North America']"
Sushi with Fruit,https://eatsmarter.com/recipes/sushi-with-fruit,"Rinse 1/2 lemon in hot water, pat dry and cut a strip from peel.","['Dips', 'Sushi', 'sweet sushi', 'Spicy', 'Tropical Fruit', 'Rice', 'Dessert']"
Sweet Risotto with Figs and Raspberry Sauce,https://eatsmarter.com/recipes/sweet-risotto-with-figs-and-raspberry-sauce,"Rinse the figs and cut into small cubes. Chop the white chocolate. Add both to the rice mixture, mix well and remove from heat. ","['Rice', 'In a jar', 'Dessert']"
Milk Rice Dumplings with Balsamic Strawberries,https://eatsmarter.com/recipes/milk-rice-dumplings-with-balsamic-strawberries,"Rinse, the strawberries and cut into small pieces. Mix with honey and set aside.","['Compote', 'Rice', 'Sweet Sauce', 'Dumpling', 'Dessert', 'Strawberry Dessert', 'dessert']"
Sweet Mango Sushi,https://eatsmarter.com/recipes/sweet-mango-sushi,Then take spice mixture back from the rice and shape it into oval rolls.,"['Tropical Fruit', 'Vegan', 'Vegan Snack', 'Vegan Dessert', 'Sushi', 'sweet sushi', 'Rice', 'Dessert']"
Sweet Risotto with Cherries and Figs,https://eatsmarter.com/recipes/sweet-risotto-with-cherries-and-figs,"Stir occasionally. As soon as risotto is cooled, remove cinnamon stick and lemon peel. Rinse figs, pat dry and quarter. Layer risotto and figs in a dessert glass. Drizzle with cherry juice and garnish with sour cherries. Serve.","['Stone Fruit', 'In a jar', 'Fruit', 'Rice', 'Dessert', 'Fruit Dessert', 'dessert']"
Rice Pudding with Raisins,https://eatsmarter.com/recipes/rice-pudding-with-raisins,"Combine milk with salt and sugar, add rice and bing to a boil. Cover and cook on low heat until rice is soft and liquid is almost all absorbed. Add raisins, butter and cinnamon. Stir. Serve hot or cold.","['Rice', 'Pudding', 'Dessert']"
Chicken in Rice Paper Rolls,https://eatsmarter.com/recipes/chicken-in-rice-paper-rolls,"Rinse chicken breasts, pat dry, sprinkle with a little soy sauce and place in a bamboo steamer. In a saucepan, combine 200 ml (approximately 1 cup) water with rice vinegar. Bring to a boil, set bamboo steamer over the water and cook 8-10 minutes. Remove the chicken breasts, let cool and cut into strips.","['Rice', 'Cooking on vacation', 'Asian', 'Spring']"
Rice Pudding with Pistachios,https://eatsmarter.com/recipes/rice-pudding-with-pistachios,Remove the vanilla bean and spoon the rice pudding into bowls. Serve sprinkled with chopped pistachios.,"['Rice', 'Dairy', 'Dessert', 'dessert', 'Andalusian']"
Risotto with Squid,https://eatsmarter.com/recipes/risotto-with-squid,Rinse squid and pat dry. Peel carrot and shallot. Dice carrot finely and cut shallot into strips. Sauté 1-2 minutes with carrot in remaining oil. Add squid and cook 3-4 minutes. Season with salt and pepper.,"['Octopus', 'Seafood', 'Rice', 'Risotto']"
Spicy Rice and Vegetable Salad with Raisins,https://eatsmarter.com/recipes/spicy-rice-and-vegetable-salad-with-raisins,"Heat 1 tablespoon oil in a skillet. Drain the raisins. Add the zucchini, carrot, celery, chile, and the raisins and cook, stirring occasionally until the vegetables are tender, about 5 minutes. Add the rice and almonds and stir to combine.","['Rice Salad', 'Spices', 'Rice', '400-500 Calorie']"
"Coconut Milk Soup with Shrimp, Rice Noodles and Bean Sprouts",https://eatsmarter.com/recipes/coconut-milk-soup-with-shrimp-rice-noodles-and-bean-sprouts,"Peel and rinse the shrimp. Heat the spice paste with 1 tablespoon of oil, pour in the fish stock and coconut milk and boil for 5 minutes. Add the shrimp and cook for another minute.","['Shrimp', '400-500 Calorie', 'Asian', 'Spices', 'Seafood', 'Shellfish', 'Rice', 'soup', 'Coconut Soup']"
Asian Rice Balls with Chinese Cabbage and Mango,https://eatsmarter.com/recipes/asian-rice-balls-with-chinese-cabbage-and-mango,"Meanwhile, peel carrot and finely dice. Rinse leek well, drain and cut about 8 cm (approximately 3 1/4 inches) of leek into very fine dice. Add diced vegetables to rice about 5 minutes before end of cooking.","['Rice', 'Dumpling', 'Cooking on vacation', 'Asian']"
Rice Noodles with Leeks and Sweet and Sour Chile Sauce,https://eatsmarter.com/recipes/rice-noodles-with-leeks-and-sweet-and-sour-chile-sauce,Rinse and chop chilies.,"['Onion', 'Rice', 'Cooking on vacation', 'Sweet', 'Asian']"
Risotto with Green and White Asparagus,https://eatsmarter.com/recipes/risotto-with-green-and-white-asparagus,"Peel the lower third of the asparagus and cut the remainder into small pieces. Peel the white asparagus completely and cut into small pieces. Heat the remaining butter in a skillet, add the green and white asparagus and saute briefly. Deglaze with white wine, cover and simmer until al dente, 6-8 minutes. Stir half of the Parmesan into the rice along with the asparagus. Season with salt and pepper and lemon juice and serve immediately garnished with the remaining Parmesan.","['Risotto', 'Vegetarian asparagus', 'Cooking', 'Vegetable', 'Sprout', 'Rice', 'Asparagus risotto']"
Rice Fritters with Vegetables,https://eatsmarter.com/recipes/rice-fritters-with-vegetables,"Heat oil in a pan. Use a tablespoon to scoop small portions of batter and place the fritters in the pan. Fry on both sides, about 5- 6 minutes. ","['Rice', '500-600 Calorie', 'skillet dish', 'veggie burger', 'Fritter']"
California Rolls with Caviar,https://eatsmarter.com/recipes/california-rolls-with-caviar,"Line the sushi rolling mat with plastic wrap and place a nori sheet with the smooth side down. Spread half of the sushi rice on it, slightly press and turn the nori over carefully, so that the rice is directly on the plastic.","['Rice', 'Sushi', 'Cooking on vacation', 'Asian', 'Japanese']"
Dirty Rice with Cranberries and Pecans,https://eatsmarter.com/recipes/dirty-rice-with-cranberries-and-pecans,"Sauté 1-2 minutes while stirring. Pour in the chicken broth and bring to a boil. Cook over low heat until the rice has absorbed almost all the liquid, about 20 minutes, stirring occasionally. Add the scallions, parsley and pecans, simmer 3-4 minutes and season again with salt and cayenne pepper. Serve hot.","['Rice', 'skillet rice dish', 'North America', 'American', 'Cooking on vacation', 'Vegetable', 'Side Dish']"
Risotto with Cheese and Eggplant,https://eatsmarter.com/recipes/risotto-with-cheese-and-eggplant,"For the risotto, peel onion and garlic and chop finely. Heat 4 tablespoons oil in a saucepan and sauté onion, garlic and lemon zest over medium heat. Pour in the rice and cook briefly while stirring, then pour in the wine. Bring to a boil and cook until the liquid is almost completely evaporated. Ladle in about 150 ml (approximately 3/4 cup) of hot broth and the lemon juice and cook, stirring frequently, until almost all liquid is absorbed. Continue to add broth in this manner and cook until rice is al dente, about 20 minutes, stirring frequently.",['Rice']
Deep-Fried Rice Balls with Tomato Sauce,https://eatsmarter.com/recipes/deep-fried-rice-balls-with-tomato-sauce,"Season rice with salt and pepper. Cut Gorgonzola into cubes. Place 1 tablespoon rice in your palm (dampened with a bit of water to prevent sticking). Place a Gorgonzola cube in the center of the rice, and form a ball around the cheese. Dip rice balls in beaten egg, coat with breadcrumbs and fry until golden brown in hot oil. Serve with tomato sauce and basil to garnish.","['Dips', 'Baking', 'Finger Food', 'Nibbles', 'Cheese', 'Dumpling', 'Rice']"
South African Style Rice Salad,https://eatsmarter.com/recipes/south-african-style-rice-salad,"Combine yogurt and mayonnaise, mix well and season lightly with salt and pepper. Rinse lemon balm leaves, shake dry and pluck small ones. Arrange lemon leaves in bowls, top wtih salad, toss lightly and serve.","['Rice Salad', 'Side Dish', 'Dressing', 'Sauce', 'Rice', 'Cooking on vacation', 'Home Cooking', 'African', 'South African']"
Chestnut Risotto,https://eatsmarter.com/recipes/chestnut-risotto,"Season with salt and pepper, and chopped parsley. Stir in the grated Parmesan and serve immediately.","['Nut', 'Rice']"
Cuban-Style Rice Dish,https://eatsmarter.com/recipes/cuban-style-rice-dish,"Brown the meat in hot oil, sprinkle with Cajun seasoning, then add the onions and garlic and sweat until translucent. Add the rice, sauté briefly, pour in vegetable stock, stir and gently simmer everything covered about 15-20 minutes.","['Rice', 'skillet dish', 'skillet rice dish', 'North America', 'American', 'Caribbean', 'Cuban']"
Rice Paper Rolls Filled with Vegetables and Papaya,https://eatsmarter.com/recipes/rice-paper-rolls-filled-with-vegetables-and-papaya,"Briefly dip each rice paper sheet in cold water and place on a damp kitchen towel (after 1-2 minutes the leaves become pliable). Lay papaya, beet and mushroom strips bundled at the bottom of the sheets of rice paper in the center, leaving free a small area around the edges. Sprinkle with cilantro. Wrap rice paper around filling, rolling tightly. Prepare a wide pot with 1-2 cups of boiling water. Place a bamboo steaming basket on top, then put the rice paper rolls in the basket. Cover and steam for 5 minutes.","['Rice', 'Finger Food', 'Herb', 'Fruit', 'Sweet', 'Asian']"
Sushi with Tuna,https://eatsmarter.com/recipes/sushi-with-tuna-0,Divide the sushi rice into 8 portions and shape each portion with moistened in water and vinegar with hands (into oblong balls). Cut the nori sheet in 8 rectangular pieces and attach each piece on top of a rice ball. Cut the tuna fillet into 8 slices. Place a leek on the work surface and place the tuna in the middle.  Take a little wasabi and place the rice ball with the nori on it. Hold the ends of the leeks strip upwards and gently tie together. Serve the tuna sushi with a dollop of wasabi paste on a plate.,"['saltwater\xa0Fish', 'Nibbles', 'Rice', 'Sushi', 'Asian', 'Japanese']"
Grilled Pork Strips with Tomato Rice Salad,https://eatsmarter.com/recipes/grilled-pork-strips-with-tomato-rice-salad,Add diced tomatoes into finished rice and serve.,"['Pork', 'Ragout', 'European', 'Greek', 'Meat', 'Vegetable', 'fruit-vegetable', 'Rice']"
Vegetable and Mushroom Rice,https://eatsmarter.com/recipes/vegetable-and-mushroom-rice,"While the rice is cooking, cut the beans into 3 cm (approximately 1 inch) long pieces, blanch for 2 minutes in salted water. Drain and rinse in cold water. Rinse the broccoli, cut into florets, blanch 1 minute, drain and rinse in cold water. Wash the chilli, cut in half, clean and chop very finely. Rinse mushrooms, cut into slices and fry in butter. Add the chili pepper, fry briefly, then add beans and broccoli and cook for a few additional minutes.",['Rice']
Risotto with Radicchio,https://eatsmarter.com/recipes/risotto-with-radicchio-0,"Trim radicchio, rinse, divide into leaves and cut into bite-sized pieces. Heat the rest of the butter in a pan and sear the radicchio briefly. Season with salt and pepper, and fold the radicchio into the risotto just before serving.",['Rice']
"Risotto with Pumpkin, Leeks and Herbs",https://eatsmarter.com/recipes/risotto-with-pumpkin-leeks-and-herbs,"Add the pumpkin cubes and deglaze with the white wine. Ladle in about 150 ml (approximately 3/4 cup) of hot broth and cook, stirring frequently, until almost all liquid is absorbed. Continue to add broth in this manner and cook until rice is al dente, about 20 minutes, stirring frequently. Grate the Parmesan finely and stir half into the risotto. Season with salt and pepper. Place risotto on plates and serve garnished with the remaining Parmesan.","['Risotto', 'Vegetable', 'flowering vegetables', 'Onion', 'Rice']"
Apple Risotto with Radicchio,https://eatsmarter.com/recipes/apple-risotto-with-radicchio,"Season the risotto with salt and pepper. Stir in radicchio, 4 tablespoons Parmesan and the remaining butter. Distribute among 4 plates and serve sprinkled with some grated Parmesan.","['Pome Fruit', 'Rice']"
Lettuce Rolls Filled with Rice Noodles and Turkey,https://eatsmarter.com/recipes/lettuce-rolls-filled-with-rice-noodles-and-turkey,Cook rice noodles according to package specification and drain.,"['Rice', 'salad', 'Cooking on vacation', 'Light Cooking', 'Asian', 'Vietnamese']"
Vegetable Rice Salad,https://eatsmarter.com/recipes/vegetable-rice-salad,"Rinse bell peppers, halve, remove ribs and seeds and cut peppers into small cubes.","['Rice Salad', 'Rice', 'Light Cooking']"
Turkey Strips on Fried Rice,https://eatsmarter.com/recipes/turkey-strips-on-fried-rice,"Cut the meat into strips about 1/4 inch wide.  Peel garlic and chop finely.  Clean, wash and cut the scallions into rings. Wash the basil, shake dry and coarsely chop the leaves.","['Turkey', 'Ragout', 'Turkey Ragout', 'skillet rice dish', 'Quick', 'Easy', 'Poultry', 'Herb', 'Rice']"
Bulgarian-Style Grape Leaves with Rice and Raisin Filling,https://eatsmarter.com/recipes/bulgarian-style-grape-leaves-with-rice-and-raisin-filling,Rinse the grape leaves under cold water and pat dry. Place two grape leaves overlapping each other to create a very large surface.,"['Rice', 'Cooking on vacation', 'Armenian', 'European']"
Peppers with Rice and Currant Filling,https://eatsmarter.com/recipes/peppers-with-rice-and-currant-filling,"Heat 4 tablespoons oil in a pan and sauté the onions along with the pine nuts. Drain the rice, add to the pan together with the spices and currants and sauté until the rice is soft. Add enough water so the rice is almost covered and cook on low heat for about 15 minutes. Stir in the herbs. Halve the tomatoes, core and cut the flesh into squares (slightly larger than the opening of the peppers).","['fruit-vegetable', 'Vegetable', 'Rice', 'Cooking on vacation', 'Asian', 'European', 'Turkish']"
Sushi Rice Rolls with Caviar,https://eatsmarter.com/recipes/sushi-rice-rolls-with-caviar,"Place a strip of avocado on the lower third, brush with wasabi paste and roll up tight, being careful to remove the plastic wrap. Cut each of the 4 sushi rolls into 6 equal sized pieces and top each with a little caviar. Serve 6 pieces per person.","['Rice', 'Cooking on vacation', 'Asian', 'Japanese']"
Risotto with King Prawns,https://eatsmarter.com/recipes/risotto-with-king-prawns,"Add the broth a little at a time waiting for it to be absorbed by the rice before adding more. Repeat this procedure until the rice is cooked, about 20 minutes.","['Shrimp', 'Rice', 'Light Cooking']"
Tuna Risotto,https://eatsmarter.com/recipes/tuna-risotto,Garnish with parsley and serve in bowls,"['saltwater\xa0Fish', 'Fish', 'Rice', 'Sprout']"
Wild Rice with Beef and Vegetables,https://eatsmarter.com/recipes/wild-rice-with-beef-and-vegetables,Cook the wild rice according to package directions. Press the cooked wild rice into timbale molds while still warm.,"['Beef', 'Beef Ragout', 'Asian', 'Cooking on vacation', 'Meat', 'Herb', 'Rice']"
Lamb Rolls with Wild Garlic Filling,https://eatsmarter.com/recipes/lamb-rolls-with-wild-garlic-filling,"For the filling, toast the pine nuts in a dry skillet until fragrant. Rinse the wild garlic, shake dry and coarsely chop. Grate the Parmesan. Mix the pine nuts, wild garlic and Parmesan together and purée with 3 tablespoons of olive oil and season with salt and pepper.","['Lamb', 'Roast', 'Meat', 'Herb', 'Rice', 'Pesto', 'Wild garlic pesto', 'low-carb']"
