title,url,description,types
Rice Asparagus Bake,https://eatsmarter.com/recipes/rice-asparagus-bake,"In a large saucepan, heat 2 tablespoons of oil and sauté the onion until soft. Add the asparagus and sauté briefly.","['Sprout', '400-500 Calorie', 'Casserole', 'Rice Casserole', 'Asparagus Casserole', 'baked dish', 'Mediterranean', 'Vegetable', 'Rice']"
Leek Rice Salad with Tomato and Mint,https://eatsmarter.com/recipes/leek-rice-salad-with-tomato-and-mint,"Rinse, dry and cut leeks into rings. Rinse, dry and halve tomatoes. Pluck mint leaves and chop coarsely.","['Rice Salad', 'fruit-vegetable', 'Herb', 'Rice', 'Onion']"
"Rice Noodles with Tofu, Shrimp and Chicken",https://eatsmarter.com/recipes/rice-noodles-with-tofu-shrimp-and-chicken,Cut the tofu into cubes.,"['Shrimp', 'Pasta', 'Sauce', 'Rice', 'Dough', 'Asian']"
Spring Rolls,https://eatsmarter.com/recipes/spring-rolls,"Season rice with fish sauce. Place rice, carrots, shrimp and pineapple in the middle of the lettuce leaf in a row. Fold in two opposite sides of the rice paper and roll up tightly. To serve, cut rolls in half with desired dipping sauce.","['Rice', 'Asian', 'Vietnamese', 'Cooking on vacation']"
Zucchini Risotto,https://eatsmarter.com/recipes/zucchini-risotto-0,"Meanwhile, rinse zucchini, dry and cut into 1-2 cm (approximately 0,5-1 inches) pieces. Combine peas and zucchini pieces, add to rice and cook together for about 5 minutes. Season with salt and pepper. Add remaining butter and half of parmesan, stir. Remove bay leaf, place risotto in bowls and serve sprinkled with remaining parmesan.","['Risotto', 'Rice']"
Fried Rice with Sea Bream,https://eatsmarter.com/recipes/fried-rice-with-sea-bream,"Cut fish into bite-sized pieces, season with salt and pepper and sear on all sides in a pan with vegetable oil. Spoon rice into bowls, top with fish and before serving, sprinkle with sesame seeds.","['fruit-vegetable', 'Fish', 'Rice', 'Spices', 'saltwater\xa0Fish', 'Roast', 'skillet dish', 'Asian']"
Spinach Risotto with Lemongrass,https://eatsmarter.com/recipes/spinach-risotto-with-lemongrass,"Melt butter in a saucepan, add and sauté leeks and bay leaf. Cut lemongrass stalks in half and add with ginger and rice into the pot. Sauté and add about 1/4 of hot broth, stir and simmer until almost all the liquid is absorbed, then pour in more broth and continue this process until the rice is almost tender. Add spinach and simmer a few minutes. Season with salt, stir in Parmesan cheese and serve immediately.","['Risotto', 'Asian', 'Thai', 'European', 'Italian', 'Vintage', 'Vegetable', 'leafy green vegetable', 'Spices', 'Herb', 'Rice', 'Spinach risotto', 'Primi Piatti']"
Pumpkin Risotto,https://eatsmarter.com/recipes/pumpkin-risotto-1,"Continue to add broth and stir until rice is creamy and all broth has been used, about 20-25 minutes. Add pumpkin when 10 minutes of cooking the time remains.","['Risotto', 'Vegetable', 'flowering vegetables', 'Rice', 'European', 'Italian', 'Primi Piatti']"
Scallops with Rice Noodles,https://eatsmarter.com/recipes/scallops-with-rice-noodles,"Rinse the scallions, cut into rings and fry briefly, with the pressed garlic, in 1 tablespoon hot oil. Season with salt and pepper.","['Mussel and Clam', 'Seafood', 'Rice', 'Dough', 'Asian']"
Asparagus Risotto,https://eatsmarter.com/recipes/asparagus-risotto-1,"Peel shallots and finely dice. In a pan, heat 1 tablespoon butter until it becomes foamy, then sauté the asparagus pieces (not tips), shallots and rice. Mix champagne, asparagus stock and broth. Add 2 ladles of water to the rice and let it boil over medium heat while stirring.","['Risotto', 'European', 'French', 'Italian', 'Valentine&#039;s Day', 'Wedding', 'festively', 'Vegetable', 'Sprout', 'Rice', 'Asparagus risotto', 'Primi Piatti']"
Asparagus Rice Cakes,https://eatsmarter.com/recipes/asparagus-rice-cakes,"Boil rice with lightly salted milk and let swell, covered, over low heat for about 20 minutes. Pour rice into a sieve, drain, leave to cool, then transfer contents to a bowl. In a pan heat oil and fry scallions for a few minutes, then stir marjoram, eggs and Pecorino into rice and season with salt and pepper. Grease a round-shaped baking dish (about 20 cm diameter) with oil, fill with rice pudding, smooth out and put more at edges of dish.","['Savory Tarts', 'asparagus cake', 'vegetable tart', 'asparagus tart', 'Gluten-free', 'Gluten-free Vegetarian Recipe', 'Gluten-free Dinner', 'Gluten-free Lunch', 'Vegetarian', 'Vegetarian asparagus', 'Vegetarian Lunch', 'Vegetarian Dinner', 'Vegetable', 'Sprout', 'Rice', 'Lunch', 'Dinner']"
Seafood Rice with Pineapple,https://eatsmarter.com/recipes/seafood-rice-with-pineapple,"Add mushrooms and clams. Season with salt, pepper and curry. Add pineapple and cook. In a separate pan, sear shrimp in oil on both sides. Fill hollowed-out pineapple with pineapple rice, top with shrimp and garnish with parsley leaves.","['Tropical Fruit', 'Seafood', 'Fruit', 'Rice', 'Roast']"
"Peppers Stuffed with Rice, Chicken and Chorizo",https://eatsmarter.com/recipes/peppers-stuffed-with-rice-chicken-and-chorizo," Heat oil in a saucepan and cook celery for about 2 - 3 minutes. Add paprika, thyme, oregano and rice, mix well, add broth and simmer for 10 minutes on low heat. Add tomatoes and simmer for 10 more minutes.","['fruit-vegetable', 'Baking', 'Vegetable', 'Rice', 'baked dish']"
Shrimp with Rice Salad,https://eatsmarter.com/recipes/shrimp-with-rice-salad,"For the sauce: Rinse the chile pepper, halve lengthwise, remove the seeds and white ribs and cut into fine strips. Rinse the pandan leaves and mint, coarsely chop and place in a mortar with the chile and chile sauce and crush while gradually adding the peanut oil. Add the onion, crush slightly and season  with salt and pepper.","['Shrimp', 'Spices', 'Rice', 'Rice Salad', 'Cooking on vacation', 'Asian', 'Indonesian']"
Cold Rice Pudding with Ham and Peas,https://eatsmarter.com/recipes/cold-rice-pudding-with-ham-and-peas,"To make sauce: Melt butter in a saucepan. Add flour and sauté briefly. Deglaze with 400 ml (approximately 1 3/4 cups) broth and cream. Stirring constantly, cook over medium heat about 5 minutes. Season with salt, pepper and nutmeg. Stir in remaining peas.","['Legume', 'Cooking', 'Vegetable', 'Pudding', 'Rice']"
Vegetarian Spring Rolls,https://eatsmarter.com/recipes/vegetarian-spring-rolls,"Heat soybean oil in the wok. Add scallions, garlic, chile pepper, bell peppers and lemon zest and cook for about 2 minutes. Stir-fry, then add cabbage strips and contiinue to cook briefly. Season with salt and pepper.","['Dips', 'Vegetable', 'Rice', 'Sweet', 'Asian', 'Spring']"
Vegetable Rice,https://eatsmarter.com/recipes/vegetable-rice,"In the meantime, rinse the leek and cut into rings.","['Onion', 'Rice', 'skillet dish', 'diet', 'Healthy Eating']"
Paella with Chicken,https://eatsmarter.com/recipes/paella-with-chicken-0,"Rinse chicken legs, pat dry, trim and season with salt and pepper. Heat oil in a paella pan or large ovenproof skillet and fry chicken on all sides. Bake in a preheated oven 190°C (approximately 400°F) for about 10 minutes.","['Chicken', 'Poultry', 'Rice', 'Paella', 'skillet dish']"
Leek Risotto with Mascarpone,https://eatsmarter.com/recipes/leek-risotto-with-mascarpone,"Add the rice and cook, stirring until glassy and well coated. Add the wine and cook, stirring occasionally until the rice has absorbed the wine. Season with salt and pepper. Add enough broth to cover the rice by an inch. Cook, stirring frequently for 15 minutes, add the leeks and continue cooking adding more broth as one amount has been absorbed until the rice is creamy with a slight bite, about 15 minutes longer.","['Onion', 'Rice', 'Side Salad']"
Spanish Paella Rice with Mussels and Shrimp,https://eatsmarter.com/recipes/spanish-paella-rice-with-mussels-and-shrimp,"Heat 5 tablespoons olive oil in a large, deep frying pan and fry the onion in it until soft. Add the pressed garlic and saute briefly. Pour in 0.5 liter (approximately 2½ cups) of beef broth and simmer for 10 minutes.","['Rice', 'Paella', 'skillet dish', 'European', 'Spanish']"
Fruity Rice Salad with Pesto,https://eatsmarter.com/recipes/fruity-rice-salad-with-pesto,"Toast the walnuts in a dry skillet over low heat until crisp and fragrant. Remove, let cool and coarsely chop. Peel the apple, halve, core and cut  into small cubes. Put the rice in a bowl. In a bowl, stir together the crème fraîche and pesto, season with salt and pepper, stir in the apples, two-thirds of the nuts and the rice and fluff with a fork. Cover and refrigerate until chilled, about 1 hour. Serve garnished with apple wedges and wild herbs.","['Rice Salad', 'Pome Fruit', 'Rice', 'Pesto']"
Shrimp Temaki,https://eatsmarter.com/recipes/shrimp-temaki,Rinse cucumber and cut into about 7 cm (approximately 3 inch) long and 5 mm (approximately 1/4  inch) wide strips. Rinse and trim scallions and cut into 7 cm (approximately 3 inch) strips and halve lengthwise.,"['Shrimp', 'Nibbles', 'Seaweed', 'Rice', 'Onion', 'Cooking on vacation', 'Asian', 'Japanese']"
Stuffed Fried Rice Balls,https://eatsmarter.com/recipes/stuffed-fried-rice-balls,"For the filling, rinse vegetables and finely chop. Heat some oil in a pan and cook ground beef until crumbly, add the vegetables and cook together. Add tomato puree, season with salt and pepper and simmer 30 minutes.","['Rice', 'Snack', 'Baking', 'Dumpling', 'Cooking on vacation', 'European', 'Italian']"
Stuffed Zucchini Blossoms,https://eatsmarter.com/recipes/stuffed-zucchini-blossoms,Carefully remove the small green sepals below the petals. Rinse blossom carefully in a bowl of cold water and drain.,"['Rice', 'cooking for one']"
Rice with Chicken and Vegetables,https://eatsmarter.com/recipes/rice-with-chicken-and-vegetables,"Peel garlic and chop finely. Rinse peppers, halve, core and dice or cut into strips. Peel carrots and slice into long strips. Brush beans. Blanch beefsteak tomato, peel, remove seeds and chop. In a pan sauté garlic and onion in olive oil. Add rice to pan and sauté briefly.","['Chicken', 'Rice', 'Light Cooking', 'Christmas']"
Rice with Chicken,https://eatsmarter.com/recipes/rice-with-chicken,"Peel the carrot and cut into thin slices. Heat the peanut oil in a Dutch oven and saute the chicken pieces. Reduce the heat, add the onion, garlic, chile, spices and rice. Add the diced tomatoes with juice, a little chicken broth and carrots.","['Chicken', 'Poultry', 'Rice', 'Roast', 'skillet dish', 'African']"
Rice with Ham and Pineapple,https://eatsmarter.com/recipes/rice-with-ham-and-pineapple,"Heat 1 tablespoon of oil in a pan and saute pineapple briefly, add chile pepper and ham and saute for 3-4 minutes. Add oyster sauce and remove from the pan. Add rice to the pan and season with salt and pepper. Combine rice with pineapple mixture and spread in pineapple halves. Garnish with chile pepper halves and serve. ","['Tropical Fruit', 'Spices', 'Fruit', 'Rice', 'Roast', 'skillet dish', 'Asian']"
Risotto with Squash,https://eatsmarter.com/recipes/risotto-with-squash,Stir in 40 grams of butter and sprinkle with Parmesan and reserved squash. Serve immediately. ,"['Risotto', 'Vegetable', 'flowering vegetables', 'Rice']"
"Rice with Chinese Cabbage, Peppers and Leeks",https://eatsmarter.com/recipes/rice-with-chinese-cabbage-peppers-and-leeks,"Rinse cabbage, pull apart leaves, cut into strips and mix with the prepared vegetables and the rice, season with salt and pepper.","['Onion', 'Rice', 'Light Cooking']"
Saffron Rice and Chicken,https://eatsmarter.com/recipes/saffron-rice-and-chicken,"Rinse the chicken, pat dry and cut into small pieces. In a mortar, crush the coriander and poppy seeds with 1 teaspoon salt. Season the chicken with the mixture.","['Chicken', 'Poultry', 'Spices', 'Rice', 'Cooking on vacation', 'European', 'Eastern European', 'Russian']"
Mango Chicken and Rice,https://eatsmarter.com/recipes/mango-chicken-and-rice,"Rinse chicken breasts, pat dry and cut into bite-size pieces. Sprinkle with salt and pepper.","['Chicken', 'Poultry', 'Spices', 'Rice', 'Tropical Fruit', 'Quick', 'American', 'Caribbean']"
Nasi Goreng,https://eatsmarter.com/recipes/nasi-goreng,"In a bowl, mix together the flour, egg and milk until smooth. Heat 1 tablespoon oil in a skillet and saute the batter, turning once until golden brown. 1-2 minutes. Then roll up and cut into strips.","['Pancake', 'Eggs', 'Rice', 'Asian', 'Indonesian']"
Stuffed Cabbage Leaves with Rice,https://eatsmarter.com/recipes/stuffed-cabbage-leaves-with-rice,"Heat vegetable broth and put cabbage rolls in the pot. Cook for about 30 minutes on medium heat. Cook rice according to package instructions, drain. Rinse and quarter tomatoes, mix with rice. Season with salt and pepper. Place rice on plates and top with stuffed cabbage rolls.","['fruit-vegetable', 'Vegetable', 'Cheese', 'Rice']"
Zucchini and Tomato Risotto,https://eatsmarter.com/recipes/zucchini-and-tomato-risotto,"Rinse and remove strings from the celery and slice. Blanch the tomatoes in a pot of boiling water for 10 seconds. Drain, peel, quater, remove the seeds and finely dice. Carefully fold the zucchini, celery, and tomatoes into the rice during the final 5 minutes of cooking. Pluck the rosemary, finely chop half and stir into the rice along with the vegetables. Season with salt and pepper. Before serving, garnish with remaining rosemary and sprinkle with grated Parmesan.","['Risotto', 'Vegetable', 'flowering vegetables', 'fruit-vegetable', 'mushroom', 'Rice', 'Light Cooking']"
Rice and Beans with Pickled Meat,https://eatsmarter.com/recipes/rice-and-beans-with-pickled-meat,"Heat the oil in a skillet, add the onion and saute until translucent.  Add the meat and saute briefly. Remove from the heat.","['fruit-vegetable', 'Rice', 'Roast', 'skillet dish', 'European', 'Greek']"
Chicken Risotto with Pesto,https://eatsmarter.com/recipes/chicken-risotto-with-pesto,"Heat 4 tablespoons oil in a saucepan and sauté garlic and onion until soft. Rinse the rice in a sieve, add to the saucepan and sauté briefly, stirring constantly. Pour in wine and stir until liquid evaporates. Ladle in about 150 ml (approximately 3/4 cup) of hot broth and cook, stirring frequently, until almost all liquid is absorbed. Continue to add broth in this manner and cook for about 10 minutes. Add zucchini and bell pepper. Continue adding broth and cooking until rice is al dente, about 10 more minutes, stirring frequently.","['Chicken', 'Poultry', 'Herb', 'Rice', 'Cooking on vacation', 'European', 'Swedish', 'Scandinavian']"
Asian-Style Chicken Soup with Dried Mushrooms,https://eatsmarter.com/recipes/asian-style-chicken-soup-with-dried-mushrooms,"Chop mushrooms. In a pot, combine mushrooms, chile, carrots, leeks, chicken broth and ginger. Bring to a boil and simmer 4 minutes. Add chicken breasts and simmer 5 minutes more. Remove chicken breast and cut crosswise into strips.","['Chicken', 'Asian', 'Cooking on vacation', 'Meat', 'Rice', 'soup', 'Chicken Soup']"
Spicy Rice,https://eatsmarter.com/recipes/spicy-rice,"Cut the meat into bite-sized pieces, season with salt and pepper, and sauté in hot oil on each side for about 2 minutes. Remove and keep warm.","['Chicken', 'Meat', 'Rice', 'soup', 'Cooking on vacation', 'Asian']"
Nasi Goreng,https://eatsmarter.com/recipes/nasi-goreng-1,"Bring rice with turmeric and almost twice the amount of lightly salted water to a boil. Simmer, covered, on very low heat for about 25 minutes. ","['Pork', 'Meat', 'Rice', 'Onion', 'Cooking on vacation', 'Asian', 'Indonesian']"
Vegetable Rice,https://eatsmarter.com/recipes/vegetable-rice-0,"Peel the onion and garlic and chop finely. Cut the chili pepper in half lengthwise, remove the seeds and chop very finely. Rinse and peel the vegetables. Cut celery into diagonal pieces. Cut carrots into thick slices, cutting the very thick carrot slices in half lengthwise. Cut the zucchini into large pieces. Cut the parsnip into matchsticks. Clean the mushrooms and cut in half (or quarter very large mushrooms).","['Rice', 'baked dish', 'Light Cooking']"
Coconut Rice with Mango,https://eatsmarter.com/recipes/coconut-rice-with-mango,"Peel mangos and cut fruit away from pit into 1-cm (approximately 1/2-inch) thick slices. Brush mango slices with a little melted butter. Grill on both sides, 2-3 minutes.","['Tropical Fruit', 'Rice', 'Fruit Dessert', 'Fruit']"
Curried Vegetables and Rice,https://eatsmarter.com/recipes/curried-vegetables-and-rice,Heat oil in a pan over low heat. Add onion and cook until translucent. Add leek and diced pepper and stir-fry about 10 minutes. Stir in cooked rice and curry. Season with salt and Worcester sauce. Serve rice sprinkled with parsley.,"['Rice', 'Healthy Eating', 'Gluten-free', 'Gluten-free Vegetarian Recipe', 'Gluten-free Vegan Recipe', '250-400 Calorie', 'lactose-free', 'lactose-free vegetarian', 'food-combining', 'Food-Combining Dinner', 'Food-Combining Lunch', 'Vegetarian', 'Vegetarian Lunch', 'Vegetarian Dinner', 'Vegetarian Entree', 'skillet dish', 'skillet vegetables', 'skillet rice dish', '25-Minute', 'Easy', 'Family', 'leftover', 'Quick', 'College Cooking', 'fruit-vegetable', 'Onion']"
Fried Rice with Fried Egg,https://eatsmarter.com/recipes/fried-rice-with-fried-egg,"Rinse and peel vegetables. Cut eggplant and zucchini into cubes, cut peppers into strips and tomatoes in half. Rinse the herbs, shake dry and chop finely. Peel garlic and also finely chop.","['Fried Egg', 'Rice', 'Eggs', 'fruit-vegetable', 'Herb']"
Rice Casserole,https://eatsmarter.com/recipes/rice-casserole,"Beat egg yolks and butter until fluffy, add to rice pudding.","['Pome Fruit', 'Dessert', 'Fruit', 'Rice', 'dessert', 'Casserole']"
Chicken Fried Rice,https://eatsmarter.com/recipes/chicken-fried-rice-0,"In 2 tablespoons of the sesame oil, make an omelet with the eggs and salt to taste. Remove from pan and cut into pieces. Heat the remaining oil and quickly sauté the cooked rice, shrimp, all the cooked ingredients, and soy sauce, stirring continuously. Serve immediately.","['Chicken', 'Shrimp', 'Rice', 'Roast', 'Asian', 'Chinese']"
Rice Paper Rolls with Shrimp,https://eatsmarter.com/recipes/rice-paper-rolls-with-shrimp,"Rinse chile, remove seeds and finely chop.","['Shrimp', 'Dips', 'Rice', 'Sprout', 'Onion', 'Cooking on vacation', 'Sweet', 'Asian', 'Vietnamese', 'Spring']"
Fruity Paella,https://eatsmarter.com/recipes/fruity-paella,Rinse mussels and brush well. Peel garlic and chop finely.,"['Stone Fruit', 'Seafood', 'Fruit', 'Rice', 'Paella', 'skillet dish']"
Rice Noodle Soup,https://eatsmarter.com/recipes/rice-noodle-soup,"When the broth has boiled vigorously once, reduce heat and simmer until reduced to 2.5-3 liters (approximately 10 1/2 to 12 1/2 cups) of liquid, 2-3 hours. While broth cooks, skim off foam occasionally. Pour broth carefully through a damp cloth strainer or a fine sieve. Discard solids.","['Shrimp', 'Meat', 'soup', 'Spices', 'Herb', 'Shellfish', 'Seafood', 'Rice', 'Pasta', 'Cooking on vacation', 'Asian', 'Vietnamese']"
Spring Rolls with Meat Filling,https://eatsmarter.com/recipes/spring-rolls-with-meat-filling-0,"Place the rice noodles cold water and soak for about 30 minutes. Cook 1-2 minutes in boiling water (according to package directions) until al dente, drain and cool. Rinse the lettuce and remove the thick stems. Rinse the bean sprouts and cilantro and pluck the leaves from the stems.","['Rice', 'Cooking on vacation', 'Asian', 'Vietnamese', 'Spring']"
Noodle Soup with Vegetables,https://eatsmarter.com/recipes/noodle-soup-with-vegetables,"Boil lemongrass, ginger, soy sauce and lime juice in the vegetable stock. Simmer over medium heat for about 5 minutes. ","['Broth', 'High-Carb Diet', 'Asian', 'Vegetable', 'Pasta', 'Rice', 'soup', 'Party Soup', 'Vegetable Soup', 'Stew']"
Rice Salad,https://eatsmarter.com/recipes/rice-salad,Rinse and trim the cabbage and cut into strips. Blanch in boiling salted water for 12-15 minutes. Rinse in cold water and drain.,"['Rice Salad', 'Vegetable', 'Seed', 'salad', 'Rice', 'Onion']"
Risotto with Seafood,https://eatsmarter.com/recipes/risotto-with-seafood,"Rinse mussels and place in a pan with a little water. Cover and cook over medium heat until the mussels have opened. Discard any unopened mussels. Season risotto with salt and pepper. Rinse, shake dry and pluck the parsley leaves. Top the risotto with parsley leaves, mussels and shrimp. Serve immediately.  ","['Rice', 'European', 'Italian', 'Primi Piatti']"
Risotto with Tuna,https://eatsmarter.com/recipes/risotto-with-tuna,Put risotto into bowls and serve.,"['saltwater\xa0Fish', 'Rice']"
Saffron Rice with Broccoli,https://eatsmarter.com/recipes/saffron-rice-with-broccoli,"Finely grate a little lemon zest, then squeeze juice from lemon. Combine 2 tablespoons lemon juice with oil, horseradish, and lemon zest. Season with salt and pepper. Pour marinade over broccoli. Serve rice topped with broccoli.","['Rice', 'Vegetable', 'Spices', 'diet', 'Light Cooking', 'Winter Vegetable']"
"Peppers Stuffed with Rice, Pinenuts and Hazelnuts",https://eatsmarter.com/recipes/peppers-stuffed-with-rice-pinenuts-and-hazelnuts,"Rinse the basil, shake dry and chop. Set some aside for garnish, stir the rest into the rice mixture. In a skillet, heat the butter and sauté the hazelnuts until lightly golden.","['Rice', 'Vegetable', 'European', 'Mediterranean']"
Asparagus Risotto with Trout,https://eatsmarter.com/recipes/asparagus-risotto-with-trout,"Peel and chop shallots. Heat oil in a saucepan. Add shallots and cook until translucent. Add rice and cook, stirring, 1-2 minutes. Bring broth to a boil in a small pot, then reduce heat and keep warm.  Ladle 1/4 of the hot broth and wine into rice and cook over medium heat, stirring frequently, until almost all liquid is absorbed. Continue to add broth and remaining wine in this manner until rice is al dente, about 25 minutes, stirring frequently.","['Risotto', 'Fish', 'Vegetable', 'Sprout', 'Herb', 'Rice', 'Asparagus risotto']"
Risi Bisi (Rice and Peas),https://eatsmarter.com/recipes/risi-bisi-rice-and-peas,"Rinse the rice, and cook in the broth according to package directions, Stir in the thawed peas during the last few minutes of cooking time.","['Legume', 'Cooking', 'Meat', 'Vegetable', 'Rice', 'European', 'Italian', 'Primi Piatti']"
Paella,https://eatsmarter.com/recipes/paella-0,Cut the chicken and pork into bite-sized pieces and cut the squid into small pieces.,"['Rice', 'Roast', 'Paella', 'skillet dish', 'European', 'Spanish']"
Paella,https://eatsmarter.com/recipes/paella-1,"Rinse the chicken and pat dry. Cut the ham into small cubes and the chorizo into thick slices. Rinse the fish fillets, pat dry, cut into bite-size pieces and sprinkle with lemon juice. Rinse the prawns and pat dry.","['Seafood', 'Rice', 'Roast', 'Paella', 'skillet dish', 'cooking for one', 'Cooking on vacation', 'European', 'Mediterranean', 'Spanish']"
Strawberry Risotto,https://eatsmarter.com/recipes/strawberry-risotto,Sweat the shallots in hot oil in a pan until translucent. Add the rice and deglaze with white wine while with stirring. Add half the wine and the finely chopped strawberries.,['Rice']
Orange Chicken Legs with Orzo,https://eatsmarter.com/recipes/orange-chicken-legs-with-orzo,"Gently separate skin from the meat and place some sage leaves under the skin, season with salt and pepper.  ","['Chicken', 'Poultry', 'Rice', 'Tropical Fruit']"
Spring Rolls with Ground Pork Filling,https://eatsmarter.com/recipes/spring-rolls-with-ground-pork-filling,"For the spring roll, soak glass noodles in a bowl with hot water for about 10 minutes. Rinse scallions, trim and finely chop. Drain glass noodles and chop with scissors. Pat dry crabmeat and chop. Mix crabmeat with noodles, ground pork and chopped green scallions. Mix shrimp paste with fish sauce until smooth and mix with cilantro leaves to ground pork noodle mixture. Mix all well and season with salt and pepper. Spoon 1 tablespoon of the filling onto rice leaves, turn sideways, moisten the upper end with water, roll up and press firmly.","['Dips', 'Rice', 'Cooking on vacation', 'Asian', 'Vietnamese', 'Spring']"
Vegetable Curry,https://eatsmarter.com/recipes/vegetable-curry-2,"Heat the oil in a large pan over medium heat, add the potatoes and carrots and cook, stirring frequently, for 10 minutes. Pour in a little hot water and cook another 10 minutes.","['Vegetable', 'Rice', 'Curry']"
Saffron Risotto,https://eatsmarter.com/recipes/saffron-risotto," Add half of parmesan and stir in butter, place risotto into bowls and sprinkle with the remaining cheese. Serve. ","['Risotto', 'Spices', 'Rice', 'Cooking on vacation', 'European', 'Italian', 'Primi Piatti']"
Paella with Chicken,https://eatsmarter.com/recipes/paella-with-chicken-1,"Rinse the rice. Heat 3 tablespoons olive oil in a large frying pan and cook the chicken thighs about 15 minutes, Add pork and cook 5 minutes. Remove the meat from the pan, set aside and season with salt. Add garlic, onion, bell pepper and drained artichokes to the pan and simmer for 5 minutes, remove.","['Rice', 'Roast', 'Paella', 'skillet dish', 'European', 'Spanish']"
Asian Green Salad with Tuna,https://eatsmarter.com/recipes/asian-green-salad-with-tuna,"Cook noodles according to package instructions until al dente, drain and mix with watercress puree.","['Pasta Salad', 'saltwater\xa0Fish', 'Rice', 'Dough', 'Asian']"
Pumpkin Risotto,https://eatsmarter.com/recipes/pumpkin-risotto-2,"Melt remaining butter in a large pot. Cook remaining onion until translucent. Press garlic through a garlic press into the pot and sauté briefly. Add the rice and cook briefly, stirring. Add wine and cook until reduced by half.","['Risotto', 'Vegetable', 'flowering vegetables', 'Rice', 'European', 'Italian', 'Primi Piatti']"
