title,url,description,types
Rhubarb Rice Pudding,https://eatsmarter.com/recipes/rhubarb-rice-pudding,"Toast the almonds in a dry frying pan. Stir the rhubarb puree and up to 1 tablespoon of the almonds into the cooked rice. To serve, scoop the rhubarb rice pudding onto small plates, drizzle with raspberry sauce and sprinkle with almonds. Serve immediately.","['Sweet Sauce', 'Dairy', 'Rice', 'Dessert', 'Rhubarb Dessert', 'dessert']"
"Stuffed Tomatoes with Peas, Zucchini and Rice",https://eatsmarter.com/recipes/stuffed-tomatoes-with-peas-zucchini-and-rice,"Rinse the tomatoes, cut the top off and reserve. Remove the seeds with a spoon.","['fruit-vegetable', 'Vegetable', 'Rice', 'Summer Vegetable']"
Middle Eastern-Style Rice with Meatballs,https://eatsmarter.com/recipes/middle-eastern-style-rice-with-meatballs,"Heat the oil in a pan and cook meatballs on all sides. Add the rice, shallot and garlic and sweat briefly. Stir in the tomato paste and deglaze with broth. Simmer over medium heat for about 20 minutes. 5 minutes before end of cooking stir in the vegetables. Add the cinnamon, cloves and coriander and season the rice with salt and pepper. Serve.","['Rice', 'Meatball', 'skillet dish', 'skillet rice dish', 'Asian', 'Middle Eastern', 'Meat']"
Avocado Rice Salad,https://eatsmarter.com/recipes/avocado-rice-salad,Bring broth to a boil. Rinse rice and add to boiling broth. Cover and cook at low heat for about 20-25 minutes. Then open and leave to cool.,"['fruit-vegetable', 'Vegetable', 'Rice', 'salad', 'Rice Salad', 'Lunch', 'Quick', 'diet', 'Healthy Eating', 'Vegetarian', 'Vegetarian Salad']"
Sushi Boats,https://eatsmarter.com/recipes/sushi-boats,"Salmon supplies omega-3 fatty acids, which ensure that the blood flows well and thus have a positive influence on the cardiovascular system. The fine fish also contains the often scarce trace element iodine.","['Rice', 'Cooking', 'Appetizer', 'Lunch', 'Dinner', 'Main Course', 'Snack', 'Sushi', 'Menopause', 'Osteoarthritis', 'Stress', 'Diabetic', 'Gut Flora', 'Elevated Blood Lipid', 'Healthy Eyes', 'Crohn&#039;s Disease', 'Irritable Bowel Syndrome', 'Osteoporosis', 'Fertility', 'Iodine Deficiency', 'Guest', 'Exotic', 'Party', 'Meal for Four', 'Superfoods', 'High-protein', 'diet', 'Low-fat', 'Low-sugar', 'Vitamin-rich', '250-400 Calorie', 'Japanese', 'Asian']"
Coconut Rice Pudding with Fruit Salad,https://eatsmarter.com/recipes/coconut-rice-pudding-with-fruit-salad,The mix of coconut milk and rice tastes great and makes you feel full; the fruit salad on top provides a thick portion of vitamins. This rice pudding variant is also ideal for children with lactose intolerance: coconut milk contains no lactose.,"['Rice Pudding', 'Cooking', 'Grain', 'Fruit', 'Rice', 'Brunch', 'Sweet Breakfast', 'Lunch', 'Dinner', 'Main Course', 'Dessert', 'Exotic', 'crowdpleaser', 'Family friendly', 'Easter Dessert']"
Rice with Peas and Cheese,https://eatsmarter.com/recipes/rice-with-peas-and-cheese,"Milk and cheese provide high-quality protein and plenty of calcium for bones and teeth. Natural rice contains valuable vitamins and minerals, and the peas strengthen the immune system through saponins.","['Rice', 'Low-cholesterol', 'Low-cholesterol Vegetarian Dish', 'diet', 'High-protein', 'High-protein Vegetarian Dish', 'Low-fat', 'Low-fat Vegetarian Dish', 'Gluten-free', 'Gluten-free Vegetarian Recipe', 'Gluten-free Dinner', 'Gluten-free Lunch', '250-400 Calorie', 'Mineral-rich', 'Low-sugar', 'crowdpleaser', 'Vegetable', 'Legume', 'Grain', 'Sauce', 'Classic Sauce', 'Side Dish', 'Rice Side Dish', 'hearty side dish']"
Chicken Fillets in Vegetable Rice,https://eatsmarter.com/recipes/chicken-fillets-in-vegetable-rice,Chop onion and garlic finely.,"['Chicken', 'Poultry', 'Rice', 'baked dish']"
Fruity Rice Pudding,https://eatsmarter.com/recipes/fruity-rice-pudding,Gently mix the rice with the fruit  and garnish with lemon zest.,"['Pome Fruit', 'Dessert', 'Dairy', 'Fruit', 'Rice', 'dessert']"
Rice Pudding,https://eatsmarter.com/recipes/rice-pudding-3,Peel grapefruit and completely remove pith. Cut segments into fillets.,"['Pudding', 'Eggs', 'Fruit', 'Rice', 'Dessert', 'dessert']"
Chopped Chicken Stew with Rice,https://eatsmarter.com/recipes/chopped-chicken-stew-with-rice,40 mins,"['Chicken', 'Chicken Ragout', 'Meat', 'Poultry', 'Vegetable', 'Onion', 'Spices', 'Nut', 'Rice']"
Herb Rice Salad with Shrimp,https://eatsmarter.com/recipes/herb-rice-salad-with-shrimp,"Drain and cool the rice. Stir the herbs and lemon dressing into the rice. Allow to stand for 10 minutes. Rinse the shrimp and pat dry. Heat the oil in a skillet. Add the shrimp and cook until pink, about 3 minutes per side. Serve the rice with the shrimp on top.","['salad', 'with Alcohol', 'Herb', 'Scampi', 'Rice']"
Pumpkin Risotto Casserole,https://eatsmarter.com/recipes/pumpkin-risotto-casserole,"Heat carrot juice in a pot. Peel and quarter pumpkin, core and cut into 1/2 cm (approximately 1/5 inch) wide strips. Grease baking dish with olive oil.","['flowering vegetables', 'Baking', 'Casserole', 'Rice Casserole', 'Vegetarian Casserole', 'baked dish', 'Vegetable', 'Herb', 'Rice']"
Moroccan Soup for Ramadan,https://eatsmarter.com/recipes/moroccan-soup-for-ramadan,"Sauté the spices with 1 teaspoon salt in 1 tablespoon of clarified butter. Add 1 1/4 liters (approximately 6 cups) of water and bring to a boil. Add to meat pot, cover, and gently simmer about 1 hour.","['Stew', 'Gluten-free Meat Recipe', 'Gluten-free Lunch', 'egg-free', 'Milk-free', 'African', 'Arabic', 'Moroccan', 'Cooking on vacation', 'Lamb', 'fruit-vegetable', 'Legume', 'Spices', 'Rice', 'soup', 'Lentil Soup', 'Vegetable Soup', 'Lentil Stew', 'Lunch']"
Vegetable Soup with Rice and Lemon,https://eatsmarter.com/recipes/vegetable-soup-with-rice-and-lemon,"Cook rice in boiling salted water according to package instructions. Then drain, rinse and set aside.","['Rice', 'Fruit', 'soup']"
Shrimp Risotto,https://eatsmarter.com/recipes/shrimp-risotto,"Meanwhile, zest one lime and squeeze the juice. Rinse shrimp and marinate briefly with lime juice and season with salt and pepper. Cut chives into small rings.","['Shrimp', 'European', 'Italian', 'Seafood', 'Shellfish', 'Rice', 'Primi Piatti']"
Pie with Rice and Nuts,https://eatsmarter.com/recipes/pie-with-rice-and-nuts,Rinse the rice well in a colander and drain.,"['Filo Dough', 'Spices', 'Rice', 'Cooking on vacation', 'Asian', 'European', 'Turkish']"
Biriyani Römertopf,https://eatsmarter.com/recipes/biriyani-romertopf-0,Rinse the rice under running water in a colander and drain.,"['flowering vegetables', 'Vegetable', 'Spices', 'Rice', 'Onion', 'Cooking on vacation', 'Asian', 'Indian']"
Chestnut and Parmesan Risotto,https://eatsmarter.com/recipes/chestnut-and-parmesan-risotto,45 mins,"['Nut', 'Party', 'Rice']"
Colorful Rice Salad,https://eatsmarter.com/recipes/colorful-rice-salad,"Rinse bell peppers, wipe dry, halve, remove seeds and ribs and cut into narrow strips. Rinse and dry tomato, quarter, remove stem and cut into thin strips. Peel onion, halve and cut into strips. Toast pine nuts in a dry skillet until golden, remove and set aside.","['Rice Salad', 'fruit-vegetable', 'Herb', 'Rice']"
Rice and Cucumber Salad with Shrimp,https://eatsmarter.com/recipes/rice-and-cucumber-salad-with-shrimp,"Peel and halve cucumber lengthwise, scrape out seeds with a spoon, and cut flesh into cubes.","['Shrimp', 'Rice', 'Rice Salad', 'Buffet', 'Party']"
Fruit and Vegetable Rice Salad,https://eatsmarter.com/recipes/fruit-and-vegetable-rice-salad,"Mix the fruit into the rice and vegetable mixture. Mix together the mayonnaise, sour cream, salt and pepper until smooth, then add to the salad. Season with salt and pepper, cover and let sit for a half hour. Serve with flatbread, as desired.","['Rice Salad', 'Fruit', 'Rice', 'Light Cooking']"
"Rice Salad with Ham, Olives and Peppers",https://eatsmarter.com/recipes/rice-salad-with-ham-olives-and-peppers,"Cut the ham, salami and cheese into strips. Rinse the parsley, dry and chop finely. Transfer to a bowl along with the peppers and pepperoncini and the rice. Add the oil, season with salt and pepper, fluff with a fork and serve. Garnish with the olives.","['Rice Salad', 'Meat', 'fruit-vegetable', 'Rice', 'Roast', 'skillet dish']"
Rice and Vegetable Soup,https://eatsmarter.com/recipes/rice-and-vegetable-soup-0,The high-quality protein and iron from the lean meat and the minerals in natural rice make the soup a real tonic. This is especially good for stress or when your health is not up to scratch!,"['Rice', 'diet', 'High-protein', 'High-protein Meat Dish', 'Low-fat', 'Low-fat Soup', 'Low-fat Meat Dish', '400-500 Calorie', 'lactose-free', 'Lactose-free Soup', 'Mineral-rich', 'non-alcoholic', 'Vitamin-rich', 'Low-sugar', 'Hypertension', 'Diabetic', 'Iron Deficiency', 'Elevated Blood Lipid', 'high cholesterol', 'Healthy Gallbladder', 'Heart Problems', 'Fertility', 'Stomach Discomfort', 'Pregnancy', 'Lactation', 'Stress', 'Menopause', 'Meal for Four', 'Meat', 'soup', 'Main Course']"
Indian Spiced Beef with Rice,https://eatsmarter.com/recipes/indian-spiced-beef-with-rice,445 mins,"['Beef', 'Asian', 'Cooking on vacation', 'Meat', 'Indian', 'Rice']"
Italian Vegetable Rice Bowl,https://eatsmarter.com/recipes/italian-vegetable-rice-bowl,40 mins,"['flowering vegetables', 'European', 'Vegetable', 'Italian', 'Primi Piatti', 'Rice', 'Sprout']"
Creamy Mushroom Rice,https://eatsmarter.com/recipes/creamy-mushroom-rice,80 mins,"['Risotto', 'European', 'Italian', 'lactose-free', 'mushroom', 'Primi Piatti', 'Rice']"
Salmon Sushi Rolls,https://eatsmarter.com/recipes/salmon-sushi-rolls,"You can use brown rice for the sushi for more fiber, and you can also add other vegetables like cucumer, carrot, or avocado. Serve with low sodium soy sauce. ","['saltwater\xa0Fish', 'Sushi', 'Asian', 'Japanese', 'Cooking on vacation', 'Seaweed', 'Fish', 'Rice', 'Nibbles', 'Gerollt']"
Thai Dessert Rice Cups,https://eatsmarter.com/recipes/thai-dessert-rice-cups,225 mins,"['Rice', 'Asian', 'Dessert', 'dessert', 'Thai']"
Vegetarian Mushroom Rice,https://eatsmarter.com/recipes/vegetarian-mushroom-rice,35 mins,"['leafy green vegetable', 'European', 'Italian', 'mushroom', 'Risotto', 'Primi Piatti', 'Rice']"
Curried Soup Bowl,https://eatsmarter.com/recipes/curried-soup-bowl,50 mins,"['Chicken', 'Asian', 'Curry', 'Cooking on vacation', 'Poultry', 'Ragout', 'Rice', 'Dough', 'Chicken Noodle Soup']"
"Gruyere, Broccoli and Rice Bake",https://eatsmarter.com/recipes/gruyere-broccoli-and-rice-bake,65 mins,"['flowering vegetables', 'Vegetable', 'baked dish', 'Casserole', 'Rice', 'Broccoli Casserole', 'Auflaufform']"
Sweet Rice and Pine Nut Triangles,https://eatsmarter.com/recipes/sweet-rice-and-pine-nut-triangles,70 mins,"['Rice', 'Asian', 'Cooking on vacation', 'Roast', 'Japanese', 'Rösten']"
Stuffed Zucchini Halves,https://eatsmarter.com/recipes/stuffed-zucchini-halves,60 mins,"['flowering vegetables', 'Vegetable', 'Rice', 'Gefüllt']"
Turkish Stuffed Peppers,https://eatsmarter.com/recipes/turkish-stuffed-peppers,25 mins,"['Vegetable', 'Asian', 'European', 'Cooking on vacation', 'Seed', 'Rice', 'Turkish', 'Gefüllt']"
Spicy Italian Rice Bowl,https://eatsmarter.com/recipes/spicy-italian-rice-bowl,25 mins,"['Turkey', 'Poultry', 'Spices', 'Rice']"
Stuffed Peppers,https://eatsmarter.com/recipes/stuffed-peppers,475 calories,"['fruit-vegetable', 'European', 'Cooking on vacation', 'Vegetable', 'Rice', 'Spanish', 'low-carb', 'Gefüllt']"
Southeast Asian Steak Salad Bowl,https://eatsmarter.com/recipes/southeast-asian-steak-salad-bowl,"If you want to cut down on fat and calories, replace the steak with chicken or turkey.","['Beef', 'Asian', 'Vietnamese', 'Cooking on vacation', 'Meat', 'Nut', 'Rice']"
Squid Ink Rice with Seafood,https://eatsmarter.com/recipes/squid-ink-rice-with-seafood,580 calories,"['Octopus', 'Rice']"
Prawn and Chile Glass Noodles,https://eatsmarter.com/recipes/prawn-and-chile-glass-noodles,This cold salad is perfect for a light dinner on a warm summer evening.,"['Shrimp', 'Dough', 'Asian', 'Spices', 'Seafood', 'Shellfish', 'Rice', 'Pasta Salad']"
Citrus and Rice Broth,https://eatsmarter.com/recipes/citrus-and-rice-broth,330 mins,"['Herb', 'European', 'Greek', 'Fruit', 'Rice', 'soup']"
Exotic Rice with Lamb Curry,https://eatsmarter.com/recipes/exotic-rice-with-lamb-curry,886 calories,"['Lamb', 'Asian', 'Meat', 'Roast', 'Indian', 'Spices', 'Rice']"
Rustic Country Rice Dish,https://eatsmarter.com/recipes/rustic-country-rice-dish,50 mins,"['fruit-vegetable', 'Herb', 'Rice', 'whole-food']"
Shrimp and Pepper Rice,https://eatsmarter.com/recipes/shrimp-and-pepper-rice,588 calories,"['Shrimp', 'American', 'Cooking on vacation', 'Spices', 'Shellfish', 'Latin America', 'Seafood', 'Rice', 'skillet dish', 'South America']"
Veggie Wrappers,https://eatsmarter.com/recipes/veggie-wrappers,45 mins,"['Rice', 'Asian', 'Spring', 'Lunchbox', 'Picnic']"
Rice with Favas and Dried Fruit,https://eatsmarter.com/recipes/rice-with-favas-and-dried-fruit,60 mins,"['Rice', '400-500 Calorie', 'diet', 'Herb', 'Light Cooking', 'Mediterranean', 'Gratinieren']"
Steak and Noodle Salad Bites,https://eatsmarter.com/recipes/steak-and-noodle-salad-bites,30 mins,"['Beef', 'Asian', 'Cooking on vacation', 'Meat', 'Rice', 'Dough', 'low-carb']"
"Rice, Grapefruit, and Veg Bowls",https://eatsmarter.com/recipes/rice-grapefruit-and-veg-bowls,15 mins,"['Party Salad', 'Rice', 'Rice Salad', 'Tropical Fruit', 'Onion']"
Green Shrimp Curry,https://eatsmarter.com/recipes/green-shrimp-curry,25 mins,"['Shrimp', 'Asian', 'Curry', 'Cooking on vacation', 'Spices', 'Shellfish', 'Seafood', 'Rice', 'Dough']"
Spanish-style Fish Casserole,https://eatsmarter.com/recipes/spanish-style-fish-casserole,35 mins,"['Stew', 'European', 'Fish', 'Rice', 'Sprout', 'French']"
Chinese Rice Balls,https://eatsmarter.com/recipes/chinese-rice-balls,45 mins,"['Meat', 'Asian', 'Chinese', 'Cooking on vacation', 'Dumpling', 'Rice', 'Dämpfen']"
Southeast Asian Rice Bowl,https://eatsmarter.com/recipes/southeast-asian-rice-bowl,Add an extra dash of soy sauce on top of this dish just before you serve to ramp up the flavor.,"['Rice', 'Asian', 'Indonesian', 'Cooking on vacation', 'Side Dish']"
Thai Rice Pudding,https://eatsmarter.com/recipes/thai-rice-pudding,37 mins,"['Tropical Fruit', 'Asian', 'Cooking on vacation', 'Rice', 'Dessert', 'dessert']"
Spanish-style Chicken with Rice,https://eatsmarter.com/recipes/spanish-style-chicken-with-rice,736 calories,"['Chicken', 'European', 'Poultry', 'Rice', 'Rice Side Dish', 'Spanish']"
Flaked Fish with Rice,https://eatsmarter.com/recipes/flaked-fish-with-rice,25 mins,"['fruit-vegetable', 'Fish', 'Vegetable', 'saltwater\xa0Fish', 'Rice', 'Rice Salad']"
Filled Herby Tomatoes,https://eatsmarter.com/recipes/filled-herby-tomatoes,25 mins,"['fruit-vegetable', 'European', 'Vegetable', 'Italian', 'Herb', 'Rice', 'Gefüllt']"
Filled Green Peppers,https://eatsmarter.com/recipes/filled-green-peppers,65 mins,"['fruit-vegetable', 'Vegetable', 'Rice', 'Gefüllt']"
Wild Rice with Shrimp and Lemongrass,https://eatsmarter.com/recipes/wild-rice-with-shrimp-and-lemongrass,30 mins,"['Shrimp', 'Shellfish', 'Seafood', 'Rice', 'Onion']"
Charred and Filled Peppers,https://eatsmarter.com/recipes/charred-and-filled-peppers,70 mins,"['fruit-vegetable', 'Vegetable', 'Rice', 'Summer Vegetable', 'Gefüllt']"
Spanish Rice with Seafood,https://eatsmarter.com/recipes/spanish-rice-with-seafood,60 mins,"['Shrimp', 'European', 'Cooking on vacation', 'Classic', 'Herb', 'Paella', 'skillet dish', 'Rice', 'Spanish', 'Pfanne']"
Cheesy Rice Slices,https://eatsmarter.com/recipes/cheesy-rice-slices,50 mins,"['fruit-vegetable', 'Vegetable', 'vegetable tart', 'Savory Tarts', 'Picnic', 'Rice']"
Steak Wraps,https://eatsmarter.com/recipes/steak-wraps,30 mins,"['Rice', 'Asian', 'Spring', 'wrap', 'Gefüllt']"
"Nori, Rice, Avocado and Apple Roll",https://eatsmarter.com/recipes/nori-rice-avocado-and-apple-roll,455 calories,"['fruit-vegetable', 'Asian', 'Cooking on vacation', 'Japanese', 'Pome Fruit', 'Rice', 'wrap']"
Filled Red Peppers,https://eatsmarter.com/recipes/filled-red-peppers,70 mins,"['fruit-vegetable', 'Vegetable', 'Rice', 'Gefüllt']"
"Black-eyed Peas, Ham and Rice Casserole",https://eatsmarter.com/recipes/black-eyed-peas-ham-and-rice-casserole,364 calories,"['Legume', 'American', 'Cooking on vacation', 'Vegetable', 'North America', 'Rice', 'low-carb']"
Golden Rice Patties,https://eatsmarter.com/recipes/golden-rice-patties,25 mins,"['Bitesize', 'veggie burger', 'Rice', 'Tropical Fruit']"
Chilled Rice Desserts with Berry Sauce,https://eatsmarter.com/recipes/chilled-rice-desserts-with-berry-sauce,1515 mins,"['Rice', 'Dessert']"
Rice Pudding Morrocan-style with Pistachios,https://eatsmarter.com/recipes/rice-pudding-morrocan-style-with-pistachios,304 calories,"['Rice', 'African', 'Moroccan', 'Dessert']"
Korean-style Sliced Beef,https://eatsmarter.com/recipes/korean-style-sliced-beef,Serve this with some brown rice and a side salad to ensure maximum satiation and nutrition. ,"['Pome Fruit', 'Asian', 'Korean', 'Cooking on vacation', 'Meat', 'Beef', 'Stone Fruit', 'Rice', 'Menu', 'low-carb', 'Marinieren']"
Indonesian Seafood Broth,https://eatsmarter.com/recipes/indonesian-seafood-broth,70 mins,"['Shrimp', 'Asian', 'Stew', 'Cooking on vacation', 'Seafood', 'Menu', 'Rice', 'soup']"
Rice and Pea Patties,https://eatsmarter.com/recipes/rice-and-pea-patties,331 calories,"['Rice', 'veggie burger', 'Buffet', 'Nibbles']"
Rice Pudding Pie with Fruit,https://eatsmarter.com/recipes/rice-pudding-pie-with-fruit,55 mins,"['Berry Cake', 'Berry torte', 'Diabetic', 'Cake', 'Fruit', 'cake or tart with fruit', 'Rice', 'Summer Cake', 'tart']"
Baked Tomatoes Stuffed with Rice and Lentils,https://eatsmarter.com/recipes/baked-tomatoes-stuffed-with-rice-and-lentils,215 calories,"['fruit-vegetable', 'Baking', 'Vegetable', 'Legume', 'baked dish', 'Rice', 'Gefüllt', 'Backofen']"
Gluten Free Spicy Chorizo and Vegetable Rice,https://eatsmarter.com/recipes/gluten-free-spicy-chorizo-and-vegetable-rice,45 mins,"['mushroom', 'American', 'Cooking on vacation', 'Roast', 'Gluten-free', 'Latin America', 'Mexican', 'Central America', 'Rice', 'Meat']"
Rice and Veggie Wrap,https://eatsmarter.com/recipes/rice-and-veggie-wrap,36 mins,"['Rice', 'Asian', 'Cooking on vacation', 'Finger Food', 'Japanese', 'wrap', 'Gefüllt', 'Gerollt']"
Spanish Seafood Rice Dish,https://eatsmarter.com/recipes/spanish-seafood-rice-dish,60 mins,"['Shrimp', 'European', 'Cooking on vacation', 'Seafood', 'Paella', 'skillet dish', 'Rice', 'Spanish']"
"Risotto with Squash, Pine Nuts and Feta",https://eatsmarter.com/recipes/risotto-with-squash-pine-nuts-and-feta,"If you don't have feta, goat cheese is a great substitute.","['Risotto', 'Home Cooking', 'Country Style', 'Vegetable', 'flowering vegetables', 'squash', 'Seed', 'Herb', 'Rice']"
Fish with Crisp Skin on a Bed of Risotto,https://eatsmarter.com/recipes/fish-with-crisp-skin-on-a-bed-of-risotto,75 mins,"['Risotto', 'Fish', 'Roast', 'Vegetable', 'Herb', 'saltwater\xa0Fish', 'Rice']"
Butternut Squash Risotto,https://eatsmarter.com/recipes/butternut-squash-risotto,"If gorgonzola is too strong a flavor for you, feel free to use parmesan cheese instead.","['flowering vegetables', 'Vegetable', 'Rice', 'Risotto', 'Rösten']"
Korean Beef and Rice Bowl,https://eatsmarter.com/recipes/korean-beef-and-rice-bowl,Use brown or wild rice instead of white rice for more fiber.,"['Rice', 'Asian', 'Korean', 'Cooking on vacation']"
Spiced Rice with Nuts,https://eatsmarter.com/recipes/spiced-rice-with-nuts,30 mins,"['Chicken', 'Curry', 'Poultry', 'Spices', 'Rice']"
Coconut Rice Topped with Mango,https://eatsmarter.com/recipes/coconut-rice-topped-with-mango,525 mins,"['Tropical Fruit', 'Asian', 'Cooking on vacation', 'Rice', 'Fruit', 'Dessert', 'Thai']"
Korean Rice with Sautéed Mushrooms,https://eatsmarter.com/recipes/korean-rice-with-sauteed-mushrooms,583 calories,"['mushroom', 'Asian', 'Cooking on vacation', 'Korean', 'Rice', 'soup']"
Indian Rice Pudding,https://eatsmarter.com/recipes/indian-rice-pudding,70 mins,"['Spices', 'Asian', 'Cooking on vacation', 'Indian', 'Pudding', 'Dessert', 'Rice', 'dessert']"
Vietnamese Summer Rolls,https://eatsmarter.com/recipes/vietnamese-summer-rolls,60 mins,"['Rice', 'Asian', 'Cooking on vacation', 'Spring', 'Gefüllt']"
Gourmet Seafood Risotto,https://eatsmarter.com/recipes/gourmet-seafood-risotto,50 mins,"['Lobster', 'mushroom', 'Shellfish', 'Seafood', 'Rice']"
Oyster Mushroom and Sun-dried Tomato Risotto,https://eatsmarter.com/recipes/oyster-mushroom-and-sun-dried-tomato-risotto,75 mins,"['Risotto', 'Herb', 'mushroom', 'Rice', 'Home Cooking']"
Mussel and Prawn Spanish Rice,https://eatsmarter.com/recipes/mussel-and-prawn-spanish-rice,15 mins,"['Shrimp', 'European', 'Seafood', 'Paella', 'skillet dish', 'Rice', 'Spanish']"
Decadent Rice Dessert,https://eatsmarter.com/recipes/decadent-rice-dessert,5 mins,"['Rice', 'Dessert']"
Crunchy Truffle Assortment,https://eatsmarter.com/recipes/crunchy-truffle-assortment,20 mins,"['Nut', 'pastry', 'Rice', 'praline']"
Creamy Rice with Ramps,https://eatsmarter.com/recipes/creamy-rice-with-ramps,35 mins,"['Chicken', 'Risotto', 'fruit-vegetable', 'Poultry', 'Rice', 'Vintage', 'Gefüllt']"
Rice and Vegetable Broth,https://eatsmarter.com/recipes/rice-and-vegetable-broth,60 mins,"['fruit-vegetable', 'Vegetable', 'Grain', 'soup', 'Rice']"
Indian Bean and Potato Curry,https://eatsmarter.com/recipes/indian-bean-and-potato-curry,45 mins,"['Root Vegetable', 'Asian', 'Cooking on vacation', 'Vegetable', 'Indian', 'Rice']"
Panfried Halibut with Spanish Rice,https://eatsmarter.com/recipes/panfried-halibut-with-spanish-rice,50 mins,"['saltwater\xa0Fish', 'Fish', 'Meat', 'Rice', 'Risotto']"
Classic Spanish Rice Dish,https://eatsmarter.com/recipes/classic-spanish-rice-dish,50 mins,"['Chicken', 'European', 'Poultry', 'Paella', 'skillet dish', 'Rice', 'Spanish', 'Meat']"
Puffed Rice and Papdis Chaat,https://eatsmarter.com/recipes/puffed-rice-and-papdis-chaat,150 mins,"['Vegetable', 'Asian', 'Cooking on vacation', 'Indian', 'Sauce', 'Rice']"
Seafood Rice with Herbs,https://eatsmarter.com/recipes/seafood-rice-with-herbs,50 mins,"['Lobster', 'Herb', 'Shellfish', 'Seafood', 'Rice', 'Christmas']"
Valencian Rice with Beans,https://eatsmarter.com/recipes/valencian-rice-with-beans,830 mins,"['Rice', 'European', 'Cooking on vacation', 'Paella', 'skillet dish', 'Spanish']"
Spanich Rice and Garlic Bake,https://eatsmarter.com/recipes/spanich-rice-and-garlic-bake,55 mins,"['fruit-vegetable', 'European', 'Cooking on vacation', 'Meat', 'Baking', 'baked dish', 'Rice', 'Pork', 'Spanish', 'Onion']"
Rice and Chanterelle Stew,https://eatsmarter.com/recipes/rice-and-chanterelle-stew,40 mins,"['Risotto', 'Oktoberfest', 'German', 'European', 'mushroom', 'Mediterranean', 'Rice', 'Home Cooking']"
"Rice, Beef and Garbanzo Broth",https://eatsmarter.com/recipes/rice-beef-and-garbanzo-broth,70 mins,"['Stew', 'European', 'Cooking on vacation', 'Rice', 'soup', 'Spanish']"
Salted Cod Rissoto,https://eatsmarter.com/recipes/salted-cod-rissoto,2950 mins,"['Fish', 'European', 'Cooking on vacation', 'Rice', 'Spanish']"
Rice and Meat-filled Eggplant,https://eatsmarter.com/recipes/rice-and-meat-filled-eggplant,65 mins,"['fruit-vegetable', 'Meat', 'Vegetable', 'Lamb', 'Rice', 'Gefüllt']"
Rice and Crayfish Broth,https://eatsmarter.com/recipes/rice-and-crayfish-broth,25 mins,"['Seafood', 'European', 'Cooking on vacation', 'soup', 'Rice', 'Spanish']"
Seafood with Spanish Rice,https://eatsmarter.com/recipes/seafood-with-spanish-rice,50 mins,"['Shrimp', 'European', 'Seafood', 'Paella', 'skillet dish', 'Rice', 'Home Cooking', 'Spanish']"
Citrus Rice Salad with Mixed Seafood,https://eatsmarter.com/recipes/citrus-rice-salad-with-mixed-seafood,125 mins,"['Tropical Fruit', 'Seafood', 'Rice', 'skillet dish', 'Pfanne']"
Courgette and Ham Risotto,https://eatsmarter.com/recipes/courgette-and-ham-risotto,40 mins,"['Herb', 'European', 'Cooking', 'Italian', 'Primi Piatti', 'Rice']"
Rice and Caper-stuffed Tomatoes,https://eatsmarter.com/recipes/rice-and-caper-stuffed-tomatoes,80 mins,"['fruit-vegetable', 'Vegetable', 'Rice', 'Gefüllt']"
Ham and Asparagus Risotto,https://eatsmarter.com/recipes/ham-and-asparagus-risotto,45 mins,"['Risotto', 'Easy', 'European', 'Vegetable', 'Italian', 'Primi Piatti', 'Rice', 'Sprout']"
Lentil and Rice Salad,https://eatsmarter.com/recipes/lentil-and-rice-salad,521 calories,"['Legume', 'Side Dish', 'Vegetable', 'Mediterranean', 'Rice', 'Onion']"
Savoury Rice Cakes,https://eatsmarter.com/recipes/savoury-rice-cakes,50 mins,"['Rice', 'veggie burger', 'Fritter']"
Smoked Haddock Rice Breakfast,https://eatsmarter.com/recipes/smoked-haddock-rice-breakfast,40 mins,"['Fish', 'Asian', 'British', 'English', 'European', 'Cooking on vacation', 'Indian', 'Rice', 'Topf']"
Chicken and Seafood Paella,https://eatsmarter.com/recipes/chicken-and-seafood-paella,1547 calories,"['Seafood', 'European', 'Paella', 'skillet dish', 'Rice', 'Spanish']"
Chicken and Seafood Rice,https://eatsmarter.com/recipes/chicken-and-seafood-rice,45 mins,"['Mussel and Clam', 'Seafood', 'Rice']"
Creole Rice Dish,https://eatsmarter.com/recipes/creole-rice-dish,You can substitute the rice for cauliflower rice to lower the calorie count.,"['Stew', 'Casserole', 'North America', 'American', 'Cooking on vacation', 'Rice']"
Creamy Thai Chicken Curry,https://eatsmarter.com/recipes/creamy-thai-chicken-curry,45 mins,"['Chicken', 'Asian', 'Curry', 'Cooking on vacation', 'Poultry', 'Spices', 'Rice', 'Thai']"
Rice-filled Pancake Rolls,https://eatsmarter.com/recipes/rice-filled-pancake-rolls,85 mins,"['Pancake', 'Asian', 'Chinese', 'Eggs', 'Lunchbox', 'Rice']"
